title,description,url,published_date,publisher,keyword,bank,sector,text_for_sentiment,sentiment_compound,sentiment_positive,sentiment_neutral,sentiment_negative,sentiment_label,source,collected_at
HDFC Bank emerges as top choice for global EM funds with record ownership - Business Standard,HDFC Bank emerges as top choice for global EM funds with record ownership  Business Standard,https://news.google.com/rss/articles/CBMi1gFBVV95cUxQUUVSUlFiM0tBQ29qVUdPMmkwRGtvZlh4ektkTmIzUm9WWksyb3FKN2hpZkdBMmFmUkpROVZQVGg3ZU5pc1Q5NWFBd3RtWjktSlgzR3pzRHhXbUNXU2JaVnN2SzRXSTBGRS0zZjBQcjRJT3ZpVEFPbGZ6SGxvZkM4TWtONkt1N1FiNlFDT3hyZ3ozWDdTX0ZRYXl5Wmd0UGp4dkpTZ3lNanZLS192bG5lUGZVV0xPdzdQOXVvd2lMRGgwTXdUSnBKZ0d5YTY0ak1FNHpzQ0Zn0gHbAUFVX3lxTFB3NkZZd3Q4YXFoRkJId0VIVjVtcUxjVk5NVUN0dW9Gbzdvc2JzWW5ZZjdwU08xZ2RsRUtmTlpzeUxIaHpIbGpvN0t4dWZZc1JXYUhQOFkxSUpxS2NFbEQxaFRfMW83b25veXZhdi0zSTcxcGY3Q3Q2UXo5UEZmMmh1bWkwTGVWeThvMmdDUk9xd3Zvcy1FUzc0OEFsdjQ1MGJSWW91aHVXcGpVR2lBelo2bTZMVkRDYWhNWmtyRkJDWG5VTVQ5Z01JMktqX2s5X29ySkxKamZHNDgxcw?oc=5&hl=en-IN&gl=IN&ceid=IN:en,"Thu, 28 Aug 2025 07:00:00 GMT",Business Standard,HDFCBANK,HDFC Bank,Private Banks,HDFC Bank emerges as top choice for global EM funds with record ownership - Business Standard HDFC Bank emerges as top choice for global EM funds with record ownership  Business Standard,0.3818,0.11,0.89,0.0,positive,GNews,2025-12-09 13:43:47
"HDFC Bank Q2 results: Provisions drop sharply QoQ, earnings beat estimates - CNBC TV18","HDFC Bank Q2 results: Provisions drop sharply QoQ, earnings beat estimates  CNBC TV18",https://news.google.com/rss/articles/CBMiyAFBVV95cUxOTG01akZUV01zNW5nNlBvYllRcVI0bWZpVnZBckg4ZEkxR05kVlZOcFUwYmJidUFyTWQ0UGhVdkRrc2F0WVR1aXJvNHhmUENzVUFpQjJzRU5RWUZheHBUM0kydGFtTVhja3ZXcUNUOG9ELWVLRkRvVE5jamYtTjFtSWp2RHNyR1BWcEdnS0hQMlV1YWUyLXVqOGRoMDAtaEVzRC1yV2hnSmJXTmFyUFUxSWpxU2g3WHNmZTFlQktXbFJ1cUZIUGtud9IBzgFBVV95cUxPLWlseHNGOWpWMjc4ZlRiNjVzVkZ6VGE0em9NLXgybDhCWFRvNWd0WnZxb0Zkb1BISnZ3bXlsb3A5QWlKb2FFUWZqLVR3bVBKRWxLbXlaRWdrOVkxWVZlSW5tZDM5NW9WazlGaXlXQ1Zpc2VwWHBOb2w1TUd2TEpoZFFoZmhMLUVaZzZNTG4tejBBV1dHUnlBdG9fWE02Y0x2NjN0LTQtYWVCN0VtTXNEZEpaZ25Kb2RaLWZrZnhwbVg1a1AtcWNNVXZmYU93QQ?oc=5&hl=en-IN&gl=IN&ceid=IN:en,"Sat, 18 Oct 2025 07:00:00 GMT",CNBC TV18,HDFCBANK,HDFC Bank,Private Banks,"HDFC Bank Q2 results: Provisions drop sharply QoQ, earnings beat estimates - CNBC TV18 HDFC Bank Q2 results: Provisions drop sharply QoQ, earnings beat estimates  CNBC TV18",-0.4939,0.0,0.856,0.144,negative,GNews,2025-12-09 13:43:47
"HDFC Bank Q2 Preview: Repo rate cut to weigh on margins, stable asset quality likely - Moneycontrol","HDFC Bank Q2 Preview: Repo rate cut to weigh on margins, stable asset quality likely  Moneycontrol",https://news.google.com/rss/articles/CBMi4AFBVV95cUxNZ0c3YmotV2xGVHE4WUpiMVhkbXlnY2hrbFU4RkVLZktkeElwWDFZcUNlVklPM05vRWx3QXpRMkhGODlCRExIUVpKdm1zZzRCRXhyNDhaa2xaYTZfRUZEUDJnYjY1N2RTcTBmODIwN2FabHJhX3V1ZWpDZkVLMUt2dUFUYTlhb2lqMGdyQXZnLXZIdHI4MnQ3bkhHX1ZGOVBHSjlwNTJCTFlsRzlHYl8wZXEwTmtMU3Z2ekNhc3hDRHdraEFIZmhqZmlTZWFpdkQ5d3RQNGRxYksycmhGbUtKM9IB5gFBVV95cUxOTDJrdDgxSDFwMnI5b3o3WDJGMVJfd3EzLVJaeVFWd3psbU9TcGV3SVY1eE5QQ0hSd3hfUjZ1bFV5bUNqdlFSaThERTU4UkhndTZzZDJ1bERjN3FRaUFjaVdPMmI4NThoWHoyZU5zdzh4ZXg5ZmpvMXRZM2VrTzBjaU12TU15ZERsdzZrUWJPMk5od0pZRXZYcURsMTk5c3VrblRTbTVJY1ZaMHItRGF2SzA1ZWkzTzRtUzdtNFJXN0FKVjVqZ1p1VzI2WGFPWGY3UXN0U2ZfcEVNNEVXaWhYYjVBZFM4QQ?oc=5&hl=en-IN&gl=IN&ceid=IN:en,"Thu, 16 Oct 2025 07:00:00 GMT",Moneycontrol,HDFCBANK,HDFC Bank,Private Banks,"HDFC Bank Q2 Preview: Repo rate cut to weigh on margins, stable asset quality likely - Moneycontrol HDFC Bank Q2 Preview: Repo rate cut to weigh on margins, stable asset quality likely  Moneycontrol",0.6369,0.232,0.665,0.103,positive,GNews,2025-12-09 13:43:47
HDFC Bank's 1:1 bonus to Page Industries' ₹150 dividend: Corporate actions steal the show in Q1FY26 earnings season - Upstox,HDFC Bank's 1:1 bonus to Page Industries' ₹150 dividend: Corporate actions steal the show in Q1FY26 earnings season  Upstox,https://news.google.com/rss/articles/CBMigAJBVV95cUxNX0M2N2hTRllud0xQY0xJYW5fSDR4MGY2WmNpWi1nZUIxbkJfcEhzQmMtbzJVM3FsWVBOWlBLNmVvMGVuaFVNS2dBYTVIZHBZeVJ1YThtdk05SE9tb29hWVk4TlZOVWlfU1lodUFQRFZ1QWpwRFhuU0ZzWVhxdzM2RmpkMU01cjM5cU4yeDBfeE96Ymd6XzJTRTRMRThpd01iSXV1Y0hFd2p1ZkdiVUNNWXlIckR1NldnOHZGNkpreHpiWDl5VFU5UEJRdjhiS1ZLSHpnUXNLc2t3elBEb2M5OW5qbXBMZ3lOdHQ4N1hyZVdoSExfdDNOT3phZmpGQ18y?oc=5&hl=en-IN&gl=IN&ceid=IN:en,"Tue, 12 Aug 2025 07:00:00 GMT",Upstox,HDFCBANK,HDFC Bank,Private Banks,HDFC Bank's 1:1 bonus to Page Industries' ₹150 dividend: Corporate actions steal the show in Q1FY26 earnings season - Upstox HDFC Bank's 1:1 bonus to Page Industries' ₹150 dividend: Corporate actions steal the show in Q1FY26 earnings season  Upstox,0.1531,0.145,0.723,0.132,positive,GNews,2025-12-09 13:43:47
HC quashes notice to HDFC bank CEO in Lilavati hosp defamation case | Mumbai news - Hindustan Times,HC quashes notice to HDFC bank CEO in Lilavati hosp defamation case | Mumbai news  Hindustan Times,https://news.google.com/rss/articles/CBMi1AFBVV95cUxOMk9rMjNIZnExTFhMcUE0N09La0c1S2xpaWgzUWtoZ1IzcGxJRV9kbm5aZ19QRjRmdTh0U01qZllZd09qOXIxdWttMndfaDRoVC1BM0liRVN5clJRd1ZjTW5xam9CMC1nMG93RFVBSDM4OHJxclNvc2R0SnRVZ1I3RjRhdl80a3RHSjlQOWRfS3E3S0hpVWRxOXRlR01EWWZWcllHQVA2SVh4T0VqRm5taFhIRTk3TF9HNVI2Yi14dTZiMlczT0FkVlNfbXR2b2Z1ek9EOdIB2gFBVV95cUxQUnp2bVF6N3g3NGFRai11X3FaWV9Xc1E4MVVJdlY0bDhockJ1cU94SEQzOVQ2UnhudlhJQVlDUTR6TlhzTEtwLVREcUFqZFN2QlhHNjZja0tlWTJ2cE5aSlNTMld1QklIOWJWMVVpRGR5WVcwX0FrQkljYk1IUC1USlJmaUFDSVdlZ1N1NEZRSTdNMmRMWUJmT2p5ZF93QkJreXRDZEQ2aldUN1V0SERIOEpUeUJFaWY2Yk15Tnc2UXR4SXZJVFNyUDdpV25ndkNfa24wU2I5S2hfQQ?oc=5&hl=en-IN&gl=IN&ceid=IN:en,"Tue, 19 Aug 2025 07:00:00 GMT",Hindustan Times,HDFCBANK,HDFC Bank,Private Banks,HC quashes notice to HDFC bank CEO in Lilavati hosp defamation case | Mumbai news - Hindustan Times HC quashes notice to HDFC bank CEO in Lilavati hosp defamation case | Mumbai news  Hindustan Times,0.0,0.0,1.0,0.0,neutral,GNews,2025-12-09 13:43:47
"SBI, PNB, HDFC Bank & others have changed their website domain names on RBI’s instructions; Is your bank a - The Economic Times","SBI, PNB, HDFC Bank & others have changed their website domain names on RBI’s instructions; Is your bank a  The Economic Times",https://news.google.com/rss/articles/CBMikAJBVV95cUxPV1BjeVdoWU5IeTRXT1kzcGxfbGZiY1NMaWVsMkFjRW5XMkxjbEl0dk5qekZ2MHp6ZHFFM3B1a1lKUnJBWWtQcW94NVB3WjRPZmRMWnJtcFNfX2RFWko1VnZpTUhHTGlHcDVuOGtpMkxFZ2Jfb0xUQmRseXBYSGdmbWsxbjJkU0hoUEg0NGFxUjRUNTFENHdwbXIzQjNZU3pzaDIxVTlSZTVsNWpPQzhPV2JwdHdGb2ZMNTNZdDQxam5sY1Q0dkFZMVRoT05yZXA1cEJlck9OWXRXamdIXzdtMGpZcnMtcDZOdXNMallyZVlJMEFiU1RGMDhHbjJ3azdiR2JyaWYwN3hWRmJhUURkX9IBlgJBVV95cUxPQUR6cWlxY1VhTzA2V3BGT1lzQUVMbzB1Z3pLRUI0ajBHeWZKM2YyMG5HQWtWeVk2RTdsUjNRLXg3REFnNXpydFpVUGNqd2R2ZHZqV2xfWVRRUXNkQ1M0c0tzN25XWUtscG12RGRHZVN1WUp1S0lrVFhmSDNEQURVYjkyUENhcHZJVFV1TFotbkp1RkhmaVRKNzFUN3hOb3BYR1B6Q0pDRzNoRkY0a2JFNE9GcWxwOVBpLWFZY3JiemNfTVJ3N2pEbHE4R2FuNG1haEh2MGdaSzU0NHdUeWl2YWxkSm53eTk5cHdvRmhkQVY3Y0dpOXM0YjRIdlpleHBoUXlpcEJZR2Yzbm9nc0ZUcmZ2MjR0UQ?oc=5&hl=en-IN&gl=IN&ceid=IN:en,"Fri, 31 Oct 2025 07:00:00 GMT",The Economic Times,HDFCBANK,HDFC Bank,Private Banks,"SBI, PNB, HDFC Bank & others have changed their website domain names on RBI’s instructions; Is your bank a - The Economic Times SBI, PNB, HDFC Bank & others have changed their website domain names on RBI’s instructions; Is your bank a  The Economic Times",0.0,0.0,1.0,0.0,neutral,GNews,2025-12-09 13:43:47
HDFC Bank shares adjust to bonus issue: Did the stock actually plunge 50% in one day? - Moneycontrol,HDFC Bank shares adjust to bonus issue: Did the stock actually plunge 50% in one day?  Moneycontrol,https://news.google.com/rss/articles/CBMi4AFBVV95cUxPYlo2THNlcDVBdWw5aDIzNEx0TTRtZVdLWTJoUEhOdFRDRFFJSl9UdU9BZ09iNVRrVjJtMENzVjhEZ2dmWWJpYWJtdV8zMDBpQmxuOG5YdVptN0pwVGQ0a0QxNXNRUGhtUzhWMkR5Y3JHZDYzYkhPcnF0VmF6NlU2cms5YWVYWlV0MUYteHIyajhVUTFvUUpnQ2FlN3Z0blVibG1vZmVJb2U4NEJaQlNuX203eWI0VEsyd2FSYjQtTEhkSl9yVHhWbU1McDZnbW1TcUpUR1BHcG5HQ3o3S3hrcdIB5gFBVV95cUxNTm9wT1VhUExBRXVqNHY3cVkxQm5hMTZGaGpCSjJQTzlxZFhDb2JmU0xmMFA5ajE2eWZZSV83bGk5WFFQanNKbnZYM0sza2ZFUlhReGRTc0JESm1VZHNCTGxBR20wbW5yRThWbVBiOEM4RVh3cWNJaWc3U2toaXh3YVh0eHVQR3RhUW1uMk1xdlhOel9la0JKVUNWcFQ3Nmd1eUFPR2h1RjVGRDFjNXAzeHpkc0drUXlLT05HYVc3NS1tT1JPc05JcGVVSjZUMUdFdkdiNVBZSFJoSEY0UGJTR0RkSi1Zdw?oc=5&hl=en-IN&gl=IN&ceid=IN:en,"Tue, 26 Aug 2025 07:00:00 GMT",Moneycontrol,HDFCBANK,HDFC Bank,Private Banks,HDFC Bank shares adjust to bonus issue: Did the stock actually plunge 50% in one day? - Moneycontrol HDFC Bank shares adjust to bonus issue: Did the stock actually plunge 50% in one day?  Moneycontrol,0.8948,0.275,0.725,0.0,positive,GNews,2025-12-09 13:43:47
HDFC Bank’s first-ever 1:1 bonus issue—Last chance to buy shares before August 26 ex-date - financialexpress.com,HDFC Bank’s first-ever 1:1 bonus issue—Last chance to buy shares before August 26 ex-date  financialexpress.com,https://news.google.com/rss/articles/CBMi0AFBVV95cUxOdGt5eHg4c3VTamhxYXNTdHZrM296WlA2cU1jMHhWX2hFSTNCRWFFNmRSOVlYd08tbWxjZFJEVl9NTTdKYV81VC1kUVZUM0czTXl1TGdRV2V2SzN1MXB5b1ZjWU5GWWNxZUs5cHU3MDQ4YUpVQUF1bDY1NDBsVFpJUHFUMmJPWlV4TFhSS21iMVY3QVpiSVI1amJfRXR3d0ZidVNHSmh0cXNhLUhXb2NaRUU1NEpvcFVwd0xxcDljd0tBcUNSYUJWRl94X29IR0Nl0gHXAUFVX3lxTFAtTlhXSTZ0YWVWY3dXaDZycnBycERpTnRBWFptSXRzYVdZRHN4MG9IWjBfRVVvRXp4d2RENndpVkRwLUI3aUJnWDBWakhFNFZsQ3hWRjM5MjNTS1RXVEtZSjZ1V3NaZmZLZW9mampXNjJNb0ZWcEFYMHc3X2tORnJUOTdzaUNtSVVtVTVKRFowZmNCSUUxUUNETlZjSTg5VnVIdk1nNjM0MW0wVll3dGJ4dXB1Y203SHMyNEtYN0hpY0pfUTFKX0ZZMjBxLU1uYVpwS2kzem00?oc=5&hl=en-IN&gl=IN&ceid=IN:en,"Mon, 25 Aug 2025 07:00:00 GMT",financialexpress.com,HDFCBANK,HDFC Bank,Private Banks,HDFC Bank’s first-ever 1:1 bonus issue—Last chance to buy shares before August 26 ex-date - financialexpress.com HDFC Bank’s first-ever 1:1 bonus issue—Last chance to buy shares before August 26 ex-date  financialexpress.com,0.9246,0.381,0.619,0.0,positive,GNews,2025-12-09 13:43:47
SBI vs HDFC Bank: Which banking giant is ahead after Q1 results? - financialexpress.com,SBI vs HDFC Bank: Which banking giant is ahead after Q1 results?  financialexpress.com,https://news.google.com/rss/articles/CBMixAFBVV95cUxQS19JMTZtQnJEX3FHMzhwYWY1dms2NWxLamUzcTRuSTBPVS03VF9tclZYTHdHMjBvOGRfWG85SmcyRXkxeElxQjlaR0VBVTBFcDNrTjJmRmZtVk13a3VIblNneVFsdWtmSm5qMDM4dnZSMnhxVm9yRV9kdzVEV1pmRmk3bF9RWlVGekZUd3o3THpXRWdMdVdmVjYyX3otbllVMXFVM0RjXzZoTUNxbEZRYjdKVmlhR3dBX2t5X3hTdHo0Mmtl0gHLAUFVX3lxTE04bS1tdUplbGRsbERtMUx2QXF5Q3lYQ0xPWGdFNGpENHNHQnQ1N0ZpekZ1a1JzRG1SVFNoT0Q2eXVhOFo0TWczSlVvTGJiWTV5RTR3REY1aHRlRkc4RW5DY1J4YmM0N21FbG82M0wxekFURkZzejNsd2Joek9pS245enZHZGV1X0ZaeDI3WkZyX1YxMVd4TW4ySHZWV1FucmpJdk45VWY2eTJvWWJlMW9WTzM5czVwbzM3bF9sLUhmb0Yyb2pRVmVTblBR?oc=5&hl=en-IN&gl=IN&ceid=IN:en,"Mon, 01 Sep 2025 07:00:00 GMT",financialexpress.com,HDFCBANK,HDFC Bank,Private Banks,SBI vs HDFC Bank: Which banking giant is ahead after Q1 results? - financialexpress.com SBI vs HDFC Bank: Which banking giant is ahead after Q1 results?  financialexpress.com,0.0,0.0,1.0,0.0,neutral,GNews,2025-12-09 13:43:47
HDFC Bank share price becomes 50% cheaper today; know why - MSN,HDFC Bank share price becomes 50% cheaper today; know why  MSN,https://news.google.com/rss/articles/CBMirwFBVV95cUxQZzU4NlZMSVBIOHp5MTRjOGxzcXQ4YVNZWDFTc0JXcGFnNEd0OXl5OVFsREFGUGNUSmhCRndFMkVsOHRPa21fQko2VWpSYWdXOHRjZmhWMnRxOW5OVVpTWG1sdjZGcmI0TlRLTGdocWZrTzZUTjdRZmowMVBadnQyYTdzcHFxemFHOExVd0ZKQXlkOHFLMENLQVgyd1czMWtMWEFwYUhsSENCbnJCMTV3?oc=5&hl=en-IN&gl=IN&ceid=IN:en,"Wed, 27 Aug 2025 07:00:00 GMT",MSN,HDFCBANK,HDFC Bank,Private Banks,HDFC Bank share price becomes 50% cheaper today; know why - MSN HDFC Bank share price becomes 50% cheaper today; know why  MSN,0.5267,0.173,0.827,0.0,positive,GNews,2025-12-09 13:43:47
"Top MOSL Banking Picks: Earnings recovery nears; ICICI Bank, HDFC Bank, and SBI top investment ideas - livemint.com","Top MOSL Banking Picks: Earnings recovery nears; ICICI Bank, HDFC Bank, and SBI top investment ideas  livemint.com",https://news.google.com/rss/articles/CBMi-gFBVV95cUxPVDlEdDdNdDNBMDFlMmdRSU5HT2lTeDdsbTNJNkZhMjAzVzFIYndqR25Lb04xNW51MzVOLWJJUndPX3B6Y2M4SlBxaEYzZVE1N2s4WmczRk5YZnpMN2U1N19sZ2Z1THUxNHA2S29BSDhTeFlnU0o1RzVMR3RuaW80MDV5Q1E3VjJodDRBczRMNlUtdVZQOWV2Y2VIODVQY3VvVFk4MjVOTGJ6TjVHRllYc3VNemY1bVZWQksxdUZvazZNbzJod1VpR3N4Z0ZwNnBETlNnYkl1TG5kRHlsWjJTSjRlQmVrV3c1M2luWkNFU2RmQjItOXJnakpB0gH_AUFVX3lxTE53SmpxRk5uUjZhREIwdHZIMm1Yb29jR016Z0VHZFVVY0Q0S2h2U0NjYi1MN2dlQTJTNURLU3hWS2I5OUlOc3dGSGJ3SXY5d29fOHVlenBRYXgweUw1b29saVVDb3VaT1B5Ti1uQUVZY3FoWnVGaHk4OTVVMlFzSktmVm5wNl9MRTA4b1ZLM3hHRXNXbG1iWDk0aEYzUGE4THdfdnhuZ0g1RmNaODRDX244N19SelM2Ui1JdXNka1E4Q0VZQUdINmIzLUhaZHYtNjFXdXVpVEp1YUU3RE1TY3JqY2w3UHlub0gyQmJkV1NjSjVRcHNxb1Y4Vjc2cXpNVQ?oc=5&hl=en-IN&gl=IN&ceid=IN:en,"Fri, 05 Sep 2025 07:00:00 GMT",livemint.com,HDFCBANK,HDFC Bank,Private Banks,"Top MOSL Banking Picks: Earnings recovery nears; ICICI Bank, HDFC Bank, and SBI top investment ideas - livemint.com Top MOSL Banking Picks: Earnings recovery nears; ICICI Bank, HDFC Bank, and SBI top investment ideas  livemint.com",0.6369,0.188,0.812,0.0,positive,GNews,2025-12-09 13:43:47
"HDFC Bank bonus shares explained: Share price may fall 50%, but holding doubles - MSN","HDFC Bank bonus shares explained: Share price may fall 50%, but holding doubles  MSN",https://news.google.com/rss/articles/CBMiywFBVV95cUxQQVR0U21HNHdKUm41T2sxVGtmX1Nhd0xtbG9WNjI2WnlvSFN4em9HQVdqTThKMm1POUJ4VXdsa3ZUTzRVR2xySEtINzZCakFxbnBYYl8tY19xTG1kdXZOVEFVNzlKckw5M25rMFFwMVlpWkk0Y0ZGQ0xHQXQtXzRjVXNySjdyazF5dExnVU1QYjlnTGxRWFRUSkVCTWY2aDhMRndhR0tubzIyaEV0NENnekxnV0E0SnZFcmpPQ0g3WDl5YnFKd0dJSkxHUQ?oc=5&hl=en-IN&gl=IN&ceid=IN:en,"Tue, 26 Aug 2025 04:14:59 GMT",MSN,HDFCBANK,HDFC Bank,Private Banks,"HDFC Bank bonus shares explained: Share price may fall 50%, but holding doubles - MSN HDFC Bank bonus shares explained: Share price may fall 50%, but holding doubles  MSN",0.93,0.407,0.593,0.0,positive,GNews,2025-12-09 13:43:47
HDFC Bank share crash explained: Did it actually fall over 50%? - India Today,HDFC Bank share crash explained: Did it actually fall over 50%?  India Today,https://news.google.com/rss/articles/CBMi1wFBVV95cUxNZ3NEYjJzeEppWDJ1RUw1U2NsTk1IQWgxeWVodHVBdjFwXzhGWnNLbmZiTlNDSDV5a0N1bEZzSE9uZUdLVTRySTNJSWxnTE1lV3JMOFJaZmpibjE1d29SUzUyRTRwTXFhWWVzdHBjRFA5QUZTY0ZhSTIycWVMS1VoUzY1dEgyelp2WjZNM2pWRF90cFhmZ0taMUdQaDdEWDBaNEVhdE0zYWdrYzQ2UC1iUHN4QVpMeWFiVzE3ZGo1SUVoc3gxemQ1VFd1c1FzeDZieEI4TmhFa9IB3AFBVV95cUxNNWtfSGxPaE9IcWQtWkZKLVdUbklLcmw4NHhzYzRpc2NwWjRITlVKNUJ5WkFZaTVzRjhobGlEcVNSRXloWjByYnNYUU9OY0YyZVRUREljYzdKMG5GZE91M3FfTnFwOTcxU0lNMnYyM25GT1FHZzlRNXZvaVBmZWNQaDFPODRkbXhrZ2UtRjNNWEJJeWZJd1BCZXBBWUNMMi1jNmlvcEltMkJpV3VCeVZBS3ZQb05RZ0JRemFpclJadHN1dk1vbnl5aXVSZXdMcGlBR09FYmNvdlpuVC1D?oc=5&hl=en-IN&gl=IN&ceid=IN:en,"Tue, 26 Aug 2025 07:00:00 GMT",India Today,HDFCBANK,HDFC Bank,Private Banks,HDFC Bank share crash explained: Did it actually fall over 50%? - India Today HDFC Bank share crash explained: Did it actually fall over 50%?  India Today,-0.3313,0.133,0.694,0.174,negative,GNews,2025-12-09 13:43:47
adr strength hdfcbank it ratecut connection - Zee Business,adr strength hdfcbank it ratecut connection  Zee Business,https://news.google.com/rss/articles/CBMioAFBVV95cUxQNnNoYXZIRnRXcEQ0QkhPNHRuZVNvdmJFeFFjRFRwMUhwWTVSSFNZWTdfTHo1cEFEUmRMa25WeENvb3hDZ2lhWE9zX21PS0tnbkxtZGROblA4dnIyTFloSlluNDFQT21RUncyY1RoSEtneGpCWmJpZFQ0OXNxeXVuNEZQWmxhdkFiVHltcFB2Y3Vtckk2T1FVdERhd3ZSSXpM?oc=5&hl=en-IN&gl=IN&ceid=IN:en,"Thu, 18 Sep 2025 07:00:00 GMT",Zee Business,HDFCBANK,HDFC Bank,Private Banks,adr strength hdfcbank it ratecut connection - Zee Business adr strength hdfcbank it ratecut connection  Zee Business,0.7506,0.299,0.701,0.0,positive,GNews,2025-12-09 13:43:47
"HDFC Bank, SBI Among Motilal Oswals Top Picks In Bank Stocks — Check Full List - NDTV Profit","HDFC Bank, SBI Among Motilal Oswals Top Picks In Bank Stocks — Check Full List  NDTV Profit",https://news.google.com/rss/articles/CBMiuwFBVV95cUxQS3VkejJMZmdVbHRvcEdleFVpUy12bFZ6bTZQWDJXamkzbThfMFdWN2xXQmdrT2RRU3VQRGwtZnpnS0FMQmN4QV9ocHFjUlA4aWdyczF5dHZNT3V4SVBXWlJtZXdnckY1eGEwOGZEMGl3VlJSbE9fWkxPU2hCVjFnaXRIUXdTTktDNGdxZnhCbURfQS1yMDJJUVBPUzlvQ1NhNkdmVk9vcDFoUFYzeFJZbjNOT0VTbGRYTmlV0gHAAUFVX3lxTFB0OGdadFZHamYwQWZqSnR6X3Fha3ByUEJsb3Jwa1V3ZlduRWpyZndpeE5VRDlES2xRM21xRmZ0RG50MGNwX2d1bl9LbURMZ3ZpYlB4N09ORjFXNjVpRVBiVzJrZFY0WU4yV1JtTHU4WThoM2dlbFFiTk1BeVU1cm43N1lVaTFYQ2hNQ3ZITHVkTUpoMnU5cFJXUk9KT3B3MjF6ZERWeTRtU0ZjRVB3MW9ULWs2eFBhV21UMVdYd1RlNw?oc=5&hl=en-IN&gl=IN&ceid=IN:en,"Tue, 16 Sep 2025 07:00:00 GMT",NDTV Profit,HDFCBANK,HDFC Bank,Private Banks,"HDFC Bank, SBI Among Motilal Oswals Top Picks In Bank Stocks — Check Full List - NDTV Profit HDFC Bank, SBI Among Motilal Oswals Top Picks In Bank Stocks — Check Full List  NDTV Profit",0.8126,0.233,0.767,0.0,positive,GNews,2025-12-09 13:43:47
HDFC Bank Share Price Falls After Bonus Issue | Key Details On 1:1 Bonus Shares - Samco,HDFC Bank Share Price Falls After Bonus Issue | Key Details On 1:1 Bonus Shares  Samco,https://news.google.com/rss/articles/CBMi0wFBVV95cUxQbmpROUQ4NUhqTExnQUFzMHhPcFFsajNORXY2R1VCMktEekloOHRmWFg3YV84eWh3MlZPb2xBTU9ma3RaY3pKMGE1RnpCdHk4cXBhRGJsQ2pZT0NENmFBcG1yMHJ1cEl5VVdINjNycTJvY0hlWXpxMlF4ZEpSNFYwQTRKTFVFRThhSlNKb25GaDhsX3VuZVZjeVIyYjZRRW5FRnMzenlucjZFOXg0b1JCcmxEeko5WGJtMndMd2pBQ0hzZlFoZ1NUZE5lZnZUUFlTQjFR?oc=5&hl=en-IN&gl=IN&ceid=IN:en,"Tue, 26 Aug 2025 07:00:00 GMT",Samco,HDFCBANK,HDFC Bank,Private Banks,HDFC Bank Share Price Falls After Bonus Issue | Key Details On 1:1 Bonus Shares - Samco HDFC Bank Share Price Falls After Bonus Issue | Key Details On 1:1 Bonus Shares  Samco,0.9674,0.477,0.523,0.0,positive,GNews,2025-12-09 13:43:47
HDFC Bank Bonus Issue: Last Day To Buy Shares To Qualify Before Record Date — Check Details - NDTV Profit,HDFC Bank Bonus Issue: Last Day To Buy Shares To Qualify Before Record Date — Check Details  NDTV Profit,https://news.google.com/rss/articles/CBMiwAFBVV95cUxOZ3NXMW1tVkw5VjYzNzVyM0piSG9hUXBmWVZlZG1WaEx2eDdOQWhQTnUzSVpvZzlPcXpCZmdfalI3RU1rTElEdmNGbUhZbm0wYzh6em9pSTNLMk1fdUZZZEFuemdSSVc3MEFtRi0xUERGZEhqdnRGdEhlc3ZHb0JZbkYzQ1lTT2plQkliTXNlZGFUYlhLaUwwSFJsalRJUjBmMF9vMFNrYjlNeW9SVVlac21hZ3MyNmdfUkNXRkd4SXDSAcYBQVVfeXFMTzEyNHN4QnY1emdobnlDWXFuS1c1VEd6cHhDbzVncEFlaGhXeFJfMG5DZkdGdUNkeW5JX0QtYXFhRzRrNG5DbV9aVXpZRkN4b3k4ZFFPZHFIUU9Icy1TajJsUDA4UUtUN0hoSm0zWjFHUVkyR252OXVmZnY0MG1hUE1FRlE5NW5aRENIN0FkSHVBVHpCemZORmU1SnVSSHFVSmJVN0Y1YVVFY3NyalRkc2taU3hsa2Jld2tKb19XV3c0alNoRGVB?oc=5&hl=en-IN&gl=IN&ceid=IN:en,"Mon, 25 Aug 2025 07:00:00 GMT",NDTV Profit,HDFCBANK,HDFC Bank,Private Banks,HDFC Bank Bonus Issue: Last Day To Buy Shares To Qualify Before Record Date — Check Details - NDTV Profit HDFC Bank Bonus Issue: Last Day To Buy Shares To Qualify Before Record Date — Check Details  NDTV Profit,0.9451,0.343,0.657,0.0,positive,GNews,2025-12-09 13:43:47
"HDFC Bank, Airtel, HUL: Motilal Oswal picks 10 stocks with up to 24% upside - Business Standard","HDFC Bank, Airtel, HUL: Motilal Oswal picks 10 stocks with up to 24% upside  Business Standard",https://news.google.com/rss/articles/CBMi3wFBVV95cUxOaVIyampvM1JmSmFNMDNacGZZQkc2aEtOZUpiTGhPbl9LenhqdkN6Z3JZajJ6ZUxGZHZvcnFGRnkwN3pnQ21wMXZ2emo1T2kybmJtdUVkY1BzZWh4dU5QVWFsODhlUmo1RVJJM29lWGUwelA3Y0lEUk9YUkxXWDRNZ0JqZGtTaWJaZ3p6emRiRGVOeTRmWkdzVWlxVHl0c0xVdy1ZVjJKb0RoZHpveXRGYnlGZWp0eHQzVktQc0VHM3Zwc1E1QS1QTFdLLWdUc1JMWmVmbmxlWnNYb1V5VGlV0gHkAUFVX3lxTFBKdDFxY01qY3o5RDB2dEltaDB3X0FHNXc0OW9BcVlsc1B4ZXg5MkdRUmpvclhOOHNYM1FLTGJQOFNGTmMxM1FPREwtNWEyY3RFdzlmNmRCSEFZRnVuSUY0aWNUT2JTNnpUOHg1Q1lseUk0V1FzRGVSbGJCaWZRWHdwVS1zVTh3YjJWeU9wMk53b0FMNzFmVWZiWlMyeW05dkFEYkRRb0ZMXzRkR1V1LWtaa2tSSXdXNzBucDNzd1hvQ0RsRFV0eVFCUTRtSEZMb3Rfcm9XQTI3Ujl3VTF3dXFTYTVlcg?oc=5&hl=en-IN&gl=IN&ceid=IN:en,"Wed, 10 Sep 2025 07:00:00 GMT",Business Standard,HDFCBANK,HDFC Bank,Private Banks,"HDFC Bank, Airtel, HUL: Motilal Oswal picks 10 stocks with up to 24% upside - Business Standard HDFC Bank, Airtel, HUL: Motilal Oswal picks 10 stocks with up to 24% upside  Business Standard",0.0,0.0,1.0,0.0,neutral,GNews,2025-12-09 13:43:47
HDFC Bank warns against APK fraud: What is it and how it works - Times of India,HDFC Bank warns against APK fraud: What is it and how it works  Times of India,https://news.google.com/rss/articles/CBMi3AFBVV95cUxQR2tmT1lGVDJiWUFYN0hkLS1qOWpRSjJOZldSZFNpNFQ0VnRiU29HekQzLU1reDlwVWg2dkpsRmFuRWs4MHB3RXI2WGVnOFVnYjFlSVNINDI0STVQWU1MYWtBTXJwN1BLV2xGakJ3YWVrVW9PQnQwcXUxUWg4cnA3RG5nVGdEUEU4dnNkTV90bTlFUHQ1enF5NXNyV2F4Y1g4Mlo0cTJWTUpkRHZfUTdjbFFPT2xXZEJGWkRzTGlBVDdlTG9LaXduMGM4aThQTjhGU2N5RVJiNlJfTFMy0gHiAUFVX3lxTE1kNmJ3S3RHQkwycnFuRFFzbnRLWVg1T01GVS0zdWlDZWRTc3NKbF9sem5rSlJuU3dUczVHTm5sZ1BaT09iMndoVHZweXVJLUs0bVEzd2lBRUU5VEt4b0N4X2dnX2UycWs1UHNRVjRLc0I4Y0R4bzNTZFdPcU1RM0Q4Ri1QOFRidzU3S0JfeC1YQ3dwdk9CZVB4b1BpMDl5TzVqV016MjRubTc5VkxSV1dubjNDcHhuT1BVRTNaakVhb1Qzb0tFdS1xSU9sNGlka3JGNzFWWHRJeTlYUHdYSENONmc?oc=5&hl=en-IN&gl=IN&ceid=IN:en,"Wed, 06 Aug 2025 07:00:00 GMT",Times of India,HDFCBANK,HDFC Bank,Private Banks,HDFC Bank warns against APK fraud: What is it and how it works - Times of India HDFC Bank warns against APK fraud: What is it and how it works  Times of India,-0.8555,0.0,0.736,0.264,negative,GNews,2025-12-09 13:43:47
HDFC Bank introduces 'My Business QR' for small businesses - livemint.com,HDFC Bank introduces 'My Business QR' for small businesses  livemint.com,https://news.google.com/rss/articles/CBMiugFBVV95cUxQblFJUXVzeVE3SVNpS3RUV2dRMXZRWUYwLXNDWW1NOWdPaXFzQUloc3R6TFdMSWdQR1JkZ3ExUVNPYy13dUYtRktmZzZBaTFtcUtOXzZKSXhiaFk4NEc4VGd3Rkw2QzBqaWp4ejR6Z3NRMlkxRGhNaUJCbFc5Sm13SEdjQkV0Vy1YMFZDajlKSnBlRVZiYURCVTRTbzVFbHVBVFNpT2tKVG12TU1lSklkZUhCSUhCOFFtLUHSAb8BQVVfeXFMTU50RV91N3NJcHpjd0E1QS1HOW5OVUZNUG9mZkZOS3JocDMtMGhCalY4M2tjQUN2OUdNTmRadVZ0M21MWXNCamttdXgzYXd4WF93ODljUXhheTJQYXpfaHEzZk43UVBBSUhTbGI5SENMOEk4OHhYVllDTlFOVjF1dWZ2dElSX2Q3TlJTaEJ2VVN5WDYxdUJaUC1SSUx4TU1qdnItc29rLTVIVmRsZG1CSHpfWGMzWEJkSmkwZXFQaTQ?oc=5&hl=en-IN&gl=IN&ceid=IN:en,"Thu, 09 Oct 2025 07:00:00 GMT",livemint.com,HDFCBANK,HDFC Bank,Private Banks,HDFC Bank introduces 'My Business QR' for small businesses - livemint.com HDFC Bank introduces 'My Business QR' for small businesses  livemint.com,0.0,0.0,1.0,0.0,neutral,GNews,2025-12-09 13:43:47
HDFC Bank shares extend decline post 1:1 bonus; analysts divided on outlook - Business Today,HDFC Bank shares extend decline post 1:1 bonus; analysts divided on outlook  Business Today,https://news.google.com/rss/articles/CBMi2AFBVV95cUxPTTVNTnVxaF9odl9yVDM3R09XQ2tPdy1BalhQSUNRbmx5RFZobGVydnZ1T05YWXdwRW0wX0QxakpoRk95S2hnQV9PZEJHazBhT3YxbjRsS2dwSVZvbXBFcHk0VGlJdndkQ3g0WndJYTZtQW0wRWNoWW1sSl9UQ09mcjhxa2dlMElrQkJaU0FzRjNhS1d3T1VYQzZUZWl5UEJRUW9sc3dqQWx6bFBrZEFGRk5YaXZ4OXFHcllrWVB4UWJNM0xLVTJyaFNvOWhHWG9yYndjYmVvemnSAd4BQVVfeXFMUDhuWVdsMl84QUNuZm4tUXFWc3lZN0x4MEl5V0U4RnBaYmRXNy02bjhvaVRyWVBQS2J3TjhtLVpoLWR6LXJXUjNqVUZ1bFRJNUFiSmIzbFNaWnp4R19nbndqSC1WTjduUmpYRU5DX3d1SnVfY0tUZFdINjVKZ2hoOGlpV3ZQQlNQMkxjM3J3aWdtOUFQNVNrTFgySlR5MTdEd0ZITjYwYTl2RnZRakR1NV9DZU5WMDVyeXBaYWVxQmU5ajRjcTBIeDRYNlVJYl9STVFsV0hTSmU2MWVjb1dn?oc=5&hl=en-IN&gl=IN&ceid=IN:en,"Mon, 01 Sep 2025 07:00:00 GMT",Business Today,HDFCBANK,HDFC Bank,Private Banks,HDFC Bank shares extend decline post 1:1 bonus; analysts divided on outlook - Business Today HDFC Bank shares extend decline post 1:1 bonus; analysts divided on outlook  Business Today,0.9153,0.392,0.608,0.0,positive,GNews,2025-12-09 13:43:47
"Dividend, bonus issue: Vedanta, HDFC Bank, 12 others to remain in focus - Business Standard","Dividend, bonus issue: Vedanta, HDFC Bank, 12 others to remain in focus  Business Standard",https://news.google.com/rss/articles/CBMizwFBVV95cUxQc1RUeHdfNERpYlVzVXpMaUpqb2pFVllVamRCUVJvbEYwc0V2VVdfV0JHR1RhakhUbDRXMXFBSUE4U2l4YUlQNDZxeTlnU0g3dFUtQlg1ZUlxWVdHQXZHNnN3aUZtSjFmSURKSXVtWGFRWG5PNUFfWnRMOHlVYnlVQmRucVJDZ0FLcUM0YmVGRy1WQW02d05xX0I5VS1EdUpQS0RaQ3dJb2FXRzJOQU04b3dWZGFNZEVHUFNkZ3JjVG16QWxjZXY2VDREWGptaTTSAdQBQVVfeXFMTmc3X3Mxc1ctaE9Vb0lIY1pXdXlxOGN2WFpOMUVKLXJpb09WcHlBSTRaT1UzemdkcUp1WGxPRmctdy1kSTJDMWxxaDNwLVAtSHIxYmk2Qnc5NmtWWHBUUGNSaTBuLXZEaWNGQ2JmSjduVExYYjlua3NhZjNoTGhXSTBTVnVpeEl1d25HVmhoZTdXUndaRVh1am1waWY3aTFObzBmTlNaN1l2UHpWVk9DNkh1NUJVNTA2Yy1sWHV0SkdyUjJYNDhZbENvbWFubmxVMmQyRWU?oc=5&hl=en-IN&gl=IN&ceid=IN:en,"Mon, 25 Aug 2025 07:00:00 GMT",Business Standard,HDFCBANK,HDFC Bank,Private Banks,"Dividend, bonus issue: Vedanta, HDFC Bank, 12 others to remain in focus - Business Standard Dividend, bonus issue: Vedanta, HDFC Bank, 12 others to remain in focus  Business Standard",0.7906,0.206,0.794,0.0,positive,GNews,2025-12-09 13:43:47
"HDFC Bank, SBI, ICICI Bank: Nifty Bank falls over 1%; what investors need to know - Upstox","HDFC Bank, SBI, ICICI Bank: Nifty Bank falls over 1%; what investors need to know  Upstox",https://news.google.com/rss/articles/CBMi0AFBVV95cUxOaGZrRW1JV1EyNmlKVm9CQjMxa1pvQXJHVEpLanFUaDV1ZUp3ZVU2TlZ2NnBzMjZ6V2JQUFpCU2RQUjBqQTM1RU9Mek92M2JoQlV4blNidHk1MzAzMTN4NUNVYU5BeVlvODVaektYbHdUNmI4Y3FXVUxKWnc0RVlfbWNpejhnNzdGREluSTlUblBfdUt6MmwwYUh0SlVnU2xvekZBbFpubVVyV0UtcWhrTGdTRmo2QmdPaDhQUzdIczVJdWJhelVMd2l4N3IyZ0do?oc=5&hl=en-IN&gl=IN&ceid=IN:en,"Fri, 22 Aug 2025 07:00:00 GMT",Upstox,HDFCBANK,HDFC Bank,Private Banks,"HDFC Bank, SBI, ICICI Bank: Nifty Bank falls over 1%; what investors need to know - Upstox HDFC Bank, SBI, ICICI Bank: Nifty Bank falls over 1%; what investors need to know  Upstox",0.6597,0.148,0.852,0.0,positive,GNews,2025-12-09 13:43:47
