title,description,url,published_date,publisher,keyword,bank,sector,text_for_sentiment,sentiment_compound,sentiment_positive,sentiment_neutral,sentiment_negative,sentiment_label,source,collected_at
HDFC Bank first-ever 1:1 bonus issue: Bank announces Rs 5 special dividend; here’s what it means for inve - Times of India,HDFC Bank first-ever 1:1 bonus issue: Bank announces Rs 5 special dividend; here’s what it means for inve  Times of India,https://news.google.com/rss/articles/CBMinAJBVV95cUxOWlZGdm8zVHloTXZvMy0wZXdKNzV6QVgwRjZGSUdMRGZjSEd3Zlp2a1VaZWNaYm5CUy1HZEd6RTNzemtlX2dwdjQ4TUdmOVNUUDZFVzk5Q0R5M2dVQmJ6U2FZTzAyYVBuQmhlQkFwWHh0U3cyQjJXN3hkSEtNTi14U3YtRHlMQ0JVVVJrOXM3NGZaRkRLaS1TNExkU0U4aV8xV2lmSDlUZE1IalNkRVdKTjk1WUxGVHV6MVgzNTlSU0JaRFBVLXNBdFdfalhYVWtXbkNzY295RUU0UDZsNXpjYVgzZjJQbUlTU3FqamRMRG1wV1I1ZWZ5VFhuaXY2MFdwV2FvaEI0ZElleWUwYkhCQW85eXV4ZDBlT3o2WtIBogJBVV95cUxNOWU1VmZRUjNpdDZ0XzhIRDU2LXJIX3BHNEdkYThKMDRjYnhiTHExQ0t5eXplN3pQWFZWTVpULWJrbzRweTZUeFp4WU1ZRXdRMlg2TUZNN2ZMMl9nWmtQUk9vVkU4cFNJUGtuNnctel9XUmI2bjhIWUNRMW93N0JzeEJUSzF1Rnl0MmRLU1Vod2drZ1hyOVNzeFc3ZlhuZjZRQ3YtNGt5Vm12TWVVRXgyVHZvTlo2R1dsZDYtRDAzQklheDB5Mld6QUNWNXNMQVROYk01VHNKSEpabHNvYlFpaXhYQjNtU3lFbktLb3ltNE1ZS1hSNEZrb0FmdmVhUHpXcFlNR19GbVd6VG8wN0NqVzlOaTFEUGJ3RzlpUndySWRRUQ?oc=5&hl=en-IN&gl=IN&ceid=IN:en,"Mon, 21 Jul 2025 07:00:00 GMT",Times of India,HDFC Bank,HDFC Bank,Private Banks,HDFC Bank first-ever 1:1 bonus issue: Bank announces Rs 5 special dividend; here’s what it means for inve - Times of India HDFC Bank first-ever 1:1 bonus issue: Bank announces Rs 5 special dividend; here’s what it means for inve  Times of India,0.9081,0.241,0.759,0.0,positive,GNews,2025-12-09 13:43:47
"ITC, HDFC Bank among 5 stocks with up to 29 'Strong buy' calls in Nifty - The Economic Times","ITC, HDFC Bank among 5 stocks with up to 29 'Strong buy' calls in Nifty  The Economic Times",https://news.google.com/rss/articles/CBMi5wFBVV95cUxOOFdlMll1bDZjYUp4UHpyTE0yOHB0dzVBSFBqMHNla2N3QXp2c0RkdG9WNXYwMkljZkJKeExJQXpyR1pjVjBwUmRTTWZLeEtmOTY4SnN4dU1wcVdWMEZzV1FQT25xWW9aVHNsZFEwdHVwUDRIODE0ck1IWGFBNzNOdmhmbGZmbUpaVmJTU3pxWlhMSzhacGRkbHFrcEVYZHNjR0RzZm1iVmhRN0JYNkMxZ296dmkxS1hFZUxkU3hCM3NIeXBjYWhCc1cyUlZscW41X09jUnRaMHU0NXBjSlVXaS1rMTBPeFk?oc=5&hl=en-IN&gl=IN&ceid=IN:en,"Fri, 05 Sep 2025 07:00:00 GMT",The Economic Times,HDFC Bank,HDFC Bank,Private Banks,"ITC, HDFC Bank among 5 stocks with up to 29 'Strong buy' calls in Nifty - The Economic Times ITC, HDFC Bank among 5 stocks with up to 29 'Strong buy' calls in Nifty  The Economic Times",0.9001,0.267,0.733,0.0,positive,GNews,2025-12-09 13:43:47
HDFC Bank Q2 PAT rises 11% y-o-y - financialexpress.com,HDFC Bank Q2 PAT rises 11% y-o-y  financialexpress.com,https://news.google.com/rss/articles/CBMinwFBVV95cUxQQ1g2RUtTSlBrNHNQVmxTNlY4bWoyUXVhMFFXdHRSS21yakFNNHJoeGphWTQzTGFjajFSRWZUNk5YSEdFWFRVXzAxWlQ2dGR2REdtNlY5NElMVVVSLW1tcnJGcnJLa2l0M3NPZF9fcEVkLTdMRm0xUVFDTFlWbE1YRnZHangtQzhxbEFLNEg4dUN3cVpDRENUR0ZyQWJNQVXSAaYBQVVfeXFMTU1zeVdQS2FkWkZvWUhmc3dxY3BZTnNfZGRONFVwM3NyOW1sVHJ0cE4yY0tTWmNyVjRQSERlYWg0Vk5xM3NCRHZEVVVtdlpDcHdHOEVMN0dIRUdOX1dGcU5JTjBjaFZfYXBpTHU5cWN4em0xNzdmLUY0TUJtSzhCSUZKLUlVMlU0QndzMDFqc2RYYVNkWDdCUkRQek9wekVROXZscnh0dw?oc=5&hl=en-IN&gl=IN&ceid=IN:en,"Sat, 18 Oct 2025 07:00:00 GMT",financialexpress.com,HDFC Bank,HDFC Bank,Private Banks,HDFC Bank Q2 PAT rises 11% y-o-y - financialexpress.com HDFC Bank Q2 PAT rises 11% y-o-y  financialexpress.com,0.0,0.0,1.0,0.0,neutral,GNews,2025-12-09 13:43:47
UAE: Dubai watchdog restricts HDFC Bank branch from offering financial services to new customers - Times of India,UAE: Dubai watchdog restricts HDFC Bank branch from offering financial services to new customers  Times of India,https://news.google.com/rss/articles/CBMihgJBVV95cUxNeTFGaFJFTU1EcEtRMDBaSGVpQzZrdERjSEdhU05oYjNmXzlqM2xpWHdRQmVCbnVrVlZHaWNfUnNaRHZPWDFoeUd2NENMdUc4SldSU0JlcEpGNHppaks0c21PdTY3U1FJc3hDeU95WUFBZWxaR2o2cDEwT2tDZ28yeFV2Y2JXLTBoc0lqOVhCLVpMUXktSzlhVk1XWnFSYjF0QUgzVjI2eWtvajI2djVTa2ZPMUNyZnJtb3BKM0h6anJGdFV1RVRrU2QtYzFkU19hdHRiWjJIc1ptRWJkTWxwenlyX19DMHYycDBqZlJpVjZvUlNXQ1RTcEhiZkE5Y3l4ODJWZVV30gGLAkFVX3lxTFBFcnk1Q3BNdWF2TVdNQkw5T3NtTTVNSnNaMlM1YmUyMXVIYkQ1U0psZ0hyaWdNZWlVRV9IbWoxck5lbklCT1RSUDVpZi0zVEhGdFROZjY4akNpOUlEWHI3U25LUUwxR3g4WmZXTzVZaXlaYkFDVlhSRXZ5ZEVOc1Rta3NRNFJDa2VRWVcwMjBjem0yRHY5ZkRuWE9TYXZsYURudTZTdGNUY09HODZPMUJaN0pTbUFhTTB2b1ZST1gtaGFSNXhFODJQRTA2NG54QVdPZXRGR3lwMEJJWDJ5cGFBZmxQRjk2OXZTTlhkZExaUGRDZEVkVExNb2o2bjA2R2NFRDVEUFk2WF9PRQ?oc=5&hl=en-IN&gl=IN&ceid=IN:en,"Tue, 30 Sep 2025 07:00:00 GMT",Times of India,HDFCBANK,HDFC Bank,Private Banks,UAE: Dubai watchdog restricts HDFC Bank branch from offering financial services to new customers - Times of India UAE: Dubai watchdog restricts HDFC Bank branch from offering financial services to new customers  Times of India,-0.5574,0.0,0.878,0.122,negative,GNews,2025-12-09 13:43:47
HDFC Bank shares stuck in a range for 3 months: What technical levels should traders watch for a breakout in stock? - livemint.com,HDFC Bank shares stuck in a range for 3 months: What technical levels should traders watch for a breakout in stock?  livemint.com,https://news.google.com/rss/articles/CBMikAJBVV95cUxQWjhqVy1NOWxhblJXM3ZLbkFNWTRncjBfOUItNzVQTTVScGFSTDNVWkFSSDFsZEk2SVJuaTdMNFNqeXRsT0cxa0VZT0xXQ1JFY1pDTl9zWjhCUGNDdXlUTUpRdVQzaXc4NDBaSHpucWxMdmZaU2VDZlFDWmFSSU9tYVFtLVdyeXA4WjhCS05nSlhqSmwxd2ZHNVNFMWtJVFZWRTcyX1pKT3duODZRQ3hXdjA1N0p1cDhTZzhsRWsyLTl5VzNCYWxGZ0IweWNDWDI1Vmlnc3FvVUYyRFBnUUZTeFFtUnM3UnhHbzhTdG12UWFTZWhHSVgzLXlIeU1PaXRYNnN2Q2F5U1NUSHlUWWZ4UdIBlgJBVV95cUxOTUQyVVRXaFZlSXBKNXptZk04TVRDRFgzTUthd1ljZ3AzMDV0RzB6T3RKSzI4Zm1OVHFLRG5PaGpKY1V2enNEQ1YzYkwwRmJ2bVBFSTJtVWp1SUEycmI5OHRQQ3RVN1cwSWJGODlrVzJqNjB1TnZlbllLVGg0TzBFVzR5Qy1sOW95cjZCWF9aQ3F2cGhPVlp2eWVvb3NvbHYwSGh0TzJNQmVRQVYyakluS25wTEVGT0ZKZF9wYXlHS0Jqbm4xRHZkTVVoSFRDVHBmSHRnQThNYmRWazMxVHREUHFyNmc1X0FMRlJTR05vZ3VnWEpYVWtQRXdWV0ItbElIV2tEVG1Hd3JTWGNGcUpBZUNWQk9Ndw?oc=5&hl=en-IN&gl=IN&ceid=IN:en,"Thu, 18 Sep 2025 07:00:00 GMT",livemint.com,HDFCBANK,HDFC Bank,Private Banks,HDFC Bank shares stuck in a range for 3 months: What technical levels should traders watch for a breakout in stock? - livemint.com HDFC Bank shares stuck in a range for 3 months: What technical levels should traders watch for a breakout in stock?  livemint.com,0.1926,0.096,0.824,0.08,positive,GNews,2025-12-09 13:43:47
HDFC Bank (HDB) Reports Higher-than-expected Quarterly Profit - Yahoo Finance,HDFC Bank (HDB) Reports Higher-than-expected Quarterly Profit  Yahoo Finance,https://news.google.com/rss/articles/CBMif0FVX3lxTE5ZZ3JPdmZqcVoyQXEyUjJSZlNQTk9rN0RXclp3b25oNDlKUlJWM3RzRDNlaTNCcWhTZDByV09aN0pUNi02ZG1jeG9zTXBFVUtZbzlicS1WNmNTX2loU1MzdGR1VkhtblhER0hqeWtycFZBcmplSUdiUHVfQVlfNEk?oc=5&hl=en-IN&gl=IN&ceid=IN:en,"Wed, 23 Jul 2025 07:00:00 GMT",Yahoo Finance,HDFC Bank,HDFC Bank,Private Banks,HDFC Bank (HDB) Reports Higher-than-expected Quarterly Profit - Yahoo Finance HDFC Bank (HDB) Reports Higher-than-expected Quarterly Profit  Yahoo Finance,0.7003,0.254,0.746,0.0,positive,GNews,2025-12-09 13:43:47
"HDFC Bank to clear cheques same day from October 4, 2025: What it means and what you need to do - The Economic Times","HDFC Bank to clear cheques same day from October 4, 2025: What it means and what you need to do  The Economic Times",https://news.google.com/rss/articles/CBMi8AFBVV95cUxOWEhQQnpZc1hlTHFHYWdWTXBDNWFlaXpCUDZFSnZ1bllQMWJ2eTJHbjlYRWpiVFp2RGRvZEFXeWN1TEc5M3I1T2RmbTUzRDdsMmotRXFJYnFuRFFaTC1iYnhUYjQ0VnVJemNDcWlQdV9rd005bHdXSEN6cDJoQ21uTWlQUTlGNzE5TC05NlU2WUZsTXdNMm13aTdHQ1JKSHUwZ1ZOc3N4eXoyVUlKMkhnTUtTbzktc250cVdOM2lTbzRhOWRqbVZmSFNFS3djT20wb2d1TjZ0UnUwcjJNZzgwNHFkT1gyMEZFczA0NFp5UkLSAfYBQVVfeXFMTWNnYmllZ2l3QnQtSllMUFRjY1JFZFBPcWl3TjJYWmZqRjlBbTVUZjRLRWljMEppNnZwbkZ0STBPWDRMM21qTWVESUNueGpVR3VwSHlXeURLZmJfMnZYWnVzekpIZGI3clBfREFuT2VjNzlRRnFfUWpVUnlPN1ZoM3pOYXRSRWRULVFoRXY1dmQzT01hc29faFVvUjhmdHJJc1ZHN3FrbEZDXzZEZWptbzBySm5aRUFNUjQ4dDc0ZFlqSXBKeGtHRXR2TTVWOE92TUk2TjlaUWFsakZFc2M1cGJiZjVVR3poNXlaVHVRUkk1UC10Z0dn?oc=5&hl=en-IN&gl=IN&ceid=IN:en,"Tue, 30 Sep 2025 07:00:00 GMT",The Economic Times,HDFC Bank,HDFC Bank,Private Banks,"HDFC Bank to clear cheques same day from October 4, 2025: What it means and what you need to do - The Economic Times HDFC Bank to clear cheques same day from October 4, 2025: What it means and what you need to do  The Economic Times",0.6369,0.104,0.896,0.0,positive,GNews,2025-12-09 13:43:47
Down 50%? What's behind the drop in HDFC Bank share price today - Business Standard,Down 50%? What's behind the drop in HDFC Bank share price today  Business Standard,https://news.google.com/rss/articles/CBMiyAFBVV95cUxQMGZjS2YxcHlDNU8zNFIwMEtadE9SRUJvWlljY1ZzWjJBNHhkeFBjY0VnQzdOZF8tbFMwUnA3UlFDN2xObFdjZG94QVowREJsU2V5bGdibEk0Wk45UjNpQk9Ec1R3N25aYnJXSWM2QjJta3JSU2lhdWlBOHpOeWcybTJMdmVoQTJIUlhVOXpJM0xGNG9Uc0RsRlVWUTBtcTF3UkJpSjlJYjNuN0x4SlVTTFFTZ1VFOGZaRFdQMm8zTG1hclE0RU9UY9IBzgFBVV95cUxQczBTVTNUZUhBUV9sYkJjbkpqbDZtX0M5ejRsNEVQN1l4UzZnQ2ZmbmtxMU1LNGVDM08wVXZDN2w5Zk5sLW1UYnFHNm1DTW44b1NvMnVIeUlpUzJpbzZ4b190cTRjVXVmWGdTUUpkTDdINm9lNWYybEFOMTktSXA4dmd0OTY3cHJsNzh5OWE0bF9HbFZfOXNPT1ZPdFlGV2VIOUo5dUx3R3hjcTZfdnR3bjNFTEV2bE9SQm5KLXYzbE4xNEVscldibzJqZ3RuUQ?oc=5&hl=en-IN&gl=IN&ceid=IN:en,"Tue, 26 Aug 2025 07:00:00 GMT",Business Standard,HDFCBANK,HDFC Bank,Private Banks,Down 50%? What's behind the drop in HDFC Bank share price today - Business Standard Down 50%? What's behind the drop in HDFC Bank share price today  Business Standard,0.1431,0.14,0.736,0.124,positive,GNews,2025-12-09 13:43:47
"HDFC Bank Q2 Results: Profit Up 11% YoY, Asset Quality Improves - NDTV Profit","HDFC Bank Q2 Results: Profit Up 11% YoY, Asset Quality Improves  NDTV Profit",https://news.google.com/rss/articles/CBMiqgFBVV95cUxPNTFGXzItN2tIeUZmWmtlSTNfc2F1OTBuejZpTUpVME9mU2tmNVpISmFiYjdUanhCTTZkb0JvRzJkZHZFS3d1TG1LeWMxN1A1Tkp3N21nR211ZndTZXJzd1BUTU9BV0lFV1R6enNqQVczMXFwSmFfei1jaXhSeGFtTzNKVXZQWjQ4aXdOXzNzZmVwU0JmX1k2OTJDNFZMVFVjZGZqTzBRZ2JlZ9IBrwFBVV95cUxNX29IN0Y4ZHQ2aVdjVm9hVmdJRldwNWlqT1ZTeFFXQUFPY2haUnphMkpKTWttcHZJaldrc2UwWUlvLWk4LTJ1eXlWS3h4QmhNc1hqaWpVcGl5NkNIRVFkY1h1ZW12al90Y0xaNG5lMEJPQnZNS1FPWC1YZUhrQVVWaENiVlkwd1JkV19NcU9tZC1Yc3RHOEdyT3pSdWlHNm5tWTVSYnJSV1A4d1FLdFdB?oc=5&hl=en-IN&gl=IN&ceid=IN:en,"Sat, 18 Oct 2025 07:00:00 GMT",NDTV Profit,HDFCBANK,HDFC Bank,Private Banks,"HDFC Bank Q2 Results: Profit Up 11% YoY, Asset Quality Improves - NDTV Profit HDFC Bank Q2 Results: Profit Up 11% YoY, Asset Quality Improves  NDTV Profit",0.9648,0.539,0.461,0.0,positive,GNews,2025-12-09 13:43:47
HDFC Bank share price: Did the stock really fall 62% today? Here's what happened - Times of India,HDFC Bank share price: Did the stock really fall 62% today? Here's what happened  Times of India,https://news.google.com/rss/articles/CBMi9AFBVV95cUxORHBHMy01VXY0cUdMdzExS2Y3bUU4ZlQ4ZkU4SDZXWjd0emRqNEhOVHM0WXdRakV2OHV6RlVva3d2UnpOWmV3WWFvZ3pWcTdwZ2lQMGhBbGlMZW1MLUJLMFdxNEZvSHkzRnoxYTdWLXljZS15amNuanBsenhBVjZvQVpueTllZnZoTGVQV2RoUnFyTWNLMjdSM05pQW04UDRla2I2NmpGVkc5V2hqdUtLZk0xV0hGT0tQcWFsanFnYWI0aUJMQ1RYbENGTFFtTzJnRmNhWGRGVjViRHpQcl9nY2Z3QmRfWVNJWUpldjZLTXhoX0Rp0gH6AUFVX3lxTE5XWGE3SWVUUDl4akY2N1pSSjF3TnBLYXRXVUd3T3BmLWJZcFJjbzIybFNSMGJQdm1SQ3pqTmdqLUlvTzdJd3l6MFpNRzBRd1luT3Q2aVFGOG9veTl3djUtVFpaaWZZS2hNMURpVW1sZnJadWFEeGVYNGNjbXhhZjJrV25Pa2RzMFNRNmpZdTB6SExLU2ZXTFEwQlM5c2oydl9OMnJDMlFHTnRUM0EtbWNhMTVPYjZscjRXWk5LLTQxSk9MTVd1Y09CQUJVbkZPX2ZiTmFEOVlYdERsRTJGVDliQzljNjhwa0dNbEFSMkZtc20wV042enpkcmc?oc=5&hl=en-IN&gl=IN&ceid=IN:en,"Tue, 26 Aug 2025 07:00:00 GMT",Times of India,HDFCBANK,HDFC Bank,Private Banks,HDFC Bank share price: Did the stock really fall 62% today? Here's what happened - Times of India HDFC Bank share price: Did the stock really fall 62% today? Here's what happened  Times of India,0.5803,0.126,0.874,0.0,positive,GNews,2025-12-09 13:43:47
"‘Next HDFC Bank’ will be built on investment accounts: Groww backer - The Arc - Technology, Startups, Entrepreneurship News & Analysis","‘Next HDFC Bank’ will be built on investment accounts: Groww backer  The Arc - Technology, Startups, Entrepreneurship News & Analysis",https://news.google.com/rss/articles/CBMitgFBVV95cUxOZ28wQWc5aFEzQ3hVOUlrLVFPSDdTVHB3RFJELVlJS2J0RnU3TkdnSDNiUWRMQVdUMUVzRGZiQ3RBOVNaQkZVYzVrNDRzUDlGZGw2cDk5Z2tFRVE1UkFvZGlhS3FxSllvM2F1YnlNRnBLc1ZSbm9IY29ZdzNuaXBHakQ0UWpEMmUwRFFDWmdtZnU0RG01S0tiMl9xbjRWVkFWbHprR2xUSi1BV2ZUVEhmdGtPR2pRZw?oc=5&hl=en-IN&gl=IN&ceid=IN:en,"Tue, 11 Nov 2025 08:00:00 GMT","The Arc - Technology, Startups, Entrepreneurship News & Analysis",HDFCBANK,HDFC Bank,Private Banks,"‘Next HDFC Bank’ will be built on investment accounts: Groww backer - The Arc - Technology, Startups, Entrepreneurship News & Analysis ‘Next HDFC Bank’ will be built on investment accounts: Groww backer  The Arc - Technology, Startups, Entrepreneurship News & Analysis",0.0,0.0,1.0,0.0,neutral,GNews,2025-12-09 13:43:47
"HDFC Bank Q2 earnings: Net profit rises 11% to ₹18,641 crore, NII rises 5%; asset quality improves - Upstox","HDFC Bank Q2 earnings: Net profit rises 11% to ₹18,641 crore, NII rises 5%; asset quality improves  Upstox",https://news.google.com/rss/articles/CBMi6AFBVV95cUxOanh3NGxRQ2RfT3Q2VzlTQWh6dzV3WUxEOVhnNmJGdUNqUUZGdk0yM0M2bUFpbFZBUHhXVTBuRXBpMF9heXhQREYwUWlOUVZtLTV3aE9DTXBjcUZUTnVDMnpXblNJbEoyRVI4VHkzVTZkNFFuZWg0ZXB0T1Q0elhKUlpmVzhsZ25jd2JHM0NyRUZwaVZ0X0VUQVoxdnZ5azB4eDNHRVBxVmFRUHVjOFNnLVdwSVgzUmxaUTFXel9HaXcwdDhMdGVBTWFyZU02dXlKVEMwdDZCYU1ua0RmSGJqMEJiQkQ4cV8w?oc=5&hl=en-IN&gl=IN&ceid=IN:en,"Sat, 18 Oct 2025 07:00:00 GMT",Upstox,HDFCBANK,HDFC Bank,Private Banks,"HDFC Bank Q2 earnings: Net profit rises 11% to ₹18,641 crore, NII rises 5%; asset quality improves - Upstox HDFC Bank Q2 earnings: Net profit rises 11% to ₹18,641 crore, NII rises 5%; asset quality improves  Upstox",0.9371,0.346,0.654,0.0,positive,GNews,2025-12-09 13:43:47
HDFC Bank share price falls after adjusting to bonus issue. Should you buy? - livemint.com,HDFC Bank share price falls after adjusting to bonus issue. Should you buy?  livemint.com,https://news.google.com/rss/articles/CBMi2wFBVV95cUxQNmliNkh5bExpdWIyb2FhMGtTMWo1eGNVM3FNOE5qSmFJSGpOM3R4cGttVFdJQ1BQeDRoVHZzdDUtTVMtQ1ZLR3BMVXR2cVFObE9LOHl5XzJWSVExeHJ4WjBieVRZZFl1WnU3WlM5VTBYZG5KM0cwYnpJWkJLb0pHcTRuU2d2Z2Z1cGRkMWtjcUpiT0NmMFBRUUdpRnVvTUFXSFE1blNDa3lRTlhJQ2FJdExiQWRQcVRNb3FyZUMxSV90Z21IUnliWXBoVDcxLUtNQVpjWGhLaWhaemvSAeABQVVfeXFMTVBNZUVIQmpJMnVpOS1jeHh5QUFvNHUxQ2dYemJ6MlRnVTI5TS1UYmU1SmpMak9jNmFuekR5LVI5WUcwSkkwQ0xZaWNYX2dKS0JyR3pGeWZ3V012VFJVR2Yxelk5bTNWdmo3NjBOQTlETlBKdWI4bzl6OFp1Z2NuQkVkMmRCZVpHbXZ2SU51Xzh5aGxDU1VmRXlMbElwWjBLRFh3ekxVRHRZbjA4eGlBYm43UjlnN0tiaTlGNW9UekJWbXZyZUV1bnREMjJUakwxQ2l3RmZEczlJNUpLSGlPbmI?oc=5&hl=en-IN&gl=IN&ceid=IN:en,"Tue, 26 Aug 2025 07:00:00 GMT",livemint.com,HDFCBANK,HDFC Bank,Private Banks,HDFC Bank share price falls after adjusting to bonus issue. Should you buy? - livemint.com HDFC Bank share price falls after adjusting to bonus issue. Should you buy?  livemint.com,0.8948,0.32,0.68,0.0,positive,GNews,2025-12-09 13:43:47
"HDFC Bank Share Price Today, HDFCBANK Stock Price Live - HDFC Sky","HDFC Bank Share Price Today, HDFCBANK Stock Price Live  HDFC Sky",https://news.google.com/rss/articles/CBMiUkFVX3lxTE9HSlMwOUE3N19XeTRXTl9pS2dFZUstWGlnRE5JOHpGWDRwaElMWFBNelBpMTEyaTZxc0NZRUV2eEFld2J2RWRJX3JyLWh2Tm90TUE?oc=5&hl=en-IN&gl=IN&ceid=IN:en,"Tue, 29 Jul 2025 16:04:55 GMT",HDFC Sky,HDFCBANK,HDFC Bank,Private Banks,"HDFC Bank Share Price Today, HDFCBANK Stock Price Live - HDFC Sky HDFC Bank Share Price Today, HDFCBANK Stock Price Live  HDFC Sky",0.5267,0.173,0.827,0.0,positive,GNews,2025-12-09 13:43:47
HDFC Bank shares trade in the green; latest update you need to know - Upstox,HDFC Bank shares trade in the green; latest update you need to know  Upstox,https://news.google.com/rss/articles/CBMizwFBVV95cUxOcDFkUDlVdVFtMTc0MEVCWWR2ZjV6cnVXQ0t5dXd0d2lfckdhS1YwaDZQX2o4TWNPTHlrUVoxb2hsWGgtdjVqZlJFVTZDbnZGWjh0V2E4dnMxLU9BejJWcVRJUnpoX1BkN3k1cm5LWmRRT2QycVo3NWdLU2hURldOTjdtUjcxdjFrR1lWVVBMSVQ4MFpsYlJlenYyR3h5SHJaZWtvUXdiZWNmem5LRUlhSVZYRDNsTnJyY1RJMG91NXVFMXlabmREMXVCdERwRTQ?oc=5&hl=en-IN&gl=IN&ceid=IN:en,"Sun, 28 Sep 2025 07:00:00 GMT",Upstox,HDFCBANK,HDFC Bank,Private Banks,HDFC Bank shares trade in the green; latest update you need to know - Upstox HDFC Bank shares trade in the green; latest update you need to know  Upstox,0.5267,0.14,0.86,0.0,positive,GNews,2025-12-09 13:43:47
"HDFC Bank Shares To Trade Ex-Bonus Today, Share Price To Halve — Check Allotment Date - NDTV Profit","HDFC Bank Shares To Trade Ex-Bonus Today, Share Price To Halve — Check Allotment Date  NDTV Profit",https://news.google.com/rss/articles/CBMiqgFBVV95cUxObVB5R1BoT1RPd0I1dHk5V2xocnAyblBYd0UxQ2IwUmxJQ2hQX2Q1ZHBBR19Pb1dTVnBySnZvZkR2T2pTeUxkZEhlRW5OOGIyaUN0TFVSRkRjakJZeVlFMVd1c00tMHFSU010dTE0YjQ2ZTRUTURoS3paN05weVc1RGRRZnFMbUp3TkNtam5EWTdQT0dwSEZha3JHaDRCRUhidGNuS3dxbTVvQdIBrwFBVV95cUxOZC04VmgyajI0ZURqcUZFTVpOVmx3bWczck5VR1llWEx0UERfMTZLTzZZbXhldUJBNGN3aENtaVA5LVVpYmMyTEtGNzdfVlFMMDZKdG1rVFd2SlYzS0xVblU5TGVGSUNTbHF4TXFOOEVESzhpZFQ4MVEybzY2VjFHSkZLUnBvOWZiZFA2LV9DSklIb3NYMGZaa0tWU3Q5Z0l6cGd5UDlXM2IxM3RvemtB?oc=5&hl=en-IN&gl=IN&ceid=IN:en,"Tue, 26 Aug 2025 07:00:00 GMT",NDTV Profit,HDFCBANK,HDFC Bank,Private Banks,"HDFC Bank Shares To Trade Ex-Bonus Today, Share Price To Halve — Check Allotment Date - NDTV Profit HDFC Bank Shares To Trade Ex-Bonus Today, Share Price To Halve — Check Allotment Date  NDTV Profit",0.9118,0.335,0.665,0.0,positive,GNews,2025-12-09 13:43:47
HDFC Bank declares date to announce Q2 results 2025. Details here - livemint.com,HDFC Bank declares date to announce Q2 results 2025. Details here  livemint.com,https://news.google.com/rss/articles/CBMizwFBVV95cUxQYlc2NHZCM05QU18xRU9EWXZndktRRU9ZSl8wYXM0dU1uZXRvTzhHUnVfSDFPVFZFS0lPcmhSZS05MUh4TFFJeGFpekNzUGV5ZWlHUE9mXzMzNTRlN296Z0xEZzA2Rk43SlVqNHZMQU9WNGRnYWhqaVFMZlUzNlYyRHV3SE1UN3FLSDItR241NUpUU3NzN29zcVNSemFxUlF6eVBQRmxQMm5ZR2RGanhQVDJ2amJhVEpmT3B2SDEwbV9NaUZQSVd1LTR6ajBqMTDSAdQBQVVfeXFMUHFrLVp2alJRSHZpSDU4M3JHX09DQ3lVcHpybTc3OGYxLWw1OHJZbGdGRWFwSUllaUJpRDlCWExhZFRocGpTQjZkendWdi1jVjlwbzJLaEt5WFFGMlZnbTN1UEVnX1ZWRV92N213RUI1cGxNcXA0WGZlRGNlOGhJVFcweklEaEtVVENkcndxa3hLclBQdVA3MGpxMkpNZWM4djhjZlByZVZXTUMwbnFpdWR0RGdPajVFcW54WW45YmoxOVFnaDZicjNwYi1BRlJwbEtrdUs?oc=5&hl=en-IN&gl=IN&ceid=IN:en,"Tue, 23 Sep 2025 07:00:00 GMT",livemint.com,HDFCBANK,HDFC Bank,Private Banks,HDFC Bank declares date to announce Q2 results 2025. Details here - livemint.com HDFC Bank declares date to announce Q2 results 2025. Details here  livemint.com,0.0,0.0,1.0,0.0,neutral,GNews,2025-12-09 13:43:47
HDFC Bank first-ever bonus issue: Last day to buy shares of the private sector lender before 1:1 payout - livemint.com,HDFC Bank first-ever bonus issue: Last day to buy shares of the private sector lender before 1:1 payout  livemint.com,https://news.google.com/rss/articles/CBMiggJBVV95cUxOQ2N3SnZOa0ZKdXhZdHZubXpUQkM0TmgzY3dmUm4wNUNvcWxhN1I2NUpXLW9GZFlCdllwNVRpelNXN0R0Q1lSdHU1aGNORDh1NlhLSWdtdVN4YlVtMEdaWHRLSC0tbV9fV1V4UExFaVN4YTJ5N3pQY2xnTkdsUHlIeE9kSFNUb3lLYVZtSEtTRnBJMW5wS0xON0dTYndkS1F0NVNwdXpfSzNxQ3pOOGVEVVUzQ20taUoxYlNoUkRseHNJNEE0VjA1aThSS21GNEFBUVhEMVcwY1dzcTkxSEJEallnQTRiV1NVUHhvM0FWSzAzTmdTREpENWxlQlZ6bkotMFHSAYcCQVVfeXFMTXMzUFRvZTVOVTFmVGRPMnpORDhsQWcyN0RSeDdfS0hJcmVUcWR5RXB2M0JuY1cwbFhaajJFLS1jakU4dkNvaXB3Q1B4LVBjRUpQT0xvbjNSZUdyZ2tKbWJEWnFSa1E2cEM4eUxST3VoVXpKdE1adGRJYU02V2lpcHZ3NF9WNE9wVE81X3JEdkRqOE9zQXpOd2FCc2FNX0Q4U1NOTG9VSUtXZkdRVFVmeHUxWkYtMnBsTmtuUDRxdGdJWXpvWDVkRDJxbk5nVFR2eEVBY05DRWYyUW1tN3FETVB1UlZiS2JKVVpsYjhFRGtiSlU3ZjA2RWFMdkREMFVsVXdRdjd3QVU?oc=5&hl=en-IN&gl=IN&ceid=IN:en,"Mon, 25 Aug 2025 07:00:00 GMT",livemint.com,HDFCBANK,HDFC Bank,Private Banks,HDFC Bank first-ever bonus issue: Last day to buy shares of the private sector lender before 1:1 payout - livemint.com HDFC Bank first-ever bonus issue: Last day to buy shares of the private sector lender before 1:1 payout  livemint.com,0.886,0.246,0.754,0.0,positive,GNews,2025-12-09 13:43:47
HDFC Bank allots 33.50 lakh equity shares under ESOS - Business Standard,HDFC Bank allots 33.50 lakh equity shares under ESOS  Business Standard,https://news.google.com/rss/articles/CBMizwFBVV95cUxPc3JVeDVHUkVxNlhLdzhCUENHcXRmUHJORTZ1WWJ0YXd6bHRMdzU4QkV1ZlVfalFHOFNwZlpNY0h3VHNqNldjWHBPM1kzdG5JLVc1cmZSVHdZWnhOYkJaVVJoUmJTTlRYZ3BJMmM3b1k0VnA1TW9wNnZVSjhPZzhnVG93ZkMydkJsckZVVmNMZjEyZWlYNElVRkdTa0NLMkZyWFNGS3l2NFZoVlJ1c0lKMnVyX0RPTy1jaHR1Y0REa09GS2g4cDdRUVJoM2FBTFXSAdQBQVVfeXFMTk5valVvdWR4OUZVVVlWQ0prRnhpY3pERGZFam5BaTRZMGxsb2E0SXpxYy1uQlFiNmpXNXN3bk5VNkpiN29mazNEX3pHUHJabG5sU2JCYlZzVW1yZHM5a296LVJ3ZElWZkQ1M2x1djI1NG5yaDZqWXJmVUhpc2pjam44NlJBX0JaMDRHcmpUVU5Wd1Ytenl5eXQ0Q1J6M1Z1dTJsRDZaLUN3eVZmWUwtbFBDdks2dzRjNVdkVHJBdHhoNV9pVkRXZzcwakc2b3lpMVllOEI?oc=5&hl=en-IN&gl=IN&ceid=IN:en,"Tue, 30 Sep 2025 07:00:00 GMT",Business Standard,HDFCBANK,HDFC Bank,Private Banks,HDFC Bank allots 33.50 lakh equity shares under ESOS - Business Standard HDFC Bank allots 33.50 lakh equity shares under ESOS  Business Standard,0.5267,0.173,0.827,0.0,positive,GNews,2025-12-09 13:43:47
HDFC Bank puts bankers on leave amid Credit Suisse bond probe - The Economic Times,HDFC Bank puts bankers on leave amid Credit Suisse bond probe  The Economic Times,https://news.google.com/rss/articles/CBMi4gFBVV95cUxQak1aWFE0cVQxeGFzUmYzNkNUZUN6eGxqRTAxbkljOTY5RmdydzFRTzBiY2J3YlMzZ3M2d25JMlNia0J6NWtVQVRXMU0xUF85RjNtb1Vzbjc2X1BVLUd1YWFiOVZra3FadmFVUEwzWWFnTm16UFktUVNldlNSX1hkMUxQb2ZVd1JyX1ZUVjEyZmd2SkZnWGtzSUZYdFFRLWQxVGQ1ckdlWnVzbTRvQ3BqQ2RPdEhlQW5oY0I0QXIxN3VxWjZuRnVVOGcydkt2SmJCdE1USjV0aWtqYkNMMlFGY3FR0gHnAUFVX3lxTE9OMXV0UkdlcUpCMTlaQmZmN2szSHBxbjIzZ2lUN3pXcUxnYks4VkZ5dUo0cldKUHE1WEh5Szg5VWkySE43T2Iya2t3TjlDMmFuZ1htUl9RemxoYTJjQ1A3bEllcUxSWGtkZXRHNUs2Zk5qLTVlYTdlV3Zlc3ZOd3lndURHZTBhVnFQdWptWGpyb0k4Y2RPMVAtX19fY0tGNDhyeVNVYkl5dmtTUFNjV01kUWRxaGc4WERrVWNEUVhNaWQwTDRRN21pNGJJYXFnZVg1a2p4ZS1rV2VNcjVQOS1TNzVGckJoQQ?oc=5&hl=en-IN&gl=IN&ceid=IN:en,"Tue, 28 Oct 2025 07:00:00 GMT",The Economic Times,HDFCBANK,HDFC Bank,Private Banks,HDFC Bank puts bankers on leave amid Credit Suisse bond probe - The Economic Times HDFC Bank puts bankers on leave amid Credit Suisse bond probe  The Economic Times,0.5859,0.16,0.767,0.074,positive,GNews,2025-12-09 13:43:47
HDFC Bank Declares 1:1 Bonus Shares; Ex-Date 26 August - HDFC Sky,HDFC Bank Declares 1:1 Bonus Shares; Ex-Date 26 August  HDFC Sky,https://news.google.com/rss/articles/CBMihwFBVV95cUxQOHpXX1d6N04zMHptRkdkZUMtUVFyay1rUjdfQUtPMi1PaVZrNWRfVHUyOW90dXVLd18xVXdQOUJSOTd2dVJvUXdNMk1xTXhoYlJ3bkU5Si1vTjA4M1YwU0lfMVhPMjExVVFiUThiQjVDeG81U2lZNDFvdV9yeUpsZnFVM0FvUXM?oc=5&hl=en-IN&gl=IN&ceid=IN:en,"Fri, 22 Aug 2025 07:00:00 GMT",HDFC Sky,HDFCBANK,HDFC Bank,Private Banks,HDFC Bank Declares 1:1 Bonus Shares; Ex-Date 26 August - HDFC Sky HDFC Bank Declares 1:1 Bonus Shares; Ex-Date 26 August  HDFC Sky,0.886,0.375,0.625,0.0,positive,GNews,2025-12-09 13:43:47
"HDFC Bank gets 'Buy' again from Nomura, target price tweaked; here's why - Business Standard","HDFC Bank gets 'Buy' again from Nomura, target price tweaked; here's why  Business Standard",https://news.google.com/rss/articles/CBMi0AFBVV95cUxQNzd0X0t2blFTWGk5ZTBjVl84UUtDRVR1REdMQXVSN3Zsa3E0QnhVNEpYUmF2ZDJuTUV3RWdCSGRXa2N6eHJ1VURZMHFpR0hxNi1Uc1ZvdkxTU0cwcW0xZjlzZ0VjX0dKdEZ2QTI1SVZKNzZ3eTJBcm0wbGwxVC0xZ2RqZnd4WEFtQlhBaU5RN1VrZnQ0TFBsbmxLWFpBcXR0YXUtMS1IZk9HUnRhWDhpeXpLZ2FHRC1vcDF2bmd5WTlvMzlyM3ExUG9VaXdDLUk10gHWAUFVX3lxTE1BZTJ2Yl9wTi03Y0dybHc1Z3BfZmZOUlpwTUFseVd6TXNReFFKdFlvVG15czdhaFpXUDExYVFPVXdvRzFzMmRYcWNuRDhhbkdacXQ1TlZzRDBJdm9qVTdyRTZnMjdaemM2VEgyT0VYZWkyT1FwQllKWFBSbEpFUHNoSmpXUGc2QnBnM0NVSUxETTVPd2htbDFybXVPTzgzOXA2T0dNWkpzUGFMZ2Qxc3RKYlltVFpCT1JBZWFiLXRUT2ZqWUFzdEVpQm5MM2lvSW9pRnE5QlE?oc=5&hl=en-IN&gl=IN&ceid=IN:en,"Mon, 06 Oct 2025 07:00:00 GMT",Business Standard,HDFCBANK,HDFC Bank,Private Banks,"HDFC Bank gets 'Buy' again from Nomura, target price tweaked; here's why - Business Standard HDFC Bank gets 'Buy' again from Nomura, target price tweaked; here's why  Business Standard",0.0,0.0,1.0,0.0,neutral,GNews,2025-12-09 13:43:47
HDFC Bank Q2FY26: What should investors expect from results? - Business Standard,HDFC Bank Q2FY26: What should investors expect from results?  Business Standard,https://news.google.com/rss/articles/CBMi7wFBVV95cUxNeTM3VGJNeHhaeTMzcWd5MDQwNDNzWDVJaWg1WWNpVi14SkluYXNpNzh6d2llbDV1RlRaZGhpa2NTREZ0UXYyUVZER0hUQzVUNzFiOFFrc295MEN4cGRJS2ZhWlhyMkh5cGtsRWNKYUxRSFg3bU9jZ0NnSk4tUmJMeW5fU2h3dzBQLU56ZzU1SzkzQ2V0ajBaZU5xTXE4LUp1aXh5QWpXTWNDYjV5Z2F1U0xhWWIzYXRLTUNtbGtBV21LbFZKU3Y4azM4Mk9WU1d5LVJINm5DNmJRazE0a3RCUXRZSzk2UVVDQ0UxWWhrNNIB9AFBVV95cUxObjN1UHRqU1RmdTRSdnJCQTdOTlgtUTJZeENJMDJTVXBfcXpQbC1vNVZ2WURLZzJ5cGdKVDV6bTE3dVN3dnBFYlNZUnZ1UlFXSWI5a01acnRFSzJfSWpFZ2NnNmVGNmwzLUhuZlVGR1Y0OUxHRHNZblBoX2tIemJSMHg2aUxKdVhkRjZtc3lzTkVLQkpRRGN0VlJvT1NPLU5pYl9tZXFjR1FDMERKaGhYamw4LU1zRFNtYXVzWFF3VHB4U3ZsZnRDY25iaENreTVHV01Bd2pkS05rR0FmSnZpS2FmeVBDRkhDamh4cXRLakU4ZzBn?oc=5&hl=en-IN&gl=IN&ceid=IN:en,"Wed, 15 Oct 2025 07:00:00 GMT",Business Standard,HDFCBANK,HDFC Bank,Private Banks,HDFC Bank Q2FY26: What should investors expect from results? - Business Standard HDFC Bank Q2FY26: What should investors expect from results?  Business Standard,0.0,0.0,1.0,0.0,neutral,GNews,2025-12-09 13:43:47
"HDFC Bank Trades Ex-Bonus After 1:1 Issue, Closes at ₹972 - HDFC Sky","HDFC Bank Trades Ex-Bonus After 1:1 Issue, Closes at ₹972  HDFC Sky",https://news.google.com/rss/articles/CBMipAFBVV95cUxOSG9CMG10U000Qm1pbXFDZGRSY1JXZVRGaDJWTk1mMDdMVkJ0Sm85Zk1RSXozNkx4dlhmSmNUT2t6SjU4OXV6b3dUMXdlLTlWZXdsMlg3Um1yWTBVOVRGVHJ1YVFCcXZWTjFEYjg1QVU4UUtOMUVsbktqOTI0ekRGSGNRcjRfTE5vbk1sREhLYjl5ZTFxQk1wLS1xekdlNWRfLTF1bg?oc=5&hl=en-IN&gl=IN&ceid=IN:en,"Tue, 26 Aug 2025 07:00:00 GMT",HDFC Sky,HDFCBANK,HDFC Bank,Private Banks,"HDFC Bank Trades Ex-Bonus After 1:1 Issue, Closes at ₹972 - HDFC Sky HDFC Bank Trades Ex-Bonus After 1:1 Issue, Closes at ₹972  HDFC Sky",0.0,0.0,1.0,0.0,neutral,GNews,2025-12-09 13:43:47
