title,description,url,published_date,publisher,keyword,bank,sector,text_for_sentiment,sentiment_compound,sentiment_positive,sentiment_neutral,sentiment_negative,sentiment_label,source,collected_at
"Fund houses backed by SBI, HDFC Bank, and ICICI Bank dominate inflows: Report - livemint.com","Fund houses backed by SBI, HDFC Bank, and ICICI Bank dominate inflows: Report  livemint.com",https://news.google.com/rss/articles/CBMi6wFBVV95cUxOY1VuTFkzUzdLQzJEcTlRNmlOeURIRjR2ZlRGVm9JWUN6UVhEbVFtUlUtaU9hWEZGdy1lVC1aa0RQYVVicHdfZWZyV1VEdmw2VjlqcThUZExianA4WVNkSkltSGd2S1hrWXR0THhUQ1NKVWlVSjByWkVPUEh3WVdlbjRWQnMzTnZHd2lXUnRMamFGWVkwajBmaHBTdTlYYVR4VzlFai14SUJ1RmtVZE1mR1drTjBOQ0VzdkhvWGZ1c2VLMzZzdkwwNjd0WUFEbXU1eXJEV2J1V2FHRVRfdmlGVGJkcWFuNXJBU0gw0gHwAUFVX3lxTFBOWWMzdkg4M2EtOTM1dEtFZlJCLXVHX29SYkwwbGJmbTM3eFFQN1NyMGJkRlNVNDdvRkV6R2p1OE5TbFJOQ1M5STBpbHlnR0YwekE1ZTlWZUZIaTMzY2tnekxKaWlCUURqRk4tM0FVVGVWWEZNQ2xGM2dmSVRxdU1zX1A2LTU1bFRtdkp2d2lDblRJbk9QaUx6MGZFaW9hN3huaVdkNnNnUG8ybk1tbTZwaWVzQTdHcjFqN3dUZ1FyeFNWYTA2MjU3OFNEaHdqbHlQY3c3NTh3Qm9paUhzWHI4TDZYY2QyZHAwRGYtcWZlSg?oc=5&hl=en-IN&gl=IN&ceid=IN:en,"Tue, 26 Aug 2025 07:00:00 GMT",livemint.com,ICICI Bank,ICICI Bank,Private Banks,"Fund houses backed by SBI, HDFC Bank, and ICICI Bank dominate inflows: Report - livemint.com Fund houses backed by SBI, HDFC Bank, and ICICI Bank dominate inflows: Report  livemint.com",-0.2023,0.073,0.828,0.099,negative,GNews,2025-12-09 13:44:53
"Nifty Bank Index rejig: Why HDFC Bank, ICICI Bank shares are under pressure? Here’s what you should know - financialexpress.com","Nifty Bank Index rejig: Why HDFC Bank, ICICI Bank shares are under pressure? Here’s what you should know  financialexpress.com",https://news.google.com/rss/articles/CBMi4wFBVV95cUxQREpUbmIwMjNJUHViSHRWVmVaUnBWcV9yQUkzdHV6NGlwNkdQS2U4MG15bjRyVGlWN284eDJiTGFEWDVKbEUwdUh5Ti1tdDlMSUV0VWFqMXMzNG94LXlmX3BJSkNDUkZPVktzODBOeW9rei05X0FLQnE0SWotcUp6c3FOb2pCaTEzdlBKdnBpZS1rVjFZNFR3RU5mel9QRlNYanE3NEVpWUxKcTF1a1FlajJ2UHdwWkVNbWt1ekJPdVhpbUVOTHNwZW54ek5zN050RlpJNEpvbmhzX2R4eGhkSndlVdIB6gFBVV95cUxQMnFPWGg0cVB6YVpCUTBKWkJJNHZtMXdFQnQtRDRMYUo2VUdlcVNCMkgtZFlRVjBKX2FHa1ptczRobHJvNS14R3BHc0czbU5iTUFBMEFIWnhxM0tqQmxxUk1aaDkzbzRxbVlYckx2TkhvMkhXQjZscGw5QklQMEduR3NSeUJnRDFuOEV4UmNfQVR2UkFfNjlaZ2pROTg2UnlVeVdxdnAtMFhQTHFLRUtzRnVKd0NHSTRuaHVGV281OENMQ2YzX1h5SjRZSWNyMnNBdXAtbEJGYklFTXlxYXVzS2ZoSnpzMUdPSnc?oc=5&hl=en-IN&gl=IN&ceid=IN:en,"Tue, 02 Dec 2025 12:23:25 GMT",financialexpress.com,ICICI Bank,ICICI Bank,Private Banks,"Nifty Bank Index rejig: Why HDFC Bank, ICICI Bank shares are under pressure? Here’s what you should know - financialexpress.com Nifty Bank Index rejig: Why HDFC Bank, ICICI Bank shares are under pressure? Here’s what you should know  financialexpress.com",0.6966,0.214,0.694,0.093,positive,GNews,2025-12-09 13:44:53
Why Is ICICI Bank Share Price Falling In Trade? - NDTV Profit,Why Is ICICI Bank Share Price Falling In Trade?  NDTV Profit,https://news.google.com/rss/articles/CBMikgFBVV95cUxPd3FDcGFvU191TGs1Z3lrRTlHZHBqRUFHZnBfNU5yNTJfMXY2VGNqUTdhenVRQmZvWVFXT1RNSTVFVGlKTE5jSkdHRm5XVkZGQUxQcFZkRTNQTFg5S1piTWpwUXUyckRBTDhTYUVySy1NTFZzUnBHWWN1OFBZamxnZzI4cUJidE51Nzc0Z3BkQVZwZ9IBlwFBVV95cUxNdFc1aGZTbjA0dVJNUWVFandLLXhLNkJyRTEwcnJfMDVMTmg0UEFBSUlJLWhMbTFKT0c1WDRVMFVyUjBWYzgtcHlTWVY5T1JqTURBOWpfMW5oWHI1OHlZRmJfZ2FvRVE5bmJkb3NPSDlueVM1dDlWWkhqaWd0YkFzUlYteHNGTFU3X3B1NGxPUDhXTGVWN3VJ?oc=5&hl=en-IN&gl=IN&ceid=IN:en,"Mon, 20 Oct 2025 07:00:00 GMT",NDTV Profit,ICICIBANK,ICICI Bank,Private Banks,Why Is ICICI Bank Share Price Falling In Trade? - NDTV Profit Why Is ICICI Bank Share Price Falling In Trade?  NDTV Profit,0.8105,0.343,0.553,0.104,positive,GNews,2025-12-09 13:44:53
Not thuggery—ICICI Bank’s account hike exposes a brewing banking shake-up | Mint - livemint.com,Not thuggery—ICICI Bank’s account hike exposes a brewing banking shake-up | Mint  livemint.com,https://news.google.com/rss/articles/CBMivgFBVV95cUxPMW1SUmhmOW5EczVGNWRWeWtlQ0QwZjAzVUR6N21XbVBjS2JubnNNNUFNeUV1dXM4TUpBbnhXTFljZDI5LS1MdWhYcU51NHY0WkJIVkhXdUszc01JMUxOME5nOFE1Sng4ZFpFR011dUdUQkJqS0JTU3NBX1BaVG16aVI5NUw3WUxoSXhjWE1oYWlxdi1iQmlZYnpSYVlUdDgzSmh2WkhEUkgyWDcwZ3l5dXNoSmZNdkF1b3J3NGdn0gHDAUFVX3lxTE1kbnhHTnZwbHN3UHNQcUdzZzdvS3BiQUgza2NWU1VWUGZRWHdhMlRGOWkyREVaSTg2Wk1YcUNyVWxzbVlyTlVFa09DWHkwTG12ZXFjSkx5X3R0Tnc3MGpnWFhZRXk0czVQdDZ4RkktREIxWjdmVWZtV1hnRE1YZXpYckhlNVdDOExpTTQ2YUVTMUxCZVd5cUJ6MmduYlhud1JrcUExLVZrVzdZM0Q0T3BzWE1Wb3otSVM1QzdDNm53SkIwcw?oc=5&hl=en-IN&gl=IN&ceid=IN:en,"Thu, 28 Aug 2025 07:00:00 GMT",livemint.com,ICICI Bank,ICICI Bank,Private Banks,Not thuggery—ICICI Bank’s account hike exposes a brewing banking shake-up | Mint - livemint.com Not thuggery—ICICI Bank’s account hike exposes a brewing banking shake-up | Mint  livemint.com,-0.25,0.0,0.893,0.107,negative,GNews,2025-12-09 13:44:53
ICICI Bank to start same-day cheque clearance from 4 Oct; check details - Business Today,ICICI Bank to start same-day cheque clearance from 4 Oct; check details  Business Today,https://news.google.com/rss/articles/CBMi4gFBVV95cUxQQi1taHhfbzNWUlhXVFh6NV9GZk10dVFCRERRSlJzcHQ0eTRoQUtlbUU1aXlUVW56VV94dEJRMDVzeXFEcEVsR1JBQzE3RU5hQzlJVWZFQWI1dDl2b19xckVMVUdkZE1WSHRUSVR4cDhXcGRJVC1zLVJMSzNhaGRuLVYzZWNwazZzTzRmZWlpRXhOa0xVcmhSZmFrMW1aRXFRZk5MQmQwVnk2bUF4ZGZ0NUpZaWNrSzgwRE1yMzE0LThhb1dIdE5KdkdjS1hqNDM1OEQ5RFBvckR0VXFhZEhtQkhn0gHnAUFVX3lxTE9vOXRkMlJWbEx3VnpLUDY2ZkQ2LVRaSUlHNF9iSzNjT0NESEdIcHF4MU9YQk04Vzl4RXdIUFZMVXBGRTh6VTBZUlBHRTBtMFd5RTIzZ09iYkhDeUFRaTJCWUY2WXVXT3l4ZXA0U2ROdzVOSGE2VFVKUUI1RUNHbE0yQlNKTnBOOFI2MXZlSzBWclJSY3dBMDRGOUFzU1RZWl93Um94LUNDa2ZKN1J5cTF5OXRoNHVpcUJ5Y2lhay1EVE9aSnlGMHZTdW4yTVZLbTh2SFJHa0RZZ0pHdV85dV95Z0xfTTZMaw?oc=5&hl=en-IN&gl=IN&ceid=IN:en,"Tue, 23 Sep 2025 07:00:00 GMT",Business Today,ICICI Bank,ICICI Bank,Private Banks,ICICI Bank to start same-day cheque clearance from 4 Oct; check details - Business Today ICICI Bank to start same-day cheque clearance from 4 Oct; check details  Business Today,0.0,0.0,1.0,0.0,neutral,GNews,2025-12-09 13:44:53
ICICI Bank shares: Here are revised target prices post Q2 results - Business Today,ICICI Bank shares: Here are revised target prices post Q2 results  Business Today,https://news.google.com/rss/articles/CBMizAFBVV95cUxQR2FzbXd3LVNGQU80S2NBdERlNFByU2xfWHU4VEpLWDBlLTlxMVlfVUhEYlUxR1E0NXZfbXM3cnFLaFY0UkdXX1E5OWNBeWhCWHpLY2czNGpscFROMXpUWnhFMkJuaEtTRFBQekdNTGNhYkczWkVOVXQ3eEVkRTFpNWVFelo0MDhtQ09LTlpNeS1jOHJaN1lLVjFUSS0xTVhMMFVCYVZTMWJBN1ZIVWZhYi1Kb21qZjRDdno2Nko1RnhZd05JRGpXRkJLN2HSAdIBQVVfeXFMT3BTZEJzenNXYTFFM3BqOG42YmVLUWFwdEs5OS14cFZIaUpNRlVoaktKdFk5TEhZVWlLSHhzUnk5c3lEMnlZLTc3ZDNveWxpc2FBQnVPb0ZPX2Rxcnc4cDVGajVoc3F4VWFVVEZLZ1dqNHR0NU9NWlJzTUNFdG93akN0VWJnelRNTW9YOTFnaXE0aGtEaDN5YnVmQ3g3Z2lzVWw5NGRtMUthQ1RTVlFMWUVXLVdzSFh1SlNQTGdYLTE1Vzg5STFRRjh1TVRnZnBVUHNn?oc=5&hl=en-IN&gl=IN&ceid=IN:en,"Mon, 20 Oct 2025 07:00:00 GMT",Business Today,ICICIBANK,ICICI Bank,Private Banks,ICICI Bank shares: Here are revised target prices post Q2 results - Business Today ICICI Bank shares: Here are revised target prices post Q2 results  Business Today,0.5267,0.15,0.85,0.0,positive,GNews,2025-12-09 13:44:53
DPIIT And ICICI Bank Sign MoU To Support Startups In India - BW Businessworld,DPIIT And ICICI Bank Sign MoU To Support Startups In India  BW Businessworld,https://news.google.com/rss/articles/CBMinwFBVV95cUxQeUlnWHBMQkY4aGhrWl9PX3VSUDFkM3lTSTBOQTR6ZmQ5NjdZaEN4d0dvOXhqSWF3dFpvNC1ZSjZQWkNycGpDOGVVWjZibDFXZW91T3c4TG5FakRwVFF1ME1rT20xcFF3UGFUeU9GNzR3ZkM5OWNqLS1HQW90b2czUjNpdDVVYXZyUDJGSDVNUDlPbzktbmFnaFZCNDVNT3c?oc=5&hl=en-IN&gl=IN&ceid=IN:en,"Fri, 05 Sep 2025 07:00:00 GMT",BW Businessworld,ICICI Bank,ICICI Bank,Private Banks,DPIIT And ICICI Bank Sign MoU To Support Startups In India - BW Businessworld DPIIT And ICICI Bank Sign MoU To Support Startups In India  BW Businessworld,0.6597,0.178,0.822,0.0,positive,GNews,2025-12-09 13:44:53
"ICICI Bank minimum account balance: Revised charges, who's impacted, penalty, more - All FAQs answered - livemint.com","ICICI Bank minimum account balance: Revised charges, who's impacted, penalty, more - All FAQs answered  livemint.com",https://news.google.com/rss/articles/CBMi7gFBVV95cUxOZ2wycmdhMDNKcHFCSlllMjRoWUN1c29FS0tmN3d4MkNCSGtlUU4yWVQzeXdqc1Z3ODN4dHhZWmJXYmNqdjdoUWNmTFFtbHpDQ1ZUeDNpTUZqdVRfa3hidkZmdEZaRVcyQ2R0MkVoazd0MEN2OTJuQ1IwT3pBdFZEOHFucVNVU0dWWU41WHNqQWZZTC1JdGh5bTZrWnZMbVZ6UjNuall0OFZydzU0eHpYanRlUUdyV2JmSklFTGZwempSTXo1WkdJVmU5QmY5emk1QUprT3NxankyV05SRkhoUVBkTGFfbnV3aWVINVpR?oc=5&hl=en-IN&gl=IN&ceid=IN:en,"Thu, 14 Aug 2025 07:00:00 GMT",livemint.com,ICICI Bank,ICICI Bank,Private Banks,"ICICI Bank minimum account balance: Revised charges, who's impacted, penalty, more - All FAQs answered - livemint.com ICICI Bank minimum account balance: Revised charges, who's impacted, penalty, more - All FAQs answered  livemint.com",-0.8481,0.0,0.74,0.26,negative,GNews,2025-12-09 13:44:53
"""Elitist"": ICICI Bank's New Minimum Balance Rule Sparks Strong Reactions On Internet - NDTV","""Elitist"": ICICI Bank's New Minimum Balance Rule Sparks Strong Reactions On Internet  NDTV",https://news.google.com/rss/articles/CBMiuAFBVV95cUxPdnhkNmM0RVVXeUMxR3ItUXRXbEdFU1pWRHoyNm9NRHpaMllQZG5rOGFuYklwMndKOU4wQ3FnV3c4TjdjRFluZzFQRW9jSGQyblZLaWdRdFd3eGxVOFRZYVFJcFdKdzNjUXpXUENiMUVsU3htT1BRSTBXWDRBSUVrOEFwMGdvQWxMNm5zbERrdFZ5SkJ0cGNkSjExdXRDb1FxTzFFa01GRmFURFhSSEp2dlFIY3lIdURl0gHAAUFVX3lxTE9qb1JYc0o3dHgteWEwT1pqYjI4QldhWmMxUm5USklYYXk2MWo2ZGEwZG55d3M0VHJlWlBldGtBN0dRNmNVeFV2MUlDM05rSEQwajBwVzRINDI5dFVpdHhVUE80RTlKVG9jc09hU3FjcnpUM0ZoMUZsWDJEQjFDVFFBajJwZFF0NFk2TGlLOERTNGFwRDV4b2l1SUViWm05UDRVVlNqOUU3V3dlbG92Q3NnOUtUNjBIMkJpSGxZWWp4MQ?oc=5&hl=en-IN&gl=IN&ceid=IN:en,"Sat, 09 Aug 2025 07:00:00 GMT",NDTV,ICICIBANK,ICICI Bank,Private Banks,"""Elitist"": ICICI Bank's New Minimum Balance Rule Sparks Strong Reactions On Internet - NDTV ""Elitist"": ICICI Bank's New Minimum Balance Rule Sparks Strong Reactions On Internet  NDTV",0.765,0.209,0.791,0.0,positive,GNews,2025-12-09 13:44:53
The total return for ICICI Bank (NSE:ICICIBANK) investors has risen faster than earnings growth over the last five years - simplywall.st,The total return for ICICI Bank (NSE:ICICIBANK) investors has risen faster than earnings growth over the last five years  simplywall.st,https://news.google.com/rss/articles/CBMi0AFBVV95cUxQZC1hSGdtOXl3SGlxTnVXNDR5Wlo5NlB1bmR4Wmx2SGJKZVRzamNpNjNXcEg5MElTaHA1aUhTMURacTNUV1pYQUxlVEY2clNZMDVDVVZ6LVRvODB5TnpOZ1FVcGZBRW9iQk1KMTdWQ1A3NDJMcnM2TzJtVlU2UDRDODc1ZTVTbV94N3pjbHZZd08wckRpN1ZIdlkxbTJ2RkVTdWNTV3Niclo1ZWU2aE4xR1pJYmU1SnRMSndLelBWVWh0MTUzdVhzbzFhZnBzOVdN0gHWAUFVX3lxTFBnV3JjeDRXbE9JS3VTN3QzVENCMFhKSTlNNlRTMHk5Q0prM1VSVjE3VHNvd1BPd0NrQnowVnhXZk9GazR4VURiNjd2Z2NvVmdxWG1jWmxpTUFqZ050U0FHQmZ0N2F1eW1SaG5jSnlPeW1pS1BOckEwNTR2eUdnd0psR3FsZWZkT295WFNKMzNBaWFkbzhCNXZzZ3NmSzRwRVFhcGtyWl9kU0FBaGpoNVpFOW1Fb2ZQSl9FMFF4NnVoc0tfZjN6Q1ZzRHkxQkRlbDBVbE5GZWc?oc=5&hl=en-IN&gl=IN&ceid=IN:en,"Mon, 29 Sep 2025 07:00:00 GMT",simplywall.st,ICICIBANK,ICICI Bank,Private Banks,The total return for ICICI Bank (NSE:ICICIBANK) investors has risen faster than earnings growth over the last five years - simplywall.st The total return for ICICI Bank (NSE:ICICIBANK) investors has risen faster than earnings growth over the last five years  simplywall.st,0.6369,0.118,0.882,0.0,positive,GNews,2025-12-09 13:44:53
"ICICI Bank hikes minimum balance to ₹50,000 on savings account: What does it mean? - livemint.com","ICICI Bank hikes minimum balance to ₹50,000 on savings account: What does it mean?  livemint.com",https://news.google.com/rss/articles/CBMi3AFBVV95cUxOYS1qLUJGVmpfdHdXV0ZCS3ZZdVdlNXhMLVlTZEREOW5xa3BUS3dLSk1lR0tIaE0tWkhZdjJPMW9XblhBcklkaEFHZVViU1VwYjU4VWRNV3o0a3FXOVZ5SVFfSUxjcGJkOHJ0T0hsTThJMzlKd2FYbGdhcjduSk0tWHVJNTRyYjAxbmJyd1RHeWRQX3RUaXN0VXZXelVPSVhUdnhFYWdGOTNOeldjSWMwY0xtbXJERDJQRjdBa2dwZjNxeHFSTzZZaGVUQTY5TkVsUnlPTGY4aHRnX3dp0gHiAUFVX3lxTFByRUZQNGdidjVibTA5Y1VueU8tM1hjejdkSGtzY0JaeFctRnVRaVdNS0l3Mm1QYk9oX18wSl9tMDNpN0lRc3B3LWhCcXMwU05mZkRybzNZaVo0dllwaHNCTnc2V0wtWW5pYjZCWGw1ejNkUFpJLVRFZlZyV3RRTGdNRm9ON3VxWU44Y1NTWXNTTWlaUWtkQ2NwZkZrUHcySDdURXRIemxGOEluZ3ZYZG5mc0lGeXVPQ25oaTZUcWVxRm5QVklPT29fVF96VHRxR3ByVU9YaFFGVUJVa2RNYW02SkE?oc=5&hl=en-IN&gl=IN&ceid=IN:en,"Sat, 09 Aug 2025 07:00:00 GMT",livemint.com,ICICIBANK,ICICI Bank,Private Banks,"ICICI Bank hikes minimum balance to ₹50,000 on savings account: What does it mean? - livemint.com ICICI Bank hikes minimum balance to ₹50,000 on savings account: What does it mean?  livemint.com",0.0,0.0,1.0,0.0,neutral,GNews,2025-12-09 13:44:53
ICICI Bank raises minimum balance requirement for savings accounts - The Hindu,ICICI Bank raises minimum balance requirement for savings accounts  The Hindu,https://news.google.com/rss/articles/CBMiyAFBVV95cUxQNFk1OHl2aHpkMXdNekNkMVdieG9BRTg3ZzBEbndDZU4yQmdOVVZDTlJjaDQ3WlpLcHVaUndTQUtiWGFCWXBXOHBIcksybEE2cHVXSzQ3Zk0zU1J3Nktac1BvNjJTS3FqZEk3YXhqbzEta1BZX2ZFcm9CbUJYV2FSODhlaTB5RkNYQVl6R2M4X1J1MmJGTGh4T0JEZEdXOXdIMFc1ZjJIR2txbWlYTk5pLWhPVWFqczBHbk03UGxfc081U25NRE82ZNIBzwFBVV95cUxQbWt6blByWnNnQzkzeVZiX2FoSllyRzEwWEMzLWtkYkdnS2JkWUkzbGxkclRyRE9hSWpBVnN3cDdJdTRkOElmODM2Z3YwUC0yR0pzOXczUlF0aGFIa2ZIMkxKRlJScW51eXFtVDJfaWJwTjJLdjYtMDRnNlAxQm9CQ2dmN3hfRFFBdFJ0dm4tRmVrZVFQbDE4ME93SlRhSW9zNGRhdnVHaWo2Nzl1eXlfTWxGWUpuTUNTRDRLd2UtOFJDY0ctc1dNZElyUmt4Q00?oc=5&hl=en-IN&gl=IN&ceid=IN:en,"Sat, 09 Aug 2025 07:00:00 GMT",The Hindu,ICICIBANK,ICICI Bank,Private Banks,ICICI Bank raises minimum balance requirement for savings accounts - The Hindu ICICI Bank raises minimum balance requirement for savings accounts  The Hindu,0.0,0.0,1.0,0.0,neutral,GNews,2025-12-09 13:44:53
"ICICI Bank new minimum balance rules: FAQs, charges, and key information - India Today","ICICI Bank new minimum balance rules: FAQs, charges, and key information  India Today",https://news.google.com/rss/articles/CBMiyAFBVV95cUxPZDNZUTc4cjdDNXUybWJ4UDNDLU1MSWRMSzl1bFZUYVJLTFZWV1lESElPZlZDbXBLYkNpcGk4ZmowRm51QjkxbVVWbFNGNTZBU0UyVFhXbHNkc2tKamhsdmdBaUxyWlhycWZSVlBoa2pKaDhvSURuOXAxcmwyRW5GSTVGdTlGbWNmLUxaQXFWMXJBLUdmVXI0c0pMVW1MQUJoMXhOWjUxci0yYjV1bUJSYzBmTVRmdFFic212SzhRc1pfbzlaeGFPddIBzgFBVV95cUxOY2NWeFM2aVFTekxYclVhamxqdk9pUFNzSUNtYzNvbHpnN3ZJUlZWWF9iMmtXZDJLNlJyM3IzclBheGgzYjNURDhzemtVdFc1T0lDeDRSdWxIN01KNFhZSy1yX1lIcXV2dnRSbjZvclRaZVZ0YnFhUm1lYWJRcFlpOVVZN2xTeGZRQmx1MUt5S2xfbHdNQmw4WDNhWS10am5LaEJkQjNqSjFwcnZTZTB5NTNDSzI0a0RPNGtUUnpmR0lYeXFaakFVaXFPcFJtZw?oc=5&hl=en-IN&gl=IN&ceid=IN:en,"Mon, 11 Aug 2025 07:00:00 GMT",India Today,ICICIBANK,ICICI Bank,Private Banks,"ICICI Bank new minimum balance rules: FAQs, charges, and key information - India Today ICICI Bank new minimum balance rules: FAQs, charges, and key information  India Today",-0.4939,0.0,0.856,0.144,negative,GNews,2025-12-09 13:44:53
"ICICI Bank sharply hikes minimum monthly balance in accounts to Rs 50,000: Check penalty rates for non-compliance - The Indian Express","ICICI Bank sharply hikes minimum monthly balance in accounts to Rs 50,000: Check penalty rates for non-compliance  The Indian Express",https://news.google.com/rss/articles/CBMi8gFBVV95cUxOU2xPUG5icE50MFFzLWtaa2JUdGM1UVJXZ1ZWUWJZYXNsRk9VM3JEdTVWblVWWXhiLXZFNE1janZucXBXUmcxTzExNlhTQXFvbGFCbDBmZmFnMC1FYXRXQ21aYjEweUJsMFJEbEptdTRNeXFPaTBFMzltT3FOdUFQWU00U1h3NDhNT2VxRmVxamhzYW1Gd3VrUThxek5rb3EwMWpOZ0lZVDBlRWNmQ0NWdzhLSFBkRThpeUtybmlXR0VPS3NIcHZxOUhwNUp3enp5eHdtRmZSSWpETjhWOGV2VWJwaGVNdWZmR1hILVJ0Tlg4d9IB-AFBVV95cUxQYU9RdkJZelFrdWRzZFRMNlR2ZG80NHpqZjVDbVhzTnpHdUFYU1JJazdoLTRGdGtidlhSOWVORUxHZW1lajYwQkhSLWpBUHFFZkcteVZGMjFadjdpVUV6bnc0a1NRS1JEcEw3bnJxLW9NenFrXzAwTFpMVVlSZ1d0Q0dqalNTa2licFhMWm04RGhrczFDSy05bE0yakYtaFlRR1FzSlFhOGQtM3ZabDhEb0s4ZmxuNU1rWDNSZzhMVElycWVILXBTRm1nS3dyQllHVy1oWEdWamZBVzNkWjRzdEIwdUs4eGtYbnFtc0hGTUZFZWtIRjBSSw?oc=5&hl=en-IN&gl=IN&ceid=IN:en,"Sat, 09 Aug 2025 07:00:00 GMT",The Indian Express,ICICIBANK,ICICI Bank,Private Banks,"ICICI Bank sharply hikes minimum monthly balance in accounts to Rs 50,000: Check penalty rates for non-compliance - The Indian Express ICICI Bank sharply hikes minimum monthly balance in accounts to Rs 50,000: Check penalty rates for non-compliance  The Indian Express",-0.7184,0.0,0.867,0.133,negative,GNews,2025-12-09 13:44:53
"Has ICICI Bank taken a U-turn on Rs 50,000 monthly average balance? Here's what its website shows - The Economic Times","Has ICICI Bank taken a U-turn on Rs 50,000 monthly average balance? Here's what its website shows  The Economic Times",https://news.google.com/rss/articles/CBMi8gFBVV95cUxPMjJIdkVPZVdkVzlaSVFLZktaMzVjamhKeDJQdFlBMXlPaG95YXJNNlpMdC1IUDFSRC04Z3k0OE5yZm1VSGMzdHh1NEtGOVZZRmduR25LTW9DSmxPOXhqRTZRejh4MllFVXlWQnE4bTlmNUpqOFhqb0Fhb0pjdnJrRVVJQmlCaUc1cGpqYmVJRWx4Ti1BaTZKTllOVzFXOXM5UWpzckFwTC1nMGVHbXN3dzlYMU1uck9vRXVfblJGMVZVWWF0TEw0OVB4bnRKaXYtWmRuRXdFNWx0TGt2V1F4bkFjVnBrRTBDaVpqdlRmMTZjd9IB9wFBVV95cUxQV0g1OGFzTDRUSzZvSVRNMjhUVmFKaVc2ZTVkdkdTR0doT3Q4V19yM1VBanM5Y0x0ZXVBQnBxVVlVY2NkbzhqV1lVMWc5QnE0ZThhazBYR3VBcmVTVFk2YXFsZnJNRjZNOHdRX2dMODFRY1RVXzFtYlI3QkZMY0dRZkVxWTdTTlkzRW96UWRRRHIzQTEyMGxtY2xURjRKSE5KVUdaTTU4eURGZUx5YlJySTBCbTBfcDRQVXBmdzl4Ql9CRWlEcnpyclVUYnAtVWZhRGZGVHVwbWxRSEZlZ0xoNVNDZkVGcFZ1bWtXWDdESW1TYUt5dFk4?oc=5&hl=en-IN&gl=IN&ceid=IN:en,"Wed, 13 Aug 2025 07:00:00 GMT",The Economic Times,ICICIBANK,ICICI Bank,Private Banks,"Has ICICI Bank taken a U-turn on Rs 50,000 monthly average balance? Here's what its website shows - The Economic Times Has ICICI Bank taken a U-turn on Rs 50,000 monthly average balance? Here's what its website shows  The Economic Times",0.0,0.0,1.0,0.0,neutral,GNews,2025-12-09 13:44:53
Indian central bank fines ICICI Bank for regulatory non-compliance - Retail Banker International,Indian central bank fines ICICI Bank for regulatory non-compliance  Retail Banker International,https://news.google.com/rss/articles/CBMijAFBVV95cUxQcktuZWJ2YXU4STRTRzNUbldLdnZ6V2ZSZXdOcXFSbENGLXdtYWFoZlJGSHhuejNRVGRSaURvOWlSc3J2Z2tTc2s0STNwekV4MnRsV05DWnVFMkJ6UkE0emtYX1lkX2t4TGFOZlJ5b0w5OHRvWnQ2bDJsQ0djVFpPZ0NySkptV085cWFUVg?oc=5&hl=en-IN&gl=IN&ceid=IN:en,"Mon, 11 Aug 2025 07:00:00 GMT",Retail Banker International,ICICIBANK,ICICI Bank,Private Banks,Indian central bank fines ICICI Bank for regulatory non-compliance - Retail Banker International Indian central bank fines ICICI Bank for regulatory non-compliance  Retail Banker International,0.0,0.0,1.0,0.0,neutral,GNews,2025-12-09 13:44:53
"If EPS Growth Is Important To You, ICICI Bank (NSE:ICICIBANK) Presents An Opportunity - simplywall.st","If EPS Growth Is Important To You, ICICI Bank (NSE:ICICIBANK) Presents An Opportunity  simplywall.st",https://news.google.com/rss/articles/CBMi0wFBVV95cUxQU0xSRXJyYTE1YXIyeFRXNWk4NDNLaFB1NENXendLVTlnb3B1cjBic1RDb3phbVFxeHhrcmJrMkI5a29NVHc1bzNHQVY3ZHI5cGx3TzVKaklvbk5mZzBDS29zOUkzc3dNYWJURGlrMnppczF4TU92SlZ3RWFNNDh0TndGZktJWVBQRk94WnNLbHljSnowT0hVM0Nsb0ZoRm1rWFppeUtNYXp3azFvVG1IWmYzZk9LQlJkMUhCVGgwU2lqUjVreUwtSXlab2xpLXh2c1E40gHYAUFVX3lxTE5nVFlXcWp4RnJtbXdoQ2x3RjhGQmttN1Awa1BPTGFLdzV2X0hyaXUxaFZCTWpNMUtPTF9wSE1LM2Z2M0prTERRa20zMWNZaUZ2WWd6LXhfUzZQRm5DN2tTRXpyaU5rcU1HWDB6bEpySTFLRDcwY1NxbWZqX2xRVFN4NnU3aFMyWXdrUTluSXd4NW8xQlBibzd1X0JhODdYQV94MXdmN3JYb3FyTUlwX2g0VGtsS2Z0SHlTQzBhaVk3X2RLb0N0c056dkdVRHZPQVRPS1NpOWhWTg?oc=5&hl=en-IN&gl=IN&ceid=IN:en,"Mon, 03 Nov 2025 08:00:00 GMT",simplywall.st,ICICIBANK,ICICI Bank,Private Banks,"If EPS Growth Is Important To You, ICICI Bank (NSE:ICICIBANK) Presents An Opportunity - simplywall.st If EPS Growth Is Important To You, ICICI Bank (NSE:ICICIBANK) Presents An Opportunity  simplywall.st",0.9081,0.385,0.615,0.0,positive,GNews,2025-12-09 13:44:53
ICICI Bank Raises Minimum Balance For New Customers: What This Means - NDTV,ICICI Bank Raises Minimum Balance For New Customers: What This Means  NDTV,https://news.google.com/rss/articles/CBMiqwFBVV95cUxNaC00SUdXNmJsQkpPQ3hoZkNabjN0UXhsSDgwcU5XVDJJV1dlenkxZUJrcUo0QlM0VnRRb2MyYnpic3kwNThsY1JOck1NMkh5TWFPX21GTTk4aG9CY3p6MUJJYkttdm4wOVVJQkFzRmFMbm9rbGxNNUxOUkktMWJkV1NFUHVaaUZfOE1mNzhPVkJPYU1PQ3N6V3kzQkhyUHhkbFAtSTh3UkFHTW_SAbMBQVVfeXFMTkZEcHhfc0loN0I4eFNYUXExWTRNQ1NyZWJMZEZHanRDdnNjSVUzdGpjd0QtQTZKbGVqdkVWZVc2cVZiN0xLWExyQ3BmNzUzQVNiaUJvQUx0ZzBtZ3FqTjloWEZwOTE4aVhpWXN6MXhueXEtaFIxb3Z1QWNydEh0bnR6eWdTX2xBQTBYR3daM2pFN0NTY1FjNXVPTVN4cUtzaUdMNFRyTjdMMWxBZFU0M1lxSkU?oc=5&hl=en-IN&gl=IN&ceid=IN:en,"Sat, 09 Aug 2025 07:00:00 GMT",NDTV,ICICIBANK,ICICI Bank,Private Banks,ICICI Bank Raises Minimum Balance For New Customers: What This Means - NDTV ICICI Bank Raises Minimum Balance For New Customers: What This Means  NDTV,0.0,0.0,1.0,0.0,neutral,GNews,2025-12-09 13:44:53
New rules: ICICI bank raises minimum balance for new customers - Here are the details - Times of India,New rules: ICICI bank raises minimum balance for new customers - Here are the details  Times of India,https://news.google.com/rss/articles/CBMi_AFBVV95cUxNaER2SGY5YjdXd2dXQlF5cS1CdE9zN0ZXWU9reW11VHhGdjB1ZlpOZUdaMVhqczl4ZkFpVWgwcEl0WW1rbmkxTFpJdi1YRk1VQkdYZjYzdGJabzZGNmM4U3NydzhzQjFYQzBqVkVaZlQ1YVo0eHRLVUo0Wm5nR1F1aHZpNGpXWC01VVZYbi1LNHluZzhBLVc4SHVCZWxhczc0MHB1XzV5YUo5d2FBZzUxMllPdkpkUGc2M0MwaTFHUVBhdVNub1dXeGFRdnRacUhyZXc4YXpRNkpsR0hQSTJzTHhVcXlsOVRJUTZiaEVIbnpzRzBWeEdiS1VRT2_SAYICQVVfeXFMT2xsYWhxd09Qc01RVHo0TW80M05ITHlsSWZBR3U5djNsakZORm5rXzRWTXAwUUVJWjZINkdCLWdyZXlTZEdyREZDbHNXMVFSNEN2SURtNV9OVUxFb1czU19fSG9wdndzS2N4cm1MTWJUeXAtM3FOSy1UcWxnSXh1d3YyMEVRbkxqWC1Na1pnZmlSRGVRa0xLbGxVczhiaWl4bWZlajloLVZxZEJ6TlZJRk5xS1dsNlNGQ05wYW5DZGdaNFJ5Qkp1N1EwTFBTSThuRjB6MU5waTNLNXB3b1E1dzZXZk4wRUhxRnJ2OHhTVWx5YnRxdW5zeUo0SUhBaEVBSkZB?oc=5&hl=en-IN&gl=IN&ceid=IN:en,"Sat, 09 Aug 2025 07:00:00 GMT",Times of India,ICICIBANK,ICICI Bank,Private Banks,New rules: ICICI bank raises minimum balance for new customers - Here are the details - Times of India New rules: ICICI bank raises minimum balance for new customers - Here are the details  Times of India,0.0,0.0,1.0,0.0,neutral,GNews,2025-12-09 13:44:53
ICICI Bank Limited (NSE:ICICIBANK) is largely controlled by institutional shareholders who own 72% of the company - simplywall.st,ICICI Bank Limited (NSE:ICICIBANK) is largely controlled by institutional shareholders who own 72% of the company  simplywall.st,https://news.google.com/rss/articles/CBMi0AFBVV95cUxQVDBHbmNTek01OUdWWFJKNWRCN056UDVkQW5xTjc5RkRZNUJZX05DRWJ2T2Znbk5LUmtyOUpxak5GMGV0X0JuaDJaUzZmMWthQXhrNllRenBMQ0FLU3lrYmZXeUREMlU2Nm80c1o1ZjhfQ1lhR0lJcDVpNnJha1JKNFc0Qjl2YzNTc2NFN1YwVWpKUlpyMDFVbWVyOXhoa2hjX2t4dmVjY01jbjRGU1pOVjFEQkRJX0Uxamk4WHpmT29yc0RSbTVfQllZTFJhQ3JP0gHWAUFVX3lxTE9STmFURk4yV2wzOEVsY0FHZ25xWHhtWkhsN2d4YkRDblZteGhXclRmaElYdkZRRVdLZjRfOExOTzNsWGtjMHRUdjBlRWEtd1BYVGVYNi1TRU5jcVhGSGEwcS0xVGh2SzJvdE9kdmxwQkoxNGFZTE9nWXBESzJONmJUelJvaDJ0M2VQSU9FX1Q2OUJsRUJzRUNQa3ZsenBDWEFyRk9XeVF0d1ZnWUR6M0o0UWpNaTdZV29wSW1LU05YYWxPT1NlNENDWmZFcklJQm51RndJUFE?oc=5&hl=en-IN&gl=IN&ceid=IN:en,"Mon, 25 Aug 2025 07:00:00 GMT",simplywall.st,ICICIBANK,ICICI Bank,Private Banks,ICICI Bank Limited (NSE:ICICIBANK) is largely controlled by institutional shareholders who own 72% of the company - simplywall.st ICICI Bank Limited (NSE:ICICIBANK) is largely controlled by institutional shareholders who own 72% of the company  simplywall.st,-0.4215,0.0,0.897,0.103,negative,GNews,2025-12-09 13:44:53
ICICI Bank REVISES minimum balance requirement after backlash: Here are the new rules - livemint.com,ICICI Bank REVISES minimum balance requirement after backlash: Here are the new rules  livemint.com,https://news.google.com/rss/articles/CBMi3wFBVV95cUxNQU1EZGhxd2s2OTdXSWU5N1ZfTzNKa25hcVBDZ01EXzhXNjlod081cnR6OU9mYnNNNUhDSGVuaG40RDFSZEZ5Z3RzVVZscjVaSUNueFpmMm5kODF1anVxRDJ5X2hycm5STXM4blhKTEtxYXdFLTk0LWVQek9mZzEzM19HMFM4dlV5Smhrby1UZmw1V1RWVjBpVnZFeGI1RjZER0xERlZxOUFOVVE3bDlwVFJnc1hOUjQ2dktpN1RCa3djemJEb2NkcjRBMjdoZ1plZkdUa0l5WEdPSzJIREg0?oc=5&hl=en-IN&gl=IN&ceid=IN:en,"Wed, 13 Aug 2025 07:00:00 GMT",livemint.com,ICICIBANK,ICICI Bank,Private Banks,ICICI Bank REVISES minimum balance requirement after backlash: Here are the new rules - livemint.com ICICI Bank REVISES minimum balance requirement after backlash: Here are the new rules  livemint.com,0.0,0.0,1.0,0.0,neutral,GNews,2025-12-09 13:44:53
ICICI Bank’s hike in monthly average balance: How it compares with other private and PSU banks - The Economic Times,ICICI Bank’s hike in monthly average balance: How it compares with other private and PSU banks  The Economic Times,https://news.google.com/rss/articles/CBMi7wFBVV95cUxPQWZfSElNLVlGZHVSR2FQQXpyWjR4cC1RVERWczZLa3NpUkIyV0NJM2RxbFI2TzBHNmxYM0NiX3BXa19GVlRjTC1PTUZ6V1NXUnlZazV4cEllWkNkTkJZMlllV0xkczMzVUcxbmUzYS12RzFPbnk3TXB3NjdNZU5nbWVvZW5QTFYyQzJsUUFVdDhiQzRfeTQwUTNxSGlVdEVCRmV2NzVacW16U1hCcWdjNkRhUkZDSTMwZkFPaFF1bDc4N0U1eFZhQTF1MFh1eDhfQ1VRZFdJMDdrb0pTbkJ2UjRxVG1TY2ozQ0NQLXhvb9IB9AFBVV95cUxPWk9mVEU0NmU0eDdsZlgyRVNnTU1UQmE1R2JSd0tQYWNPcHhmWGRyWjlLcFhWMFBsWEVoOE1IbFVzY0NKMkZ0b25aTXdVSmNYaEdQNGM0dEFBXzNNOTJiVUVqWmtpRFcwbEZmX0tKTURoM3FvZFpPTVQ2T1pKOGF4N2djdUY2QTZicWlUb0FhRV93SFdOMV9sRllOYTFtVVY5a3NfYWF5MUhmdUJRLV9JMDNCTF9wRTRCaUZyVzR4M2xqR2ZvZVRYNXZFdDRNMVNkYUxQQUJGaUtnUEQtYjBQUUVZZ3FqWW5vOWFfdHdXLURNVjE3?oc=5&hl=en-IN&gl=IN&ceid=IN:en,"Wed, 13 Aug 2025 07:00:00 GMT",The Economic Times,ICICIBANK,ICICI Bank,Private Banks,ICICI Bank’s hike in monthly average balance: How it compares with other private and PSU banks - The Economic Times ICICI Bank’s hike in monthly average balance: How it compares with other private and PSU banks  The Economic Times,0.0,0.0,1.0,0.0,neutral,GNews,2025-12-09 13:44:53
