title,description,url,published_date,publisher,keyword,bank,sector,text_for_sentiment,sentiment_compound,sentiment_positive,sentiment_neutral,sentiment_negative,sentiment_label,source,collected_at
VinFast India Partners With ICICI Bank To Deliver Comprehensive EV Financing Solutions - VinFast India,VinFast India Partners With ICICI Bank To Deliver Comprehensive EV Financing Solutions  VinFast India,https://news.google.com/rss/articles/CBMitgFBVV95cUxQT1hEOHM0dVR4QXkxWmVUbjFuR2ZUSi1jVU1sUjd5UEk5QlF4OTlJYWE2S1Z6WXc1LTBBSEMzcnc0U281S0g4Ums1STNyMWR5cHRzVlZKOWRGSjh3N1FqOXpVVHFKU0xnTzhob3lscUk4SGFPUzNxSGJrdXN2R2RtcGd6Ty01R09Dc3duS2N4YlVJVlRVcXpOSWY4aEdWUk5UbDk0NWRkMl84cXpoMHV6cm12LVQwdw?oc=5&hl=en-IN&gl=IN&ceid=IN:en,"Wed, 17 Sep 2025 07:00:00 GMT",VinFast India,ICICIBANK,ICICI Bank,Private Banks,VinFast India Partners With ICICI Bank To Deliver Comprehensive EV Financing Solutions - VinFast India VinFast India Partners With ICICI Bank To Deliver Comprehensive EV Financing Solutions  VinFast India,0.6597,0.228,0.772,0.0,positive,GNews,2025-12-09 13:44:53
"RBI identifies SBI, HDFC Bank, ICICI Bank as Domestic Systemically Important Banks in 2025 list - The Hindu","RBI identifies SBI, HDFC Bank, ICICI Bank as Domestic Systemically Important Banks in 2025 list  The Hindu",https://news.google.com/rss/articles/CBMi4AFBVV95cUxOQjRrT3RHLXhDeVdpQUdxVUxHcUJwdzlZYU82UkVMZFA4cVpValI2cTNlSktlVWVmc1Q1cC1zQU5OSTVEMGF5Y214TGFkOXdSckt4M0tlZHplcVk3Q3NkUnZFSHZMVlNaRGJ6cUh0UllvYnY3WlZJdVRQVU9ZNzNleURxWHR0WXNBUEpnSHZlc0w1QjZjcWVWLWVITThVZVlack5aVnpibjlYY0tuWmNsZy1ZU082RE5UeDhlc2hKMG5GX21uMVJ4Q1YxSWZZZTVxak1fMFVQcUowcFR4SVlTVdIB5wFBVV95cUxNRW9rTjNzVmZMdVVnM3c5bGdGNTRneUkzTERNenRVNWQ5RUYzWmw0UDFzbkw3bzhubnRIR19ieml3TEpQU3J4Rlkza1RTTE1sY1cwa2xqRUdyZjAta0NtaTNfLUI4MnFPNGN3Wl9ELXpwZVJ5aW1fTV9sMW54SEFXR1pQMHRGT1ZCUnpuOHJuTFZGVTkxckM2d0RVR0dqN1JiUm1WLVl1cHI1MXdvcFNfUVdFMEJrU1dMV1BGSktEblBCYTFnQlRuVWhxY0hqcUY3YlJrbXhpcWhmbWlEaHktdzloUE9vM1U?oc=5&hl=en-IN&gl=IN&ceid=IN:en,"Tue, 02 Dec 2025 16:45:00 GMT",The Hindu,ICICI Bank,ICICI Bank,Private Banks,"RBI identifies SBI, HDFC Bank, ICICI Bank as Domestic Systemically Important Banks in 2025 list - The Hindu RBI identifies SBI, HDFC Bank, ICICI Bank as Domestic Systemically Important Banks in 2025 list  The Hindu",0.3818,0.098,0.902,0.0,positive,GNews,2025-12-09 13:44:53
"Stock Of The Day: Sell ICICI Bank Futures: SL 1338 Tgt 1300, 1285, 1270 Banking stocks looking weak ICICI may lead weakness in Bank Nifty Sell Hindalco Futures: SL 643 Tgt 620, 610, 602 Meltdown in metals in global market Sell Chola Investment Futures: - facebook.com","Stock Of The Day: Sell ICICI Bank Futures: SL 1338 Tgt 1300, 1285, 1270 Banking stocks looking weak ICICI may lead weakness in Bank Nifty Sell Hindalco Futures: SL 643 Tgt 620, 610, 602 Meltdown in metals in global market Sell Chola Investment Futures:  facebook.com",https://news.google.com/rss/articles/CBMi4AFBVV95cUxNTGhaZ2ZKcnllY1BsOWFrZXI2OXBSWUlpbUZMRUZudHFPZ2w0YTdSSXZUSFE0SWZhS1NmN1JiNGV2MFhqV1oyaEhaUHVwaWRyeEtsQUQzQzJVQlRtaEQ1Y3VGbzg1WUFuZEVPYkRRSjJ6NldTR1hCa3h6M2lMamlDZHpDdlZiZDlVcTZyWnRVdkJyb3Qwd00zN3Z2NWo1d3lfeXBVaURBNW12Rng2Q3FkWFpCa1V5eWJmMHB6YldPYnpfN3BacExqRk9XcWQ2d1d4TWlfM1FnT3JUejZtODZ4aw?oc=5&hl=en-IN&gl=IN&ceid=IN:en,"Wed, 18 Dec 2024 08:00:00 GMT",facebook.com,ICICIBANK,ICICI Bank,Private Banks,"Stock Of The Day: Sell ICICI Bank Futures: SL 1338 Tgt 1300, 1285, 1270 Banking stocks looking weak ICICI may lead weakness in Bank Nifty Sell Hindalco Futures: SL 643 Tgt 620, 610, 602 Meltdown in metals in global market Sell Chola Investment Futures: - facebook.com Stock Of The Day: Sell ICICI Bank Futures: SL 1338 Tgt 1300, 1285, 1270 Banking stocks looking weak ICICI may lead weakness in Bank Nifty Sell Hindalco Futures: SL 643 Tgt 620, 610, 602 Meltdown in metals in global market Sell Chola Investment Futures:  facebook.com",-0.7184,0.053,0.835,0.112,negative,GNews,2025-12-09 13:44:53
"Following strong customer feedback, ICICI Bank has reduced the monthly minimum average balance for new savings accounts opened after August 1, 2025. The balance requirement has been cut from ₹50,000 to ₹15,000 in metro and urban areas. However, - LinkedIn","Following strong customer feedback, ICICI Bank has reduced the monthly minimum average balance for new savings accounts opened after August 1, 2025. The balance requirement has been cut from ₹50,000 to ₹15,000 in metro and urban areas. However,  LinkedIn",https://news.google.com/rss/articles/CBMiuAFBVV95cUxOUlFDY2t2aS1mc0ZINUZxaE1laF9rZ1VmekxyS3dMOVNObExpYVRCbDR2RWVjUVczTEhpWlk0X0UzVVB4R3JfNU9VT0Jvc1Q2cTdsN0UzUWQzTXAwUkdYZUN6U0JUTS1NakFCc2RSNUhXU1ltZDB6NTNzTXp3eWFwTFhDc0FTR2l5NS1xbkhGcC1oOHk0QXRwR0ZJRS1McVA4WGJjVmU1elJNR2ZvdG5Wc3dOSkJyQ1ZY?oc=5&hl=en-IN&gl=IN&ceid=IN:en,"Thu, 14 Aug 2025 07:00:00 GMT",LinkedIn,ICICI Bank,ICICI Bank,Private Banks,"Following strong customer feedback, ICICI Bank has reduced the monthly minimum average balance for new savings accounts opened after August 1, 2025. The balance requirement has been cut from ₹50,000 to ₹15,000 in metro and urban areas. However, - LinkedIn Following strong customer feedback, ICICI Bank has reduced the monthly minimum average balance for new savings accounts opened after August 1, 2025. The balance requirement has been cut from ₹50,000 to ₹15,000 in metro and urban areas. However,  LinkedIn",0.5267,0.077,0.874,0.049,positive,GNews,2025-12-09 13:44:53
Rs 50k to Rs 15k: ICICI bank rolls back min account balance rule - Times of India,Rs 50k to Rs 15k: ICICI bank rolls back min account balance rule  Times of India,https://news.google.com/rss/articles/CBMi4wFBVV95cUxPWmo0aFFwcVY5cE1JZUktRHFndl9EbTVDSkpLWkFjNmJodERZVXZDUGFTVHVVNFE1dEp3eUJvMEQtVjRfZXV6ejNSNDFrNUZtQlRKclBPUnFydGJkalpma1dwRjBhSVlCMmhZM2F2MWU1S3R3QjhSVFhtUDV2X0JLUVZxQ2dMLXB5UzVlLTd3SWxYX0xqYzRMU1RiaG5kdUpaMFFpRnY1ZS01blBST2VOQ0g5ak1DU2tXemtxTlhvekNrZ2tTSENlVzJGMGgtck1HaWdRZkJlTnhBeWZpQUs4ZWpBWdIB6AFBVV95cUxQRlFOcTk5czFISHZBODBrbkFCRjl3Zm4ydTRyYlF6NEhnZDVud2phM05peW11eFp4bnJjT09fT19oalpnY0k3TzNMUl94UjRvSl93NEF6cXNnbDAybkFINTVqRDY2UTE4Y2Uzc1BZTlZWdzVwZll5Z3RxbzFnVmFiZ3pFWERHQlkxXzFlUW1kLXZ1eV9TWmlwbGVmb2d2N2QyanRZUlhVbm9tQy1EdHFQWFUxOEVlZWpnd0xWX0t4Uk1BbnpuY2c4WnBqcU5qaGYzZ1NTeERPNFNTVTFURGpLX1B1b0EzQUY5?oc=5&hl=en-IN&gl=IN&ceid=IN:en,"Thu, 14 Aug 2025 07:00:00 GMT",Times of India,ICICIBANK,ICICI Bank,Private Banks,Rs 50k to Rs 15k: ICICI bank rolls back min account balance rule - Times of India Rs 50k to Rs 15k: ICICI bank rolls back min account balance rule  Times of India,0.0,0.0,1.0,0.0,neutral,GNews,2025-12-09 13:44:53
ICICI Bank gets Rs 49 cr GST demand notice - The Economic Times,ICICI Bank gets Rs 49 cr GST demand notice  The Economic Times,https://news.google.com/rss/articles/CBMiyAFBVV95cUxQWjBVc09yMF93RjFiWmNMbXlnU1AtQkhHWlI4S25TdHY3SlFHbjlOQTQ4LW9hcDhQdnlRT0hwVXE4XzktNFJsZVNnSmotZU9ONmRXTjFINVliOHF4ZlZKYW1FVkR2QW4tb0RZY0xxOUlEdzJLN1ZzQWJVaDBiZ1E5RjE4ZVVsSXZzMjVWZ1VoMng1UjBKUHN4dTlPNWxCMXRZVmVDVWQ4dW93dnhqY0liZ1NqUUR4UzhYcnpGMWl4SVZzdV94N3NFdtIBzgFBVV95cUxOOVN4MUVSUmJNcDFYZXBhNGwxdmJraEZrRGZtR01hc0xSNnhMc2lhZ05TaE1JSWZnd01iV2FYaGY1REx6STRvek1ITlU0QnltQVkxUjdyOF8zM3JjTGlKODRMM1NDMk4zSlNfR0J3dlducEpjMkVmYzU2aGJ3QWhmbldqRThJbDJmaHJlTlRlbG54NmJPS1NlX2dfam4wVjh4a2oxMGZDUFVuMDdpTDhSYzRjWjJNWXBxZDhROEF0Vm5KVVNkZTUyTl8ydUhGQQ?oc=5&hl=en-IN&gl=IN&ceid=IN:en,"Wed, 17 Sep 2025 07:00:00 GMT",The Economic Times,ICICIBANK,ICICI Bank,Private Banks,ICICI Bank gets Rs 49 cr GST demand notice - The Economic Times ICICI Bank gets Rs 49 cr GST demand notice  The Economic Times,-0.25,0.0,0.885,0.115,negative,GNews,2025-12-09 13:44:53
Amazon Pay and ICICI Bank renews credit card partnership with reduced forex fees - Elets BFSI,Amazon Pay and ICICI Bank renews credit card partnership with reduced forex fees  Elets BFSI,https://news.google.com/rss/articles/CBMiqgFBVV95cUxPRTBGcktrNElSRW9EUk5hNzh3Tm9wOWhDa2NCX2VKQ3RXaUMtMkdXRGtQWUNWNWVBVjd4dFNlWTh4VG5Na3otRUZiT25PQTVoSV9nSFROVFBRdmdqTHBlQ3pxZmdwVm9ZQzdWNjN6Q21BV0JUbl9mRzlwSGQ0Qzhka3paV0h6bVBLZzNyM3hJRWVQeThSVWdycEhvQTc4dlcxcWtGUU5mbmhudw?oc=5&hl=en-IN&gl=IN&ceid=IN:en,"Thu, 11 Sep 2025 07:00:00 GMT",Elets BFSI,ICICI Bank,ICICI Bank,Private Banks,Amazon Pay and ICICI Bank renews credit card partnership with reduced forex fees - Elets BFSI Amazon Pay and ICICI Bank renews credit card partnership with reduced forex fees  Elets BFSI,0.7003,0.236,0.687,0.077,positive,GNews,2025-12-09 13:44:53
"ICICI 3 in 1 Account: Manage Savings, Demat and Trading in One Place - ICICI Direct","ICICI 3 in 1 Account: Manage Savings, Demat and Trading in One Place  ICICI Direct",https://news.google.com/rss/articles/CBMiVEFVX3lxTE5Ub201ZXRjYmJ5RHNVenNyQ3ZPbjVsMDBfZmtuMEFLYUJBaDYybEpUZG5Jd1dCVEdsYU4zZU1mVkhIVE1nRlloQVl1dE1xbDk3S0hZaA?oc=5&hl=en-IN&gl=IN&ceid=IN:en,"Thu, 20 Feb 2025 18:25:24 GMT",ICICI Direct,ICICI Bank,ICICI Bank,Private Banks,"ICICI 3 in 1 Account: Manage Savings, Demat and Trading in One Place - ICICI Direct ICICI 3 in 1 Account: Manage Savings, Demat and Trading in One Place  ICICI Direct",0.0,0.0,1.0,0.0,neutral,GNews,2025-12-09 13:44:53
ICICI Bank revises minimum balance requirements: What are the new rules? | Latest News India - Hindustan Times,ICICI Bank revises minimum balance requirements: What are the new rules? | Latest News India  Hindustan Times,https://news.google.com/rss/articles/CBMizgFBVV95cUxNdVotc3VPYVZlMUdhRFFKWENFVGV4a1ZJNVBsWnJLREVvY3dIbXJyNExGZHlTcG95WjVtTG83UFJzdEtmUEJCUzQwM1k3Y0JIYUVPcFcxNVpmQUN5cmFUbjZIYUpGWjU4azlpV2lWV2xvT3FSMjhUbEZ3dXJLbHd3bGh3MlR0dVI4UVg4amV6bl96QWIxNzlzWTJ5VzFmZXJtc1NHb2lnamphdXRLQjFGSVFBZTBlUnN3RkFUQ21XX2VXSVNzVWJSX0w1czBvZ9IB0wFBVV95cUxPcjNvODlQXzBDMzNoaTFQWi0tQ19OQ1dIQ0RvcXZXaDdsZ294NThZRU9hQmJIWTBhRFZHQ2sxMjlvYjFneWYtYkg4dm1YakdTUmtiWHV1X1h6MnI2X3dvTU1fSmY4ZXlTRWJ5Yml2YUFqbU5iQ0oxSGs0X0Z4b25CT2R0MUdud293akU1dHNSY0VHTzMwRWd5bS1xRHNaZEprY211YUk3UDFPb05xUXlRRkNaR2ZZQ2VVdktNZTZNYzd6ektoS2FwTHRLN0prZXpkQURv?oc=5&hl=en-IN&gl=IN&ceid=IN:en,"Wed, 13 Aug 2025 07:00:00 GMT",Hindustan Times,ICICIBANK,ICICI Bank,Private Banks,ICICI Bank revises minimum balance requirements: What are the new rules? | Latest News India - Hindustan Times ICICI Bank revises minimum balance requirements: What are the new rules? | Latest News India  Hindustan Times,0.0,0.0,1.0,0.0,neutral,GNews,2025-12-09 13:44:53
"RBI retains SBI, HDFC Bank and ICICI Bank as systemically important banks - Business Standard","RBI retains SBI, HDFC Bank and ICICI Bank as systemically important banks  Business Standard",https://news.google.com/rss/articles/CBMi6AFBVV95cUxOUXJjYTE3LTYzOF9fMVY3OHZESUdWWUJfWktTX0haVGJndEkwUEdVRm14UUtrNmlrUFcxRG01YzhZU2RHa2E0dk0wOWZmZWIxOFJRaFp1aVJzYnBnN2t3Wmllb3N1MUE0ZHA4LXJ0ZHlmRWpSQVBDUWxpQWRLeW1DMzdFaENGampHeTEtNWpkbV82VUhpbTZLbEV5Q24zWkYtN0Z0bjhwTDh3RGJlWG1OYmFMUXJteW5oSkVqcW1JeWsyN29tOEtvSEFrUlpwZHRSVmN1WHlNRTh5WVY3VzVpNzNyX0lCODRz0gHuAUFVX3lxTE4wbWZ0dWZIRXFFZ1hqOFRpaEhCR2dJZVpWRmZTLVBEY0pnY01MMkk4RG9hbkxVX1dLR3JWblBMY3ZWTENhZVEySV8wQkJvZUVXWV9Bd2JlYlVDWWoyTVF4MldHZ01VOFpsQjQwNFZ5ZUNxa09nWGRBN0ZqUGJRRjNXMXdvemlMUWpwY19tenJ1bE80OWZWR2d4RkNvMzRGMlczLTd5M0QzbWtRXy1NcGoyVVB1YXVUejVuazNUblgyaXgyX2RrZ2U0MEp3QjF6ZlRjb2Y5TzU2Z0tvYWdxVDlZUC1qMlMyOU04c0E5bkE?oc=5&hl=en-IN&gl=IN&ceid=IN:en,"Tue, 02 Dec 2025 12:35:20 GMT",Business Standard,ICICI Bank,ICICI Bank,Private Banks,"RBI retains SBI, HDFC Bank and ICICI Bank as systemically important banks - Business Standard RBI retains SBI, HDFC Bank and ICICI Bank as systemically important banks  Business Standard",0.3818,0.118,0.882,0.0,positive,GNews,2025-12-09 13:44:53
India's ICICI Bank beats quarterly profit estimates on lower provisions for bad loans - Reuters,India's ICICI Bank beats quarterly profit estimates on lower provisions for bad loans  Reuters,https://news.google.com/rss/articles/CBMiwwFBVV95cUxQYXBXQkh4bHllSC1OSFFsMDloRFhUZ3FTazBRbzRYMTYxNjNPVHl6SUJYWG1Kek1QSU44bzFrQUJvN3ljekJpWFE1R2dndHJvcUlSUGpQa05HZEpuQnl5TVBweVE1LXRRbW9QZFh1NEZHVFFzWTBQck9VRTlNQ21uWmVUSXJuVnlyNl9tM3JwdXNGd2ZjWDVMS0dpWjRrMFlhU1duYkRRVEhJcnNiYURDSjdaMzcxMExmcGFGZ18tckNScGM?oc=5&hl=en-IN&gl=IN&ceid=IN:en,"Sat, 18 Oct 2025 07:00:00 GMT",Reuters,ICICIBANK,ICICI Bank,Private Banks,India's ICICI Bank beats quarterly profit estimates on lower provisions for bad loans - Reuters India's ICICI Bank beats quarterly profit estimates on lower provisions for bad loans  Reuters,-0.6808,0.144,0.572,0.284,negative,GNews,2025-12-09 13:44:53
ICICI Bank Lowers Minimum Balance. Check new rules & penalties - India Today,ICICI Bank Lowers Minimum Balance. Check new rules & penalties  India Today,https://news.google.com/rss/articles/CBMiwwFBVV95cUxOcmNtb2JWSjFGOHBKSHlVMVdZSXdlT2NNMlJXU3p5N0puNFVVOWRhRlVnU2pVZjZYQjZGalg2TmVWMmpwX1VPVlQwX09lSTdod0pqel9HS1lQdVVDVkpzZ2F0VThDaDBQOXV2V0ZpYVFncTJFRG9fLXA3SzNNQ2l3QUp2RXZPNWxhMWZMaVRzSUM5Zld5SFR4dXNCbHIyWk9aSGM0dFRIZ0JrazhFbHJnUHBpTDFXZ1BYOEE3bE5NWks2TnfSAcMBQVVfeXFMTnJjbW9iVkoxRjhwSkh5VTFXWUl3ZU9jTTJSV1N6eTdKbjRVVTlkYUZVZ1NqVWY2WEI2RmpYNk5lVjJqcF9VT1ZUMF9PZUk3aHdKanpfR0tZUHVVQ1ZKc2dhdFU4Q2gwUDl1dldGaWFRZ3EyRURvXy1wN0szTUNpd0FKdkV2TzVsYTFmTGlUc0lDOWZXeUhUeHVzQmxyMlpPWkhjNHRUSGdCa2s4RWxyZ1BwaUwxV2dQWDhBN2xOTVpLNk53?oc=5&hl=en-IN&gl=IN&ceid=IN:en,"Thu, 14 Aug 2025 07:00:00 GMT",India Today,ICICI Bank,ICICI Bank,Private Banks,ICICI Bank Lowers Minimum Balance. Check new rules & penalties - India Today ICICI Bank Lowers Minimum Balance. Check new rules & penalties  India Today,-0.25,0.0,0.885,0.115,negative,GNews,2025-12-09 13:44:53
"ICICI Bank Q2 Results: Profit Rises 5%, NII Up 7% - NDTV Profit","ICICI Bank Q2 Results: Profit Rises 5%, NII Up 7%  NDTV Profit",https://news.google.com/rss/articles/CBMilgFBVV95cUxNZDlhVWlaZXYyREo5VFNnaFlPMmpBVWNUVTcwWTJfSUlCOFZ4ZjAxaFFXNXdpNEdPYWVDUnJ1TU9SY3hpZEZxamhiTjhSMmpRM3dpTlFfNVhVR3JITUlOV29hQnJoakxSTnFhLVc5alVNUkRxel9hdmxHVHk4NTJrdDNZbDJuMEt1cDNOY01yN1NJZHRoQnfSAZsBQVVfeXFMTU93NHkzbDFIYTRfSmRPV3UzMzdiYnRXR3licmxYbUcwVFUzQ3h1TDhuZlRiTzBnZ0FxM19NMUE2MnNkRWlrbjF1U0R2Ykl0UmFDY3hsWVlwVHpqWUw1VnVUazNUcWlLZm1SNThydVpoMG9Yd2U5NFZEUFc0ZjdETXRRMGRvZG1zN1U5N1ZHWXNGTFlJUXhINGxuRHM?oc=5&hl=en-IN&gl=IN&ceid=IN:en,"Sat, 18 Oct 2025 07:00:00 GMT",NDTV Profit,ICICIBANK,ICICI Bank,Private Banks,"ICICI Bank Q2 Results: Profit Rises 5%, NII Up 7% - NDTV Profit ICICI Bank Q2 Results: Profit Rises 5%, NII Up 7%  NDTV Profit",0.891,0.356,0.644,0.0,positive,GNews,2025-12-09 13:44:53
SBI vs HDFC Bank vs ICICI Bank: Which bank is the best long-term stock to buy for investors? - livemint.com,SBI vs HDFC Bank vs ICICI Bank: Which bank is the best long-term stock to buy for investors?  livemint.com,https://news.google.com/rss/articles/CBMihgJBVV95cUxNRUh5UW01bl9IaVdPX0hvNkY4eGhZSi1BXzIzWGhsMEdFUHlGbFlKT19OaDlNZnVjWFktNW0tcnFZNC1lMUVkMGU1N2NvUGlpVVFwNXp3bk5VV29SSHdHYk5tSjhuMENwM2VreDJGek01MUVOVkt1Y2VPcGkwcVFHcXF0Q1RzdU92eGJVcjNBbkRUMGlXN2Q2bG5acll2TTJvb0E5cThVZGRmMzZIMXBGZ3ZETlBkMG9hMXNlOElaZjZkdV8xU2ZZSVFwQlpLb2FGTHF1SzdZTXIzUUk2NEdFcUZLV2VPWjBNRGdBNTVldEF4Vy1jb1pWZjc4ZE8xQWtSOEhIb2FB0gGLAkFVX3lxTE9JemZiYzhjWjVvS2ZuRG1OT1JYQkZnSExVWUlfWjFPRXZ0NWdVYjZlalJsS3JMSUJ3R1NURmZ4ZFNYUHZtQlVwbnJHbU9BOFE4QVVaN0hKd1B0d3JlS3UtaHhaRzNLQmRjeTFVTzROUUJ4OVI2YUZpSEYtZmxvMkROaEg3OVNJRHhvaS0taUpyM0kzUlBvWWh0WFlEVG9MYmM5blE1SEdSUjF0UVNNYTVKQTJ6dFJtMXQ2OERkcGRGLV8yQzRuaDRZNE80cE9WdFhtVE5pd3ZtSm4zYnMzMXdPOFVBdk12ek1KY2VNTGJDeFV3ejRscDJZRkREbFIyN29XUWwyeDdSc3gzMA?oc=5&hl=en-IN&gl=IN&ceid=IN:en,"Tue, 25 Nov 2025 08:00:00 GMT",livemint.com,ICICI Bank,ICICI Bank,Private Banks,SBI vs HDFC Bank vs ICICI Bank: Which bank is the best long-term stock to buy for investors? - livemint.com SBI vs HDFC Bank vs ICICI Bank: Which bank is the best long-term stock to buy for investors?  livemint.com,0.8677,0.191,0.809,0.0,positive,GNews,2025-12-09 13:44:53
"ICICI Bank Q2 net rose 5.2% to ₹12,359 crore - The Hindu","ICICI Bank Q2 net rose 5.2% to ₹12,359 crore  The Hindu",https://news.google.com/rss/articles/CBMimgFBVV95cUxNYVNQTTZxTHAyRndRbThQZ2pnZnBLYl9MTU1GSFI5ZGZzWTNFZ2s0VlJJNGg0ZUx5bVdNckFrSFBaTHlqWkExVGJhbE1QemlTbXZyRHVLaUdUWFpDUUdYaFk1RW9UdkVkU0s0YmMxaFQ2dTBmYkNOdWk0LWpYVmxQTVZScndZQncyOTNJNl9XOUFfSTV5alk4czlR0gGgAUFVX3lxTE9sZW9kcXVENVczSjE3blFOVFdFSjd0VWI2XzhOX3NIRWh5eVgtNTZHUlliSjVVdWQ1UTNObExzQW5tQ2hWMFc4dlFMYVZWdlpHdkYtcGZoSDY3QmVBVV9abXZ0TWo1TkRHdENyN09Qc1h1Mzg2RDhIcUFVX2ZoUURSU3lFTUZzTjctWmpGZWVFLU5HUF9aeV9PMnB2ODBLelA?oc=5&hl=en-IN&gl=IN&ceid=IN:en,"Sat, 18 Oct 2025 07:00:00 GMT",The Hindu,ICICIBANK,ICICI Bank,Private Banks,"ICICI Bank Q2 net rose 5.2% to ₹12,359 crore - The Hindu ICICI Bank Q2 net rose 5.2% to ₹12,359 crore  The Hindu",0.0,0.0,1.0,0.0,neutral,GNews,2025-12-09 13:44:53
"ICICI Bank to clear cheques same day from October 4, 2025: What customers must know - The Economic Times","ICICI Bank to clear cheques same day from October 4, 2025: What customers must know  The Economic Times",https://news.google.com/rss/articles/CBMi4AFBVV95cUxQYlR0SVNaWnBYODlGQkdhZ0NmVVpMRFhuMlVTaV8wTmhVTjdQOTJjMHJ0YWtvVXhVQzJaV0ExX1ZrZVdETDI0QWJBODRRZ1hvTl82ODllNFRKN0E5VWMtWUgzd2x3S0tNT1c3b1ByM0lVMGpHMEdMUnN2S0tjZEdJNnFvMjdnQmZRTWpPY093NThaNHQ0Rkpad0ppbWIzTldFWkFucS1pcm1aYU9YTDdoQjFraDlnRk80ZkZhYXFNNk5UMjV5eFlPRlNKQTV2Mjh3VjNFRHRpZWxKa1oyeS04bdIB5gFBVV95cUxOV2dEQ1g1Z3FJY0VZZXlHXzB5ekdPcjh6S3RBamFvOERwWlVCaGVLcmdYR1UzVU5sX2cxSHo0OGFoLWVHaFpLLS13LUtsTjlaclI0QUxOQWtqbXhxZVZVYm9NbTFrRGhIS2MtMU9OaFBsbDNyWFFRakRCNWxYZWxfeVJvcm9RSExPclhvUU4wRWFqT3FyZExXOXU2SlJXX1Q3S05CdTg2cDRoOV9WMGVIZXJZdmR1djFrV0N6ME9rMUdHZGRubkdLeXNnLUFkemNyRFNURExoV2drdmUzOVdxaGswUHU3UQ?oc=5&hl=en-IN&gl=IN&ceid=IN:en,"Tue, 23 Sep 2025 07:00:00 GMT",The Economic Times,ICICI Bank,ICICI Bank,Private Banks,"ICICI Bank to clear cheques same day from October 4, 2025: What customers must know - The Economic Times ICICI Bank to clear cheques same day from October 4, 2025: What customers must know  The Economic Times",0.6369,0.129,0.871,0.0,positive,GNews,2025-12-09 13:44:53
"ICICI Bank Q2 results: Profit up 5% at ₹12,359 cr aided by low provisions - Business Standard","ICICI Bank Q2 results: Profit up 5% at ₹12,359 cr aided by low provisions  Business Standard",https://news.google.com/rss/articles/CBMi5wFBVV95cUxNNC1QYUNTZkxBRXZxVXM2Y1ZpLXRtWE1TOTNRNEVTSi1ZRlhaOWJoczVULVJydjNwakdtSE4zMGlvMmoxSklFRndhMzVlVk12V0VFUFBzSDM2SHZnV2RZd005ZmN5WEQwZUVoY1FVZ3dRTGNZNmhPRzZXT0dEWHc4SWRNcTVmTFgwMXh6aHJlX2FnRFRndGlxbzVtNDFIMnA3TkNXTTlUMGxTMkVmVU5mb2Y1R3Y4V3U2UWdCQjFncXhfWUdpd0ozNnlNNFZ4cDBjdjcycTBZRGhmeHpiM3RWdlBUYkM2R1XSAewBQVVfeXFMTkd0R3dzdVFaS2U1cTN0RWJMOHgtUV9hUTdrR3ItV242MFkzTGZrZFQ0dmU0Q1pvVWZsM19FQmxYU2txbW9MT2FBcmFVaXNsdm5BRDBUbHFEcGxEVnJzbWt3UE5RZS03X3FZR21sTmhnYWZlcWdjVC1DVGNtNWxDMTM2cjJxS3VjazZCdlVFdHVVSWtudGRuOG5iZm53cXdMdExGcUdpOHp3QWtwS01RV2JrbjVVY1pIcGpjbnEyWEM0OFJKRVRVbUp1UmRieDNmNk1qWkxpcnd0bHVxbjNLa2RhbFB0b3JlRER5X0M?oc=5&hl=en-IN&gl=IN&ceid=IN:en,"Sat, 18 Oct 2025 07:00:00 GMT",Business Standard,ICICIBANK,ICICI Bank,Private Banks,"ICICI Bank Q2 results: Profit up 5% at ₹12,359 cr aided by low provisions - Business Standard ICICI Bank Q2 results: Profit up 5% at ₹12,359 cr aided by low provisions  Business Standard",0.3818,0.149,0.744,0.108,positive,GNews,2025-12-09 13:44:53
"ICICI Bank lowers min balance requirement to ₹15,000 from ₹50,000 - The Hindu","ICICI Bank lowers min balance requirement to ₹15,000 from ₹50,000  The Hindu",https://news.google.com/rss/articles/CBMipwFBVV95cUxOQ2RaY29oN1JDb1c3M2VrNEJmbXAxSEpqeDgxNklvOTF4QmZOMlhhVDg3ekdLci1JX2JZLV8zcFl4UnVTOTZsY0lOT204RjdiMTRzbFFGWC1TU2pzRV9CSTIzUDdNZkZVX1FhR2xURjAzbmJnNHlLMXc4NGZadEtaZ3NMeGZ3UEdMZ0ZVVUs4NlAyVnFTNlM5eDZvYUs0Rm13eTZReWVfMNIBrgFBVV95cUxQdmZSRThpMEVTQmRsRFZPbU9zLW9VaVFBU3lCUm1STks5T2ZFN0d4SGU1M2g4V1dxUl9uekhoaUYwT0VWOFRyX0hpQzItcWNFNUw0SWRFWWNvYnZxMGVHd0kzU0V1RE1NeS1WSFI5QmU4VTVGd2N1SkwwbTZVb3VZbkhlekVEWmtVcXFzOWJibHVlUmJLalpETWRqTG5Mci01SDlPeFYzZGstX3R3Q3c?oc=5&hl=en-IN&gl=IN&ceid=IN:en,"Wed, 13 Aug 2025 07:00:00 GMT",The Hindu,ICICIBANK,ICICI Bank,Private Banks,"ICICI Bank lowers min balance requirement to ₹15,000 from ₹50,000 - The Hindu ICICI Bank lowers min balance requirement to ₹15,000 from ₹50,000  The Hindu",-0.25,0.0,0.885,0.115,negative,GNews,2025-12-09 13:44:53
"ICICI Bank stock at crossroads, may test multi-year supports: Tech charts - Business Standard","ICICI Bank stock at crossroads, may test multi-year supports: Tech charts  Business Standard",https://news.google.com/rss/articles/CBMi1AFBVV95cUxQY19QeFRFQUk2M3R1YWNyLWgyenJ6VjFuR25MN0s3RW00N1lpZGFURW5Bb0xCa2p5YnEzOWJ0XzRuYnc3V0lUdGVsbXl6RHNoeUNXYThxWlpOa2VRazVaWmNrX3hKNlVfb1ZfbjRsT254TmVkUnE5VlhpU3lZZUxZd0ZPeS1EZnZoN2p1UWdRS0Q1SWQ4MzY3Z0lwUndGdjZhNS1WbjBrN2dpX2V6NW1OSlJDVkQ0RnFxSlI3T2lYM21DNUZ5UjdiX05Sb2JXdUJKdndDRdIB2gFBVV95cUxPZks4b2pOOHNBbnMydzV4MVd1cnZPSlBheDBNdGVsWHBwQTdoNk1HSTFuMDhJUFF6aExuWHc1N1ZPb0JmYjItVkZuYi1UUGJPQURqOXc2dENGUDVpNzZneWYyTDV1anNjbzB4Ymp2c28tNUtjd0FnNDlmaWxUMjNpUTdBOXRkc2U3WGhQOGRhQTZRNm5YcjlkeUtvN1dBVm9Cdml5YWx0NC1Jc1YxNGVlZExOMm9LUDBuWExjR01SOWNWS1c1TnpwN3lXbUhjcmNibmNVdFZFa0Q3dw?oc=5&hl=en-IN&gl=IN&ceid=IN:en,"Tue, 25 Nov 2025 08:00:00 GMT",Business Standard,ICICI Bank,ICICI Bank,Private Banks,"ICICI Bank stock at crossroads, may test multi-year supports: Tech charts - Business Standard ICICI Bank stock at crossroads, may test multi-year supports: Tech charts  Business Standard",0.6124,0.167,0.833,0.0,positive,GNews,2025-12-09 13:44:53
"Stock markets advance for fourth day on buying in HDFC Bank, ICICI Bank - The Hindu","Stock markets advance for fourth day on buying in HDFC Bank, ICICI Bank  The Hindu",https://news.google.com/rss/articles/CBMizAFBVV95cUxNNDA1N2dWWnhpOXpyQlNjbTFDbml3VjdfZTJTb3FfaEo2U0dFRDNlNy1JdHRuOHVianlqTzdqbHd1czRYMGhycGFfSGdOc083WUhUQXFkRWpHam9zY3ZtSW5UNGtzVTNSMTNTQnNfMk1fcVlpeDNHSlg5Qmk2MFFZZEpwMWVIeml0dDlQX3FDTmlHd21Udi15YkpHVElqdm4ya2ZLVHZtcU9Fdm1EYWZjSGlHdGFiU19oaktSbzZrR1dORGktMHRmRHZVRmfSAdMBQVVfeXFMTVZVWF9RZjJRNFNnamt2VE10cDlCODdmMUVLb0o5YXl4RVVDeU5BSXB2MzlWMWZ1YklCVjlTbFVDeWgxQmpVWi0tUlFsejBMYXl6czhscDVwbDhDaXNoeWJGdE5MVkhtWTJqdjBZVHROazJzUnAtYk5DLXVOemZJSW44bE5lN0h0NVdPTlRYZk01V1VpcUlZR1pTTEJHNmJzNmZIRmd6dnhJX0F4b1g4NlV1OW01MFYzMVNIYWo5dHd1RnBxRFdta0thdDBfdlFyQ1gwOA?oc=5&hl=en-IN&gl=IN&ceid=IN:en,"Tue, 07 Oct 2025 07:00:00 GMT",The Hindu,ICICI Bank,ICICI Bank,Private Banks,"Stock markets advance for fourth day on buying in HDFC Bank, ICICI Bank - The Hindu Stock markets advance for fourth day on buying in HDFC Bank, ICICI Bank  The Hindu",0.0,0.0,1.0,0.0,neutral,GNews,2025-12-09 13:44:53
Will ICICI Bank’s chief stay another term? The market wants to know | Today News - livemint.com,Will ICICI Bank’s chief stay another term? The market wants to know | Today News  livemint.com,https://news.google.com/rss/articles/CBMi8AFBVV95cUxORTJBbk9vcVgyS1Utb2hqdjVCSDB0bXFTZWkyNThTMVFsV2RFV2hEcnFRUWxQRER5Z0tXbXg4aE1NemhpNzNHOUE4ajFWV2paZlZtUkdkdGRyeEFoRHBBQmpEbjBLM2RTWFBHUXZzME5kb25kckpIM0hMVnNvbVI5aXF2MFVmQjRuZ2JrUWxxNlFsOFRSQ2RCSzEtYjFIUjRNMFgtWk1YaFk5aExfSXpWa2NOUnhIV015Vm1XZWVGdUZvbV9leDNKTDhtY1cxT09TSE1MYjlia0xVSDlRelFhV1g3MnZDTUp5U0JtLWVrbjDSAfYBQVVfeXFMUGZqSUU2NnBHcUVEd2lWbUFibFRSVVQ2ZkVIN1NmaFJXVHAzY1VfSzJDbEpsRVItMXg5LTBaSmxlM2h2cE9NOV9YcEZwSWFXSHBBX2NjVjlEeC00dW9WV3lueFdtNWpBM2lzWVpoVkU5bzdHVnk1aE1ja3VWQXNVYUloOXNGcDRkcS1Kc0d0VnE3czN2MHFHb2JmTlBSeWp6TWV2QUlYM1daX3lsM1J1RHdubVltQ05xSklpSmJjeXlBM1VBSTVqQVFOYUlJeWQ2TUpQbEdzdEx4ME5sZkEwZnV1Z0d2azdzWEtzcHJUMVpJaVhLOFJB?oc=5&hl=en-IN&gl=IN&ceid=IN:en,"Mon, 27 Oct 2025 07:00:00 GMT",livemint.com,ICICIBANK,ICICI Bank,Private Banks,Will ICICI Bank’s chief stay another term? The market wants to know | Today News - livemint.com Will ICICI Bank’s chief stay another term? The market wants to know | Today News  livemint.com,0.0,0.0,1.0,0.0,neutral,GNews,2025-12-09 13:44:53
ICICI Bank stock: Declining right now and may be a bit undervalued - HDFC Sky,ICICI Bank stock: Declining right now and may be a bit undervalued  HDFC Sky,https://news.google.com/rss/articles/CBMilAFBVV95cUxOTkVVVmhOeGsyY2NmSFVXa250ZVhTTTlubGZsb2ZGbzZnWGxua2RSMUhHbnprNlVjSzdiLVZVUGFqaGJYVmpwY1VkaF9KUGRRZTV1Y1VVcE9vdTZvNFEyeHdOUERPQzY5cWFTY2tVWUFIVUl4QVlUOWFhSEcxZnBPQTZwSEtxT2U3TXk5aHk4aF9rdDNI?oc=5&hl=en-IN&gl=IN&ceid=IN:en,"Thu, 23 Oct 2025 07:00:00 GMT",HDFC Sky,ICICIBANK,ICICI Bank,Private Banks,ICICI Bank stock: Declining right now and may be a bit undervalued - HDFC Sky ICICI Bank stock: Declining right now and may be a bit undervalued  HDFC Sky,0.0,0.0,1.0,0.0,neutral,GNews,2025-12-09 13:44:53
"ICICI Bank Q2 Results: Date, Time, Earnings Call Schedule And Share Price History - NDTV Profit","ICICI Bank Q2 Results: Date, Time, Earnings Call Schedule And Share Price History  NDTV Profit",https://news.google.com/rss/articles/CBMiwgFBVV95cUxQZWpsNmEteGpzWExSWkdVMnRGN3ZNRTc2cFJZVm1JWDAyeG5Pai1lczd3MEpzN3VHOXlxb0Z5UUNvRkkxMzVhTmRhRkVTS2FQb1JvLUJJTE01UjBDM3FfRVhERnFVNk11bzBVek00akhQcFlERjZ3U2dYMGU5NUhiNjhNMXVRN1dwZ3FlZXNpSVV1UGFpUUlRWFdDWFQySXAyOUtBajlrbDlFU1pOQl9udkloLWI2OF9FcloxYmRjU0s0Z9IBxwFBVV95cUxQZUlfWkRQRGRpYVVQMEtwUmQ2QUFuclg3ckJtYVAwM1JfNUZ3S2RFMWQ1MFFCY3otZS1qWTAwWEFrbEhPTlF0VE9meXlBTnM0V1c2TDZMV0hmTmU5VkJ3dnFWQ09JdndhQXhFS2kxUkJLT2tGaTRMZkktQmtfWXJzdC1LQkhFUzlDSzRhSVU4Vk5NNEdac01kQ0N5UVlHVzFIRGRTMGc4VHRUWkd3Wmd1aGI4Q0ZacVFNaHUxQTJsN1E1OXExWGk0?oc=5&hl=en-IN&gl=IN&ceid=IN:en,"Thu, 16 Oct 2025 07:00:00 GMT",NDTV Profit,ICICIBANK,ICICI Bank,Private Banks,"ICICI Bank Q2 Results: Date, Time, Earnings Call Schedule And Share Price History - NDTV Profit ICICI Bank Q2 Results: Date, Time, Earnings Call Schedule And Share Price History  NDTV Profit",0.8481,0.274,0.726,0.0,positive,GNews,2025-12-09 13:44:53
