ticker,date,title,description,url,source
BANKBARODA,"Fri, 09 Jan 2026 08:00:00 GMT","Bank of Baroda Wins Big at IBA Banking Technology Awards 2025, Bags Five Major Honours - PSU Connect","Bank of Baroda Wins Big at IBA Banking Technology Awards 2025, Bags Five Major Honours  PSU Connect",https://news.google.com/rss/articles/CBMivgFBVV95cUxPSDlzSzhWUG1wMXh1U3JDaVlxb2RfelREWmdiTlUtVElFYU5JUS1YZHdmVE4tTkJGckZ4T2xSNlF3Ym1wTU1CYm8tRjFEOG1aZnEwcnMtYldjRmdYOVdFNmFuNm9NUlZKWnVuNVM4bzN0MzZXVndaUUxlV3Vjd0hZNUNvQ0xBZXlXOUFNU3E0LVNOblU1VVk3akZLNFRkdXB4LVcxS2lPaWZGVXdJRnp4Snl6aTcyeWpBa2VQTjdn?oc=5&hl=en-US&gl=US&ceid=US:en,PSU Connect
BANKBARODA,"Mon, 05 Jan 2026 08:00:00 GMT",Bank of Baroda logs 15% loan growth in Q3 - The Economic Times,Bank of Baroda logs 15% loan growth in Q3  The Economic Times,https://news.google.com/rss/articles/CBMixgFBVV95cUxNUW9IdWRxR3JNeEFHdG9Bb2NWdHF4c0NxNjNYTFpjeGc2anBDQXh3dU11YU9VaVVhd3RtVlBHZmFkek5kY2U5YjhlVWllZlNqOU5OVjUtc0F1aVR6eUVYRFJSNmgwUnBRUm1rRzVaaERVZ1VGZVo3Y1JvZlhtVTJJWVYtRUhIbWFzdW14b3hjbXpfVU4yTWxFVTNoUEp3b2RucmNlRmthTk9xVXU3XzBPb0tvS2p0MEY0R2N2dHN4MXRGeC14S0HSAcsBQVVfeXFMTmJ3ZERDeEhuV2tlVFdpampCQ1NHSnFyY3kwa0lPS2hsOGxHbndtaGRMdl9aZ3VmdTl2d0tmU0U4SEZfYm82MEkwOWVZTEVvN0pNRGVLU1p3aVRRc0stTEpSLXE1OF9UUEdaTUppM1dQd2REcGRtQWRxWWVuU0J0ajByZmNHYkFZN1FOV2hWMzZMVzd3Q2N5elVBRUdKLXk5eTBjTF9wc2o2RzR0M2lTQUtuSmRfaXlHbHhKdXh4X2ZsQUxGR0FOX2RoOGM?oc=5&hl=en-US&gl=US&ceid=US:en,The Economic Times
BANKBARODA,"Sat, 03 Jan 2026 08:00:00 GMT",Bank of Baroda manager booked for ₹71.4 lakh fraud - The Hindu,Bank of Baroda manager booked for ₹71.4 lakh fraud  The Hindu,https://news.google.com/rss/articles/CBMitgFBVV95cUxPcnhNVUV1aW9WMEtIa3NGQ0ZWbXNDanEwaGt3WldQMmQ4RjBWdmFVOTN5QTVEX3duYmZGbkhXdnQwamVSakZhLW1NOFFIeFJUZE5URHZLMGdRWFZkdzc2WW1USFY2a3l0S2tzajBoa18yNWk1Uk5xek9CRFVNNFNRLU9XV1JwdHBSc0VBenNCdmx5MnhCR3o1S200QVR1RGozejhBQmRLNnY3c1FfWGhMOWlFTU1jUdIBvAFBVV95cUxQLXBaS3V6OW5uaUN1eGwxelFsbVFKSnFsYzdjRk9OR0hOeGtlaEdjSExCdHdZMHlfbGh0RXBCSS1nVG1RWGlWLTl5NjRoV0FCOVJ2RlhoOXZQLXBPRW1yRGpzZ2lKcFVEZ0ZaM3ZhYXY2UXJLMzdqaDd3N0pFYnBSektCcW0yeFB1eXBBRncwazU1clliem5HeTBEYmJ0eGMtY0N3Tkd3NHVxeWctQ3JxSTJjSEVLRm1SN2dxTQ?oc=5&hl=en-US&gl=US&ceid=US:en,The Hindu
BANKBARODA,"Mon, 29 Dec 2025 08:00:00 GMT",Bank of Baroda opens hybrid digital-physical branch in Bengaluru - IBS Intelligence,Bank of Baroda opens hybrid digital-physical branch in Bengaluru  IBS Intelligence,https://news.google.com/rss/articles/CBMipgFBVV95cUxQU1ptd00tcGZzeGdKRFdVdFVyN1piQ3Y4alJVcnE3N0lxRmdSQlRZb3M1Qk13cEg3ZlhGR0dlOVZqb0o2SGx0TGk3OVNDZHEzcWUwVWVKeGFiRTBTZm05YkFpSGtCVFhaU2VzTm5udnNtTU1VSkJ3dzhJem1XR20tZXgtLW9aOFAzZ2NUUnc5YmpHWTI3XzFfZ0M5aV9raXhkb0s0Mk1B?oc=5&hl=en-US&gl=US&ceid=US:en,IBS Intelligence
BANKBARODA,"Wed, 07 Jan 2026 08:00:00 GMT","Bank of Baroda eyes prepaid card base of 1 million in 5 years, seeks external assistance | Mint - Mint","Bank of Baroda eyes prepaid card base of 1 million in 5 years, seeks external assistance | Mint  Mint",https://news.google.com/rss/articles/CBMizAFBVV95cUxQZjktdVFhenVDNGF5TmxtaTBPaXdmMXV4bGV1Q3dadUhTSTNGaV9VeXpLdU1wc1dOZFdXX0tsZkVMWHRNdFV0dEpkVEllZW0xM2V5Qkc1c2ktd2lkdzgwa2RZZm1IWjdmY1N4UXFrOVpLV29JU2ZwamI1VWZHeUFmNTl3S21ieDlOellnSXZxSHpkcUVrZ0E5Z2pMQVVSYVN0ZWtyaUpsVVllX19mOGpfakpodnc3X3ZCcGhwV1RjZldmN2tpek5VSk9obTXSAdIBQVVfeXFMTzZMTzBBalRYejBKSU9fbGl0MHA2RktRdmJGamhacXIwYzdDeTVCa3VQbDRqdTJwUHdONHdBVll6Y3JwT21RSmZMRXJOb1djcThuc2pHQVZkVV80Zzg1bHprUzZYY2tMd01LWWZkTHF4ZUxPcndVbW9KTzhBVXNsdFZnaFBjcmlyTUNrWi0wUXRfOW90TUh2M1pHWnlLNmpkZTA1am43Z2JnalFLeFNjRWlHREhrUnN5clFVT2xnYndDUVE0bUJRUXU2Rlh0OGNxYXVB?oc=5&hl=en-US&gl=US&ceid=US:en,Mint
BANKBARODA,"Sun, 04 Jan 2026 08:00:00 GMT",Bank of Baroda shares touch 52-week high: Here’s what investors should know about Q3 business update - Upstox,Bank of Baroda shares touch 52-week high: Here’s what investors should know about Q3 business update  Upstox,https://news.google.com/rss/articles/CBMi5wFBVV95cUxQMThka1habUlTNU9KVDljRFVsOFlrd2ZOdFF3eUVwRGhJTlM4MFRjLUI3cWs1MHJNUXF2V1Biek8tM0g4ZkctTGo2RlhlUWpOcnZmRHNiYWNETGNXcWZyX3B2eXV6cEhNUzFQdUZKcUstLTlSS0RobTc4NzQ4VEI4ZlJUMTlrUHV4SjJTRmNjR0VOV3BVY1ZfWUdyLWRNUHJlcHdFc0RoMGtOSHFfTS01d3Uyc2lYaHlaRlRPdURSZTVUT2dOczc4aVVrN3ZtbTRLOERoQnRRd2FRV2dhSlltQURWbmdhUFk?oc=5&hl=en-US&gl=US&ceid=US:en,Upstox
BANKBARODA,"Thu, 22 Jan 2026 17:24:47 GMT",Bank of Baroda signs MoU with IIFCL to boost infrastructure financing - Banking Frontiers,Bank of Baroda signs MoU with IIFCL to boost infrastructure financing  Banking Frontiers,https://news.google.com/rss/articles/CBMioAFBVV95cUxQRVZfT05XeWNYMTNoUEFuYXdSSTNTRE9qOGUyMktrbTl5TjBRc1h6OFE1VURyVkl5ZkJtMnV4amY3U09yOTBuMmZ2aG5kcTFmM0htRWZwcmNSRG56TzJPcEFBek14VXVFSGc3WkNScEl4WFdqZEdlbXUwS3R2TWhFckY4TG9zNGEwV1lpLVFJa2tTZ2RPdVQzTlVKaVRYT01W0gGoAUFVX3lxTE1ENDB6NzFxVWF5VnJVVWJ6UGZCcXZHcWNZMXpteWxHY1VjNThwX2FYNkVRWWg2QlBOYkMtaDg3OGhpai1aNHJiOWNLWmtwSklNaUxZaFBpQzloZlRncnN1RzJDZjFUZDk3ZHlvaXRhQXpqd0RmTThxdGxtMXZUUUZLRWRsa2RpSEJSdG8yQ204THZKeEFFaldJVkluT3BzR19rUmRWVWNqRA?oc=5&hl=en-US&gl=US&ceid=US:en,Banking Frontiers
BANKBARODA,"Fri, 09 Jan 2026 08:00:00 GMT",Bank of Baroda maintains overnight MCLR at 7.80% from January 12 - CNBC TV18,Bank of Baroda maintains overnight MCLR at 7.80% from January 12  CNBC TV18,https://news.google.com/rss/articles/CBMitwFBVV95cUxQRDZoLWhkbUwyNkppQjM1cW9zVUIzeU52ZURtN2NwZ2ZWaDlWWjg2amhoLU5tb3lfQmgzMnltR05aM25xT1hQZmdlWXYzU1JjQnBnSndKMHpNLXVwb2YxSjlQai02WFZCZUZtSFoxZ19HTTdDTWpJWHMxbUJ6MWJQdlY5Rl8zd0Q4eFZoSFFQZ1JqbkhwWFJEMGFIS1VwNEpkcFV1NnVHYWFTTm5PakZaU2xTb1hRMjDSAbwBQVVfeXFMUEtqZFlhMXRDaFNUbDI1a1JVUU9Qb0JSN3hRNVJUYWtOekpWRzFPUW5VZFdJRElYX0tXdHM5LUk2RVo3TG0wOVRQTDRmZnh0NGxuQlB3YWN5SnJXbnVJcWNMdzZFajdkOGVGMzNVdnNNZWEwNWpKa0pEZWlmX1BhRG5leTY3ZnhxUEZxN055dTZnQ25iYkpyS2JFanFPbVVMOVpQRktOUzdQa3J4NkFURWNWNS1XbGRxQ3k0djQ?oc=5&hl=en-US&gl=US&ceid=US:en,CNBC TV18
BANKBARODA,"Fri, 02 Jan 2026 08:00:00 GMT",Bank of Baroda Assistant Manager booked for Rs 71.41 lakh ATM fraud in Karnataka's Bantwal - deccanherald.com,Bank of Baroda Assistant Manager booked for Rs 71.41 lakh ATM fraud in Karnataka's Bantwal  deccanherald.com,https://news.google.com/rss/articles/CBMi2AFBVV95cUxORE9NendlZXJXNDZSa2JGdllwZmp4ZWxSNWJYY01lMXE1c2VzNXIyR2pwdlRHVnpScjVVakdsV1FwZkUzcWxPaEI0SmtxRmRnMmo4YTVTWmJXRkI1cmI2Smx6UzFJSG5qX1NxU1Q1bXpzUG8xSUpuUkJxa2hydTcxSmd3MktFQTBqcElDS2dWRjd2dWt6Z2lHR0RtbWZMYmtiaEQ5VXJLUl9SRVpHZW1tMzAtUjBFa0g5YmJIajdhLVBnR3VZVnpLQ0VoWHFFMXMwUmJQVlFtRnY?oc=5&hl=en-US&gl=US&ceid=US:en,deccanherald.com
BANKBARODA,"Fri, 09 Jan 2026 08:00:00 GMT",Bank of Baroda to set up wholly-owned subsidiary to undertake standalone primary dealership business - BusinessLine,Bank of Baroda to set up wholly-owned subsidiary to undertake standalone primary dealership business  BusinessLine,https://news.google.com/rss/articles/CBMihgJBVV95cUxQTzc1R1FkSy01bXZQQXphV0J1OXhvN3VGQ0dXUUNZNVJVYzkxeno4dWQ4ZVY1R0QwVVljQlVEMElNNE5xeHp6UTdTd0ZZNlJ2YWdIaGZmX0ZJTTZtSm9hY1RJdV80UkpUV1pMR0ZOZTN3dXl6VTlkMXpydzZWRlowRzA1ZW5EMXQza0xFaHktaHNNbEV4eGZseXpGR3JwdXFpTXpxUHhjdGU4S2FYeUV2QzUxNmVuLW9ncDZQTE95dEhjTmQ5VG5BMzNFc19qRXB0TmxkOUttLUhMelMzM0JWOEhhXzd3bTJqVi1ISjk1V2t4TnNtdjN6U2VZU3ZObnlOdmFZMktR0gGMAkFVX3lxTE1uZklOVGRpNVU4Zm9iRWg5WHc1dk5pM2ZfZFUxUEFLRHJ0cy1FTzVDbUwxVmYxWUlhSTc3d0N0RjBoaGJqcE4xR0tpYm9MRnk2UHpxUWoyRDc3dzlnRVgtTVJYR2JqcGNSVWRvVlBWdVhSTVVmWGZwMzdVX2xTbm5GUmZocng2OXhHZUlqWUJTZThRRmJUdTZ3SWRfWm43VmYwTmdORDdPZTk4eG96MEN1Q0kxV3RPLS1lSTVtMTJsSEdORVdpWXBoSE5DX082cnZYOXVPLTFNdDdwRUM3RUEtT1VlaG1rTjRDb2QxNHZGdXdGTW9yTmpPZGVWQmR5WkRUQ3VkMWktVHpHT2U?oc=5&hl=en-US&gl=US&ceid=US:en,BusinessLine
BANKBARODA,"Mon, 05 Jan 2026 08:00:00 GMT","Bank Of Baroda Stock Hits All-Time High at Rs.311.9, Marking a Significant Milestone - Markets Mojo","Bank Of Baroda Stock Hits All-Time High at Rs.311.9, Marking a Significant Milestone  Markets Mojo",https://news.google.com/rss/articles/CBMi1gFBVV95cUxQUmp2N3JJUWZIUDZGU1BobVhia2tpdTl0MDJGd09MVHI1bW03UzFvd1JESjBCWkNyM3hZejlCY212emhZVFVPSTZNR0FxZkV4WEsxaF9UUDBoMEhxdjRrWTJMUkhLenVwRTJKbEtnOC0xcThEcnFQYUEyZnB0MEtQU3c2OG1aU3IzZXZIOExjTHQ0cDJfRWxvVnlaVkJ5YVFhbGdjbElvclJWclhnYXl3eXk4WldpX0MyWmlDTkFMWHgwRnIyckstZWpSWmxuNGRPcnFFZFpR?oc=5&hl=en-US&gl=US&ceid=US:en,Markets Mojo
BANKBARODA,"Mon, 12 Jan 2026 08:00:00 GMT",Bank of Baroda Strengthens Partnership with Mizoram Govt to Boost Development and Financial Inclusion - Indian Masterminds,Bank of Baroda Strengthens Partnership with Mizoram Govt to Boost Development and Financial Inclusion  Indian Masterminds,https://news.google.com/rss/articles/CBMirAFBVV95cUxOemJLVnZJQ3NMLUJuQkQtTmZPYmtMZ1dzNTZveU95UldIdHZLUDZSSkZMV1VvRGxLek1SVVBmLVBwUUYxVU1PQ0VEMWtpR09IRW52RUQ2SV9KMzV1NzV6dkc4SFp3X2taRDJOZGhvUWtLMTVreWNvS3dUTlJVcHhGYm1hTnZYNjVfV0l6NmN0UFJXUGlNU1lnWDFGYXcwbUptbmJYdlNHNHE3SmR2?oc=5&hl=en-US&gl=US&ceid=US:en,Indian Masterminds
BANKBARODA,"Fri, 02 Jan 2026 08:00:00 GMT",Rs 9cr loan scam is detected in BoB’s Rae Bareli branch - Times of India,Rs 9cr loan scam is detected in BoB’s Rae Bareli branch  Times of India,https://news.google.com/rss/articles/CBMiyAFBVV95cUxONFRQaVZDQU8wbUZVeTM2MzNkU1FXcGZfTTdTM2tIakFTVmVOR0xqT3hrbEpjcnJnb056eDJldlNXWUd6ZUpkX2NyYmtDV0dCTUFxSVc1bnpiRzJRZk9GSzY4SE1ldTZha084RFE3YzdZMTY0TW1KNEEtYndna3BVdVY2bnROdGFvc3pwTUVJdjFtTXBTemt5R0FRTnpxSWQ0clJlVjB2clVOMXBuRVdXSmYwZ1ExMFVWT2tYeFpmV09xSjZ2SWZCatIBzgFBVV95cUxQX3dLQ2xZX0lDNXo0cUtTdU00RHU4ZzlLQTBMQlkybVc2TkdxZXN0eUtMMkc4cTFOaFdxekoyV1BoTTBBbGViendBRXRHN3JXa09HVERMLWpVVmswX3Z3NlNzNnkzVVByUFdVNU1lNGJCX3c3Y0ZKcDZuRlhHSG1qY1duYW4tNFRjY2dhZUhIZnRvX2pzMW1scjEtdk1vWmJPWWxZbTFMcXk3WGRpVE1EQlc1M19PVGttdXdUdVlHQ2lDblBramx4ekVsTlh0QQ?oc=5&hl=en-US&gl=US&ceid=US:en,Times of India
BANKBARODA,"Wed, 21 Jan 2026 10:33:46 GMT",Bank of Baroda & IIFCL To Boost Infra Financing - fintechbiznews.com,Bank of Baroda & IIFCL To Boost Infra Financing  fintechbiznews.com,https://news.google.com/rss/articles/CBMilAFBVV95cUxNa3NuMEI5QjBmMXJ4NzdpUlFkMmd1YzVzN3M2SzkxRk90emZYbXNDNUk4OEhxSVBZYW9kMnJITVA5X0tDZmRYWllwcjBtaEJkLW0ybGxBMXNndGg4MHBXMkdOTmtvakI4Vm1hY0xSOVZWWnd6YlFoeTBTZElCdTNIa2o2WFEtTG1IcURldjFjam5LQVRH?oc=5&hl=en-US&gl=US&ceid=US:en,fintechbiznews.com
BANKBARODA,"Sun, 04 Jan 2026 08:00:00 GMT",Bank of Baroda Delivers Healthy Q3 FY26 Performance - PSU Connect,Bank of Baroda Delivers Healthy Q3 FY26 Performance  PSU Connect,https://news.google.com/rss/articles/CBMikAFBVV95cUxORElvQzdiWm1UbW5UV1o5eU9QYURnM3FQa2ltN2MyWHFhamRYMDM0VEdyRWZ5X3ZXMHFiUHVoOGlrMy1mb1dYVTl6UkRSRFMtcTMtcmJmcnJwRF9JV3pBMEZ0cWdLcFZrLWMtbncxekFUTXdzM3FzelZ2UUc5SDJkQkg2TUl4Q2tUaUlWdXdsSlU?oc=5&hl=en-US&gl=US&ceid=US:en,PSU Connect
BANKBARODA,"Mon, 19 Jan 2026 08:54:53 GMT",PSU stock Bank of Baroda sets board meeting date to declare Q3 results 2026. Details here - Mint,PSU stock Bank of Baroda sets board meeting date to declare Q3 results 2026. Details here  Mint,https://news.google.com/rss/articles/CBMi1wFBVV95cUxQdWFBaFo4M24wejhqMTFFMzFac3RtRlZNdFozWFcwclVfdFl2Q2hzNDZTYTZzcGxTVmFYempoRUxRWUFwNklFYkVKZ3A2dXRIdll2VWFLMkRJTV9DUmRiZmNsVGZ6OC1hWUEtS2NZMTltd0JWZWUzZkdRVVZDMWJodGlNV05VMncwOWRwYjFrVzA3WHR0eXZPb2hDR2Jhdklra2hCd0J2dGJNcHdBeTQ3Z3EwMktkTXpLY3puQkdIbkFDQVlhRk5aZWNXLW9Hbm1HbzU0TjFOY9IB3AFBVV95cUxOUTY2WmFHS3NTclFQUUZJVHlKa3FWc0UzY0pncVlTSDk1NFdtT2hlMjlwMjRLcTZscEt2OUVBYUdZQnNaWVV1eXcyQ1Z0UllaYlEzMjZCR3dKZ3hHdDRUSkZuMEtVSUhRU2ZVTTVRNG5LVGx1S3JHUUhwblk3cGNoc1F4OFVGYnlBaDhLVWhhd21HYXowYWh2RnJsUDhQQjNhTE5SeXpGa3JaREVBLWZ6cVdYNHRUNjFBZ3k2YTJkT0RPR2VMSkktcEJTTFktb091OGl6WFZNVFJadWdJ?oc=5&hl=en-US&gl=US&ceid=US:en,Mint
BANKBARODA,"Wed, 07 Jan 2026 08:00:00 GMT",Bank of Baroda new Regional Office inaugurated in Madurai - The Hindu,Bank of Baroda new Regional Office inaugurated in Madurai  The Hindu,https://news.google.com/rss/articles/CBMivwFBVV95cUxQbkU4YjBHblpISzVrN3BibjNodDFhS1lXcFAxbkpzMEhNbURTZmw3MHprVVkxOWpDT0tHS29seE9xcGxQWktDTjJqZU8zXzRZR0xpR0JkVFBnOWVnTWpXSmFPWXNPQWdQUFVNenEzQzZ4OVNGYkJBTXpJUm9PcUFJS1ppcFFkV3RadEc2SU1haTMtZU84dFhhWWZHTDdKelJLaktOcmtQbXVHWUdpSjFuWlg3cm9QMkVmcEZkX0JjTdIBxgFBVV95cUxQZVl6cHVpOC1IVmRZcmc1WU1FSHVZcXlNTmhCcWE2MXFrbDJkelVacmV3T2ItOGNQVEtWWnJEa2RYbkVSRjJ1QjZha1hGbmNDS0lKNzlpUmQwbURzQktGc09ENVY2NkFTNXNVWG5KMUJUTzd4Vk1fRFFJcHVxdkFhcDBmNlI2X3ppRk93ZFhOUnRpT3poeWNpX1VjY0pXSThPQ0czNWI3eGdMUGtOX2lqSHFWYm1nSTctSHNTMEVOLS1UcDcybGc?oc=5&hl=en-US&gl=US&ceid=US:en,The Hindu
BANKBARODA,"Fri, 09 Jan 2026 08:00:00 GMT",Bank of Baroda receives RBI approval to switch from Bank Primary Dealer to set up subsidiary - PSU Connect,Bank of Baroda receives RBI approval to switch from Bank Primary Dealer to set up subsidiary  PSU Connect,https://news.google.com/rss/articles/CBMirAFBVV95cUxPcmJ4OXdrN3hJT0dGNkp2RWhSZzNlVTBHTjh5R2o3WFlSZF9YenpNamM5d2ROeGxkaHRTV2FhVkJudkJHNWZOM1dtN2R6ZmVTLTZoNU9fdEY0N1NKcWxWcGxpMHBha1pudk53WWxZSUxSbWkwUHhyaEpsSzNiS1Jjb0hCX3FhS0F0WVQ4MWgwWlpwRDl3YVZCVFFpdF9uVXZ3b3l0MVNtREREaE42?oc=5&hl=en-US&gl=US&ceid=US:en,PSU Connect
BANKBARODA,"Mon, 12 Jan 2026 08:00:00 GMT",Bank of Baroda Strengthens Development Partnership with Mizoram Government - PSU Connect,Bank of Baroda Strengthens Development Partnership with Mizoram Government  PSU Connect,https://news.google.com/rss/articles/CBMirwFBVV95cUxPU2ZYUGFNNmlQQUp5SThLYVlyOTNoN1N1cUxjUkplSUJVRndKeG1KV1NQbzl4TENGcExZR18taW5CNzF1TnJuVDgyLVFjOEZPd1VXeXFUNlFzbUZ1OUhmc2I4R3l2Ul9hc19PY3V3Y1p6QXljVVF1YzVZUkZaOS1BRHZ1SUFNbm1iYU5VNWxsdmJTM0tfVk9Sem9neDlZcHo4SHVOTjVRZ3lxZGFpNDRN?oc=5&hl=en-US&gl=US&ceid=US:en,PSU Connect
BANKBARODA,"Mon, 19 Jan 2026 07:22:00 GMT",Bank of Baroda to go for long-term financing for Infrastructure and Affordable Housing - PSU Connect,Bank of Baroda to go for long-term financing for Infrastructure and Affordable Housing  PSU Connect,https://news.google.com/rss/articles/CBMivwFBVV95cUxOUWl3NWhUU3JtS2lpWVVkWXNNaGs1S3BDTU9UanM1YUhQRGxfeDQ4dlVzUnBVeXI2aXVnWXJCaC04ZkE3dTQ5TFBrT3VIanJ2cGs1SUJoQTNEUnhaN1ZXUFRHNkwwNUd1a3Jpdmc3LXI2T1ZKYU44Z3AwbnFqTzBUOUZ6blg2aGhUNnR2a1hySUNFMXZnVm1SWnZWR2F0M1RGV0lsY09UVGEtcFl6RTNadXIxSXU2QU43aEw3Q2tpVQ?oc=5&hl=en-US&gl=US&ceid=US:en,PSU Connect
BANKBARODA,"Wed, 14 Jan 2026 09:39:25 GMT",Bank Of Baroda Wins Four Awards At IBA Banking Technology Awards - SMEStreet,Bank Of Baroda Wins Four Awards At IBA Banking Technology Awards  SMEStreet,https://news.google.com/rss/articles/CBMipAFBVV95cUxOckxCNVdvNFZPM0p2U3VRUEg3UG1LTEpGOVk0WlE0b3YtMnJTZ1V1Q19saXoyZnpkRnRvVWZ6QnhfajFYU2QtWEFzOFBxeDkyYmF0Z1dGS2ZDbnNEdXB3cGpHcTRXbDB4U0MtUnRIUndvcEx6RmI5bkF0MGZPZXJUY0lWSndGUUd3V2ZaZnFIZFdkQmZ5RzRjTzJYNkNuclJXTm1OMA?oc=5&hl=en-US&gl=US&ceid=US:en,SMEStreet
BANKBARODA,"Tue, 06 Jan 2026 08:00:00 GMT",Bank of Baroda non-responsive! - highlandpost.com,Bank of Baroda non-responsive!  highlandpost.com,https://news.google.com/rss/articles/CBMiZkFVX3lxTE1wbEItbFd5YUs4Nmh4RzljNmpTQktNdUVNSlpsVnQ3UUtZR1FnaWNlbFpGSXZLZXB2RUhWeF8wSWRPdnFxZTFSWEl1dzQ3WVRpb0FMeFNOUWctZjhLSzE1VnViQ1dpQQ?oc=5&hl=en-US&gl=US&ceid=US:en,highlandpost.com
BANKBARODA,"Tue, 13 Jan 2026 08:00:00 GMT","Ms. Beena Vaheed, Executive Director meets Hon’ble Chief Minister of Mizoram - PSU Connect","Ms. Beena Vaheed, Executive Director meets Hon’ble Chief Minister of Mizoram  PSU Connect",https://news.google.com/rss/articles/CBMirgFBVV95cUxQTUxPR1dkT2hJT1ZBMjI0RkdjWjBlYzdKOHhYOVVFRF9mcDJtSDEyT2VYTlpyNkViU25NTUpMaldWUUdBYkZUY2tiY0VRaWFURFhDbDVVYjFfcGh6V3pwWXBIeGphM1Q5RFdBX3VwUFhwMWNoWC1XM0dpbERJbGNUS2p2dkIzYVdJdVJ2aTEwRzVqV1BUV2tLamp5d25DUEJYLUU5SjJvUm40ODVPdUE?oc=5&hl=en-US&gl=US&ceid=US:en,PSU Connect
BANKBARODA,"Tue, 20 Jan 2026 11:39:00 GMT",Bank of Baroda Launches Baroda Academy in Ludhiana to Boost Employee Training - PSU Connect,Bank of Baroda Launches Baroda Academy in Ludhiana to Boost Employee Training  PSU Connect,https://news.google.com/rss/articles/CBMiswFBVV95cUxQcHFUZmpkT3hDT0JqRlNBcG5LWWMxcUYyWFd6WXQ1LXJaQkxiUzBiNzNwRGYxYU5HV2xKZl9pOHhDa21qb3hFUlgxc2tKZUN4cUtiZWZzQWwxX0Y3VU1NYjBQaTRpMjItYy1RdEswZUhQeUVnNDZlOC0tVy0xN29iU09TRmRuRUpJaWlGT1BUTmZhbU5sVFdOZFpXSzlvNHg4anh1emFqUFlSZEw0cDNGVnA2OA?oc=5&hl=en-US&gl=US&ceid=US:en,PSU Connect
BANKBARODA,"Sat, 03 Jan 2026 08:00:00 GMT",₹71.41 lakh ATM fraud: Bank of Baroda assistant manager booked in Karnataka’s Bantwal - Vartha Bharati,₹71.41 lakh ATM fraud: Bank of Baroda assistant manager booked in Karnataka’s Bantwal  Vartha Bharati,https://news.google.com/rss/articles/CBMiwAFBVV95cUxNRVlPdzZ6aFQ5S05VRzNxa1FNWi1LWGlWTG5pbzBTRjdiTHNVMmQyaW1CSVZZazg3SVYwamtSdUxlOUhad096bkFRMTFKMGpzQW5Tc0llWTh2R2FXT1AycFQ1VTZOaUh4WDJQdzhNbFBpMFU0TThLV3hTN3JyTWdGTERpR096Ni12YjVMX01yOXlmaEhtVDJiTllLTnJXNW9RQjcwZXBQbk5VSmJYa01VNjZrNUpfM2llUHVYYWJuNHQ?oc=5&hl=en-US&gl=US&ceid=US:en,Vartha Bharati
BANKBARODA,"Sun, 04 Jan 2026 08:00:00 GMT",Bank of Baroda Q3 loan book growth higher than management guidance; Stock in focus - CNBC TV18,Bank of Baroda Q3 loan book growth higher than management guidance; Stock in focus  CNBC TV18,https://news.google.com/rss/articles/CBMiywFBVV95cUxQTEQzUWRxMzVuU3pnaTlkdHh5UFh6a3kybk5CM3dsNTVrNWFtb1BkSzYtOXEtdUN4R0pTOVJGRmlaMVp0UzVPYzVGRlcybDJrZTNSSGtoZWhWZV8zVktkY1k4ck5SMWVfQWlWVWNmdERZZ1JnS1BjTW1Hcy1LLXU3MndwZFlkZTItZmUzZ2VqaU9wc3FlQnQ5S1p4eDlqeVFfRkZfN3hqRUF3MXNtR0k5RlhjbEZ2dTNRdTVmRkZIZTA1YklsWGltTHVpQdIB0AFBVV95cUxQeElXVHJic01INUtJOFFMRGJ6Tl9GT0JJRVJPaHlERS1YeEgyZWdnc09MNk1qVGVPZ3Y2My1IZUR6amVpOTNRTmQ1MUZSTTJQZTBlelBuRHJKaHZHaXBVWk1YdkhucmtrajNtTW9mRVdsdTVpOWZCSzdxbVVqQkJsbkQwUUY2MkxRamx1dDgtZ0RzMm8wVERRRWg3UWVwNnFQNUQwblMySndDWWNkUjJfWVh3dlFGRVR4Q0hfTTY5NS1uclNOODhzTV81anBkeVZx?oc=5&hl=en-US&gl=US&ceid=US:en,CNBC TV18
BANKBARODA,"Mon, 19 Jan 2026 07:30:56 GMT","Bank security breached as thieves enter via roof: Cut iron bars, break 2 lockers; flee with jewellery and c... - Bhaskar English","Bank security breached as thieves enter via roof: Cut iron bars, break 2 lockers; flee with jewellery and c...  Bhaskar English",https://news.google.com/rss/articles/CBMiwAFBVV95cUxQNXZPOFFnZ3FVcGl5U01NVUVKV25idlZFN3ZhekJhU3dhWnUwd3hzZ1FqUXd4SzloN0pra0hZSnNYcnBrZTd0eDg0dU9DN3FxR2ZEYUdWVTNPZUhjbWRaVVE2OURpREhsYklpeXZ2Tk1LeFJncnQxUmlTTnFzZU9FMVRPdE93RmxOV0N2NEM4aTRqVGgyLU9nREd6aExhaUxKODFzY2Mtb0h4ZW1hbkt3TUNpMVlpQzRFdDFyS2hkMVTSAcYBQVVfeXFMTUpsQ3Y4S20xMG1DOE9HaWVYQkhoQTJLdXZHai15bE1fN1dfVW1zbmlSVV8yMVZRMk9XVTVwY2JJaEdIanN6b0JaTm04enVROWd5QjJsc1Vrd0NjOFdYbW5zeE5pVDAzZGhaTmVJSVFtdThPNVpGTFl6MllOWEl3N2liSVFBcUs1bWdlWDNDSUk5dHQwM20yZFl1bzBFMTcyWUxlelltUkRNRTE1cGt1S3hfekw0RXBEakprNGFFekUza1ZKcXJB?oc=5&hl=en-US&gl=US&ceid=US:en,Bhaskar English
BANKBARODA,"Tue, 20 Jan 2026 12:37:00 GMT",Bank of Baroda Announces Re-Designation of Key Executives - PSU Connect,Bank of Baroda Announces Re-Designation of Key Executives  PSU Connect,https://news.google.com/rss/articles/CBMimAFBVV95cUxOTmFWR3J5RXdSTms1Ni1LUThiYml5TDlydUJBaGNrQXVFblVGTXdrT1JFbXZ6OGh0ZDRSZkgzSHRiTWZaQmRXQTdiTTN1aVdiTEk2UGdxUkRJTzFRZGoyV0Y2Wi1IdXNNV3NsXzlNa09HZHlQS3BVVnBoSHR0NVRlU1Z2TTNnbDJQTWR0Y2tneUo4REFZRmg2UA?oc=5&hl=en-US&gl=US&ceid=US:en,PSU Connect
BANKBARODA,"Mon, 05 Jan 2026 08:00:00 GMT",Bank Of Baroda Sees Robust Trading Activity Amidst Rising Institutional Interest - Markets Mojo,Bank Of Baroda Sees Robust Trading Activity Amidst Rising Institutional Interest  Markets Mojo,https://news.google.com/rss/articles/CBMi1AFBVV95cUxNNFNyOGRjejc1ZGFBTWdFOW9jcTlqcnJuRkpZU1Nad3l2UzRDT1hxUHVXTFJlcXpPYVFSVHpTTHlfNTdUZHBSZUpNOHcxRnU2dWE5MjQyZVJuU1RXejM2WEdIOWlwZ2lXWHBOVF9fajVEZDBtTklBME1WWkJmbjdjN3NEMUw5WnFueTVhUUdxSWdqV1l0eUYzV0tWRFV1dkoyYVpMZURiUXloMjkzT2hzUWFqOGlrMDZ5Vzd1OEhZUlExVFQxLXQ1XzZiUHoxXzYtQ25CNw?oc=5&hl=en-US&gl=US&ceid=US:en,Markets Mojo
BANKBARODA,"Thu, 08 Jan 2026 08:00:00 GMT",Bank Of Baroda Strengthens South India Operations With Madurai Office - SMEStreet,Bank Of Baroda Strengthens South India Operations With Madurai Office  SMEStreet,https://news.google.com/rss/articles/CBMiqwFBVV95cUxPR0VqQnZpOEMwbjR0MFh6UHRNVDRJNGZjUnZidzh3Z2VSZ1RwWnpZZzhfRVBHSGs2RklGVXpwUGFyeEtoMzVZclZQaWxZTXNpaVNOb0lwVXp6VGtlU2pzSElBbEVZak5uWVUzczl2Sk5aYkdJVDJOTzc1cjNfMmZqbmRRRTRodkR0c3REUnU2RFlhU25yd215dEJ0LVl6RkVITmxDN1Rqdi05em_SAasBQVVfeXFMT0dFakJ2aThDMG40dDBYelB0TVQ0STRmY1J2Ync4d2dlUmdUcFp6WWc4X0VQR0hrNkZJRlV6cFBhcnhLaDM1WXJWUGlsWU1zaWlTTm9JcFV6elRrZVNqc0hJQWxFWWpObllVM3M5dkpOWmJHSVQyTk83NXIzXzJmam5kUUU0aHZEdHN0RFJ1NkRZYVNucndteXRCdC1ZekZFSE5sQzdUanYtOXpv?oc=5&hl=en-US&gl=US&ceid=US:en,SMEStreet
BANKBARODA,"Mon, 05 Jan 2026 08:00:00 GMT",Bank of Baroda Q3: Clocks 14.57% growth in global advances - BusinessLine,Bank of Baroda Q3: Clocks 14.57% growth in global advances  BusinessLine,https://news.google.com/rss/articles/CBMi0gFBVV95cUxPdU82MG1NNC1aWlJVUXhYSnNRM3ZndndtTV9TbklTZ0tOX2x4TzFzZXdEYlpIbWJ4R0hBUHpTYnBvaEtWY1dtYXpiaXNrc2IwSGpxTTMzdDNfRDZCMVFZNC05YlpxT2gxWDBYM1VNa0p3WjcxcXdORVJCUWsxV2Nqa0ZtcGUzZHE0aGlnOV82Njg2YVpfNWtISkJhZ0o3VVlpLVFMTFo2UjlLblFuSE9KTkhfcGpfc09DNGRCSnFpVmxyZXZmak1SeUZQWlMyRlNfZkHSAdgBQVVfeXFMT3p2a1RQMno0Z28zaV9HNW83Tk1EcjJJcUdHQ1B1cHV0M2ZfcHlqbWpNUXBhX1pzdkp6bXpRTnVBU1RYQ0RvLUFLb0lrRV9yMFg1Rk5ub1doSkM2WjB5b3NHSE1qdm9MSllFdmJnZEIzbW5NbE5MTmlhSTlkYTYwUThCTmV2Ui1LQm90U1hvdEpfbDJ5ekpKeFF0bWlQaDRYLTY2QU55bEc0dkVQZU5YaXpSU1lRdHlfSWFCMWJkSTZrWlMzSUFFZmJ2V29zMnhQQ0haVU5nUG5I?oc=5&hl=en-US&gl=US&ceid=US:en,BusinessLine
BANKBARODA,"Fri, 02 Jan 2026 08:00:00 GMT",Bank Of Baroda Stock Hits Record High of Rs.304.25 on 2 Jan 2026 - Markets Mojo,Bank Of Baroda Stock Hits Record High of Rs.304.25 on 2 Jan 2026  Markets Mojo,https://news.google.com/rss/articles/CBMivAFBVV95cUxOSDZ1SnoxQ3RXbkU5Mkd5Mm1Kb3BsRThMYzl1QnJfc2tDeDVnYVZVOW1DM1hBOU81TWR3RXZ0OUlDSVNiMUtRLXViZThpcDVxS2JPS05rT0dBQ0h2U0Q0enYxUkZLdVhSOVpmd2RjRHZ4NGNEM1E3czFXcU4zUVAxM3pJQzJqSEV1RUlsRXhVUks5dUZpbHNpUVktc0hTUTlKMXJEUFAzV3hNY3VLNlRfZHg2enltUVVOczRSYg?oc=5&hl=en-US&gl=US&ceid=US:en,Markets Mojo
BANKBARODA,"Tue, 30 Dec 2025 08:00:00 GMT",Bank of Baroda opens new branch on Vishwa Manava Double Road - The Hindu,Bank of Baroda opens new branch on Vishwa Manava Double Road  The Hindu,https://news.google.com/rss/articles/CBMiyAFBVV95cUxPT2t1OXR5LVBfaTBSVC1GQloxeElrTGZXeTQwQWZHWEE2My04Yi1ldG5fblRBY0Q3bkZ3aXQ1NThrT1hFR3l1WjRuVnh0aE51SlFPNmxVMElhTXZJVlp1Qkg4R2tGV092dl83UnlaSFQtdXdWaWRGZV9MdElUTWpLVUZqaVRHa2hCWE8wUkc0UWlVdWtzZXZtRDR6MDRBVHZVUkFfckZSaVVKV04yOG5wV19KNkZ2ZkNzcVR5RHlWcWpBNjVJZnJlaNIBzwFBVV95cUxNWDZKYUJXR1I5aUJOQVpzX2x1M1FIdmVubGVldERmVjYzb2lKM0lPeF9FZzlkTmlWd2tpX1c1amlmMDhfUERINUZRbkp4RUZ2WkRlUmIweEU0aVJsTi1QOEZoQzkxaUlxMUpScWZnSlZHWTVLSlIxYjIzN1lpbWNhdjBQWFNxM3J4X0FsVUpIQk5oenhRUjZnQ0t5akVuSEdEOE5qTUstY2ItdHMzVk9IdWJFbnZ2M0pJNnYtOUxHeWllbUJWR1VvVGlnZG1TNXM?oc=5&hl=en-US&gl=US&ceid=US:en,The Hindu
BANKBARODA,"Fri, 16 Jan 2026 08:47:53 GMT",Bank of Baroda Introduces bob Central Government Employees Salary Account under the DFS Initiative - orissadiary.com,Bank of Baroda Introduces bob Central Government Employees Salary Account under the DFS Initiative  orissadiary.com,https://news.google.com/rss/articles/CBMiwAFBVV95cUxPcVNxR05BQVdsMUMwdDFQZGtmWHJqTjJZVVRMUUpzQ2tFV3hUTmxVNmlXVGYya0k5X3p0dEVPUnAzeWtSRnhYUUZTNV9rVjNOclI1N0hsUGlzS2NKOGNaaXVrdVNiRjdPRnlBcV9PemJxLV9jMzdCRktTVTJnTDRrYTEzOWJDZmZoUlhaNHc4SERKZHhQSHQ1SWFDX2h6MjVfREdZSWFYWHVFSEsxdnktWU1zVzIwM05VRGxWMVV1TGY?oc=5&hl=en-US&gl=US&ceid=US:en,orissadiary.com
BANKBARODA,"Fri, 23 Jan 2026 15:20:28 GMT","Bank of Baroda Issues Strike Notice Alert for January 27, 2026 Under SEBI Regulations - scanx.trade","Bank of Baroda Issues Strike Notice Alert for January 27, 2026 Under SEBI Regulations  scanx.trade",https://news.google.com/rss/articles/CBMi1AFBVV95cUxQWUdtNE43MzZVT0hPOGFxbzNFZ3pwYkthbHpUQTJvYVJWczNjeDJWZHZtMGM4dWgwNkRWWHpoZEhOZTBkYUF3V2FJRlhyUFJiOFEwa3FnUEJ2cVVDY1hlX3N6QnN6VG1wc25sVVNlWWF4WUdMenVCc2ZZN0FfQlJMV1pmMlFTb2J5eGNlNjdydGJjV2hPVWpPYzBtanhOREpyeUM0OU94Vk1fYnFxNjBzQ0pQb3l4ZVZkcGpla2tNZ0NTc1VkSTk1ZC1PMjFudXBzQkN2SQ?oc=5&hl=en-US&gl=US&ceid=US:en,scanx.trade
BANKBARODA,"Sat, 17 Jan 2026 08:00:00 GMT",Bank of Baroda inaugurates Auction Facilitation Centre in Baroda City Region - PSU Connect,Bank of Baroda inaugurates Auction Facilitation Centre in Baroda City Region  PSU Connect,https://news.google.com/rss/articles/CBMisgFBVV95cUxOM010Ul8wX2w1OVVFUExYNUFmdHRUMjZsNENqZF9rRHVtNVRuSlNmQzMxWk4yMTViVXlrUVQ1bXZJTmJkMEhmRkp0bHZNSVRIamJrdmdSSHJLVzRRdjU3WmNMVmpIYWl4em03a1JMckh1c25VOGN1RlBZekVvTGJSNEY2TVRoNkhsdVd0ZGVUbGRLdUpnTFRjTzVJSWotcVhUNDZ2cVZLc3AyZUZHcXN4bmN3?oc=5&hl=en-US&gl=US&ceid=US:en,PSU Connect
BANKBARODA,"Wed, 07 Jan 2026 08:00:00 GMT","Bank of Baroda Aims for 1 Million Prepaid Cards, Seeks Outsourced Management - Whalesbook","Bank of Baroda Aims for 1 Million Prepaid Cards, Seeks Outsourced Management  Whalesbook",https://news.google.com/rss/articles/CBMi6wFBVV95cUxNdURfZHFpdTdzdGV3VjlpRE41V3JGenA2MTJMcHUtSWR4OUpEZVB4T3N6OTZ4WXl2NzVpakZ4R2VOUk1hRndpZDhxdW56VnpOZ1hqMTdyazZhU2xtZG9MRGVVWkx2U2hMa0JXT2RfNjBYMHAycXBwaTZWLVMyZVRIb2RKSzJxd0x3Y19ueGIwRVdnZWt4SW5iN3dPNEZuUGdWTU1zeEtjSGlXdjhTR1JGRFhNdndUaUt0NHd5NF9zQVQzUGpjNGxhakJRMXlyMFQtX0JPMEZYa042N3pFRXV3eTNON0JHRldZaWtB?oc=5&hl=en-US&gl=US&ceid=US:en,Whalesbook
BANKBARODA,"Mon, 12 Jan 2026 08:00:00 GMT",Canara Bank to Bank of Baroda: 5 banks that revised their FD interest rates in January - Upstox,Canara Bank to Bank of Baroda: 5 banks that revised their FD interest rates in January  Upstox,https://news.google.com/rss/articles/CBMi5wFBVV95cUxNZWRmcENKMFdyUlpaajEzakt5MTZFQl9xMjBsbFNRT0JpckJ4eVM2OGVPOVFnTVMydGk1RHpjTVIyOHUxOUgzdGs2eDhqRlZmZFBFamdtRl80ZlZNMERqZDFTX1Y0VUs2dEs4QmhkeXBlcUpFRTF4TjNoQmdya2NJdlFETUpSaFlIUEJGQXVWREVFeFdENU1NRmt4TlJYOHhEeHByMk5LZ2RBNXFWLTR3OFplbVpWaVJESzRVRExwRWdfdF9TdlQ3cVM3LUVpcEdrS3R0dE9xRUNNZ0VCMU5pcTdxRHp2ZFE?oc=5&hl=en-US&gl=US&ceid=US:en,Upstox
