ticker,date,title,description,url,source
BANKBARODA,"Sun, 04 Jan 2026 08:00:00 GMT",Bank of Baroda logs 15% loan growth in Q3 - BusinessLine,Bank of Baroda logs 15% loan growth in Q3  BusinessLine,https://news.google.com/rss/articles/CBMitgFBVV95cUxPLXdzQkNSbVhDQ1FUYldRVUxXVjNUNTVPVUlEejZlWlFSYXpCZ2ZXZTl1RHVzTmxJS3NNc1RLOVpvNlRYdm5KZkhGSXVxRF80WE04djZPdWtlWkpnWWFEOVd3MG9ldExMOHpJQl9oaFktaFFsOGhGM1BzbndWMTBrUXp0Rk9ncm5UdjdaYmhMb3RUamx1N2FlOFFtYWhHVFp6djNVb3lxLTZKVzRmZ0stNFZCNUhnd9IBvAFBVV95cUxPMVR1dVBEUy04NVNxNGoybER5R2lSU2E1NDJSRGZzSUpZRWNyRXpteS1OZlAya3pZVkFXM0lsaU01VWVyUFVqQTFhNjRNTFVaMGJYYU55WVgxdUFhM2RGd3JLOWRrc0RUQ0lDWklrYURKdTJuOG5RY2ZNOEdVdmpNaVBKMjllVVM5RHpod2EwLUdORlFPWlRUcXpxc0RqRF9nUG1OemI2b3BiN3BCTnNXalBlUTlCTWN1T2N2OQ?oc=5&hl=en-US&gl=US&ceid=US:en,BusinessLine
BANKBARODA,"Fri, 23 Jan 2026 10:02:46 GMT",Bank Of Baroda Sees Significant Open Interest Surge Amid Mixed Market Signals - Markets Mojo,Bank Of Baroda Sees Significant Open Interest Surge Amid Mixed Market Signals  Markets Mojo,https://news.google.com/rss/articles/CBMi0AFBVV95cUxQSlozSW0xZEc2b2c0TFUtX3VDbUN0R2U2U09lZy1ibnRHRG81Ql9pMk5sWXFibGMwb01XWVpuQ2VkNDNEa01qUTdKQlFsZTJzVzNJSDBrVG5JTDNpY0VoZmtBX3oyd3M4Mk9CSUJvV2RzTVFGR2hDYnJRTkFoTGlPMlJ6ZExSQnFpMk11U3pOZ3JyaUVqeTdxVXoySXBSMGVSZUNmaktOWDU4dHlHbUNQOXZxQ19EdnNpNWM5RXhyNnhsd0JuQlFGN3BramcxRlJa?oc=5&hl=en-US&gl=US&ceid=US:en,Markets Mojo
BANKBARODA,"Fri, 16 Jan 2026 08:00:00 GMT",Bank of Baroda Associate Sponsor for Vibrant Gujarat Regional Conference in Rajkot - PSU Connect,Bank of Baroda Associate Sponsor for Vibrant Gujarat Regional Conference in Rajkot  PSU Connect,https://news.google.com/rss/articles/CBMiugFBVV95cUxPR29vbnAxdnpzTUJhTk9FMk82Y1RVV0x5Y0thSnJ0VFNMUHluQWN2YXJiRmRUOWlFS0g3dm1kX0pBRUF2c243ZDN4TURXN29oNG1RQXIzYXh1WjQ0UXpRUG84cXdoZkhiZVVLN2I3MGM1cG1TT0xmVGt0NDY0UUtqT0RJSWlzcHlMMzU5WTZrek1xV21OcjMybWVRVkNxMWpQbFJBTF96VDBxRWMzWnhfZUd1OVVmNDVwenc?oc=5&hl=en-US&gl=US&ceid=US:en,PSU Connect
BANKBARODA,"Fri, 23 Jan 2026 09:47:02 GMT",Bank Of Baroda Sees Sharp Open Interest Surge Amid Mixed Market Signals - Markets Mojo,Bank Of Baroda Sees Sharp Open Interest Surge Amid Mixed Market Signals  Markets Mojo,https://news.google.com/rss/articles/CBMiyAFBVV95cUxQR0lTWE1Ddm1BUFdfTkhHcTRycDA0Njc3TGZ0SUVONlNGcUVGeFI1QnJSUmFiRm1YVDRVRXdXTXB2ejhRUXhXY2hVd1I0STJsc24ta1g4b2ZuWU1MYnFKeUlnTEQ1X2dHV1NLeGw4RmRxM2hFbWo0RUo2cndBR3VwbFJwNGk5UnIwTjlydmtTem9oMHlBUmVncENJSzNFUDZSMmJNUW54Y0lwbkZJUDZtd2pQQklOSVpjcW8xekk4Y2RiUHFGR1Q4WA?oc=5&hl=en-US&gl=US&ceid=US:en,Markets Mojo
BANKBARODA,"Fri, 23 Jan 2026 10:25:13 GMT",Bank Of Baroda Hits Intraday Low Amid Price Pressure on 23 Jan 2026 - Markets Mojo,Bank Of Baroda Hits Intraday Low Amid Price Pressure on 23 Jan 2026  Markets Mojo,https://news.google.com/rss/articles/CBMiwwFBVV95cUxQczIwVXp1SjBxdXpJc3l0a09NaU1pT0tZYTh2S1JvbTAtV1hEUFZxNzllNUxoZVZVMlJmZ052X0swbnZlUlVEdHFPcXJ1ZW5UUFpXbjNxR215UmFfLU5qX00teXNuNEpueVpyUV9hSHBDYURtaUZmeGgyRGVCcTFXaGdQdHZzVWZOdVg5c3BFajdpTE9QZ3pHVktFdk9wQlFQdFZ3dHZ1cDhTbHF3cEhsTktJVDVCMjNtOFdPZkRPNzdlT2s?oc=5&hl=en-US&gl=US&ceid=US:en,Markets Mojo
BANKBARODA,"Sun, 04 Jan 2026 08:00:00 GMT","Bank Of Baroda Q3 Business Update: Deposits, Loan Book Grows In Double-Digits - NDTV Profit","Bank Of Baroda Q3 Business Update: Deposits, Loan Book Grows In Double-Digits  NDTV Profit",https://news.google.com/rss/articles/CBMisAFBVV95cUxNUTdJZTg4UnlrTHZhajM4anRjSXE1Y0FGdEJmSmE3dGdhOGdJOVRrVjI4SDNIQXhtWElwV1d4c3RYMl9MZmtNYk9IMlc0WTY1d2NfUnMwbTNDNFh3TnB1c1d0WWhjaHgyTmZtajZnamMyN0FQTFJheWUxVExLY19HQ0lQUUhQRmNmaXJHS3BEY1c2NmdwVWRiQlFYa095LWprLTN3Q3lWdlBuRTN1WVhoX9IBxAFBVV95cUxNdVFhTkdfX2JIbTdGeTVIM1JiVXpGRjZTWGcxdnNmWXo5V0h6cjFLMUd1eTI4S2h2V1g3SXBjbTktUi1NMUlpV3ZrVTdSUGM3ajYwd3hlVkR5MU03T1FmSG9QeWNRREdHTzVCUWVtbkNlbk1QY0kyMHhVR3pyUGl0am5NM2pFQ2ZmOWRFZEZqaHhxY3AyQ2Z4OERfRXAwMVJERDhEMnlGMXlWc3J2NlVkOVdKNHVBSmZYUmFXZFhFVE54ZnVo?oc=5&hl=en-US&gl=US&ceid=US:en,NDTV Profit
BANKBARODA,"Sun, 04 Jan 2026 08:00:00 GMT","Bank of Baroda ’s Global Business Jumps 12%, Advances and Deposits Surge in Provisional Q3 FY26 Results - Legal Parivar","Bank of Baroda ’s Global Business Jumps 12%, Advances and Deposits Surge in Provisional Q3 FY26 Results  Legal Parivar",https://news.google.com/rss/articles/CBMiywFBVV95cUxPSlRGRlowYUtQWE9lbGpvdzlsbW51UWNGUVlCWXZqMU02QUE2bXZBajB6MGlQbGtxaFpBY2p0Y2dmbnVMRU10akstUWZQeXgxcUk3REFVQ01Mc2FYMGZfcnZLZkhaX2xlZlJFUFNRVWZIcDduX3JiSjVSOGw1eVRuYmZJVnlLMmVoN3RDUzE1cklNWVNkTGczX1VObWRkUHRSRnI5V0FuR0puR2pUbTh6ZTVNQmZ5aEdKZkExb0ZJWUhiZTd4MWVobTUzWQ?oc=5&hl=en-US&gl=US&ceid=US:en,Legal Parivar
BANKBARODA,"Sun, 04 Jan 2026 08:00:00 GMT",Bank of Baroda Shatters Loan Growth Targets! Stock Soars to 52-Week High! - Whalesbook,Bank of Baroda Shatters Loan Growth Targets! Stock Soars to 52-Week High!  Whalesbook,https://news.google.com/rss/articles/CBMi5gFBVV95cUxQdFpjcW5fRWs1UHVqdVBtb28tRmNQOWl6ZHNobDFzN3B3czBkMGFsNDJEeVhocjVXZHk5b1JGNWdqYU9remFER3NBWVp6emN3SnNudERkNk0ySWNUNjRvdUtlX012Wk9HRm5rOXgtUnlrclM0aGtqVThhQ0ZqcHB3NHpaS2dhYzZ2VjJKa0diWWtEUUJDOXBJQnNVM2V4Ym9ELXZ1MlBYZzZQbjJuUnQyNmU5UF9RaUZScjZqZHdmMUlPcGtDOUEzd1BNWC1pcWI4S0ZubmZpXzU0RmVDWlQzTnJ3VUwtdw?oc=5&hl=en-US&gl=US&ceid=US:en,Whalesbook
BANKBARODA,"Wed, 07 Jan 2026 08:00:00 GMT",Bank of Baroda inaugurates new regional office in Madurai - BusinessLine,Bank of Baroda inaugurates new regional office in Madurai  BusinessLine,https://news.google.com/rss/articles/CBMiuwFBVV95cUxPbWZmd1BqR2RZMW5RRkJlQzlsNGpIejVscmhSRGxyYnlzWTBVeW50YW5uQzI1aWdwTFBYZUhRWHp5cWZPTEVfTGN5SndvYzhRRllSRFN3UGp0RkxQM1A2U3ZXSnV2STBCOEw0OHdMQW44SnpUS2ttaWlZVG1MZ3VmQTFXVU50aENvNWprS3RmV0FSaDhYV3k3ZXMtQlh4b0d2SkR5S29wNGFSQ2FXZXJWWTNJdXZRMWVPYUsw0gHCAUFVX3lxTE9IU3Z5WnppNkpKNXA0RGdwS09YS3B4aElfWDA3VnBLWnhnQ253aWlYTmlsSWNfbVBQbW1zdG44bkUzS2kyNE5BV3Z1S2o5alIyZzBvRjJNY1lJWDZDY0F6UXV0TEV1RWhhSDMwWmFvYl93Z2RBVk9PSGdtV0I5YUhkam9YYWlQZkpJTUZpM3REU1hoZWZfT2RuZloxRVQ1cGJQMGZndFdlSWw1bkJjNVI5R1lFNTJNblhZclFvX3RncW9R?oc=5&hl=en-US&gl=US&ceid=US:en,BusinessLine
BANKBARODA,"Tue, 20 Jan 2026 06:40:11 GMT",Bank Of Baroda is Rated Buy by MarketsMOJO - Markets Mojo,Bank Of Baroda is Rated Buy by MarketsMOJO  Markets Mojo,https://news.google.com/rss/articles/CBMipwFBVV95cUxPX2ZiblNzMEtUdWtHNlhVNmluQ0M3U195SkNrR1NENVdJUjIzR1dJaTVRa19lTFNISEpmem9xaUpoVndncHppbk5DblNEUFNTYjE4SV9GSXEwdmlTTk1PVnNIRGluNDBjbUFnYTJxZDBVak53ZDMxQU9vS3lFODBkN2R2ajY4b3FpMXVMMVM5VnJVWEFpTDltTkNtVkhMWEVMMEN4RnBrWQ?oc=5&hl=en-US&gl=US&ceid=US:en,Markets Mojo
BANKBARODA,"Mon, 05 Jan 2026 08:00:00 GMT","Bank of Baroda (NSE:BANKBARODA) jumps 5.8% this week, though earnings growth is still tracking behind five-year shareholder returns - simplywall.st","Bank of Baroda (NSE:BANKBARODA) jumps 5.8% this week, though earnings growth is still tracking behind five-year shareholder returns  simplywall.st",https://news.google.com/rss/articles/CBMi1wFBVV95cUxOSVl3bDJhelJpN0pPcnZpMnNwWXZlVmpPZ08zMzI3b2s3enFQQ1hsLWlENGZwUFJhY1FEbUpaODNxMTdDYlAzME8tLUNLaDRJNTA5UDlOV09IQURFWTdrT0dmc1UwV05mbkFWdUFZQi1DYktDRjVRV0RnRGJfTDM4cTN6SGhlQ2xpa3JZWUhTb2xPRDJzY3FxdVhiVzNpV3Rhc1pPX0NYZmxpd0pFaEtzNk1iX1dKdC1zX2c2dlFLN2dHejI2M1JPTFBJRkN4YkZkS1RTSnBaRdIB3AFBVV95cUxQOHpFMldNZ3hHOEN6LXJFaGJiSzVDRHRNd212TGlYYTdLNFREVHVsQ2RyLUxsQVpLN0NfaDJRcmZXOHZReXFqRXhjQXN2dkhvRl9fMVd4emtIZzNHeGFnYjJMMlFjbUd2N2xXOFZwNkN4X05rVUVBRDE4cTVJcy15dmFwNmtJajVDaEs2VlZrWjZFT0lFSE9PeEZYWU1UWUVjbWxhWmtjTWNNS0ItZEpRNm5RdVBVdGpxNXpYUkdkMHJnUWZwZVVpaThXR1lCVG8tWjFKdXVVdkNtdF9Z?oc=5&hl=en-US&gl=US&ceid=US:en,simplywall.st
BANKBARODA,"Thu, 22 Jan 2026 03:09:23 GMT",Bank of Baroda Partners with IIFCL to Strengthen Sustainable Infrastructure Financing - Realty Plus Magazine,Bank of Baroda Partners with IIFCL to Strengthen Sustainable Infrastructure Financing  Realty Plus Magazine,https://news.google.com/rss/articles/CBMi0wFBVV95cUxQdUVQcU90MEI2TW1FTGRURjE1S0dwdlo4cmxrQU1tVE83WmtjcEJMLU1Rb3BUR3NTMW9qNkZ0cFZlVWtKZV9uYkZBdmplWXJOVnJIRjFMX2t0eHJ0Zl9DYzF6b0g3N0xMczc4UHByTDZBQUpLTUltSzdRaVR1b2RCaEFqWWZyS0d6OTNnc05HajZ1QVFVcElOaGI2ekdTOTN5UXEwSWFzOW4zbzJZOGZ6SXEtdTRRWXhGWXh2QUstWndTMzRCVUswUkxGemhCUkhTZTIw?oc=5&hl=en-US&gl=US&ceid=US:en,Realty Plus Magazine
BANKBARODA,"Mon, 05 Jan 2026 08:00:00 GMT",Bank Of Baroda Hits New 52-Week High at Rs 311.9 on 5 Jan 2026 - Markets Mojo,Bank Of Baroda Hits New 52-Week High at Rs 311.9 on 5 Jan 2026  Markets Mojo,https://news.google.com/rss/articles/CBMiuwFBVV95cUxNMHlUQjVUQTNPRUExUWxwQUFvcGVnZ2hxNDFIa24xM0dDNy1xTHQzVjBWVDdNUUxKN0FVVmVoSWRMdXR6YWJJM25VcldYaTA0Um55WFB4Ymd1MkpHeTRFQXp3X2RNTGV6Q1ZPVDVPUzhobmY3NjRxZzdCODcyZWZDYXdjQWtYMmlJYjdiU3hNU0tHRGdiYTVyM29TcXJpenZuU1dIcDRMSlozb2RWU0hmb2J4d0NNUlhNbW8w?oc=5&hl=en-US&gl=US&ceid=US:en,Markets Mojo
BANKBARODA,"Fri, 02 Jan 2026 08:00:00 GMT",Bank Of Baroda Hits New 52-Week High at Rs.304.25 Mark - Markets Mojo,Bank Of Baroda Hits New 52-Week High at Rs.304.25 Mark  Markets Mojo,https://news.google.com/rss/articles/CBMirwFBVV95cUxQRUJUUUdscThSZmMzUm1vTTZhNG51ODVSR3RBcFd2VGotcDRZcHJTTlhVMURXUnBFMjJJNms2RlMyTlpfMVNUR0VfanpPaXhIQzUybGdPZFB5X2htMWJNY3Z5bjJjc3kyckVveGctQjNlVWNBUkZEeTFQd0U5djRUNERFRFlRWU9kZDRRRzUzUUVaWUxnaDAtVUVrZHVfNGs3VjFBeUluemItRWs3VE1j?oc=5&hl=en-US&gl=US&ceid=US:en,Markets Mojo
BANKBARODA,"Mon, 05 Jan 2026 08:00:00 GMT",Bank of Baroda's global advances jump 15% YoY in Q3 - Business Standard,Bank of Baroda's global advances jump 15% YoY in Q3  Business Standard,https://news.google.com/rss/articles/CBMizAFBVV95cUxQeTVnTlYta1RXWS1xUVVDanptVmhuOGxDWG5PVjUyZ0E2b2VNVzdwTUdMbGk4QzlBS2hYeU5uREpKRy1OOUlEY1daR3lQUkFBUnJXYzlMQlAtRFpVYWtKWXBXRGtQOTRWbkl2SmpfQ3puOElHY1ZIQm9XZ2NnSDRpSlRzek1Ib3Z0TExUN3BFWWFCZW9PNEpiVkItbmtuQml2cC05TGR5MFlhOVpFM1d5NE5DMnpxYk9FcHB0S0s5TEVmMEw2aFI0Q3FZUl_SAdIBQVVfeXFMTTFFTm5zbXAxUHgwRklkOFFzUHVUNXk3UGxTMjNxUVZobVB1LTVFY0ppLThYTVl2SGtWQkU2d1ZUMkRieE04TGVlZFhuZFl6RDNYaFRoWEhPODFLSHZMR1FBVjZjN3ZXa2Vuc0pBemFTRWdjT2xPMVpOemtsa25vdFVsOUw3Z1FYZFF5M2dFZGREZGtQNmtpeXdhakFQelNVd0ZRbjl4UFI5R2tia2NDX3pJa2pVN2ZuaW0zSi15QUd2WkMtbG9Wb0VXb2JrdXpQUHlR?oc=5&hl=en-US&gl=US&ceid=US:en,Business Standard
BANKBARODA,"Sun, 18 Jan 2026 08:00:00 GMT","Bank of Baroda Board Meeting Scheduled for January 30, 2025 to Consider Q3 FY26 Financial Results - scanx.trade","Bank of Baroda Board Meeting Scheduled for January 30, 2025 to Consider Q3 FY26 Financial Results  scanx.trade",https://news.google.com/rss/articles/CBMi5wFBVV95cUxOV19FenFtam15M0RPYjRSa0tNa1ZSUVBzMVNKZlJjMDlPdHFaRmpCcVVueHBtU2tKNF9Lc2RPWmFJa1BmUzhOR3NWUVNxbXcyWEtSbXlhZVVxNTA0S0I1el9UUjRIZzdVaW12T0hzbUUwM3c5ODZidFI2SmYtWFJBOVJDMW1ONTBIWkk5UXNZS3RkVTRJVzJ3WFU5djI4eklLOTJIOGx4Y2hzdTFGa2NzOW1qX04wMy1NOXZvNnNnWU5uVnNSTkR3VHJudWNVS1FmR1Q0Tm9MYVpscHFJaGZ5Z0I1REF5aDg?oc=5&hl=en-US&gl=US&ceid=US:en,scanx.trade
BANKBARODA,"Thu, 08 Jan 2026 08:00:00 GMT",Bank Of Baroda Hits Intraday Low Amid Price Pressure on 8 Jan 2026 - Markets Mojo,Bank Of Baroda Hits Intraday Low Amid Price Pressure on 8 Jan 2026  Markets Mojo,https://news.google.com/rss/articles/CBMiwgFBVV95cUxPY0FTVkhiNHBRcUM4Z2szSmtGMHAwSlhuUkFPVWJ5X09HS1FoOXNubVVJMzk1RlNMT29JZnZjU1RFY2ZNLW51ZlgxTVpQZlYxNndiM05jaXhzLVVDWjk4SFFQc2lpbWhVY0FYdGU2bkVXcXpXZ2d0UjFXRFRWdXdwYXJ6VDBPN3pxRmswYmRlZVBfcGdNZUQ4YmktVGpRZklHaVFValhxYk4xTFNfaTRlam11dXZxRmgzSGxsaHZOaEJuUQ?oc=5&hl=en-US&gl=US&ceid=US:en,Markets Mojo
BANKBARODA,"Sun, 18 Jan 2026 05:48:02 GMT","Bank of Baroda Scam: Over ₹1.20 Crore Missing From 60+ Accounts, Customers Lock Branch - The420.in","Bank of Baroda Scam: Over ₹1.20 Crore Missing From 60+ Accounts, Customers Lock Branch  The420.in",https://news.google.com/rss/articles/CBMifkFVX3lxTFBnSFpiRTlUNmZ1eHJYUFBwdFN2UDBXM1ZuMU9QNDlwcVlESWY5aTQ2eTBldG9lemdQVFNSTnJVUVFHUmNZQzBrRndldGpsMWp3blZ5MnROMjBQbk55M2QyUE9PcmF3MmdJaTJRdnBMeFc0LTFhQ0JVSGhhTU1XZw?oc=5&hl=en-US&gl=US&ceid=US:en,The420.in
BANKBARODA,"Sat, 17 Jan 2026 23:02:18 GMT",Bank of Baroda opens new ‘Phygital’ branch in Jalandhar - Tribune India,Bank of Baroda opens new ‘Phygital’ branch in Jalandhar  Tribune India,https://news.google.com/rss/articles/CBMinwFBVV95cUxPdnBYZi1ZbW1fWC1zdllsTGNyMVRKTkNtTS1qTW55dEEwYU9zMUhJRHVBR1ZFOEtLcFlvczJZaWhYTUtZSGlTNUszSEQxZVU2aDVldnhyVHhicnRibXo2QkUtVFNsMzExU3lXRmthSzBmTE5mZkJKV0ZMS1lDRUNudllJXzBvUnRlTWJSdk1tc21jcWNHcTItQlJ0S2gwbm_SAaMBQVVfeXFMTkNweUZ3bnVRakprcXN3WU9UNW00blh0Nmo2b19KNjB5SEJZTklEQWR2cDZ4Q2FwTDIyQnlwaXRVSUt2MFVWSFRyMlFBUGttVTFUZ3NQTkNTUTQtbE9CT21pUzRnYTdzTGNoeGkzOXUyMGpVV21lXzVfRFZnN2ZrSXIyMEJoV3NJSEFfbUJFdm4wVEluUXBZVmlac3NZdlVZVHZrYw?oc=5&hl=en-US&gl=US&ceid=US:en,Tribune India
BANKBARODA,"Fri, 02 Jan 2026 08:00:00 GMT",Indian banking sector resilient; fundamentals strong for further credit growth: Bank of Baroda report - ANI News,Indian banking sector resilient; fundamentals strong for further credit growth: Bank of Baroda report  ANI News,https://news.google.com/rss/articles/CBMi5AFBVV95cUxNT0dkejhKeE03d0tXTXNLVUc1R3p0cmNFODg4bjJqYkw4Yk5sazFUQTFic0VTcVJaZEcwVkZzLVpKS2UtOWFLcDc5Ti1kZG5zajhtOEdhYVlydVZQZTVEWkl2VVBZVnp2U3UySnZCbkNaeENDM0w0d1JmWnRKV1ZteWhYcndqZHkyanRCOGVnMnhHNjZPYXI5NUJtR3dOMmFxMDJ1bXNYU3J0aDQyNXNLcUhCSGV1UnhuOXhSVDhRa292TEdpQ1d6NEhNSWlBdW9ueTlNMTBMTGdOcXV4SFRRUjBGMFDSAewBQVVfeXFMTnA5dmFhVHc1WERMVDlOVndmVWEzd01tVC1fQ3FraFRmSzZudmFqR2pxQkEwaDl2UXc3WU8wU29MVnRmbG5sc2FMU0ZJd2RpVWRpSnYwR3VBMGtFam5EMzVsWFA0QjU2d01EY3JRcDZ3bDhRZDBQbGp3YnBwcEVVZWZ4T0trZXhock5HMnRaaTJrZmVta3JudDVFQUltb3V6ZTh1YVBYRGd1SlVsbnFMNU9KYlg4SkVVS2cwdGl0UG1ablh2ZjQ5c2paT1VXYTJ1ZHpUUXBKTzdJOFdxM2x0ci1OX0l4R0c4bllZY2s?oc=5&hl=en-US&gl=US&ceid=US:en,ANI News
BANKBARODA,"Tue, 13 Jan 2026 13:18:06 GMT",Mizoram: Bank of Baroda to focus on digital banking - eastmojo.com,Mizoram: Bank of Baroda to focus on digital banking  eastmojo.com,https://news.google.com/rss/articles/CBMilgFBVV95cUxPZXczYlBJS2t4dWI2OTE0Y1Z5bi1iV3pGOFo1V1R6NC1UczIwNm9DV1Y2U0IxalVMNmRhU0p2MUx1dHl2NFFSZng0eS1yYTZTQ2dDT3VfS0JMYlNkVEtTWlJibzZjTGZDYnZoRlNkeW1vLWxvODBVR0JnSVBxYlUxS1VLTno4RHZQV09pLU55dTd2Y2FUSFE?oc=5&hl=en-US&gl=US&ceid=US:en,eastmojo.com
BANKBARODA,"Sun, 18 Jan 2026 08:00:00 GMT","Bank of Baroda Board Meeting Scheduled for January 30, 2026 to Consider Long-Term Bond Issuance - scanx.trade","Bank of Baroda Board Meeting Scheduled for January 30, 2026 to Consider Long-Term Bond Issuance  scanx.trade",https://news.google.com/rss/articles/CBMi8AFBVV95cUxQNmRrdnVvdU1MSERzd3FnUzJweDdtSGFqV05uYzN5aEZWMHRHQXZjb3RnR1lXTDYyQmFaVlA4TUVrZHJDWlBWeFk0N0pSd0JJYk8wWW1uUXZoa085YTduYi15X0MzSDNhdmlVSVdNQUtvVlhoYTJlOFN0ZzRJQ2x1bDZJRGhjc3hZYlRKU3R2Y1JEV2ZkeVBRRDBaYlZJSzNGbU9qNWJySmJhNVNqa2RWTllsNTVlMmdoRjdSRndTMkFoZ0hOek5qRGN2ejhNemI0NXhtRW9MU1FNZEdnWDVpWGJBT0kxRF81Z1BfbkNaRS0?oc=5&hl=en-US&gl=US&ceid=US:en,scanx.trade
BANKBARODA,"Fri, 09 Jan 2026 08:00:00 GMT","Bank of Baroda Keeps Lending Rates Unchanged, Stock Edges Up - Whalesbook","Bank of Baroda Keeps Lending Rates Unchanged, Stock Edges Up  Whalesbook",https://news.google.com/rss/articles/CBMi1gFBVV95cUxORTJCckVCOWZHd3NUU3BZd2pJT0FaZVFvd1pPeXdVb1VTWXR4cllhdGllRDdtSkZQSUxXVE5hemFOV3V1OUU0ZTMtSWZEQmVHT055VWctQVFvVTRLaHRILXZwdzhsdG1zVmRDb20yUnZfaWVjRnJBZ0hDOFRBUUN1WkJaMkJyVFduaWI0WURqdzBwbzdXam1KV3c2VWZGNkF1b1BsSEsweUtsWXN2OVVSbG9mZFE1d0hoV2F1Z3BZRjJQRUxVcmdjWXNDbkNSVWc0XzBTOGJB?oc=5&hl=en-US&gl=US&ceid=US:en,Whalesbook
BANKBARODA,"Wed, 21 Jan 2026 10:38:13 GMT",Bank of Baroda collaborates with IIFCL to boost infrastructure financing - Business Standard,Bank of Baroda collaborates with IIFCL to boost infrastructure financing  Business Standard,https://news.google.com/rss/articles/CBMi2AFBVV95cUxNWUFaU3YyMmZpZ08tZVRQMDZKNmxPVXdNYU1NZ0I4WHRYc2Z1TkZTempqamxwVmg5M2YteWkwcHZwN2JHUC1SZ2pDNXFvb3BYVWNFZXRkQVdQal9WcUxqTHd1V3VEMERHc25YQjZ1VFlua0gwNlllTHJUZUQ4Q3Q2Y05HbDlsYm5EcjVXWnowUlNiZFdScTdQbEpBUU1kWjVxc1ZUNnRlVThnUTY0WFVINWZOcXdSNUFidzY0dlNYWDQzSVpjYWdhYzNkNWRHX1ZKdTlpYVVsbUfSAd4BQVVfeXFMUHYtWld4WFoybjFWM3Ita3p4dnlvc0lnaUNGdUcyODNReUUxSGt5NVRVa1VUNzY4OFR1ZjB1alNNM0FqdXozS2EtRU9LU0lkY0oyRExsTFZyVEVqVHcwNHR1N0hxOFlaYUowcnlsRzFRdnU1dU9IOEpRR2NsNzE3ejJudHEwWjBNWHFfRVRSREwwSVRwc1dDUDFLTlZBaTlveTFKREhDcnR0bk11d0tVZWk5Qm9QLUI5SG1FdUR1TDBYbFBCSzNBYWdnVVZPTHZvUGh5ZTZqb2RUXzRhYTN3?oc=5&hl=en-US&gl=US&ceid=US:en,Business Standard
BANKBARODA,"Mon, 05 Jan 2026 08:00:00 GMT",Bank of Baroda logs 15 pc loan growth in Q3 - dailyexcelsior.com,Bank of Baroda logs 15 pc loan growth in Q3  dailyexcelsior.com,https://news.google.com/rss/articles/CBMigAFBVV95cUxOaG5lSkVZR0RjV1B2NWFVUHoyZzFUbHBXVEllYXo2amYwZGRQLWc0UnVMUEhiSU1CRnQyMTFzcVVxOWMzMmdZSUtCaUo3bDdkZ1NXWWNpOTR1TTQwYUdPTXV1ZHpMYkZVX2pZUjk4NGQ5WG5vektVZF9OcUt3RHdpZw?oc=5&hl=en-US&gl=US&ceid=US:en,dailyexcelsior.com
BANKBARODA,"Sun, 11 Jan 2026 12:19:14 GMT","Bank Of Baroda, Canara Bank, Jana SFB And Two More Banks Revise FD Interest Rates, Seniors Can Receive Up To 8% - Outlook Money","Bank Of Baroda, Canara Bank, Jana SFB And Two More Banks Revise FD Interest Rates, Seniors Can Receive Up To 8%  Outlook Money",https://news.google.com/rss/articles/CBMigAJBVV95cUxQUnBSVGtub3p0TmR5d1pSc2ZoWEZ4Z1dRR1drRWVzWkhfWEhYWk9DbFliYnhFUlhUanB6bVpWRVRFYk9WQ1VDSzdpYjlELWpHYW91Zm5GVG1wWkR1c21RcV9xLXA0emNNWGtua09oeXJxM05JWTl5OGZUT2swVlhSQjc0Qi1KX1VNNnZKQ1pNUkRTdV9lMnpRVEZsejNZa1hUY0p2c1M5MS13ZmNqWG1PWkZlTW01NU5xWEIwbUxRQ3NMYTdzRDhuQko3dDJGQmlqbWRMNndsQlQ1MG8zQy1IMVlEZGRyOVk2LUZ5YVMzc3RHSlNNR2hjSm5Jb05nTWxZ0gGOAkFVX3lxTE11VU1jMjBEdDVkSjNVNUg5Q0laVnNNX2NKZjFEemV4UWdvUkVrc0Z6cFNWOWlROW0xcU83RG96SWxZTVd5TjB0SmNqWHBFeDE0NGlYdHZ6M0lkNWNYQ2ZKZzQzY3hmejlqQXo1cTk4NE4wLVprNEJQLXBaUTN0RWFmd3FUekV4eGNVWVFLdVp6MU84OExuTU1CRFo4S1R5UlZmcExBaHJqemxRX25kSWgwZnM2WTJHX05PQzBsbnFWZ1NNblctempYRDd2ME5PenlwOGVRUGNIcUhtTnFIaTVhbHY0bGQ5aWIySFlNTEJfbkRuQlRsSlF6YUhZYjlzMXI0VEZ1SjczamF1anVTdw?oc=5&hl=en-US&gl=US&ceid=US:en,Outlook Money
BANKBARODA,"Fri, 09 Jan 2026 08:00:00 GMT",Bank of Baroda Receives RBI In-Principle Approval for Primary Dealer Authorization Transfer - scanx.trade,Bank of Baroda Receives RBI In-Principle Approval for Primary Dealer Authorization Transfer  scanx.trade,https://news.google.com/rss/articles/CBMi3gFBVV95cUxQdnV6b1hOZ2RKUDdnYncyQzZkdHJJaGRBbDFuQzlpS3ZaVVZRaWFSYmhsTjgtVW5CTlpJVjB0LXpoSFA0amlWdnpnbURWaDJtTzF6SDJYNHRLQUlEMFBHY0V6UlgyODRPTGFfM2RXelhieW12LTVMbl9neERIRVAxNEk3RHFiMUROU3VNTGxIMHFuRWMzRGdDamR1akVUUmhFSXR3bS1GUG1RcXpSR1JHdUdXMTFHNG1YMFpVODU3VW1XaGl5RUdnUzQyMmU0aGtuRFBWTWFaSncxNEJKSkE?oc=5&hl=en-US&gl=US&ceid=US:en,scanx.trade
BANKBARODA,"Sun, 04 Jan 2026 08:00:00 GMT","Market Focus: Oil Companies, Bank of Baroda, PNB Lead Monday Trading with Q3 Updates and Corporate Actions - scanx.trade","Market Focus: Oil Companies, Bank of Baroda, PNB Lead Monday Trading with Q3 Updates and Corporate Actions  scanx.trade",https://news.google.com/rss/articles/CBMi8AFBVV95cUxNY3Z4TFpiOXFqSGllaDVDaVJRbllxSi1JbG9DYW40aEMxVTBBQmZYRFoyRDl6TnJrQ1FTNUJuOG0tOUVZbE9faUpNdUM2SGh4TEtMM05hZWxIVWptNlNjQU5kR2l4VWhucFowd1ZtaXRhUE9sX1BIN0l3MFV3a2VYbU9zQVFCZGh6U3Y5c3llQ1BkbEVzWVlYbjEzbjZ2eW5TLUJMNjhiZ2pCdEE0dTQySWxGQzRrOE9GdEVTa3FNNGhKTjJsd2YtVFd4TzZ1bUF4M09CdktXc01QN25nMlpuZWNwbFIyMGdwWWVfRFUwQWI?oc=5&hl=en-US&gl=US&ceid=US:en,scanx.trade
BANKBARODA,"Thu, 15 Jan 2026 08:00:00 GMT","Bank Of Baroda - 5 stocks YES Securities expects to shine in 2026, with upsides up to 26% - The Economic Times","Bank Of Baroda - 5 stocks YES Securities expects to shine in 2026, with upsides up to 26%  The Economic Times",https://news.google.com/rss/articles/CBMi7gFBVV95cUxNT0tRbzR1RU5lY1ZjdVlNXzlKd2ZrMlY0VnM1U1d2SDFZZW1rTFByWlJCUGZHdVVoTXA5eVF2S2FiUzY2VlA4akF6R2lBb1NvS19ib21LQnZaS3Vmc0lqekFxRUhKcWQxZXA1MF9BdFlEcE1XRnhzWVAzbEhrRUZ2QTUwbElSczBiall2WkRtT2Nrbmszd2g1ZkY2emcycG1RVWpOZ0tSTXFJdzJkZlR4a2lvdmFxWndzLUxiNHQ1TjRvTEpvYzF1VDFMcDY3dUlsYWJUQ3VORWMybEFhYXlVeG8taHQ4a1Y3MUxTeDR3?oc=5&hl=en-US&gl=US&ceid=US:en,The Economic Times
BANKBARODA,"Sat, 03 Jan 2026 08:00:00 GMT",Bantwal: Bank of Baroda Perne branch official accused of Rs 71 lakh ATM fraud - PulauJudi,Bantwal: Bank of Baroda Perne branch official accused of Rs 71 lakh ATM fraud  PulauJudi,https://news.google.com/rss/articles/CBMiuAFBVV95cUxORWpCNkItTWNVOXdDTlVZV1VDb3dmVFRwVzlnS0Q0U1RuRXROb3VJTGZMNzlCd0UwRDlKQzI1a1g0TnRFN2VhZUE4VVJxUkRtSDl2TEtodHFld1pwV2tSRjE2V3M5V1ZNeFBaX2Zhc09lOFhKc1VtcWIwWHZSdTZKc1BMUjR5eVdSbkt4X1BVMkxoVFlKQ3RzTGxDRmNPQ3pFaGx6T3pKanhBVWI3V1BfNW51ZHJDQkVC?oc=5&hl=en-US&gl=US&ceid=US:en,PulauJudi
BANKBARODA,"Mon, 26 Jan 2026 09:44:50 GMT",Bank of Baroda Plans $500 Million Offshore Bond Issue Under Medium-Term Note Programme - scanx.trade,Bank of Baroda Plans $500 Million Offshore Bond Issue Under Medium-Term Note Programme  scanx.trade,https://news.google.com/rss/articles/CBMi1gFBVV95cUxQM085dUtfZXRWSmNzLTVOMGRlc25jdkJ2ZlFmYWNDN3FxOFZPZG1vOFdESjFRTzZqc2l4ZGs4aTVNRWJIZjNsXzZ0MnVMendNakdBcHVLYUVVNGswcC1DaU0xZFNWTVFmNzNPWk5SRUd5RXZXdFZLSWtURTVWNEh3VlV5dTRYbU1rNFR1b0Q2NnRjbk1vTWhhZ2dXV2p1TFZCWm93UW9rY0Z4Ui05Q0lBMTlfM0RHNnpZV0pEUGIzcXZ3ZTdpSnNyM1FqZWY2R2RrdW1TbnJB?oc=5&hl=en-US&gl=US&ceid=US:en,scanx.trade
BANKBARODA,"Wed, 21 Jan 2026 14:28:52 GMT",Bank of Baroda Partners with IIFCL to Accelerate Infrastructure Project Financing - scanx.trade,Bank of Baroda Partners with IIFCL to Accelerate Infrastructure Project Financing  scanx.trade,https://news.google.com/rss/articles/CBMi0AFBVV95cUxNdWhlTTZzMHMzM1NpemFuYXMwUV93N0xpQkp4M29rQ2s0VlVGNTVLZnE5dktGV01KU2pFLWU2a3dJMzdvV2NLeDd0M2kwT0YyVG5RMmg0T1FWQUV2VW53aWlFaXJfZWVRN21VZTc1X2gxU1l3ZFBEYmd4N192Q3BtMVlBaktnM1JuTzcydWJVamt6RVpoenFkYWNDaUVqNGhPUUFtZVpSZW9kNEp2R3RLcFhrbm1ZZlMxZEktT3NRNlJLTWJrTi1hSDFVbkFPYVVi?oc=5&hl=en-US&gl=US&ceid=US:en,scanx.trade
BANKBARODA,"Fri, 16 Jan 2026 10:45:22 GMT","Power Of Technology, Trust Of A Legacy: Bank Of Baroda Creates History At IBA Awards 2025. - tripurastarnews.com","Power Of Technology, Trust Of A Legacy: Bank Of Baroda Creates History At IBA Awards 2025.  tripurastarnews.com",https://news.google.com/rss/articles/CBMivAFBVV95cUxOQ29ueE1pdWM2SmEwUEJMc01jYWcyWV9KZzU5dUc0VzREakk0dFU5bkdraGJEeF9wNWZvQ09CWjdQYzJzQUFtclc0NXIySmVvOWxkYlZtcFJWQmxGUGx5MVlIYTJIdEg4YnNkdU83UXF4ZjFzbWZQWDNIT3dpcVhDSFR2YjNPM1ZGdlJLVDEyZi1ScWVmVFRzUV92T1pzVVZaaVdPUzVza01FRzZfRklnVjkwVUJXZG1BSU94MQ?oc=5&hl=en-US&gl=US&ceid=US:en,tripurastarnews.com
BANKBARODA,"Sat, 03 Jan 2026 08:00:00 GMT",Andhra captures 25.3 pc of all proposed investments in India: Bank of Baroda report - thenewsminute.com,Andhra captures 25.3 pc of all proposed investments in India: Bank of Baroda report  thenewsminute.com,https://news.google.com/rss/articles/CBMixAFBVV95cUxNS0x6ZC1YanpsVXV2RFdVZDJVTkY5anJrVFN0WURXdUdXbkRHVklWRDMxcnNaaTMtX2NYM2xsQXJnZFh0U1pwQU5ISTFDbkJ4N3JvY2FQN3B5T3dkUmY1Z1RUemx6VHJjbjdqSC1BN1NDckVNYTc2VW8zWHlNRFJHdTZoLTBKeTV2bUVOV253aFA2TWczcUhHSWxmQjQ5UlB5UWR4bWdFVy1vRl9WdVlEaU5iMC1GSUV5VWdFTW03QU1aNldM?oc=5&hl=en-US&gl=US&ceid=US:en,thenewsminute.com
BANKBARODA,"Fri, 02 Jan 2026 08:00:00 GMT",A.P. bags 25.3% of investments proposed in India in first nine months of FY 26 - The Hindu,A.P. bags 25.3% of investments proposed in India in first nine months of FY 26  The Hindu,https://news.google.com/rss/articles/CBMi4gFBVV95cUxPQjJwRGo3dGt5SWRjc3pCMm95eTlLSFBndnFoY1NXaDVaNlBwZ0NEaWw4WlZvSHdDUnBWbnFZM1ZkalJGWDJrTmxNZUVMc1NjWloxQmdTZ3hjZ1lSbFEwa2ppcG5GelFTUHBNN1pKTmlrQ0FLYnVaYzVQSUdGTm1GWGlGWFYzUHdSYUtPLXRPX2xGVW1WVHd1dURpZzl3SFF1bHp4RUpCLVlQa2lCakZUUU01ekxBeWotWWZhdFQzNEZjUDUwTldoSS1scVFxblR5aTV4U1dRZmtiOHNNU2ZXOUln0gHoAUFVX3lxTFBidnZfX3d2cGt1M2VQY0ItV2RLYnAxdjZ6MzhzNG5tSUNmaWhHZm5GYXM0LXhlUTczbE1Zc2I5VTRZRXpxVG1pQWdabUpqYjMteE52SnhXLTBuemJ5cC14V3JybGlrdFVSdlVmdkJLb05KZWloN2R1TFBtVm95TnVuOTVWcTA3NFM4dTVqbUJRRHotWmVpLWVjNGxfLU1uTUE1QkgyclQwREtsVXlYdTd6UzUyZFBNWTRIa0xRY2w2VGVPNklYM00taUx5UWpoalZWNUlVQllLRkNTQm1sWER5WngtaFdrUzg?oc=5&hl=en-US&gl=US&ceid=US:en,The Hindu
BANKBARODA,"Sun, 04 Jan 2026 08:00:00 GMT","Stocks to Watch, January 5: ONGC, Oil India, RIL, JSPL, Sobha, Cupid, CIL, DMart, Bank of Baroda, Bajaj Finance, Nykaa, PNB - Upstox","Stocks to Watch, January 5: ONGC, Oil India, RIL, JSPL, Sobha, Cupid, CIL, DMart, Bank of Baroda, Bajaj Finance, Nykaa, PNB  Upstox",https://news.google.com/rss/articles/CBMi_wFBVV95cUxQTlhReDg5a3J6Wm5LWHFNYkQyeWFDc0RFVFNxUER1dXY3YjFfLVNsNFlZNGtVLTh0UU45R1laX0xpdTlhbjRlellyMjI2ZGFDVGM1OTJmWkhOaWJRUFA4anpzQlhLTWMyczJ4cXdtOUZSb2hTRVJELXFuWnl2YkxMdjIzSnIyQ3RUQ2prVUNFR18yNFZqbzM4R0pudTJfQm05YnpjRHRrZGM4RWxjYkdiVjQwUE9GbGxxb21TcFI3d05GU2Jia1JkbmFXSzdfMUlmLTR3Y2FUOG96cEo3WFhXYTd0TXQyWEd3OU1vYlU2T0sybk9WWjNsNWs1S2xlR3M?oc=5&hl=en-US&gl=US&ceid=US:en,Upstox
BANKBARODA,"Tue, 20 Jan 2026 13:23:38 GMT",Bank of Baroda Re-designates Key Managerial Personnel with Updated Nomenclature - scanx.trade,Bank of Baroda Re-designates Key Managerial Personnel with Updated Nomenclature  scanx.trade,https://news.google.com/rss/articles/CBMizgFBVV95cUxOUUJpUW13aV9sU3JoQVJwOXZURVh0OEFOdmZTR3MyX0Z4NDhONFJIYTZBaGFaVFF6YWRIWWk4aXZ6RndnSkYyVEZrVk9DbndjWDgwQWViSXZMbmJkVDVfZnVhRlRGbm5zdVNCbmw4c1NtSUpjWGdnWDRHbXNEelprSUJzZlM5ZHVpVXN6ZHZpdEhxcmdfNkh3OVZNWUpYZUJvTFpKZklXdFc3U1FmVk5LOEVqbFVRWFJwdEIxNDhxQ1RFdVlZLXA4QlVROFh4UQ?oc=5&hl=en-US&gl=US&ceid=US:en,scanx.trade
BANKBARODA,"Tue, 30 Dec 2025 08:00:00 GMT","Five Stocks To Buy Or Sell: Indian Bank, Bank of Baroda, SAIL, JSW Steel And SBI Cards - scanx.trade","Five Stocks To Buy Or Sell: Indian Bank, Bank of Baroda, SAIL, JSW Steel And SBI Cards  scanx.trade",https://news.google.com/rss/articles/CBMi0gFBVV95cUxNTDhnWW96cmFkbGh0WDY4NG5oTlVTQmo5ZF9jUlVid1g0S1NXSm1kam1iVlZZQTdzaWQwZ3dlYUszVlJiMEhfeTBteklVYkVkYmU5R292UER1Z0Y2anNOWmV5bHJMamdBSVJzbVRlajFGNzdGaWFUZkViUFBxWXdBVmlqX1gxclpMQkNDM0JzQW1QbGwtYzQtaFBZZ2NRVGVkeENOcFowM2FJRWVvbzJrTDVtMjBONkozNDAxRFktTTduYWs2eTA4TWJ2a2hVVmI0bFE?oc=5&hl=en-US&gl=US&ceid=US:en,scanx.trade
