ticker,date,title,description,url,source
BANKBARODA,"Fri, 09 Jan 2026 08:00:00 GMT",Bank of Baroda Receives Initial RBI Approval to Transfer Primary Dealer License to Subsidiary - scanx.trade,Bank of Baroda Receives Initial RBI Approval to Transfer Primary Dealer License to Subsidiary  scanx.trade,https://news.google.com/rss/articles/CBMi4AFBVV95cUxOcFpWcU5BNXJvejlJYVZxQ0NJbklDNkdxMGRJeHJWTU52Sy13MGFPVkxldTJBRFpiaEZYdlM4RXF4ZlhQbG15Q0hiOGg0cUxHYVdfQWxvRnJSRHhRdWFwV1BqVEo1eVpPdzlSQ203MDAydE42bWoySDBnMkdUMGpfcGtUV1gxM1RXaUE4WGpUNFNVNkhqUkY2WlJ1b1I2eDMydXpNcmlyTXh3WnRQQktNQUJ6R1NOejhoaTdyamsyZVVWeHRaY0dOZ0VCNHFhWXVTaHdUNFllT1YtTjcwMzRHeg?oc=5&hl=en-US&gl=US&ceid=US:en,scanx.trade
BANKBARODA,"Thu, 22 Jan 2026 08:05:02 GMT",Bank of Baroda partners with IIFCL to boost infrastructure financing in India - propnewstime.com,Bank of Baroda partners with IIFCL to boost infrastructure financing in India  propnewstime.com,https://news.google.com/rss/articles/CBMiyAFBVV95cUxOOGI5TEctbmt4YXNUcU01OTAwamxERnFmSHJoVkNIQ1NCN0lEbU00VlI3R3gzVnhsLTVrMVo2VFhtb2hhbzZNbW5VNWl3dWQxM05VN2lzTkw2WHVnVGhXVHV3Qm1Qako2OHlYX1MzdWROSU8yMnJGZzAtOGdYQW94OVczZ3AwTXpZSW1aUmRWSzJFdThDa2s4cUQ0VkhyaWNOaFIwazBROUE3WE56bHdJM3V0VHpETFpYYjV1dnRCOEdDZExheDJ4cA?oc=5&hl=en-US&gl=US&ceid=US:en,propnewstime.com
BANKBARODA,"Mon, 26 Jan 2026 09:35:02 GMT",Bank of Baroda plans to tap offshore market with $500 million bond sale - Mint,Bank of Baroda plans to tap offshore market with $500 million bond sale  Mint,https://news.google.com/rss/articles/CBMipAFBVV95cUxQdTNRbXhIWmwxdU4tN1BfZkVPVEczc1ZrZWxDTGJSOFhBcVVxc3pKemdIOFItd0JZelJHM21kRjlTQkt1NkRWR1NTaVVUUXQ0bVpBdXhNeHBpOWdYR0s3djdleTQ5LXpncUlHVHRjSkVBaktBTU1pVHE3SmJEdmFySkJJbkV2dHRkT0hfS19XQ3IwcTFIQlNZLTZTVnNlbFhwSzlMRdIBqgFBVV95cUxNLTl1OUdNTUhUQ3V0cjB4TVRtaG5neGhqa05ITi0yRDJNMlJSQjV2TTBONWxVLXVRd213T1Z0TlpaOGIxT3M0bVhSVExuS0RVOFNKWFBQdDNpOXVvRXRHUDdyM0JUTldWdElZbUtxOTVaLWMzU1Y1aExFenZWQUF2N3V4ZHd3Snp5UUFmRVhuU2thdVpfekNEZnkwQmlRcEVDZUZWblR1QVBaUQ?oc=5&hl=en-US&gl=US&ceid=US:en,Mint
BANKBARODA,"Wed, 07 Jan 2026 08:00:00 GMT",Bank of Baroda inaugurates Regional Office in Madurai - theweek.in,Bank of Baroda inaugurates Regional Office in Madurai  theweek.in,https://news.google.com/rss/articles/CBMitAFBVV95cUxQd0VoRkRTaTJJQXdPTkUzZ1FYTUF2WFNsYjdQV0wyaFZBay1jbjBfdHRsMURSVzI5NEx6N2hzYVFrbnhCVEUzN1VaOW9BT3FVSlRuRzRLRXJnRzZ0Rkkya1hvWGdKWGlPY1hkZzMwb0I4M2pHdDc2bFJCUWEwZ0pGZlYxSk83azZIaXhLWlZ2SkFGN1pTSUhnVjRyRGp2Mkk2NU5kd1lvdHR3T3hjVDk5MDNnODfSAboBQVVfeXFMUGtXRHpQM0RlbGF4dklDN09jVlAwVjRGbGpGanQzSG0zU1JtRHJUZ3FPQjBOcm4wMjZyZkN6ZUNWUEhhTUd6c0dwYWY2Q1haQU1PZncxS2luUWNGeUhzbUZjOElEVTE5YmtoSEFpam5TZlpHR1RoeElpRHY1MThDT3RhRGRWdkFPOWo2WWU4eEExMmhFaEdoWjl6MWJjVGIwNDY1bnI3TFM2NkYwWU5pSkpPZ1pSOUJTWjlB?oc=5&hl=en-US&gl=US&ceid=US:en,theweek.in
BANKBARODA,"Mon, 05 Jan 2026 08:00:00 GMT",Bank of Baroda gains for fifth session - Business Standard,Bank of Baroda gains for fifth session  Business Standard,https://news.google.com/rss/articles/CBMivAFBVV95cUxON0kwZXZhWkZSQTJ4M3g2eHdJcnJPUjFRWXpDemtiNVpWdXBxdkI3eXlGa1RHX3Z5NjlDN253RTdqZnFiYVRYaEFIYmUwaGxVczYzWGVsS0hLNjFLSHNWTm1nbTd5TjFLMHkyVE1OYU5KbVFJWWI3QkdpSkJ1RnNQcnpiWWFocmlMNDA2ZzhZanlsMkgtd1pXYlBIUHhlM3lhZ3NSZk9tU3ExM2Y5ZlQ0QVp1cHVTTFpIUklfatIBwgFBVV95cUxQZXlSXzdfMjl4amJ3d0RaYjFFNjhORndEQng2Vms4R1F1MWhmQzdiZzZSVUhHeWJmNDNVMjhQekctTTVVVFpzX1dyLWNJc204ZVd6MHotQ3dyLWt1bEI4clFLYjNvRG03TDdGUF9qTXhjZHZOME03LW5FTDNSVy1Idnh5MS1UaUFkdXgweTdCOUtGVTl1TmI0Z1BZcHBDbjFkbFJ5N1c0VkZNd2NKQUFNSVA0dk5PYlF5NWRSNUNJWTJoQQ?oc=5&hl=en-US&gl=US&ceid=US:en,Business Standard
BANKBARODA,"Fri, 02 Jan 2026 08:00:00 GMT",Andhra Pradesh corners 25.3% of FY26 investments: Bank of Baroda report - Business Standard,Andhra Pradesh corners 25.3% of FY26 investments: Bank of Baroda report  Business Standard,https://news.google.com/rss/articles/CBMi0wFBVV95cUxPRzQ0aDVKQ2hZV0JiYmxuMFpLMmZiVUpYRGdLeUJnaHVXVjJpWHNVZTVIbGFOeTFCT0hBR1BfaWFoY294MTBRRV91d0pzX1FTUHZnMmt3SVQ2Q0V4WXRLYi12b1hVX2ZkRlBVSHd3ajl4c1UzLXlhdk51azdIWVRDMzRVYmRRRmk3eWV2UmtrNGlWY3RQNnN0bEJqVENaMEV3TGphVmlFeTlOQ0J6WUpJYjBZaWY2ZHozcXl0Zm1qY251MTgxUWdCVkV5c20xTXZMcHlJ0gHYAUFVX3lxTE1PTDNGNlA5M0NlbDRpTFlVR0xmTXJXWVBPRUFtUjM5NFBmTkc5ZG13dU9MMWllTTJfeEtYODhieDdtZFNMbU5oalR1TExwTXpVRDdZLUp5SjNSdjkzNVpVSUU0QjFEVzNsRm05OU5tRjlOblQzVE9fZ29YbkxSTGlZUHUzZkpnVkItNkFPQkNIb3o3bWw5bTAwNHF2ZlVieG9UajZJMmVuWVNNaTJCMER6RU5NMjVFalNaMlc3eDJreFBUOHFBWlZpN3ZfdUNBNVZZNVhrd2ljUQ?oc=5&hl=en-US&gl=US&ceid=US:en,Business Standard
BANKBARODA,"Thu, 01 Jan 2026 08:00:00 GMT",Bank of Baroda up for third consecutive session - Business Standard,Bank of Baroda up for third consecutive session  Business Standard,https://news.google.com/rss/articles/CBMiyAFBVV95cUxPMXFwdm9KMEM4bzR2elNsdmU1YWZIajlZLUNNSEVLQS1kQlhjMmNaQ0FPbC1VckRJSHUzUF9RYXczYUpVMFBVSXVmQlNsTG10aGd0STJvZGxjeFo0LXlmRndsVkVVcGF2eXNCMjUzWlhZLTRRbFdkcjh3ejhmZW5LYjZ6ekVnNTlOVDFYQmxFNjRqeHNWaGRxVWZPdEs2Nm85NzdRZWx5alBmY2ZwN1YzZGxaQm5tZGtOQ0E2M2NIUlJqOEVPa2x5bNIBzgFBVV95cUxQemxsdnd2TWcxT25YRHY1Y3ZGSHdkMk4xM0xqRS1sZkdsb0dQUXB3ZUJrQWptSnA0aEtrYUc1Y3loeWR2RXkycF9ZcGZuVDl3SDRkSEpTcXdTZDdaTDR6RzVyV1lZOVdoeFhvUXN4NDl4WXZtSC13VnU1aXlCVGx4ZV9RX09yOENyekY3XzZUdGVGTGpHdTFFenFqdExHSVVzeTdkaEx5Mmlhc0FZcmcxblZrdGIyTDVPcEJ4SFVBM1ZWS2NqRmxDVmFtQWtEUQ?oc=5&hl=en-US&gl=US&ceid=US:en,Business Standard
BANKBARODA,"Sun, 11 Jan 2026 19:42:53 GMT","Bank of Baroda Q2 results: Profit declines 8% to Rs 4,809 crore; asset quality improves - MSN","Bank of Baroda Q2 results: Profit declines 8% to Rs 4,809 crore; asset quality improves  MSN",https://news.google.com/rss/articles/CBMi1gFBVV95cUxOb2xpTFFXVXk4dHd5aEpRX1k2WVpFeUVEZm0yTHFKSHh0WjRCSWFzOHJUWVVuNm5HN0FYWnZhenJtUHZwcUpuV2w2N1FNZTBnUTIzVmM3Qjdvc3YtOW93ZzhiZDdDbDFwS0N2TXNUOXEzWEwycDZqcU0wS0hFU1hldmJxQVY5cjRNaDQ3dEN4ZXl6UTBHVDU5bnpNS3NrRUkxVXdmSExfNVpjTTJ2ejJ2cXJFd0pvVmtGd1FIeHNoX0EzbUxmNHVFUjlNalVIelY1T2dnT2ZR?oc=5&hl=en-US&gl=US&ceid=US:en,MSN
BANKBARODA,"Sat, 17 Jan 2026 01:37:06 GMT",Bank of Baroda partners Credai Hyderabad property show - thehansindia.com,Bank of Baroda partners Credai Hyderabad property show  thehansindia.com,https://news.google.com/rss/articles/CBMiogFBVV95cUxOVFJFa3YwNVRRdTQyOXo4aVhqc2dXQmo2eFdXTUZxbWxUeXE0bjNOaTBVX1B3eGlYRjVmYjZtY0tEUVBNNlRQT3hzNzM0anpZV3A4b25JZ0ctVGhwWWVKYnV6REhvVjVVTlROMlFtZ0o2SHJseXVwY1lCWElQeTN4Y01EM1FFNWVwVkhZTTU4NWJVR1dJckxjY2lueWNVazJnMkHSAacBQVVfeXFMUFBNb3hqenF4M2RMZ1pydDF1VkJkaE4zMXZKNkV4eU9oeVNYc3p6aUNPUGdxekpMem9WdnlScnhkaHBfNGZkc296RHZwVlMxX1JoVEdTS1RtMUVZNmhlUTZSajdpNnM1dE84N3JSelVpejZ6VUtZdGI1dnFJeEJ1NUZrVVBBTUk0LXlNbmZRWjFGU0Z1cF8yZFMyMHhLdnhhaktXRl9yU2M?oc=5&hl=en-US&gl=US&ceid=US:en,thehansindia.com
BANKBARODA,"Thu, 22 Jan 2026 10:07:42 GMT","Bank Of Baroda Hosts Clean Energy Summit 2026 In Mumbai, Driving Dialogue On India’s Green Growth And Renewable Financing - SolarQuarter","Bank Of Baroda Hosts Clean Energy Summit 2026 In Mumbai, Driving Dialogue On India’s Green Growth And Renewable Financing  SolarQuarter",https://news.google.com/rss/articles/CBMi7AFBVV95cUxNSkVrYkxpTjlwdTlsVnpZbWlPYXUzdlF2dUdCSlZSQjNQdmFnRE9LRXUzMENTbjZTV1M2SnVtUVBnRi1TTF9XSEp6U0pUSFhGcmFDV3Q0all5SjlGTEUxem9uU1J4RlpUZGVDeFg4al9RUkwxUWl6QXNlRDNjUm1uZ1JOX2JGclVKc0ZWbjFkZEw4ZG5WdGFfMDdMZXY0QXkzMzBTRVFxRE5tYUF6aFJGSjRTR29lVlRKa1dTWXEtNzdSR1JGTEZnMm4tMVM2S3BkSTkzdnNGUGdKUmYtckNnUGExMkctMElxUDVXTw?oc=5&hl=en-US&gl=US&ceid=US:en,SolarQuarter
BANKBARODA,"Sat, 03 Jan 2026 00:16:19 GMT","IndusInd Bank, Bank of Baroda, TVS Motor Company: How to trade these 3 buzzing stocks - MSN","IndusInd Bank, Bank of Baroda, TVS Motor Company: How to trade these 3 buzzing stocks  MSN",https://news.google.com/rss/articles/CBMi0wFBVV95cUxOX2tmbnU5QVlHaGMwRzFNMjZMX2l5M254b0JBc2xyS0ZRVzBiTHV2a20xUjFta1RPMWl3UUlFN250eUwzY2c0cHFDVzh2dlVJaGIwWGpsaHRweWZySEJCc0pZT2VPS3dLb21nWmU3TUdhSTAwZldsSlgyLVZHOWNfQjRDMEZfQXNjSlZYU1k3WlVuT2x6NlZ4d2djRlh3NWI2bHlMYXQ5Wm12aHZsUmhHYjJKZXk2dzgzTWhuNTZMQk9WQ0phUFRwamxKQTNzcjh5TXdZ?oc=5&hl=en-US&gl=US&ceid=US:en,MSN
BANKBARODA,"Fri, 23 Jan 2026 09:33:55 GMT",Bank of Baroda Analyst and Media Meet Schedule for December 2025 Results - InvestyWise,Bank of Baroda Analyst and Media Meet Schedule for December 2025 Results  InvestyWise,https://news.google.com/rss/articles/CBMiggFBVV95cUxPZ1h5TUJZemY1aEdhOGhwakhqX3pBbkZwVFFFZzlPVDRHc0F4RmZ2Szd3cTVHM0h3ZzVNZXppQzd5Vy1BeHVlbWhnQ015dzQ0cFRvT2ViZmlRX09sR0NMd2Nuci1SaUFmZUhzQ2NIM2JRVC1GYnpoTjFTTHZKNkNBX0hB?oc=5&hl=en-US&gl=US&ceid=US:en,InvestyWise
BANKBARODA,"Thu, 22 Jan 2026 12:57:01 GMT","Bank of Baroda, IIFCL Partner to Strengthen Infrastructure Financing in India - Siliconindia","Bank of Baroda, IIFCL Partner to Strengthen Infrastructure Financing in India  Siliconindia",https://news.google.com/rss/articles/CBMizwFBVV95cUxOSUVrN2ZLeGZlUTNLZXFMRGoyN3NqNWtPMDNzYnYyS1hyQ0lPRmVnSENuM01QbVZTeG5ocnJSVnA0Z2xUYko0TTNEdUp4ODRYamNMdldlcHpFY2hmUU14RjNKZEN4V3Jvdlp1VUpYREpCQXE5SlowbnF6a2NUdGJ4WnFFTzk4Z0lMTVo4cTBncmk4Sl9fMUNfaWp0LThNaHgyclllSF9mLVAwYm1YZEp1eFJXVnA2N3FMWE9XUUxRTUZ6RU9WRk8wQjRMVGhRNzA?oc=5&hl=en-US&gl=US&ceid=US:en,Siliconindia
BANKBARODA,"Fri, 23 Jan 2026 10:38:44 GMT",Bank of Baroda convenes Clean Energy Summit 2026 to drive India’s green growth agenda - Mediabrief.com,Bank of Baroda convenes Clean Energy Summit 2026 to drive India’s green growth agenda  Mediabrief.com,https://news.google.com/rss/articles/CBMifEFVX3lxTE52cXlvLVhERG5mclloOWlsYW95MGVCMFAxTVNTX1dtbkhlaXQxUnFhS0syaVh5ZVFTSVpxOEFrbXNhd0pYSXZpMXA4dnlsME5UMENueG0yRzFGc2drbGF5X0RYNG1tZ1Jua1UxeDN6VXd5bnR3TWtxSERmTGg?oc=5&hl=en-US&gl=US&ceid=US:en,Mediabrief.com
BANKBARODA,"Fri, 16 Jan 2026 08:00:00 GMT",Bank of Baroda - Vedanta among 8 stocks that hit 52-week high; rally up to 20% in a month - The Economic Times,Bank of Baroda - Vedanta among 8 stocks that hit 52-week high; rally up to 20% in a month  The Economic Times,https://news.google.com/rss/articles/CBMi7gFBVV95cUxPcVRBOUZkOTZmS1Z3SmxPN0RVN0ExUF9ySXpTRXZhc0xtZUpWT0NmSFRFVDBVZjhJWEk2RnBDdVkwZjZJQ2t4eFZCX293YmpMZW5DRDMzamFzSkM3bHhTNzdYSFVlNW9XTWxsNmphSzhkeE8yMWI2SW5CbmJ4dldoYTZub3FGTjdWNFdQQ056ZU1LWFl1X05xWWhSU25Wc003bDFFaVJLdzA1Z20xSXpsN21tREw0OW1lMHBFa0FzYVJJSk9XcGNjQk41bGYwNzBGWWh2V1VjT2xVN2wtb181WVFQR29wdHdtZjBhRW5B?oc=5&hl=en-US&gl=US&ceid=US:en,The Economic Times
BANKBARODA,"Mon, 19 Jan 2026 08:14:14 GMT","Bank of Baroda Plans Long-Term Financing for Infrastructure & Affordable Housing, Launches Salary Account for Central Govt Employees - https://indianmasterminds.com - Indian Masterminds","Bank of Baroda Plans Long-Term Financing for Infrastructure & Affordable Housing, Launches Salary Account for Central Govt Employees - https://indianmasterminds.com  Indian Masterminds",https://news.google.com/rss/articles/CBMisAFBVV95cUxOdlpRM3Y3UHBMQzN0dWY4cDJ2c0hKdUxteFpsX2tNSXlXRWNBaVVpdGlXYTI3cjMtYVpBek1jbTBwZjNjdmZIY1F4UjZSY09lbUlza2xrSnF5NGtTWUlFb1B6ZGZWbmtxX1JoenQzMF9ycXFLUk53QlcxWEZqbzNUNjhIcXA0UEg2MHJBalhWZUxVQkVCNlBGN3FNcjgwbG1WaGptaDYzYzhRSTZYOUNYSA?oc=5&hl=en-US&gl=US&ceid=US:en,Indian Masterminds
BANKBARODA,"Mon, 19 Jan 2026 06:06:21 GMT",Bank of Baroda Board to Approve Q3 FY26 Financial Results - InvestyWise,Bank of Baroda Board to Approve Q3 FY26 Financial Results  InvestyWise,https://news.google.com/rss/articles/CBMihgFBVV95cUxQaFUzeUZON3hkbDc5azkwZERUR2poeVVFNjVGR3VyNTFhM0phdm5MeGpLYVZPQ3ZqaHpqb0Y0NFpXZ2lMYnNqMGxkbFBIRGJFTmNLR05Hc21faDJwS1JMTUJ2Z2luN09jZUNnZElpTlYwVUJUYjhBWjFKdEFEV1JWblc3OVdyUQ?oc=5&hl=en-US&gl=US&ceid=US:en,InvestyWise
BANKBARODA,"Fri, 23 Jan 2026 12:34:35 GMT",Bank of Baroda To Consider Raising Funds Via Long Term Bonds - InvestyWise,Bank of Baroda To Consider Raising Funds Via Long Term Bonds  InvestyWise,https://news.google.com/rss/articles/CBMie0FVX3lxTFBiVW9Tek5XSVJpSjhxb3V0VDJEWk5nWHZxVlNkcU9MaVJBak9yejhncm51RFl6NmoyUEs5eE5HYnFSc01BMEc2Z09IODg2ZTRvNUJKM3BhN0J5S2FRY3BBbkFJLTdOaFVuU0RVNEY5endfWllsd1FFeHo0MA?oc=5&hl=en-US&gl=US&ceid=US:en,InvestyWise
BANKBARODA,"Wed, 21 Jan 2026 11:15:10 GMT",Bank of Baroda Partners with IIFCL to Boost Sustainable Infrastructure Financing Across India - Indian Masterminds,Bank of Baroda Partners with IIFCL to Boost Sustainable Infrastructure Financing Across India  Indian Masterminds,https://news.google.com/rss/articles/CBMipwFBVV95cUxQN3lTODhuWGhJRlRrSjhqSE5Oaktvd2hyd0wxOHpjVTY5S285bVBEWlFQdnBIajhfNHN4cWNWZDVRdXp2SjI0X1dlVHFzNHFMXzZfdl9BX3RoaVh3MWw2dElNZGxnZmkwV2QtZ0Z2cWZkVjhfNnU5cGdrWTJOaGJLQkJjYk1vUnFrQVRGZmczcnhDZFNSckxVWkgwak9PSThXSExzZmlUcw?oc=5&hl=en-US&gl=US&ceid=US:en,Indian Masterminds
BANKBARODA,"Mon, 05 Jan 2026 08:00:00 GMT","Stocks to Watch Today: Bajaj Finance, CSB Bank, Marico, Nibe, Kiri Industries, Ujjivan SFB, Sobha, Bank Of... - Moneycontrol","Stocks to Watch Today: Bajaj Finance, CSB Bank, Marico, Nibe, Kiri Industries, Ujjivan SFB, Sobha, Bank Of...  Moneycontrol",https://news.google.com/rss/articles/CBMisgJBVV95cUxPaldOU3N4cnJNVF9hMTZrdDlBbF80QmxfSV9iOExaUHNjN3ZOQnd3eHF6RndrNjR2QVZCV1BWR01QQzJ0VlQ2bnRJdlhuTlhFc2JUXzhsYjd3MjBNQnVLRm5CTXVQekZyOEliaXNlZWVibVI0VnpJdGtTazhzRVBoVHd5YmFKMG9pYW1UQ2FrYmNqV0Zna29HQVRsTm5IU3F5X0N0MHFFRjZqbEk3cjVFY0R2aXowb1ZmbUZhamNvZVdMUmlQdlhFZ1VKNnJQNllWbC0yRUkwbjZrOUp2NW9TUVYzWVpIN3F0ajRiaUpWWnQ1b0Zla1JjUGRYd2o4VTZwZTczUEtmck15NEVsNTVNX09xQlZXQU1UeVNvYVpGSF8zWUpXbVpyRl9sNlllRnl2TGfSAbcCQVVfeXFMTnZBR3QyVlpSVlUtSFpkMTFMcWlrTk9rSUNDMElEQXJwYVBra3RPemZmemV5eUV6VlVZbW82WlRVdm5HQTdEUGp1UHM3SjBkVnJHdEc1aWdZWHFNWmI2WFZTcWJ5emw0cU91S0hoWWJ3RFpnT1JnTFMtcFZ2YUhLTERaWk02TUJTN1pEQy1iYld3WUppVkRlYTlfQkJZV3o3YjdFUVJYOHJTVXQ4eUFNTGF2eHBBOVpNbjR0Yy1TeWZ5UkZJWHNCU2ZNdVJzZFpGY3diMl9CU1lSMnNxMUFtTFgxTUpaOTZuUHV6X3hmMnhmSmhMT1cxdW95UW5CcFV2LVpEN2VpaW5wNVJjS01QSDFzeTZPaVBTVkN1T21vdVNaNVRPYUNRQ1UwRHZCdUdteGwyNm9OSzg?oc=5&hl=en-US&gl=US&ceid=US:en,Moneycontrol
BANKBARODA,"Mon, 19 Jan 2026 11:18:38 GMT",Bank of Baroda - Insurance firms cut stakes in these 10 stocks during December quarter - The Economic Times,Bank of Baroda - Insurance firms cut stakes in these 10 stocks during December quarter  The Economic Times,https://news.google.com/rss/articles/CBMi7AFBVV95cUxPelZmMXVlQmFBNG93WHVzMWVjemhzX0l5ZkowXzZHbGxpQ29lRjM4LXVXbUpwckhWMkgyYzVHV0V1T1J1M2dqay1keWYwVFdzcmdXeldWcWVwYXkyTHotbGFwMUg0UmJKcjZMdnBxeUlZQ0JqVHY0UkE2Zll6N25fcmlsamdURDhNNF9feVZWLTVRRnlvRDFXbGx4eWdZaHRyRWpUTVBiUWNLdS1JZEU1M29hMU4yelNIMFBUSldGaWxrUS1EWl85QmpRZndnU3RkNUoyNl9Hb0NRLWJsME1uOU1kc2RnV21vM25TYg?oc=5&hl=en-US&gl=US&ceid=US:en,The Economic Times
BANKBARODA,"Thu, 08 Jan 2026 08:00:00 GMT","SBI, PNB, Bank of Baroda, HDFC Bank or ICICI Bank: 5-year FD rates compared – who pays most in 2026? - The Financial Express","SBI, PNB, Bank of Baroda, HDFC Bank or ICICI Bank: 5-year FD rates compared – who pays most in 2026?  The Financial Express",https://news.google.com/rss/articles/CBMi2AFBVV95cUxOanZlRG9Ia2phY0lVdUFFRm1NQU5pdy1YN25UeV9IWjVtTWFqRkpoeEppWGZGaTBteEJZY3ZIMlRwNW8zTHNhMkZNLVpIcTVPdG44Sng0azBJWERXZHBYVThwSDZ1SVEwRnV4UFEzck5xeXdIRU8xeWxLRE1reUU2cUtCelg1Nl9FdGNtdUVJc1ZaY1lGbHBobm9tNDFUYzdlR0l0OXluNDZYUkVLV1hoZ3M4dUJNWFcyVmRVY0E1MkxBMGdMckVxWVFjcUVxQW0tQkk4RnluY3rSAd8BQVVfeXFMTkNsc1B6UGZ4VXFaLV9naVl4Z2YydkthUDM2bDBkcU83SnlwUEhlT0ptVzhzSFQ4elQ0NVhGVEh6dzloS2pOd2RzUVVsNUxpM2o2bGZST2hYLThET0F1MW1Wem10T0VvTlpsT19hTUxBdVdCUDV1V0VsYjdXeVlYVmwtUGw5MmlwSnphdS1rLXRxTTlpQjAyb1pQLVZMTmFfWTZfQlBqWldIMmhBVUdXUGNvWXUzV2NrdHVUV0NBa1FoOFdpNXlIbUkwclZmT0ZwZmhIQU93eXNuVFJoeE5DWQ?oc=5&hl=en-US&gl=US&ceid=US:en,The Financial Express
BANKBARODA,"Tue, 30 Dec 2025 08:00:00 GMT",Bank of Baroda Limited (BANKBARODA) vs yyy - Analyst Upgrades & Outstanding Growth Opportunities - bollywoodhelpline.com,Bank of Baroda Limited (BANKBARODA) vs yyy - Analyst Upgrades & Outstanding Growth Opportunities  bollywoodhelpline.com,https://news.google.com/rss/articles/CBMihAFBVV95cUxQZ3pmRmg2U1QzOFBOY3NJUDZzdjRsaTVQOXJ0eHRSQzV2cHlBSm1EeU1BOFB0TmlOaUtwUEFHTDlKQnBQejFIUk9NVWRHT3ZJNFBhUDZFZlhtZkVHVG1nWXZwTW41MVJ6TjRkTHhNaEpzN3F3YjRfOFlhaGJrVDlKQ2I3MFM?oc=5&hl=en-US&gl=US&ceid=US:en,bollywoodhelpline.com
BANKBARODA,"Sun, 28 Dec 2025 08:00:00 GMT",PSU Bank stocks fall for 4th day: What should investors do in 2026? - TradingView,PSU Bank stocks fall for 4th day: What should investors do in 2026?  TradingView,https://news.google.com/rss/articles/CBMixwFBVV95cUxPZmZ4ZXQxV293RkppZUdhVjBBT0ZTNFdjZV9UUDJOWFd2d2ZxN0lnVUpGTUlIOTJSTjNJSjZsNnRRbG5FbGNLTnRqWUR0dEhpS294dzhuaHBja2ZheHlRLWdhTnRDMjdaMldmc29TVUJ5RkJfMXBwdUE2dnBEeGQ4c24wX1l6cDU5UGNyUGVWR3JfMGVrMFRKZ0N5TUFDMm1rOGdrc3p1dmNpOHlhRXliUlBQRGJXSk1neEJkSlJhNlhNenU4XzV3?oc=5&hl=en-US&gl=US&ceid=US:en,TradingView
