ticker,date,title,description,url,source
CANBK,"Sun, 11 Jan 2026 12:19:14 GMT","Bank Of Baroda, Canara Bank, Jana SFB And Two More Banks Revise FD Interest Rates, Seniors Can Receive Up To 8% - Outlook Money","Bank Of Baroda, Canara Bank, Jana SFB And Two More Banks Revise FD Interest Rates, Seniors Can Receive Up To 8%  Outlook Money",https://news.google.com/rss/articles/CBMigAJBVV95cUxQUnBSVGtub3p0TmR5d1pSc2ZoWEZ4Z1dRR1drRWVzWkhfWEhYWk9DbFliYnhFUlhUanB6bVpWRVRFYk9WQ1VDSzdpYjlELWpHYW91Zm5GVG1wWkR1c21RcV9xLXA0emNNWGtua09oeXJxM05JWTl5OGZUT2swVlhSQjc0Qi1KX1VNNnZKQ1pNUkRTdV9lMnpRVEZsejNZa1hUY0p2c1M5MS13ZmNqWG1PWkZlTW01NU5xWEIwbUxRQ3NMYTdzRDhuQko3dDJGQmlqbWRMNndsQlQ1MG8zQy1IMVlEZGRyOVk2LUZ5YVMzc3RHSlNNR2hjSm5Jb05nTWxZ0gGOAkFVX3lxTE11VU1jMjBEdDVkSjNVNUg5Q0laVnNNX2NKZjFEemV4UWdvUkVrc0Z6cFNWOWlROW0xcU83RG96SWxZTVd5TjB0SmNqWHBFeDE0NGlYdHZ6M0lkNWNYQ2ZKZzQzY3hmejlqQXo1cTk4NE4wLVprNEJQLXBaUTN0RWFmd3FUekV4eGNVWVFLdVp6MU84OExuTU1CRFo4S1R5UlZmcExBaHJqemxRX25kSWgwZnM2WTJHX05PQzBsbnFWZ1NNblctempYRDd2ME5PenlwOGVRUGNIcUhtTnFIaTVhbHY0bGQ5aWIySFlNTEJfbkRuQlRsSlF6YUhZYjlzMXI0VEZ1SjczamF1anVTdw?oc=5&hl=en-IN&gl=IN&ceid=IN:en,Outlook Money
CANBK,"Wed, 31 Dec 2025 08:00:00 GMT",Canara Bank Sees Significant Open Interest Surge Amidst Strong Market Momentum - Markets Mojo,Canara Bank Sees Significant Open Interest Surge Amidst Strong Market Momentum  Markets Mojo,https://news.google.com/rss/articles/CBMi0gFBVV95cUxOVzRHeks5RWR0U0tfMXM5RkNmQkpKZW1ka0lGbUxMeU8zbXBPcVYtZDkyZF9wMm9Oc0ZPR2dreXd5MXktazlrY1dWUG45WEhDdTdBTDdKWng2SjNzam9IWDA0S2hadGdDSVdDdVhzQ2Rzc01nZ0N3dTJRSGNDUUF5all5amdhcFZ1bXhCRVp3VVdIbGVZb1BQOGU4VXc2VVVVRS1DcndqNFBweTE2dHhBWllIekxjUEFfMDNzTkxQSXFjNjhNeS1nbkRaeG5DV3BrUXc?oc=5&hl=en-IN&gl=IN&ceid=IN:en,Markets Mojo
CANBK,"Wed, 31 Dec 2025 09:48:11 GMT",Canara Bank Sees Sharp Open Interest Surge Signalling Strong Market Positioning - Markets Mojo,Canara Bank Sees Sharp Open Interest Surge Signalling Strong Market Positioning  Markets Mojo,https://news.google.com/rss/articles/CBMi0wFBVV95cUxPNjdhYTZWMXRZZUY1dk5KcXBCc3poeDdnX0F5Uk1HUjNYOG55V1lMVDJZY1NFU1BLWUctSTlVaFFJSi1Yb0hNRmNpbEYxcURUX2NGdFY3cTFwYVpmQXRTQUtqQkw0M3JuazBheFVhQ1Q0SUMxX2NXVFFEVVFNdFh1ckhzZU1xcDlLQUVaYlVWNUFyMnNscnJqQlVQZ2dTa1lHUFFwdWVydksyRENsQTdfSVdWb2ZUZ0tZSl9heUhQNlFnY21XTW55dUdsTC02OWN2T1hV?oc=5&hl=en-IN&gl=IN&ceid=IN:en,Markets Mojo
CANBK,"Thu, 01 Jan 2026 08:00:00 GMT","NBCC (India) wins Rs 220-cr construction contracts from Canara Bank, Navodaya Vidyalaya Samiti - Business Standard","NBCC (India) wins Rs 220-cr construction contracts from Canara Bank, Navodaya Vidyalaya Samiti  Business Standard",https://news.google.com/rss/articles/CBMigwJBVV95cUxPSnptYWxuYlBzOGFGVDV4VGFBNjJ0SnZJUUhhMmU0cVkyZXlXekZVWEI0d18yMUpadlh5YURzOWVYZGhUc09ac1FlSDM4WlpIY0ZzZ0tQMjVxVFg5c19ZTFk1NGhIVHJTRUMxQVJaSlhwbEdsMGxGMHBnckFCZXJmWF9kRXlTU2YtbEpoeVJkRnduamFTcXNFZzgydGxmZ3JQM1N6bkRLSE5FaWRUUTlrTUdDVlh3dGZZME9RX1NUVW9mOFBjZkprT01IWmVXLUVqSld6eFAwOFpmOWlhYjFYLTRKemFadDVHMjFZLXpGdXhQLTlDZTBKTkFMbEwtMDR3aHFB0gGIAkFVX3lxTE44b20zajhTOVAzb2F1N0liQkFVcTRnVWlBdUNFQ0VVeVBSa0daSkM2WHRuOEJ2ajNtWWwzdlJmalFRYTJkdkpkWlI2WkRvaUpjUE9BbVVFOHpvZF9BNEcxSXU1NFROeElmQm95R2h6dm5IdkJOWE9hSHc3Q1ZxXzlPdGdyaVVlU3JVNUhxTExNMnRRUC13Sm5Iek5XMGNEZ1VaTDNMS1RpR2J6eG01WTQxdld2YXJrUkx5M2pXMXRVOXdWU3lBSmMza3hUUVF6a0QtZmpXSGstSzUzeWFVWkI4MFhjMWFwWjFNTTRfNmlEUVgzZVRXeUlZaEhxcFY2aHAtTURGM28xMQ?oc=5&hl=en-IN&gl=IN&ceid=IN:en,Business Standard
CANBK,"Wed, 24 Dec 2025 08:00:00 GMT","Canara Bank Pays ₹1,772.5 Cr Interest on Tier II Bonds - scanx.trade","Canara Bank Pays ₹1,772.5 Cr Interest on Tier II Bonds  scanx.trade",https://news.google.com/rss/articles/CBMi5gFBVV95cUxQRWdITWNtTHRNS0xDdXRYOG9WeGFPUGRRMUlpMFhUaW5oSHdlSWF5RU1jZFlOYUVETHpEellNS29UZ0RtZ3M0QWFsaWlVSWFnUEE0Vy1mVWpnSERNTTV5c0RLN2xWX0JhZi04QmREUDNRZHk0dmlLU2VIeFJycE8wclh6YUhPSWw2eS1zREJfZ0o1eHVCc01ibmlrTjlBWVVYUTN2Ni1yTm9GNlMzWkdzUzhRaUpuVGQ2bXlBUUxvV211YjBQWUdWeW5TZlhHN0VnbDgyRjdWSDYzMmtaM2NmcHYyMUhMUQ?oc=5&hl=en-IN&gl=IN&ceid=IN:en,scanx.trade
CANBK,"Wed, 31 Dec 2025 08:00:00 GMT","Canara Bank Hits New 52-Week High of Rs 157.5, Marking Significant Milestone - Markets Mojo","Canara Bank Hits New 52-Week High of Rs 157.5, Marking Significant Milestone  Markets Mojo",https://news.google.com/rss/articles/CBMizAFBVV95cUxPU3VQM3hJQkxhNGpBMFBYcEJidnVqZ2VLMkFHR0FfTDFSdW16X3NYRFMzNW1oaXV3OGFieVFVTlBiaS05amFPRklVNkNydFNEaGxZUTdvWUFHNjJoR0NEQjJ1U01zNU9kTFdkNVFNVUF0dVMtQ0ZhYmM5YTd3LVJmV1YtOVZtMUxlcVl5dUpaWDNGcXhocDN0aUp5TlJDMXVtTUFHcUktZS1XalhhUDJpQUp1alU5Y2Z2RExpNDdncVRidlJ2c2dWOVVfd3k?oc=5&hl=en-IN&gl=IN&ceid=IN:en,Markets Mojo
CANBK,"Tue, 30 Dec 2025 07:06:17 GMT",Canara Bank Sees Exceptional Volume Surge Amid Sustained Gains and Positive Momentum - Markets Mojo,Canara Bank Sees Exceptional Volume Surge Amid Sustained Gains and Positive Momentum  Markets Mojo,https://news.google.com/rss/articles/CBMi2gFBVV95cUxOeEVRQWtqZDhGV1dXOExGMDVVaWY5a3JQV2NicUgtNHFlUUU0NVFfM09QaTZOQjdvSEw4QmRCTkRDaTBHR1JWa0VHZjVUcGlRVV95aVQ2N3hFVUEwaU8xb1BMcTFKUXBFUzFWTzJVR3JsN1FOd2NqRG5aNWkzWjI4dHBxTzA5cVBkQTVxMmtSbzNFNFF3amV0QkRIaVUtaHdWS09pcDFuRTMtVjZFWjh3b2hVTTJGNG9oWGVlOTltdFN5QmZMa0RCbHpIUlRrSWprOXN3OFZtV2tFZw?oc=5&hl=en-IN&gl=IN&ceid=IN:en,Markets Mojo
CANBK,"Tue, 30 Dec 2025 08:00:00 GMT","Canara Bank Hits New 52-Week High at Rs 154.35, Marking Significant Milestone - Markets Mojo","Canara Bank Hits New 52-Week High at Rs 154.35, Marking Significant Milestone  Markets Mojo",https://news.google.com/rss/articles/CBMizgFBVV95cUxQVFJfbF9lMDBoNVBkUFFKOVBhU1NXcG1pMGxvbVoyNlNZeGxJRXRLNXk0WlNqMnRPNEpmcEJSWkZrWUtON0EzZVhScW5xUEMtZmlQY1c5Q2dfMXlVSFpIcHpTaWVHcXlXU21sc1pJVGtoQ0J2WThDSHpJdjIweUc3NllhUXVqMlZ3NFk1bUlXZ2hmMTk0RnFJbGlicENEOXdyLXhBSmI1U1huTVZlQThxdkpQX3lwcC10S1FkMTlMTUlzSlBKbWRLYjczQmRqZw?oc=5&hl=en-IN&gl=IN&ceid=IN:en,Markets Mojo
CANBK,"Wed, 14 Jan 2026 08:03:24 GMT",Canara Bank Taps NPCI BHIM Tech for Enhanced UPI Payments - Whalesbook,Canara Bank Taps NPCI BHIM Tech for Enhanced UPI Payments  Whalesbook,https://news.google.com/rss/articles/CBMi0wFBVV95cUxNX3V1UWt4ZE5nM3dSOXg3bW94elExa3h6Z25iOEpVTmlIQWRZajZpbkdRN2dYQTlSdXpNLTZzQ1d5dDF5a3VTbDZjYlY2T1IzbDZCc2lRc0JrTmJjZ1VJdDlEekNhYjJ3eHl0UnRwWlRWMHh4ZjB6NHN3V2JyQWxMdFZEeWZhQlhtWmRCaUJYUTBLejV6ZXllUkpVMlhNeWZTejExZlh0czFPQkE2eGo3bWZBRmtvWmpVNFBBUXdZRUtFRDZYVEJFYjZ5LVp6ZTI0V0xV?oc=5&hl=en-IN&gl=IN&ceid=IN:en,Whalesbook
CANBK,"Tue, 06 Jan 2026 08:00:00 GMT","Rekha Jhunjhunwala pares stake in Canara Bank, Mukul Agrawal stays put in J&K Bank in Q3 - Business Today","Rekha Jhunjhunwala pares stake in Canara Bank, Mukul Agrawal stays put in J&K Bank in Q3  Business Today",https://news.google.com/rss/articles/CBMi7wFBVV95cUxNM1lKQk9Sc2VuS2ZtQlU5enpxTG9jSUc4OUxRZWNHelowU2ZOY0hwcmtFM1MtLWtjZGF1ajk0T1RCSE41Zm9jU0tqNU1SaXZobVl3RmpGc3ZEV01jOGM2U2d1UVVUUTBiU3JCVXBxRG9aeEVMTGhfZ0xNdGUteTNQd3haNUxFVF8yMzZFVXBEZ1F2LWNfYXhOVjluc2MyRjFJdjI2UlJ0dF9CZWFKYlZrTHB6T2Q3c1FHRy15d1R3UERaQk9FTzBWVTlnc1JhdmhEaTdNZzhqRThkcEswM2JIVnNXdktkbmxDVUZIZFhNY9IB9AFBVV95cUxQa0VRaXlUV1BqcWhMZzduR0F6M083RUZCZmgydVpmQ3NvclRqS240dzZuTm0wVEpkVzRzMldqZHd5Q25VdFYxVTVjZ1M3X3RIempmVDd4UVpRSkQ0MUg4YjFqRTc5RmRwZG5jMjhqZG5sQ2FDV2F2dHNUSlN6RXkzYmhvRDdlSlpWWDhfZUNmcE0tRGZZdVlNbVR4RkdxNnN2MjNtX3lSTnZPcTRBemlyUnJfbWxRUG9XN3hxSUVVallweE84aGIyLTQ0U1QwR0tCZUZXdWxtNWNMSTUtaEpwbzNsb2E4OUdmOHctZXhhSVJJM0NN?oc=5&hl=en-IN&gl=IN&ceid=IN:en,Business Today
CANBK,"Fri, 26 Dec 2025 08:00:00 GMT",BSE Bankex reshuffle comes into effect today. Canara Bank among 4 new stocks included - The Economic Times,BSE Bankex reshuffle comes into effect today. Canara Bank among 4 new stocks included  The Economic Times,https://news.google.com/rss/articles/CBMi7wFBVV95cUxPM2NldWI3dHIyUkZPUEVwS0UzTlM3NzlLdWxVZl9vTUpTYlVFZ3NqZXZMY2xLYlRZRV9LNGl6c1NPeU1rcFNZLTlUenBISUNyanFBSWRiOXpaSzJNckJBUlo0bUtnSnI4SWJrWER3OUpUS0xqblZtQTljeWlYZlVUWDFoWDFNUE1seHBwRzZYeUk4dllDSGhBVGJHaHBuNTBSSGN2R2pIbGpxbG5uNTdIelhjMTVYUUlVX21RdUhfUXlLTFBVUEhiMkRmVzZJUHo2b05qQXdnYWROSUlyU3ZPa0dBWlhEM1lvTS1leXM1TdIB9AFBVV95cUxOY3QydnZBSURJTWJCTzkxallIT2RBS3dPaHhqWTRPeEh5UzRBMllibWU5c1hUSzljbk1qYjR1cVNUdE52UXBBOWtMUVBZQ3JpaU5udnAxeG5ieThjM3lrSGVxcTFQeE9qb2Rla1JnTXFPaUxCTkl4cnZtVTRrVWcyZUs5MFNWaWprMXhlMFp1U3RDX2NoMnNhVmxMRXNzM1gydDlDU1c0ZWtYLUF0XzhXcWFicTZsbnEyUUNuY3VJb1NrS0VKSGlZUDhURV9xamhNNms3ZWkxdUJPdTNiendKS2VLY0lSdVk2WXlzSTZzMG9ReE9m?oc=5&hl=en-IN&gl=IN&ceid=IN:en,The Economic Times
CANBK,"Wed, 31 Dec 2025 08:00:00 GMT",Canara Bank Sees Significant Open Interest Surge Amid Strong Market Momentum - Markets Mojo,Canara Bank Sees Significant Open Interest Surge Amid Strong Market Momentum  Markets Mojo,https://news.google.com/rss/articles/CBMizwFBVV95cUxPTnlvM1pwejFiM2h3TkZ6NjlmclM1b1BPZVJlTUpORG1mMXJGRzRQakpLdWhoc3I3Q08xeGZmZFEwMi1SMjZsMTRmUmVNd2NMUmNOdDEyck5yT2FLLW1NTm5ON2tCeGtmWU9iTmZ2NmdLRkk4ZWp5NEVZZXBIZk9DMUs5MXNMNTBVSjZqUVNlLWRnRmN5bVU3eGxHSFNJWWtDRHRZWWlhdjNOWHM1VktEbXpYLXc3QUNBbXVHaU9ZNGRnWmI0YXJxTHZxM19OY2s?oc=5&hl=en-IN&gl=IN&ceid=IN:en,Markets Mojo
CANBK,"Fri, 16 Jan 2026 01:51:49 GMT","Five Stocks To Buy: Tata Steel, Canara Bank, NTPC And More - NDTV Profit","Five Stocks To Buy: Tata Steel, Canara Bank, NTPC And More  NDTV Profit",https://news.google.com/rss/articles/CBMioAFBVV95cUxNMUxuQkxMUm5UREZVMFJvbERvM3BpaExuYkxadFpWT281TDItVWxFMTdtOTVfMmY3SlpfbmNoeGUwWXc4bFRMcDBGMmFzXzRrT25OQjVXWWo2bkFINFhCR283d0pYWXpSbVZEZEFBeW1NZkQ1dV90YTIzVU03dnJRVkZ5aUlXbjBVV2NWOXQ0ZTRKMTZWdmFrSVVfUy1TTW9y0gGoAUFVX3lxTFBzbFdwMTFPSjBhSnpBVDVkSjZPZ2dfUHljS2gwRDVQdFVCNDNNUVlvWkcxbU5iOWIyNDlYeXFwT29LazRmN3ZUWXFzN3NLY0lmeWlDMjBMMW9zNnJ3UW85VWJ6dVJ0N3pGTldNMjF3d3BxR2J4QnFUVnBtQWFVSFZqRE5aVUh2eGsyYV9xOHdYR1M2V1VJb3lYZzFvT21hRlJGSEVLNWQ0bg?oc=5&hl=en-IN&gl=IN&ceid=IN:en,NDTV Profit
CANBK,"Wed, 14 Jan 2026 09:02:05 GMT",Canara Bank - These 9 stocks held by over 100 MFs in December surge up to 115%. Do you own any? - The Economic Times,Canara Bank - These 9 stocks held by over 100 MFs in December surge up to 115%. Do you own any?  The Economic Times,https://news.google.com/rss/articles/CBMi9AFBVV95cUxONzA1TTFKVDVrOURSVFJNYzJNZU1kdzc2UTZZNFZPcTdhekdTN0V2aWpXWXJlaXhydkltX2N6NlRPcG1GcU5WWGs4VmN3eWlCZ1ozQlRtVFhRMTgxaGFpdlBKeFF3emNXWjBkMTItblpOZ1RXMUlHcU5zc3B6UzhsenF0UUhuaVU3M2FQMUktcW1PaUZjNFhNdDRlb0VyLWFYMzB0Z1l1UmwzVEJhc3JZTHNZYnU3MlVuamhmdGt2bmZ3NTcyRUphT0FZakZMcGt2MUtKdWRPYUVlc2dvSm1FbTh6R0YwM25NUm1BdzVXdGlZQmJU?oc=5&hl=en-IN&gl=IN&ceid=IN:en,The Economic Times
CANBK,"Tue, 23 Dec 2025 08:00:00 GMT",Canara Bank Added to BSE Bankex Index in Today's Restructuring - scanx.trade,Canara Bank Added to BSE Bankex Index in Today's Restructuring  scanx.trade,https://news.google.com/rss/articles/CBMitwFBVV95cUxPVnA4ZFVyNmgybldrMnZFWU54d3ZBSFY5SHVRVmV0cnk5aWJoMHQwMi1vdXoyY1l4TlRZM0lRUjdtNzluRHJfUEZBMnlvNHdzejBaRy1wWHhXSE1pdHFIQkViS3BGRENFNXpxdUVUaWV0WHl4aXFnVjl2S2ZxVDZPNldTZHVGaENRSEZOa1dZTzFQVHhWa0xzbHlkU0UwclpmdkdqREdMQWFZdHBobWVyaE56RmNJZzQ?oc=5&hl=en-IN&gl=IN&ceid=IN:en,scanx.trade
CANBK,"Tue, 23 Dec 2025 08:00:00 GMT",FSIB Recommends Brajesh Kumar Singh as Managing Director of Canara Bank - Daily Pioneer,FSIB Recommends Brajesh Kumar Singh as Managing Director of Canara Bank  Daily Pioneer,https://news.google.com/rss/articles/CBMimwFBVV95cUxQZ2xmR2hBcmdOaVNtcGNuczJwTldXa0ZNbElVV2EzalJYX3YxdklET2FxWjNYS0c5cmRuaFd2M1VLS2JRWk8tMWlFMFdGT3gzc0p6SzFLNFFfVmhSWmN1dWZHVmUtS08zcmVLbHhmVDAtdGFKOXg2VGo1TjNxazc0cm80MkJEWFFwT1RDRlh1R1psdGtNLS1NWjJiTQ?oc=5&hl=en-IN&gl=IN&ceid=IN:en,Daily Pioneer
CANBK,"Tue, 23 Dec 2025 08:00:00 GMT",Pledged gold stolen inside bank? Canara Mysuru branch hit by loan scam - NewsFirst Prime,Pledged gold stolen inside bank? Canara Mysuru branch hit by loan scam  NewsFirst Prime,https://news.google.com/rss/articles/CBMitgFBVV95cUxNUkVEWV9oSlpzbVU1aWNKRzl4N2lIU3BMRzJVbTRKR1dueFlNdGVIUFYxcE83NDNiUVhrQm14dzBVeHpJVzZqY2RtMlhXdDdRLXIzTW9yeFVBTXA3LXRBTDBiWkl3OGM4R3hNdnVxZzZiNjZrNEx6dkxadFBzMWlXSjVhSVU2cWM4S1k1c3g5U1NfUzk1MV9mbEFZTURtak04c1NmeTgySm5ETTlhVjBDZjhjVTFxdw?oc=5&hl=en-IN&gl=IN&ceid=IN:en,NewsFirst Prime
CANBK,"Wed, 31 Dec 2025 08:00:00 GMT",Canara Bank Valuation Shifts to Fair: A Detailed Analysis of Price Attractiveness and Market Performance - Markets Mojo,Canara Bank Valuation Shifts to Fair: A Detailed Analysis of Price Attractiveness and Market Performance  Markets Mojo,https://news.google.com/rss/articles/CBMi8wFBVV95cUxOY2lGMlVNNTk4M0xOMm5PbjlCaW1odmlxZVNTZ2ZNR3dYbmJ3TWJKRmFWSDZlaDY3UlRyd0RKYWdDdDVhb1Z6ZFlpb0NNSGVSLVdPSWtGWjlNcERYTlYyUFBmMWxpU0hMaF9Hd1RUbVBfTUZIN1NjY3VzemJDMGtLV3JzV3FFTWlNUk81V0ZvUDhWZ3pPd2FhX0VISzdjRkVnaFg3NmdRcmRXdTNsRHBWeDdraHlZSXVmYTFGSUhIYmY5T2hQYWpsbjJVd1FPTEtIWVdLbkJJRDhvRlJYaEJjUURvcFBaeV9EQ3pWd3BENy1HMms?oc=5&hl=en-IN&gl=IN&ceid=IN:en,Markets Mojo
CANBK,"Wed, 31 Dec 2025 08:00:00 GMT",Bengaluru Banking Scandal: Senior Manager Missing After Alleged Rs 3.11 Crore Scam Involving 41 Fake Gold L - News18,Bengaluru Banking Scandal: Senior Manager Missing After Alleged Rs 3.11 Crore Scam Involving 41 Fake Gold L  News18,https://news.google.com/rss/articles/CBMi-AFBVV95cUxPYUhXdWRDUFg0VWZMTVROVDBuNlhEaTJWLXBrdTdYZmZvUWN6MzYyNHQ2eVc1V2lmUk1McG5XMlBOcm9JX2pFcXFYSTlfS29vdjZzUzAxTnlZak9IMS02Nml1RVRfbE94NTA5RldOZkYybndwLXRoS1JGa3lwamRZV1V4U0VuRXlELVZUWXBUREFnY3AzSjNLUmFLNmthWnJxZk5fZTNJN3MycDNnOGZIWnVpckJiaVRiNGhUc3VMTG94anlkVEoxRzBwYUk2cnZFdU0zUThDNS02dXVVZUEtZ01xWHVISlBqTHRqeUU0T08yTWZMUWx1a9IB_gFBVV95cUxNaGxLdk1QX3FmZkd3R2xmdGw0WVY0MzNad0lTU01lRzA5VWx1V2lRTGh1WDNMQ29xV0pSUzBqQ0YtRXZmS0Fqdm1oVHlpS2VpaG90VEFjYkJkd2w2OHR5ZkhPRjNFSjV0SzhVNjJxd2F2LWtHVHl1WWRGc0NSYWdjU2pzNmk0TkVlT3ozMTBmMTY0NnozQk1Kc3RFbFJxZFk3SWt2eFdPZ0lLYld2d1huZUZ4eVRJeFNYTzF0M3FhRDVoZVlZTldMelVuVlFYRkp4VlZtTTFPNFFJbkk0ekx5ajFjclNjSXRKRDF1S256a1hwVlpvdE5SM3M0WmhZdw?oc=5&hl=en-IN&gl=IN&ceid=IN:en,News18
CANBK,"Tue, 20 Jan 2026 02:30:58 GMT",Canara Bank Valuation Shifts Signal Changing Market Perception - Markets Mojo,Canara Bank Valuation Shifts Signal Changing Market Perception  Markets Mojo,https://news.google.com/rss/articles/CBMivAFBVV95cUxONzFjSlBoVlpLTnZ4ejBkVmprMkpGeTlwQVQ0Yk4xMEZnS0RFeEhrNElrVDQzOTRncGpmck1oc3ZmRWdJclp6MnBhcTdxZFZOX05fY1RncHowMzhNZ2kzRmdRRDR5OFUza1RSNnZ1SXlMSUdOZlRxREFvSU1aaUlkcHoxaFpDZEYzcllFVEZ5REZISmxaTUktRVQyUnc4WFBaVlBfbGJmaDBlaWVzTUw3TzBTd1VNMFFBai1POA?oc=5&hl=en-IN&gl=IN&ceid=IN:en,Markets Mojo
CANBK,"Wed, 14 Jan 2026 16:17:44 GMT","Canara Bank Announces Interest and Principal Payment Schedule for Basel III Bonds Worth ₹49,403 Crores - scanx.trade","Canara Bank Announces Interest and Principal Payment Schedule for Basel III Bonds Worth ₹49,403 Crores  scanx.trade",https://news.google.com/rss/articles/CBMi-gFBVV95cUxQdmpZOVM3aklRQVBTbXdnX2RMUjh3b3R3OWtXT2ZBWWtFdGZRU19YVTFJSWdYZHN4N0FXdXFrS09panV6NkJDU0xvZmFwRHZMX2dGSVJ6Mnh5TEFUcFNDR3QtVkkwcDVta1kxbjBPNnVnY09MNzByX2pzOVhaZVUyNUx1QmN0MEFhYk5XWExjLVJWZWlkTUF3OVROMlZyVUlxX1QtRVRxd3NvWV9tT2lGa2VGUVdnS2Nwemd1MGxtVFo5b1d3Ti05MU9CcEQxWWtrUjI3VUZTeWt4aUtWbkVxdFNwek92eWRVX09kMk9XcWJ3dXdLUURfbDVn?oc=5&hl=en-IN&gl=IN&ceid=IN:en,scanx.trade
CANBK,"Fri, 09 Jan 2026 05:40:39 GMT",Canara Bank is Rated Buy by MarketsMOJO - Markets Mojo,Canara Bank is Rated Buy by MarketsMOJO  Markets Mojo,https://news.google.com/rss/articles/CBMiowFBVV95cUxQcDllRFplSEg4NmZ2VDJ6ZzRJcFV0YW9MYm8xbDMxX1pveUExcUhjaWRYN0lOZzhucnZIaTBJQ0tfRkRlYWNBbFlwMzQwY05oRHFrczVTMlJPOXlaUHk4R1ZkN3ZPZ0h0T25TY1ZlbWY1dDlSN0ZaNG1rWHF6Z1p5d0FsdXM5QkFFTm5CNVVWTzhJQllNNzJKTGJVck9peFNLSWR3?oc=5&hl=en-IN&gl=IN&ceid=IN:en,Markets Mojo
CANBK,"Fri, 16 Jan 2026 08:01:10 GMT",Canara Bank up for third consecutive session - Business Standard,Canara Bank up for third consecutive session  Business Standard,https://news.google.com/rss/articles/CBMixAFBVV95cUxNcmxvM2x4N1pvQjVzdXlic202Yk5mQk4xQ3BDNUV3NVRiZU9qQWV1cGxOSEZtQTdqMnhkZkQ2RUg5ajJiWEh2R196R0QtWHk3MUJ4a1ZCOG9JU3NRMjhoNlBfRTNOLUJlOS1xdnNwakdlXzNBVV92WWdRV3g4SnZmdHpadEg4NE9rMXpiYzYxNDNUZnIyMkdtTEFZOWFNT2hyMU8yTmRfdmRncERPSklqNUxnbUFzVDRBNi1teFg1U0NsVDhj0gHKAUFVX3lxTFBiT0ZvVXVhN2ZVMjB0di1pbXhNUEhOLXF5aUZOUmtLRmpPWW04S3B0N3RvdlJyQnQ1eHNMYXN4U1Q3VUlXOThfS2xRVHNYdlZPMUs0bzVudlE1aUJZWXc0N1l4bWliNkxSODBNeHk4VlVuLXZ5N0x1WVZ5Z1RWaWJGdXRtYnJ3czY0X0xpcS1rMFZ0VENUcFAycVVqSkZqUlZvbzByNklpSm1neE9FcDhKdTByOVBVTUhDVU04bENldEZWdl9fQ3pEdlE?oc=5&hl=en-IN&gl=IN&ceid=IN:en,Business Standard
CANBK,"Thu, 25 Dec 2025 08:00:00 GMT","Varanasi: Canara Bank Branch Manager Arrested in Cyber Fraud Case, CBI Team from Delhi Conducts Operation - The420.in","Varanasi: Canara Bank Branch Manager Arrested in Cyber Fraud Case, CBI Team from Delhi Conducts Operation  The420.in",https://news.google.com/rss/articles/CBMimAFBVV95cUxQeTFnaEtKajVZNUNjSmgxQ29ncDFUdFlKMTJtRVZuQTYxTjdUa3diR2ZRaXJMM2ZQSEJwWUEwcWNLMmpST1VYcHJXUUNCaXkxbGxzcnhRUnRvUTlpZ05BVWJWQ1F5TkVVOVFiZUk3VlJhZU9CYnZNTVdrb1FhTzVLeXVjV2JLZnFQNDdpUmM5RDRua3RHaktIbg?oc=5&hl=en-IN&gl=IN&ceid=IN:en,The420.in
CANBK,"Wed, 31 Dec 2025 08:00:00 GMT","Nifty, Bank Nifty outlook; Bajaj Auto, Canara Bank among top stock picks - Business Standard","Nifty, Bank Nifty outlook; Bajaj Auto, Canara Bank among top stock picks  Business Standard",https://news.google.com/rss/articles/CBMi0gFBVV95cUxNYmVINFlmOXpJT3hURlAyUDRxTmlEQWlTajhoNE5CYnZZZGMzMjA2WXVPOWE0cDBQUTZNd3pLZzBvOUJWN29tMnRUeGhwbVpTMFJPeVRudmVrVXpLYTQ3aWRSY20yd29rQ0RvRW41STRIT3FmdWxRNV9TTDNlbDFwWHkwdHVTNllfMDg3cnFJQ3JvSDlHNnFJM0lodG9zd3FlUGg5Q2xfc1pWT01aRHU0aXZSaUFFYi1DM2U0MEhTNUpJVm9HV3hvcGFsMThHMEMtVFHSAdcBQVVfeXFMTW9xYzlzblNXVWhWR1poLWFqVUgwRVZsZ2YycExPOWUyWW9xeEU1b3kxTkJENl9VZ3I5MVVMNWcyRXYtRUJRek5kZHFyVmlJeXR6UnJ4bGNtYnBVNVotRmlKRTg4UGJkSHhfU2dsVHpfREZqd2tZX1pDcXk2MW9lUlVEb3lSYXhSWFNSblRzbk1Dc3BiWFNHdUQtbmp1dUp1b1diTk9jUExpa1RiaWpKZW51eWhGVHZscDR6b3Mxa3hUay1oVkw5MHJWcVlJLVNJTlpKN0o0cWs?oc=5&hl=en-IN&gl=IN&ceid=IN:en,Business Standard
CANBK,"Mon, 22 Dec 2025 08:00:00 GMT",FSIB Recommends Brajesh Kumar Singh as MD & CEO of Canara Bank - thenewsmanofindia.com,FSIB Recommends Brajesh Kumar Singh as MD & CEO of Canara Bank  thenewsmanofindia.com,https://news.google.com/rss/articles/CBMilgFBVV95cUxQc2k1Y3RtOEppdXNJMTVpV01FT2U5UnNlVUdGdXV2RkFpYk5uYU1CRkw4NTZEbDZCUUc4UWFuLUhjMVRmUURRSElFMGFQandZeGx0S1h2eWwxS3g1VDk3ZkxLd1dIcEQtRkprOWV2bmRWdEozeUxkeGhlTm5FLUcwaW43UWNuQzFJZ2JwRVE1eW1WRGN6RXc?oc=5&hl=en-IN&gl=IN&ceid=IN:en,thenewsmanofindia.com
CANBK,"Wed, 31 Dec 2025 08:00:00 GMT","Canara Bank, Bajaj Auto, SAIL: How to trade these 3 buzzing stocks - Business Today","Canara Bank, Bajaj Auto, SAIL: How to trade these 3 buzzing stocks  Business Today",https://news.google.com/rss/articles/CBMiywFBVV95cUxPamRKaFZqd0Mya1BGUGd6UmVkOVhOM2pzRDUxYk1WV3dPRWJwRUdRaUZKaVpwak1ZQlBZaDdlMmNFRkdiTkdQdmdnLWRlcFdmZ1FmZ3RrN1p0bHBMeGVTdm5WNVF0RGUyUHUzMmRoZWt1SHkzbFJuNzZmaGxGcURHelc2bWVxc3l2bU1hWDZMUFdQcGZWS1JmS2VOV3NWZ0hxNmlQcjJHdWFUaDVlNVB0cXFkemxDeUJHU0JMejdNelZJWjkxaFJKU0xxZ9IB0AFBVV95cUxOeEtKN1dOUFRCeHg1QlhndUVURXBOS203RU9hZ0NpYjFZNE1WaElWREt4bzEwTzZqdHhzSUdCN3J6dnZ1X2FneFNZTUptSmNFNmtzZ0F0WlY2MWxoNDJMTVVRc0luX21JcUFUYlZaYVo1RzdRMF9DU2QwT1FXaGZERmt6bjVFUzcwYWR1TW1PSHpvN0JPS3lZOU4yMnBuT0RwMkwzTWJEcURnUGhTRDdCdHZqcm01NUxLSFdMZC1SbERQZXpxRHk3cDZrSzdLMk9R?oc=5&hl=en-IN&gl=IN&ceid=IN:en,Business Today
CANBK,"Sat, 10 Jan 2026 08:00:00 GMT","FIIs Increase Stakes in SJVN, Canara Bank, and Two Other Stocks During Q3FY26 - scanx.trade","FIIs Increase Stakes in SJVN, Canara Bank, and Two Other Stocks During Q3FY26  scanx.trade",https://news.google.com/rss/articles/CBMiyAFBVV95cUxQZGp6VXZyOURyY1dGRGNRUGY1c0dvelN5dUZFaXJPbWQtQjYtV29fM0tiUzBMWWRLZ0U1SWptY0FkajBnZ0tzNUZfRUFMaDQtOThjVWNEMGVHSzZJQWN1ZHgxOEdiY2pLVDRJclhiTF9sWlNfaFFkYzRud1JqQ3ZUZGcwbGplai1pM3ZmdUpXbkF0dE9KVG1mQ2hNYXhWTlotYml3SWVoZ2JkMEdRYUJlblZDcGtDRkUwM2RkR0tlOEJTSW5fM0F3dA?oc=5&hl=en-IN&gl=IN&ceid=IN:en,scanx.trade
CANBK,"Thu, 08 Jan 2026 12:26:19 GMT","Attempted theft at Canara Bank, Vasco under investigation - digitalgoa","Attempted theft at Canara Bank, Vasco under investigation  digitalgoa",https://news.google.com/rss/articles/CBMihwFBVV95cUxPcU5pZ1RlT0ZWUnFGc0x3d3NuamdiZDVyM0N6clN3SzZORmZ4RFJoWnlIRmxQOGs0UWp1Y0dHRDh4azhIS3djQUROQzZ5Nk82V0FhSS1CYzhlc0VXSTQxY0tVVnBVSmdJNWhMS3lkTVp6MENiQjFjTnBfUEItSXMySzJKMlI4ek0?oc=5&hl=en-IN&gl=IN&ceid=IN:en,digitalgoa
CANBK,"Wed, 31 Dec 2025 08:00:00 GMT",Canara Bank Surges on High-Value Trading and Institutional Interest - Markets Mojo,Canara Bank Surges on High-Value Trading and Institutional Interest  Markets Mojo,https://news.google.com/rss/articles/CBMiwwFBVV95cUxPM2JWQ2QwU2tmUkphZXNrOEUtNDB0SUZoQTB0ZG9QZExSMFlOVndYcDB3VldDdnhtal9LLWExbnExQXBkWmhlU3Jyb2ozTEw4c041aDVjWU1ic3cyRDI1VTVYV1JmU3cwRnpKNDNHRkJDNXNlUE9JdExsMkZ0QlVSNDVFUE1EdHVjRVpDSklLVEVUR1daN01FOEI3MXVrMmkxUGR0cU9kOGp2TmJFYnBxLWhrZkdLMVprcUx0UE9aYjVXOEU?oc=5&hl=en-IN&gl=IN&ceid=IN:en,Markets Mojo
CANBK,"Tue, 06 Jan 2026 08:00:00 GMT",Rekha Jhunjhunwala Exits Canara Bank Stake After Multibagger Returns - scanx.trade,Rekha Jhunjhunwala Exits Canara Bank Stake After Multibagger Returns  scanx.trade,https://news.google.com/rss/articles/CBMixwFBVV95cUxNQVBVM3I4UGlyS0FwMHBKQTlXcGVmX1dwQV9jX3N2MTM4VDJRZHN5cXp1bTBXX1ZiU3RVV3h1ZW9OVEFsUm5CejJqczZzNGV3NnlQLUNmUDBLR0pwOVNFQzhTdmNzaG01RVlkSU1sSVRWYjhFVFNMeXZwdm45WjROSG4zSURIMk9fYkxJR3B6MENXQmNwUVk3OTFXbzU0OXNHRmZmRkM0dXZZSnIxZEowdGJVN2JPdmdGODJkVXNJWUx4VUtLRzFF?oc=5&hl=en-IN&gl=IN&ceid=IN:en,scanx.trade
CANBK,"Fri, 16 Jan 2026 16:06:48 GMT",Unidentified man found dead in sealed Ranjit Avenue property; police launch investigation - Tribune India,Unidentified man found dead in sealed Ranjit Avenue property; police launch investigation  Tribune India,https://news.google.com/rss/articles/CBMizAFBVV95cUxNVDlua0JkdXJPWmIwRTNGNVZoeTl0Vk1uWmNwdGN1TGl2VHlsSW55QXhJei11aTRRXzRvZ1gtemp6UXBMRUNYdk04NzBzVzlkYWJfYjVXTVBhTnM3TzlDaXBTc2JwVFc0Um5YVW5NdnhMY0VCbFM3YUMtdVRUbHFHb1BpOUhVbDNZT0RoQUZtdEVvdzVCcEI0Umo2S1QzRnpFVU5BMHF1MFFwQ0pDYjBMZlo1U2NyV28xMkplbDljdjAxek0zTmRXNDNFWVXSAdABQVVfeXFMTlBOUWU2ZFFLaktfX0RwWjFKUFJyUFBlV0lJNWFxM01ZeWhFOWM4LXV6VlV2cXJ1Skw1dDdOZy1HdG5RRmZ0b2tlZVI3WUhUY19PYWFEaEFQM0RLSnlVVXdIY2NuQnd1MnlnWE1TcGdMMFFnbmhhMFNEeTJYaExRZWN6ejV5Q1ZqWUV1VDVwbFZidFpEZ3dEN2I2US05TE9Kei1XRGt3eW9RT1R2X1RkVTdXcGhRdk5jUU1Zck1PTWhMTTBRSjdCaWhwTDBKM1FTTw?oc=5&hl=en-IN&gl=IN&ceid=IN:en,Tribune India
CANBK,"Mon, 19 Jan 2026 18:16:26 GMT",Punjab National Bank among 9 stocks that hit 52-week highs & rallied up to 16% in a month - The Economic Times,Punjab National Bank among 9 stocks that hit 52-week highs & rallied up to 16% in a month  The Economic Times,https://news.google.com/rss/articles/CBMihAJBVV95cUxNaXVSeXNKTEJWUHlINFVLU0hvWHVSLTZHa28zQ0x0RmVPT3hTYVVaRDE3Ynd2aXZZN01FLW51WHBGdjVsbjlOT3l3WHJLdUhFZFhJYjZOdElfRjltT1BlVWMzcXNtbG92dzZBV3NRYm84RTZLdDhjSUtobzJieHhKYmtWY09JM1NfNk9RNXkzU3J5MnI2U3ZaMTN5REM0cjBVVE1rNVlqRDU0MDBURnl1MDdmYi1ROGNCek9PWkJNTXRPTVBOZ0dMd2ttVmJxQWNPbGJfUHN0bFBqY1dRdUdRS2dnYV9Mem1yRXhEalNsSXpwUW03Q2ZQbE84RXR1bDFzYTRKYQ?oc=5&hl=en-IN&gl=IN&ceid=IN:en,The Economic Times
CANBK,"Wed, 31 Dec 2025 08:00:00 GMT","Canara Bank Completes ₹1,774 Crore Payment for Basel III Additional Tier I Bonds - scanx.trade","Canara Bank Completes ₹1,774 Crore Payment for Basel III Additional Tier I Bonds  scanx.trade",https://news.google.com/rss/articles/CBMi3wFBVV95cUxPLUg4TFAxQjA3cDExdFhVa2ltb1h6TTBHZElBYlBFMVZ2Z2R0bWlycUhhU2Rod0pfSDVocktaWUxvQ0I4N29UMmwzNFVaWWZ1YmNUQ2NsY1ZlRTluZmIzLWNFSkl5OVctY3VvWF9PbDIyWlA4NUk4RG5DMnhSM3hPUUZQQlh2R3VsMXpaRW41ajBFTDRNMVFnQlRWOC13cjctZklBbERuN3lBOUtGNVlmNVJHaE5na054SEtpVExMMi1najNxalBkU0FUY0hDQzlETmZqZFU3VWFwNTBvakpF?oc=5&hl=en-IN&gl=IN&ceid=IN:en,scanx.trade
CANBK,"Wed, 31 Dec 2025 08:00:00 GMT",Canara Bank Credits Rs 10.76 Cr Interest & Redemption Payment Under Regulation 57 - scanx.trade,Canara Bank Credits Rs 10.76 Cr Interest & Redemption Payment Under Regulation 57  scanx.trade,https://news.google.com/rss/articles/CBMiygFBVV95cUxOMkFTTVdfclQwbzRxRVF3MUlGX3NLaG9yVThtd3ZSSUhvbVBRbXp1QXFiY21QdExvT1NaYmZmanE5MFdBM2U2blN4OHJ2cTVxdkF1SFlMRF8zYm1aTmZuZnB2XzI0QTFjYmRjdXFoT0tYZGZKWHhnbWsxRnY4SnBtUnd2QUxjSlJkemdVNkNET2FmdHJELVFMWTJiZVNwM3dwbWdVLVN4d2J6TGVKOUlIeWNzN1ZISElSZFl5UmozS0dGaU1YeDQ0UC13?oc=5&hl=en-IN&gl=IN&ceid=IN:en,scanx.trade
CANBK,"Sun, 11 Jan 2026 17:17:55 GMT",Manipal: Old water tank near Canara Bank Head Office Circle demolished - MSN,Manipal: Old water tank near Canara Bank Head Office Circle demolished  MSN,https://news.google.com/rss/articles/CBMi0AJBVV95cUxPWXFQYjJIaHFPSlFPWGY2UWFrZ3NoaXlJc1lTejBSMjR6dWZoZ2IzOWhLNnktNkpNODUzNFVSdVJLVWxpUGE0cjM3RzhfMlk1S0RQMWNrcDFoRVRzNUlBTUsteTZKbXJCMmh5N2lSVmdhZVdocWVCV2o4aTcxdnlETHFZYm96ZW90bmE0V3FiZVo2eFZmeFF2R0IxN0g2M29jMGxNTm0wQ1RjS24tUWhGNDhCYzZremxTcE80MzNjQ2ZaSG1JUTNzdE5KZ0pPRUdvVTNpa1dZUEFOSXNsYU9KNHBGM3pCbVg2ZU5jYjNwaFZKSHNmcjBSZktDZ2duZzAxLUJscFFNTHZLdUxkbE55T2dIamYzNWJLSHhKVk05U2FweERuM3g3VXVPcUgxWWRGcVFoTEhIVk11bnNfQlRkc0k0WlBkejVKby12VTQxaTk?oc=5&hl=en-IN&gl=IN&ceid=IN:en,MSN
CANBK,"Mon, 19 Jan 2026 12:33:17 GMT",Amanath Bank finally merges with Canara Bank - coastaldigest.com,Amanath Bank finally merges with Canara Bank  coastaldigest.com,https://news.google.com/rss/articles/CBMiggFBVV95cUxQb1VlandPdTRsMkFsOUh2M25PM21qWmlSYlFxMG8wRTgxamJJWmJDRTdSRmU5VVc3TWJURVVtRXNnVVdoQmYyM21RVHdKcHZZRllaZzV2Sk1iaVdWS3h4NkVYNnI3bGFnM0ctNzIxaTlEMTVhUHZ2T05Gbmg3MmhxYzFn?oc=5&hl=en-IN&gl=IN&ceid=IN:en,coastaldigest.com
CANBK,"Sat, 27 Dec 2025 06:34:23 GMT","How bank insiders enabled cyber fraud: CBI exposes nexus among Canara Bank's manager, Axis Bank's BD and money mule operators - MSN","How bank insiders enabled cyber fraud: CBI exposes nexus among Canara Bank's manager, Axis Bank's BD and money mule operators  MSN",https://news.google.com/rss/articles/CBMiigJBVV95cUxQV2d2NV8yVG12VHNURmV1OFJibS16MDlFN0VjZk01T25iaE16U0hkSFFQbEVRRS1BR0M0aVlkUTg2dk9OQkktcmxtaGRGM09sbk9yRVo5Uk85RUdIWkp4WEJwc2toTEVRUU1OVmdvN2h0dUoySnBGLTZOZ0xQdXE1Q1ZxamJEYll6cEZhenhvMkxUbW1pVmIxanhRWkxFa2t6a3lGWWJXWXlkRDRmZkNtU0l4ck9FUXZzSWV4Tl9vQS05NmxjNWhwM09qU0I5R3pjbmtCenNKUktobl9OclRrekI4eHQwZlNieGFjTjl0eVdkSTdNUmxUX19SYUliazlkZm56ZVpvZUdNZw?oc=5&hl=en-IN&gl=IN&ceid=IN:en,MSN
