ticker,date,title,description,url,source
CANBK,"Mon, 22 Dec 2025 08:00:00 GMT",Canara Bank trims RLLR - Good news for borrowers: EMIs set to drop as these banks cut lending rates - The Economic Times,Canara Bank trims RLLR - Good news for borrowers: EMIs set to drop as these banks cut lending rates  The Economic Times,https://news.google.com/rss/articles/CBMi9AFBVV95cUxNTVE3eXhCeXBfbnZndjhxS3VPTTl4NHgwVHpXbUJpN2hiM0JrdEFuYjRCLUdnNnU3SDkyZVFER0g5NkFUdVAtNlpvRHZKdjZZWlRXUnBtb1JpakdjZS1ZQUM0Rk1KNGJHcERxUTRXdGc2SUpRQVpVeFpUUEM2dmhCY1R3bmdUZkIzQTk2N05HenE3Y21HanFrV1NGX29SR3h4Zy1UbUQxbXNtanNXSzY4M296djMwcHNqRU9NSUJpX25NQlJsRklPMF90eG1LQ1p4bU5HU1N0NTdtdk9qdjljNTIwb0Q2NHVORG54VmZHejNlWEUz?oc=5&hl=en-IN&gl=IN&ceid=IN:en,The Economic Times
CANBK,"Wed, 31 Dec 2025 08:00:00 GMT","Shriram Finance, Vodafone Idea among 6 largecaps that hit 52-week highs; gains of up to 17% in a month - The Economic Times","Shriram Finance, Vodafone Idea among 6 largecaps that hit 52-week highs; gains of up to 17% in a month  The Economic Times",https://news.google.com/rss/articles/CBMikAJBVV95cUxOSkhyUk1ZLVFPQzc0a3l2WXllRFpNRnJCTTVZazc1Mjc0b1ZwMU9Xeno0QXpxZHF4YmxPX2JmSmZqSHJqXzdOWkVUVHp1WkRqVTlxZ0hkbVlZRTBDd29IZWZEcy04Wjl4TEw0eDlxSnhiS05QUklpQ0JpMWdwR05keUhpdUlVSlptU01pTlVCV0tMZENMM1JQQkRnMDVES003d2k2UFJ2Z1lMRmlFM2xDS0ZiYXFYWFJWdU1yRm5hNy1kN2JyMFFmN2hudXdGbUtmLS1jaGVsc1ZxaVRiSFJMVkUwMU1rb196NmZVZEV5TVFkR3NNU0NEYm9wM3lLblA0aHBBWDZaUXJGem9iWE9VbA?oc=5&hl=en-IN&gl=IN&ceid=IN:en,The Economic Times
CANBK,"Wed, 24 Dec 2025 08:00:00 GMT","Bicholim Robbery: 74-Year-Old Canara Bank Pigmy Collector Looted of ₹43,090 Near Kareshwar Temple; One Accused Arrested – 24 December 2025 - Herald Goa","Bicholim Robbery: 74-Year-Old Canara Bank Pigmy Collector Looted of ₹43,090 Near Kareshwar Temple; One Accused Arrested – 24 December 2025  Herald Goa",https://news.google.com/rss/articles/CBMi8wFBVV95cUxPLV9xdGl3ejVVbjBZbVdWTmE4eDFvYnJFYjRMcUFhQlZkbldLU1d3Vkx5OVFMWEVZbzc5X0dLckQ0M3JkZUctMnVGMVRCcG1NN19MR2d4eGhDTTZXRXYzTDB1MDA2N3c1WGttRDUtRUEwbkFERjJsazhQQTlDS1ZvaTNuZmJJaWNiX1VoNndQR1hhV3o0ZFF6dFJsVkhVYjhyVVp5a1FXM18xQ0duVW9hNVNZQjdJem9mWl9yX0p2YXNCUW9LMjBwYnFkd1U3cFlVTzkxOWppeGZPdllTZ1lmMmRweUFGZ1VaMVdsei1lU2hXdXM?oc=5&hl=en-IN&gl=IN&ceid=IN:en,Herald Goa
CANBK,"Fri, 26 Dec 2025 08:00:00 GMT",BSE Bankex Reshuffle Adds Four New Banking Stocks Including Canara Bank - scanx.trade,BSE Bankex Reshuffle Adds Four New Banking Stocks Including Canara Bank  scanx.trade,https://news.google.com/rss/articles/CBMiwwFBVV95cUxOQ1B3cDlkNG5EZ0ZvbEJobGxsalBLZ1JoRm9PYkVadEl1aEhFeHp6eXhxZUUtWTNxbk85bjRKR21OaE1xc3p3SzQxNTRGaGUzenh5NkgwQnFVblRSb0Zaakd4cGVWWVFvSjYzZ3dBRWlBNktXWFRocjY2QmxRSk5SR2NQSFlhX1RLd242a0gyeXZiZXNwTmZUREV6TVREQTZ1YnFON1o0WFBtWk5XZDM2OHo0NUZ4V0w2ZHN1cXVqeWp0eGM?oc=5&hl=en-IN&gl=IN&ceid=IN:en,scanx.trade
CANBK,"Wed, 31 Dec 2025 08:00:00 GMT",Canara Bank Hardeep Singh Ahluwalia Appointed as Interim MD & CEO - InvestyWise,Canara Bank Hardeep Singh Ahluwalia Appointed as Interim MD & CEO  InvestyWise,https://news.google.com/rss/articles/CBMickFVX3lxTFBhTDZnYVhEaVJKeFZKd1pOdmsxNzVYZFFmdTFPVFZiWGIwT21uYjN0OE4yZF8xeVBfUmo2Uk5HT3NlUjY1MUFMOU1XemdUT0l2cnllbkRYNjRkaWdoSUdHbDRqZVk2SDhydXlZOHFfUjRCQQ?oc=5&hl=en-IN&gl=IN&ceid=IN:en,InvestyWise
CANBK,"Tue, 20 Jan 2026 10:29:56 GMT",Canara Bank Board to Consider Q3 & Nine Months Financial Results - InvestyWise,Canara Bank Board to Consider Q3 & Nine Months Financial Results  InvestyWise,https://news.google.com/rss/articles/CBMiggFBVV95cUxObFRJVF9kbzVONW0yOFFuLXVBSHphNnJuYXJ4dUs5TEJEYjlRek5vMGNCTXF0RXRSY05RREpFT0NzMmdSdTRPS01RTS1yUGl0YjFSZFZadGl5N3dGUmE0Wm9LU21tZjdvY185Wk5QTjEwZUJSeVBibmIyenJoMENQU3NB?oc=5&hl=en-IN&gl=IN&ceid=IN:en,InvestyWise
CANBK,"Sat, 10 Jan 2026 08:00:00 GMT","Tech Query: ITC, Canara Bank, Power Grid Corporation Of India, AstraZeneca Pharma - What Is The Outlook? Where Are These Stocks Headed? - BusinessLine","Tech Query: ITC, Canara Bank, Power Grid Corporation Of India, AstraZeneca Pharma - What Is The Outlook? Where Are These Stocks Headed?  BusinessLine",https://news.google.com/rss/articles/CBMiuAJBVV95cUxOY2V6QzRNQzlNMHNFREFBZHJfV0Z3QVdyX1hGWTIzSFF2NWZzaDViRUw3WWRBSkFEaWo3TEdfeFhtb2pGRmlzQ3VFYmxoVDFVQnM1bzRUdmxhSllINnB2RW9MRjdnX3J3VUpPeU9TQlZSY2tid1cxWENaajhpWkh3X1h3dzZhdUZkb2xrVFVfclk4dVVOZHprQkliSWRUZG5CbE5xczNNWnBGeWlCYTNUS1dWZTF3ZW0tVDhwZDhEckZVRDBQSERVLU4zWnM3WFRQcEYyTElVWUh6VGd6cjNScHYzbk0tbFB2enJCcThVR3VCeEZuYTE5VzhzQU40U2NmRTlaWkYzTURVNDB6M3ZIdWtBN1daMGRwTFFjU3hYNGZWc3lzU1RncHh4X21xTFBIUzlRRGpFWkjSAb8CQVVfeXFMUEMxS2puOXJNNlBfSU96QXp1RDN0MjR0ODJZZHRwd3IxVmphSlpuVXF1UEU1U25xN0xGM1lJalhaQ3hma1lWd0s0T1oxYmhZYkdpWHVBRG1ScmRXVmRNN0M4ZnVEZElmTFJodkZXMVAtS1ZIazBFT1ZyLU5pUk00TXZnZTZGT0lYLXZOT3J0T243NUZTUkxocUFYY0ZIazMxRnR5SWgwOXptclR5SnczM0dnRldGbThZSW53YW5tSDJaWWRiMldXQXBSY3BlVEN6aFltVjZBQWtXYmhtVTA0MlBLbmN2TUpMb1N3SlFxWG04aFNRNDJCVmdMN01ueXdxZWlqVmJSVDlBR09VdUVEck1uclVHazRxbTd4Q2E2eDhqbDJ5RmxTMndiSUxuZVdVTHJFTTI5dGNPdHZ6OHl2NA?oc=5&hl=en-IN&gl=IN&ceid=IN:en,BusinessLine
CANBK,"Mon, 19 Jan 2026 21:58:15 GMT","Trade Spotlight: How should you trade Tata Elxsi, Colgate Palmolive, Shriram Finance, Canara Bank, CCL... - Moneycontrol","Trade Spotlight: How should you trade Tata Elxsi, Colgate Palmolive, Shriram Finance, Canara Bank, CCL...  Moneycontrol",https://news.google.com/rss/articles/CBMiogJBVV95cUxPMkczVU5tNkQ5eXlzM3VYNjMwcFktSV9wcHNfU2xQbXp3NUNxV2lTTVhORF9ERkZNVERyUnNEMHhzdnZGMWdYbTFMSUplY0J4NUhwd0M0RVFXMk1IbHptOHJ2cmdLdnM0dW1RSlAtdjJxYlZqeVZBaUp2aldNdFZlOHQzOVRVQTdSN3JsS0NSRUFMcXA0SGpwbnNFRmxUV216OXZ3RHlKUi1YQ1Z0aTNRTFZyaXpaVzRTVV9BOHpVUFVzYVZCUVRvTVp4UE5BQnRqb2d3aF9MTDNnQVQ2NEFvcVhFeWZPME9YUDVqVEFUaG5oUmZYMTJLV3BxU3YwdktocDhoYjBmYjhzbmNFZ1M1V0RNLUVtTTBCQ0stTmhiVnFNd9IBpwJBVV95cUxQZGxCSkZraDFWUUtsdWwxZVhNcFN4bkloZXNEcDBhT2hERmRFeVV4UHZoN1ppRFJhNGd2a3d6bDFva2diR2RMclR2TWVmSDB5YVRtRnBqUUNMLWQ1T1hZR2NnQzlmZ0dfSkFrYS1VVnYtaVU2SlFKNk15VS1KYkdKOVJwX0VhdkVRejZUcloxbFJ1M0FoR2pIUzVlQjRpTDc0YU16cGZ3ZkppbTk5aDV6OWNyUEVSVmZiVkZTa0pxWFN2TFhPUXYtbDNOMkp5X0x3ekpfTlBSWFIzdjM1R3kwQjhhWmFZaExZSnR6SGhwX294Ym9XOHFmajN1UkVLdE5zWnJwLXhrbGl0RTB3MXVKLU5weUo5bVNJZkhHYXlCMXplOURfTkM0?oc=5&hl=en-IN&gl=IN&ceid=IN:en,Moneycontrol
CANBK,"Mon, 05 Jan 2026 08:00:00 GMT",State-run banks’ headcount rises for first time in 5 years; Private banks’ dips 0.9% - The New Indian Express,State-run banks’ headcount rises for first time in 5 years; Private banks’ dips 0.9%  The New Indian Express,https://news.google.com/rss/articles/CBMizgFBVV95cUxOa0VxT1RqbXpudVAxNVYyVHV3ZDNEREd1XzdDMEhkOEJ6TVVUeWptX1p1SU1uSWs2ckFDbzVmM2J0YWlXTlJKc3RfVXdGclVvdmYzejZGUXUweU1Zcld1US1CYVFSWWdoaEI5UEVNRzJNUEdwNDQ3Zk1GSC00WGJoRUc2aWtpZGQ1UFFvb2RVckZVc1drZXdFODRPRmJ3bUVXSWIwNFBxbEFkTGlIY1BYUDNpU3F4ck14V0NkUDJtWnNWRGQ0RTB2NGZZVUFiUdIB2wFBVV95cUxPclJnZWx1TTVETUg4U05xbkpWckNmZDRPV3FjZUE2S3Y3WS12SW5lVVNGOXNzRVlkVTdaRDA4em9pRThzYXVZbmFkNGFrMXV6cEswcy1NUXdaQzd0Ni1rbVZwT293VWU1OTVYekFseWRrOWFKVmtid29Ha3hkS2JoMmp4bTNyNW5hNEstMVM0M3EyNVp3bk4zSEtQRkk4Q1lacjhiYVlqN2hJTy1nTWhIa1ZmYmx6VGZUbkJMOEFqV3dTc0Y5N1ZwZ0dpNVVyUy1RRVk1NXZCa1FmUnM?oc=5&hl=en-IN&gl=IN&ceid=IN:en,The New Indian Express
CANBK,"Wed, 24 Dec 2025 08:00:00 GMT",Canara HSBC Life Insurance Skyrockets to New Highs on Landmark Partnership Deal! - Whalesbook,Canara HSBC Life Insurance Skyrockets to New Highs on Landmark Partnership Deal!  Whalesbook,https://news.google.com/rss/articles/CBMi6gFBVV95cUxQZWpzVkpfZk5EaGNfcEhZd2NTRXdsTUkyMHRuZW9DMURkVERpdkljbmVsNDBEUWZGYmRubUEzMHk3SjVQQUJRc3lJb09UUGt0YTdZcHVETUFyblVnQ2F3MkJ3ZjFBNlhUc1NuWDdvQ3Z0THVuOXFBRVExZjU5a280dlVMY3VSWUFERnJQVzhLQlhKd3JLZkI2akctcVhhOUxqQl9ORjZnT2hJM0NNcUc4ZzVSZ3JsNjAwb2lvNTZIaWJnaTF3YTNnVm14eG45UVZGa3d4a1JrYkVsOTZyTXZPOThpaWJ1QXZhUnc?oc=5&hl=en-IN&gl=IN&ceid=IN:en,Whalesbook
CANBK,"Wed, 14 Jan 2026 07:08:24 GMT",Canara Bank - Eternal among 4 stocks showing bullish RSI upswing - The Economic Times,Canara Bank - Eternal among 4 stocks showing bullish RSI upswing  The Economic Times,https://news.google.com/rss/articles/CBMizwFBVV95cUxPTnZSZzFlcFdLTkNPdXJVdXFqYWE3cG5XUUYwMjRnOHYxaXpCYklhbHY1SFpveEdld1JwelJGOTRkbFc3NGxYdGtBbW5VRlVZTU9uVExVdjRacmgzZ0t4cEhEM1VaSlFzcGd5XzdxcHUySnhyc1h0WTkza1FFczFtMzRsc29LQmpkR2JLZ1ZMODUyb3RMeDZEY3Z5Y2pRY2JhblFzMjZBUjZYM0RBSm8yR1JGMS1GZ0lkQ2lLb3NfS1U4YnRkbXhhSDh6dGZ3alE?oc=5&hl=en-IN&gl=IN&ceid=IN:en,The Economic Times
CANBK,"Thu, 01 Jan 2026 08:00:00 GMT","Stock Alert: Canara Bank, NBCC (India), Titagarh Rail Systems, Dr Reddy's Laboratories, Time Technoplast - Business Standard","Stock Alert: Canara Bank, NBCC (India), Titagarh Rail Systems, Dr Reddy's Laboratories, Time Technoplast  Business Standard",https://news.google.com/rss/articles/CBMiiwJBVV95cUxOR29KdnFOZnJZVmVIcWF4aDNtN0RaYy16UVlHVkxRTUZsUmtzWUVCUFdLeXJ1MFF0d05sUXpwMm1CcjVqcHdMemFJZ1puVTY2a3F4cEEzYWxuUE9oRHhBZklGWHVaN2dza0J0R0djSUVQQ0xDNVNVY2VfWGtreHNGUURYTlZ3TGUxUGN0RkY3aUMtYU1TT2NsdGQ4R3ZCcjdQekdkd3N2M21RZC0wZkh2aGV3N1RUb1hrV2lYTUpUbURzX3dYY0dyMDVab1VLcWNhV05GOWlGSFc2S2NMM0VxMlZ5ak5QYkNVNlM0RDcxTGE0S0pfSF9pbG5kSG9ydEZaMEFBcXNhZEJpNEnSAZACQVVfeXFMTkd5Ukxua2FadGlSMlF4czhHVDZWa3hBNXN4SXFXcTZDdTZ2Q0ppSzM3Zk9wVXB6ZWlZeUtlQ0d2Y0hPMVhCWEdwNHRRYWlwVU9hQm5yYXQ3NGltbnc4YUZTa1g5ZTFUbkcwMXFBZmhubUtnZkNMNVBtVlBIVko1bTY2T05nd1VxTnFEWmRmdGZLM3E4Y1Zwb0ljemhLZ2I4cC1NcjgtbG1UdklNNFdBdUtTdTNiSWpaYU5NbjVmcS1sV1ZGSlM5TUVLdkNsb3RKUGVZeW9nbEx0UTJiWFBEX0pHSnkwaGJCT1hYRUhMZEhDYmZpUDg4QXN3YW1LUjNvVWZ5NGxuRXltX0x2eHl0YVQ?oc=5&hl=en-IN&gl=IN&ceid=IN:en,Business Standard
CANBK,"Thu, 01 Jan 2026 08:00:00 GMT",Lack Of Written Agreement No Bar: Allahabad High Court Holds Rent Authority Has Jurisdiction To Entertain ... - Verdictum,Lack Of Written Agreement No Bar: Allahabad High Court Holds Rent Authority Has Jurisdiction To Entertain ...  Verdictum,https://news.google.com/rss/articles/CBMi0gFBVV95cUxPVVVlYUxhUDhTUEViVlR5cFpxc1NqQ2UxeDRJY2w2b2NsUklod1FUMnhyaXE1T1FncWlvazFWTmNYTjRNN0o2RFNxSWtoSmtqWTJjOWI4Z1M0VTBlUXFqbHVJbWVFbVFsYjVGTmxOV1MtZXRmdktuVFdqQ3hYNXVDc2VaWk9HNGRNZGF2U1dpWjdvSUFyNGxDazdKd0NMUDl3emI1MnhoU3RKei0zaDNoMHpIckdIVVFvTHd5XzIyNUhVbXNxaU1wNmN5bGtqY1hBUkHSAdcBQVVfeXFMUGFkZWgzRnA1LWlMTldmRHg2VzVlZHEzc2ZPYktxX09FMXBJYk9VeEZCcVlFbjN4bHpFdzlJSFhneU9LbHpRLUphVnZ2ekdxOXV2clltcVh0NzlpTG0zWk50eHk4ZVlpMkd6cmFiSXJkWVJqejdCN24tU0Z5amZTSHlXTmNwXzQxVHVUcHJtUUFSVFMzd2d3U3dodHRDQmRWdDFvWUs1ancxYkRscTFPb1hUR0RrQ3FDcmNrTGctNWtMci1fbXJJcUVNT3VfcE9zZDZoY2tvQTQ?oc=5&hl=en-IN&gl=IN&ceid=IN:en,Verdictum
CANBK,"Fri, 02 Jan 2026 08:00:00 GMT","January 2, 2026: Bajaj Broking Reveals Top Stock Buys for HUGE Returns! 🚀 Nifty & Bank Nifty Outlook Included! - Whalesbook","January 2, 2026: Bajaj Broking Reveals Top Stock Buys for HUGE Returns! 🚀 Nifty & Bank Nifty Outlook Included!  Whalesbook",https://news.google.com/rss/articles/CBMiqgJBVV95cUxOX2RfRnhEZ3QtbmMwWk5sdEtKdDJBeWM1VlNsVHh4d0FndEl6T2VLNEd6R25BLWJLVWhacW9hSWFpTVBMTnhYRzNiTWxIR2dGckNWZ0wzcVkxak8wMVpjWmF5dm5Ydjc5YzIxWHlXcWlzOFpCaVJlX1k4U3Q2WjlaeXZqaWxnR1hnX0tVNmZ6TlZoRENDS3l2ZzlTaHN5bUNXZnBPN1d6bTN0T1BZTE9rLWZOM19Td2JtX3E0RUxvdFd6T1Q5OFVBWUgxOWhvN0VJTUlGTUs2elA5ZTJ3SmpUeDZTUVVzb3VQR3pjcXduejBVOG1Rbm1VOWpFbnVadWFwWkVUVXktekdkZWlhZkotSnJEVzN3dkNpR0VTQ2dtclJldmRyZkctQlNR?oc=5&hl=en-IN&gl=IN&ceid=IN:en,Whalesbook
CANBK,"Tue, 30 Dec 2025 07:35:00 GMT","Canara Bank spurts 1.33%, up for third straight session - Business Standard","Canara Bank spurts 1.33%, up for third straight session  Business Standard",https://news.google.com/rss/articles/CBMi0AFBVV95cUxOOEtBdmZqbUFzZzJScDBMUzFHcTB0d0wzS0tUNWtYN0h5dkJTWUtTZzZkZENscVNUcEZ4SmNGUjBXQWdlQi1tTXRMYTJWN1dXTFFqcktlVmZXYmlfSHkwaXI4cWpsRzFCSEVITGJLQk1JTUV2eUU2bndxMDFXZWxTVkdvbDFlNE10amdhWWVuUEprWWVSdTJrTjVjRXEzUFMzbmxnWGNkcWRCTzZlLXRoblF6MEJRdGhtTGRIdGk4QzBfNi1UTHN0Q2ZBQU9hQVZH0gHWAUFVX3lxTFBhMmJWampBdnBqWGlUNG5kQ2Z0VXZqRDdRRWE0WnJ1RlNRZVNyV3lsemg2bmNMcnI2SlctRHVPNGY0TGNUVmpzTVNUdFRPaVRrT3ZHcDRUWF9YajBZNmVPOHRIR29ub3YzSlA0Q3VZelM3VEI0bXNwQlNqWE1URmhnUGY0QXpHYjZzeG1GZVlGM3RibENNU2ZpMExrMHhneUJTWEJhbmNlbTN5ZklZR3ZtRG5Yak04UTBVX0gtSDBpSDVaalpFejhxYUF1czdiSTc2UlZhTHc?oc=5&hl=en-IN&gl=IN&ceid=IN:en,Business Standard
CANBK,"Wed, 31 Dec 2025 13:18:27 GMT",Canara Bank Shri K. Satyanarayana Raju’s Tenure as MD & CEO Concludes - InvestyWise,Canara Bank Shri K. Satyanarayana Raju’s Tenure as MD & CEO Concludes  InvestyWise,https://news.google.com/rss/articles/CBMigAFBVV95cUxNSXhjZDNuNDlwR1BaYlA0MWhEVUExMW9SVEZpbHhHYlN3MXZvVGdETkpZVTNaM1hUTXlTZVFQU0x6cnpMa19yQUxybW42bUt5UExXSGYxY1FZU0hISW5XN3c5Zm9vQnVDZC1sR181YUlrVEFkU2ViX3RJX3dKeWV6MQ?oc=5&hl=en-IN&gl=IN&ceid=IN:en,InvestyWise
CANBK,"Fri, 02 Jan 2026 08:00:00 GMT",CBI books rice mill owners for cheating bank to tune of 10 cr - Times of India,CBI books rice mill owners for cheating bank to tune of 10 cr  Times of India,https://news.google.com/rss/articles/CBMi0gFBVV95cUxObVZTQ3lhWFJ0WXV2TWZwdGdmazh1eXAzeWJZNzVLTVl3NnNUVEp6QkRJNUFPZzhCbFRFbHR4NFNsMlpVcEhXYUJCNnNfNmw4b2FfSy1kZFRnMEhSSUpqZXFIbzJ3WUpZUkRjcXlOc3NZclJwTjFxa0VDckdmbEgtR3NVejJ0UjVWZl8xOElRX0ttRm1idkdVd013Z3FHcjYwZERTLUoxTGdwcVdkaWd6dm5fdS1KRTJFYXpJZmdiaDcyRzJVd0d4aGRiY3ZvdWVVZlHSAdcBQVVfeXFMUENPb0NzUUJEbk9rcF96YzlWa09WUHdNd0tmZmhGN3p4RzVGS0pJUVFNbHRiR2dZYWRlY0pjUFlmSEhJSWF4U0FmOXUydzdyd05BOWk4UWQ3UTBnRDlnNHRvX0lfMUxlZURtWmxEeGlQMFdvZTR2Y2VaOFJfZ3pEZTZncU1Ja0NPbVdKMEZya1pkdDdQNWxNMDZtZm5YVktQRVM4NDdSazA0U1hMVzJYM0xOdFdOWVRlOW90M1ZnRFJObGp3QmpWaHowd2ZrZnpUbGNLTUFnajQ?oc=5&hl=en-IN&gl=IN&ceid=IN:en,Times of India
CANBK,"Mon, 19 Jan 2026 03:50:31 GMT","Motilal Oswal Picks Top Stocks: 360 One, Canara HSBC Life Eyed for Gains - Whalesbook","Motilal Oswal Picks Top Stocks: 360 One, Canara HSBC Life Eyed for Gains  Whalesbook",https://news.google.com/rss/articles/CBMi7wFBVV95cUxOX0IxQVd0RmtqbVR3UGJZRERfdDhTYTU4MGg1dktrMFhveVJlcjFlaVhkUEJIX3gxQWJ2SlRTMVBrak1SNng3Z0M2LUx2a1J2YmppTHNtQ3kyNlFVa2RwRDlFMG9VR0dQcS1wUEFiQUlsdEVDOE90eDNfallCbXZmdm5teEVtYmItSjBRRmphMTNaYUozVG81eFFfX1BuTFZUZDViLS1qNXZES3ZDeDlENy1QenpqMmV5ZVc0N2YyZFpZaXV1SHZiN2hzZ25udGRUTFdyeUtSM1Y4WUl2WHd5eUt0ZG1jbGtBNHdHUmlpUQ?oc=5&hl=en-IN&gl=IN&ceid=IN:en,Whalesbook
CANBK,"Wed, 31 Dec 2025 08:00:00 GMT",Canara Bank Confirms Annual Interest and Redemption Payments on Bonds - InvestyWise,Canara Bank Confirms Annual Interest and Redemption Payments on Bonds  InvestyWise,https://news.google.com/rss/articles/CBMikgFBVV95cUxOSkFNT0xHR1RqWjdXM0g2anJiYUw3c2xQRERJT3Y1T2h4VHdjbmdReWoyTFJ1ME9IN195aTU5bmExelBERGZmbE5jZFdiUjE0SlAyNWhfYmtUZ1ZrenJXU1hseWZRWElFRWI3ZnJTU0hkMHZUc19pQlZ5aF95UnowYjBxMGRvSU9sbFhZZFU2ZWhjZw?oc=5&hl=en-IN&gl=IN&ceid=IN:en,InvestyWise
CANBK,"Tue, 06 Jan 2026 14:20:10 GMT",Canara Bank Credit Confirmation of Annual Interest Payment & Redemption Payment - InvestyWise,Canara Bank Credit Confirmation of Annual Interest Payment & Redemption Payment  InvestyWise,https://news.google.com/rss/articles/CBMihwFBVV95cUxOM284akNqWGdzUHlLX2V0WVhKMGhacHZSektzckZJaGVvdnRhRElyXzc4THBwcVU3YUhlRWRXNzBEbEs5X296a0FwVF9WOFRDcl9GUy1ZRlVVZFNWU0tIQVNGYlBRcFpiWlpxU05EUXk0UUFfVXB6Z2IzN0FibTVITDJ6empZbzA?oc=5&hl=en-IN&gl=IN&ceid=IN:en,InvestyWise
CANBK,"Wed, 31 Dec 2025 08:00:00 GMT","Analysts recommend buys in Titan, Tata Steel, Indian Bank, Bajaj Auto, Canara Bank & NHPC - CNBC TV18","Analysts recommend buys in Titan, Tata Steel, Indian Bank, Bajaj Auto, Canara Bank & NHPC  CNBC TV18",https://news.google.com/rss/articles/CBMiugFBVV95cUxPd0J3UnY1eU04a2N0dGpTNVFSMmRzay1udlo5WUVoXzdIMWdUTlJQTzBxWlZBemtqNFptVV82WEVvYU1NM3ExOVhZcEJybzFLRlpEdEJXcnZDeFpCTm1qZGdjekFaWlNNU0NYX0Fsc21HSW40d1hzN1lidnhXejNPaWpCZWd5MnpJdGg4VjRsVk9DOF9DdXZNOFpCUHU1ck9sUnVZcE1GWFhFUmQ1VDFMeFo2RHZ2X2lLamfSAb8BQVVfeXFMTjdpVlpvZm1tNWd4bHYyQk1FdF9NeFZFdVZmbmdaRXFUSnhvb1hxSHoweVFhVUpuN3RfMnNWWFdqS3ZiYWNOR0RBODJvd2lGdWt4WDNMSGlCUmx6YTd6NjdLcWpxbzM4NmdFZHZyWE0walU1MlljVFFJVFNPZUlkSWhjREsxMzhYUDN1dGIzSkhkQ1l3ZUMzejdBUHNUVGJwbzhuS1FPRkxEVkIzUmdBQkdiWjJPelZxRkNJSHNOZ0k?oc=5&hl=en-IN&gl=IN&ceid=IN:en,CNBC TV18
CANBK,"Sat, 10 Jan 2026 16:28:58 GMT","Canara Bank deploys employees to garner deposits, mobilises Rs 16,000 cr in 10 weeks - MSN","Canara Bank deploys employees to garner deposits, mobilises Rs 16,000 cr in 10 weeks  MSN",https://news.google.com/rss/articles/CBMihgNBVV95cUxQaGtZSnBUbkVSakR4UnhFSEZVb3dtRHhaSkk3LXRkNldYSGhHSFN6X0VXSTRqeTUzRlFTRm1SWTJwREpwSFRMa3Z3bC0tOFJGZlFwcXZrSDdZemxfa1FYS1BTcnlTdzhDMXRqNGVGOGVHTXlFVGNaN3Izd2s1TnZfc0FmVlhlLXhRenk2cGJvdmhJMEQxZlZEalRUWnRNUGc5TjBoVXVxSTRYSWJOUUZnQ09vUmZJUjIxeGZlTGZUb3FVQmoxNTFoZnIxdWFIR1RoQUVGYnlFaHB4cGRYdHJuX1VjUEJ5cmZKei1uUjIxT2dYSFQ4QVdRZnIzWlJvWlNJWDdjZnRpbzY4aFh0b3FnTkFqazlDUnhfUFJURloza1N5LWY4T19UN3RXS0IwYXJTdW5GUEoxSU9XTWU1ejBtUTUxR3FDZWtsRGI0UEdBQWpGcDBPNG9VOE5fQWl6czNOa1IxSGNpQ28xQm9RZXdybDIyWWJDcndoMUFFMzlVem90MXdJZkE?oc=5&hl=en-IN&gl=IN&ceid=IN:en,MSN
CANBK,"Mon, 29 Dec 2025 08:00:00 GMT",Bank fixed deposits in 2026: 2025 in review and what's ahead for FD investors in the New Year - Upstox,Bank fixed deposits in 2026: 2025 in review and what's ahead for FD investors in the New Year  Upstox,https://news.google.com/rss/articles/CBMi8AFBVV95cUxOSUxIYXJFTTJKOTVlZ1diUi1pOVd3THkzZzhLcDdhQTBuTmF0endHR2hkZUlnTEpaVVg2eHdWT1VGa1JiVko4M0VFdmxHdWN3dnpaRHktQmpvWjZjTEhhQmtOSDdDZ0pNVll1bmtkOG8xbGtVZ3E4MUJBY1VDTGMwclZQUnlVaHZlbWtfOTY4c2x3Z1liWkxQNlFzdEdWRUp1SGp6aVdUNHFyeF9fZWZ5bFFwbXQ5TDBYTUVwZXRXT3V2Y1JGbHQzallndTRDQVRlWHp5RlZfanJQNUZIcE5JVjFjTlBfSnYtMEtlTC1KclY?oc=5&hl=en-IN&gl=IN&ceid=IN:en,Upstox
CANBK,"Tue, 13 Jan 2026 05:32:55 GMT",Motilal Oswal Sees 51% Upside in New Life Insurer Listing - Whalesbook,Motilal Oswal Sees 51% Upside in New Life Insurer Listing  Whalesbook,https://news.google.com/rss/articles/CBMizwFBVV95cUxPQUhncW1mZXNNbXJsUzd5YTY3Tk5jLVNzTmRvbEotREJvRzN4YU5kSk91dzhXT0tEa0RvcjdMT0RYc2FORkFwSTFvSVp3dTVxOGJOTzQ3X09HWEhscDNQbExWb09YeHFvNEg1eXdXUHREbVRYSUFoZ3VKT2lLU013VXJ3YlU4cW9jWWxuV3BTOUxudEZpMVplbUNMOG1NLWFjcHlhMndPXzJRZ29UYnVvWlNYanVrYkFycjN2elVRRUJvYktXazhESS05SUFxbDg?oc=5&hl=en-IN&gl=IN&ceid=IN:en,Whalesbook
CANBK,"Sun, 04 Jan 2026 11:28:05 GMT",Live Scanner Shows Breakout on Canara Bank - Real Estate Investment Trusts & Minimal Investment Trading Tips - earlytimes.in,Live Scanner Shows Breakout on Canara Bank - Real Estate Investment Trusts & Minimal Investment Trading Tips  earlytimes.in,https://news.google.com/rss/articles/CBMiigFBVV95cUxPVEh0dzVwMXJvdW12T2NFQzVqZDJFS25fNWp2MFFWMFU1bTV2Rzk5d2htWXB5dTYxVk9Cei1MbmVoRldZeWtvVjNiMldjQ0FfUTlNYUhhMHBuSE5Kb2daZXBIYURTaHdnUWtmaUxsMHdCU1I4MzZzOEJ4ZGVmdFJxSERQR25PcG40cWc?oc=5&hl=en-IN&gl=IN&ceid=IN:en,earlytimes.in
CANBK,"Tue, 13 Jan 2026 05:55:45 GMT",Canara Bank FD Rates Revised: Check Best Returns On Special Tenures Of 4 Other Banks - Zee News,Canara Bank FD Rates Revised: Check Best Returns On Special Tenures Of 4 Other Banks  Zee News,https://news.google.com/rss/articles/CBMi1gFBVV95cUxQWm5ySVM1aGNXZ2Y0VENwVGtsRkptb01iUHZWd3hPRTliaGpJWklZOHZFR21vb0tGRHZOYnZUa1BDRGZCY2F2U3g0eXVOZHJwWi10WEtZbDhBcjNPZVhxVnd0UTIyVE9UNk1kRUVYMWpRM1oxY0p4Zy1jUE90U00tc3VxSjZkRGlZZTBBRFlXSGEySHJVMVl1T2FaakdFUHVIN2UtbmYzcmhZUjBoX2ViQXlYU2l6a3NBM2RPMzJlM2h0SEV5WDRlS0pyQUNKdkVtR3gzbDVn0gHbAUFVX3lxTE4yaW1SYlFwM0hZVG9wdEJuYVBYRFVaUDQtQy1jalBMbkMxQzNHVFQ5TnRPUWJ6ckF5TzBhRnQ2N1NoT3VPLVh5MjNGdW94OXd3c3NHMlV5Z24wajZDbmd4U0NsUURoNi1QUGRFc0xlUC1WXzNGZnVqQzA3YzR3VzBkQmJRU0dDdzVubEpOVjRfU042NmhzdTU2SFJFU0RfU0l5N1RWc3M2eVVCMHRCV1hkaVZndmlJUklYUmJ2YmVCVEhyd0xFM3NMNGYwYkFfdjhNWFFiYmRFWm1CSQ?oc=5&hl=en-IN&gl=IN&ceid=IN:en,Zee News
CANBK,"Mon, 29 Dec 2025 08:00:00 GMT",Canara Bank (CANBK) Hits 52 Week High - Market Volatility Update & Maximum Profit Growth - bollywoodhelpline.com,Canara Bank (CANBK) Hits 52 Week High - Market Volatility Update & Maximum Profit Growth  bollywoodhelpline.com,https://news.google.com/rss/articles/CBMifEFVX3lxTE10UzZrcUYxRDVRQVk0S2NEbEdfOExua3ZSb0JiTE14aHVuTlNXVWJUX0RORkpzR0sydzNuMWJlcXotb1BkV1Z5bXJaQTM2SDFoa0tLQnMzZTNfMGJ3R0FId1BPb2s5aGQ5ZWFfV0FfdzVrTkZzVV9SLXJtNE0?oc=5&hl=en-IN&gl=IN&ceid=IN:en,bollywoodhelpline.com
CANBK,"Thu, 25 Dec 2025 08:00:00 GMT","BFSI in 2025: PSU banks shine, MFIs struggle, gold financiers glitter - TradingView — Track All Markets","BFSI in 2025: PSU banks shine, MFIs struggle, gold financiers glitter  TradingView — Track All Markets",https://news.google.com/rss/articles/CBMiyAFBVV95cUxPYXhwWjJUM3hYeE9zVC1JSExkOHVQSEU3SFJvWnM1a3JQT25TLUNxbjhWYVNMcjljN1hwQXZyREtsZ1pPV2JsbmlrNVNlVkI1TFFrTzRoSXhNc2g5OXBvTWJHQ04xNF9NVnlqYzJOc0Q3NVlaNW53MFExODdYLTF3U1JZb18xdExPcWFqNXczaFJKQ1dtNmVBamYwTklqNldVVEpDd2FlbXFPajBSS1JaY1F3bnE0WGFtZDMxQmxjSjJlM09iTU4xZg?oc=5&hl=en-IN&gl=IN&ceid=IN:en,TradingView — Track All Markets
