ticker,date,title,description,url,source
CANBK,"Fri, 02 Jan 2026 03:52:39 GMT",Canara Bank names Hardeep Singh Ahluwalia interim MD and CEO from Jan 2026 - People Matters - HR News,Canara Bank names Hardeep Singh Ahluwalia interim MD and CEO from Jan 2026  People Matters - HR News,https://news.google.com/rss/articles/CBMixgFBVV95cUxNczBaZTRuY1pETVZCck1uTjJkWEV0R3RMUU1sa0JlNnNDdXgwamdfcFd2cXhCcHhIWjFmT3Q3X0tzMENRSmhoWU9TTDY4WHU2Z05SQy0yVE9lb0lCMm9sUENWdVFjWkxva1E2TGQtTHJGMXJlNmxTcWFJWW5tSFFuN1E2cWdORzU2XzdpU1NyZDJ2cDh3QU1zSlhPY3RYRE9kaWw3TlZERm95RmU1NDA2cVVMWlFhYlV6UEVhQ1k2dXA4UGZEeXc?oc=5&hl=en-IN&gl=IN&ceid=IN:en,People Matters - HR News
CANBK,"Tue, 23 Dec 2025 08:00:00 GMT",Bheema Shankar Taddewadi elected national president of Canara Bank SC/ST Employees’ Welfare Association - The Hindu,Bheema Shankar Taddewadi elected national president of Canara Bank SC/ST Employees’ Welfare Association  The Hindu,https://news.google.com/rss/articles/CBMi-wFBVV95cUxQNGxUdnVtMUx3clFqRUVVWFg5OTMzT1o3NFFrVTZGY01mdWZrSlhlaV9EOVMydFZfT3Z6SVJQSnltY0x5X1ZnSlZ4aDMtMW0tcDhnNWNCUnJPeWt5Nk53VW9zVDA2Zm1qdEtWbm52QWczWjc2LWp3WmJTUXVpVFJUeGZCZ2hmaE1vekVaZWQ5U2c0ZUlHQmJDdjkyalBrN2x5eDBVSldZZHZJRFlvem9KMy1KcVQzOUJsNDMxNkR1Y3VQZlplVERwXy1XX2ZtNVd3Y3ZBeElOa2h1aTNZanl6MU4yQmlCSGVtaGJ6MjF6WXJXVFBJNDJ3aDllZ9IBggJBVV95cUxON0xOQUNrS0pUeEtRUTBQUFNBa1hobVF1Ykxvc0JfLUpZSXB5QUlEakxzUGJHcXNqVTh0VUVuQ0htNV9TX3pob0NhWWZJRnU3bHB5b09uQXEtY2ttb1pfWk94VUZRUnpfQzN3R0NKNG9hT0xmblVHMXJwTVNmdi1mRXgwZXEwaVYtUnJQNFI4cVNwc0dmMzl4OFM0LUxqZEVYQ1B5RHc4YjJfVERqekwtOXZEWExGQ1BEMXNWWTdPbC1vNkNZOFJtWU52NnVjOWFIcUZTcTZSVVlxaWQtU0NTZTZyZmgyZHZ1SFdSTGZTRldTWUFObG4tTDlLWG53RUR1b1E?oc=5&hl=en-IN&gl=IN&ceid=IN:en,The Hindu
CANBK,"Fri, 16 Jan 2026 09:10:17 GMT",NBSL and Canara Bank partner to power UPI payments - Banking Frontiers,NBSL and Canara Bank partner to power UPI payments  Banking Frontiers,https://news.google.com/rss/articles/CBMihwFBVV95cUxQdWRyVGllZmN3RGJ1Y3ZPREwzTXQyVEh3N2UzdnV5VENlNFlQUVZiektFYnRWd1pWbmlrYVpaaWtxd1EzYU9hUWFYRllqQmlqb3JVLV9zQVRDb1o2TzgwRjd3YXJhMkI1LUs2QnNYbzZ1RmQ4clV4VkJfazRjUTM3SDZEbEF2RzDSAY8BQVVfeXFMTkFKT2EweE5Wcml3MHJoTUt3NlpCeFJDR3VnUmpONjMyUUw1SXFWWFV3a0VTbXpLQ0tSSGJUcXV4Q2hwdk1Tb0ZLZ0JoSDVNakhzdmRNbjRKSHBvXzVEN0NnY0tTcEItOEpQOXRIS1lvNEJPWUdHdmN3cW1NT2ctaDhGNFhLLVhtOGdLYVRDRUE?oc=5&hl=en-IN&gl=IN&ceid=IN:en,Banking Frontiers
CANBK,"Thu, 25 Dec 2025 08:00:00 GMT","Canara Bank, Bank of Maharashtra, IOB: PSB consolidation to gain momentum in 2026; key points to know - Upstox","Canara Bank, Bank of Maharashtra, IOB: PSB consolidation to gain momentum in 2026; key points to know  Upstox",https://news.google.com/rss/articles/CBMi_gFBVV95cUxQS3hnY2NiZlhjdzFKX01tYWx4NVlMWjJIbmhzSUdlSHFMSEt1Tl9uaVVnbmxORXJRT1FXTWlDQnVTRFNIWGtINm5GdFBycDVGSmVFbDMxNmdFQlhrQWtSWkxSNDIwS1hnSUhfTjhaU1YwZjl0NWhFbzE4SmFGNUFpdTFOMGsxUjVqWXhvYnV1TEJsbWxhZ2JKTFJGTDJ3NkZfRHR3Wlpoa1hTLXp6RWl6T19lX3NxNER3Vld6NTR3TTF1SmVlenNvSU96dXctSDMxcl9CbHgwbmdGbGFDckFiQ3llNmFBbG93RGYxdUFuYmtWR1VZbTR1VWdYV1hqUQ?oc=5&hl=en-IN&gl=IN&ceid=IN:en,Upstox
CANBK,"Tue, 20 Jan 2026 03:38:33 GMT",India's Canara Bank enables UPI payments on ai1Pe app - Asian Banking & Finance,India's Canara Bank enables UPI payments on ai1Pe app  Asian Banking & Finance,https://news.google.com/rss/articles/CBMipwFBVV95cUxPUUFUVUZkWWtUZTNqUHN3bkIzeUx4aXFFOXF1Yi1lOUtjUDJuMy05cDJZcmJueDVWbXkycURHdzJpb29qNnlqcmR6UXkzTkR2WlhpRDZQX1ZVX3RxYlJaYjFYN2F3UHJXMXZDTjdUalF2WkdTLUdqd3NNek5RRVVndWg3a21Ib1hkb0RHVE9CZjBxZVlJZktyUGpweWYtWld5MFJablF6TQ?oc=5&hl=en-IN&gl=IN&ceid=IN:en,Asian Banking & Finance
CANBK,"Tue, 23 Dec 2025 08:00:00 GMT","Brajesh Kumar Singh in line to lead Canara Bank as MD and CEO, FSIB recommends - Fortune India","Brajesh Kumar Singh in line to lead Canara Bank as MD and CEO, FSIB recommends  Fortune India",https://news.google.com/rss/articles/CBMi1AFBVV95cUxPcnc0MFJVY3Zhd0RWUGRVMFZMcDZfOWd6dnhjejM5dXlHNFFSY1g2UWctNk55d1RYcWtDRmszQnhBV2JFVUZKaW43OGEyQVVHZHdfcXRwOFNMWVJKYi1fUHZiM0t5WVlTamp5U2JlVzdBeGFnSDhqYmVvMG5sb2tOdFo1cW1JdmFLa0xQdkVHSVhXQUNQRzVwN0ZTc04xd3dLQ2tyTkM2WUczT1FfdWJOT2llOFZsbGlhdGFnUWhpd014anVaVVJET2dDMDRDVV93UWw4UdIB4gFBVV95cUxOZnRJZUxBa0pZX0ExZFBvaTRLc0E2enBvZEpHSGxNakVfV05SZnhjdFJUcWxsV2VTUUZVZlQxdjhzZ3N5enQ1dXVtNkNyTlY4Z2c5MXg1YVBTMVBBOEEwanJiSVhmQW0zRVhyaG1KQUVCRUFkRTBvZEdicy12UGEtT3FmNWZoelc5M3VQOUJENS1wdlZHQzhXUXZDYXluQkNGNEJrbDdwN25UTG1JTGs5VkdUdWxoNGZsZDNEZ243aFZmM2dHdks3bF9rVjgxdUFlZTZuSG1TN050WHVXbFVYWXh3?oc=5&hl=en-IN&gl=IN&ceid=IN:en,Fortune India
CANBK,"Wed, 31 Dec 2025 08:00:00 GMT",Hardeep Singh Ahluwalia Assumes Additional Charge as MD & CEO of Canara Bank - PSU Connect,Hardeep Singh Ahluwalia Assumes Additional Charge as MD & CEO of Canara Bank  PSU Connect,https://news.google.com/rss/articles/CBMirwFBVV95cUxPanRPYTlpdUtVemNGVGRJN0h6M2dpYXNVTkRRa2ZRUmRtQUppcGJSTExtSXhFVHBvVkVoWHBYdVJyUWFTUXdvcVprUUJKSS03dElORTNaVFhRTDY2T1I2Um5YS1dUQjRma0RBRTRfbjhmNUxweGFfcTVzM1pGMnNuLUVoTjE2QVJZeHp2YW9nVWt2eWpIVk9wbVRfTlYyRWZOUnljNkUwOEJmd3lDOFZn?oc=5&hl=en-IN&gl=IN&ceid=IN:en,PSU Connect
CANBK,"Sat, 27 Dec 2025 08:00:00 GMT","How bank insiders enabled cyber fraud: CBI exposes nexus among Canara Bank's manager, Axis Bank's BD and m - The Economic Times","How bank insiders enabled cyber fraud: CBI exposes nexus among Canara Bank's manager, Axis Bank's BD and m  The Economic Times",https://news.google.com/rss/articles/CBMilgJBVV95cUxPWUdfTG1sSDdSTFJ0WFZsZXVTcnFqRjN3eDhXcmZ0VXE5UVR3YkR5Tm9jelJPNFlBWmJaRmhDay1uS3RTTkRrM0hxZ0tWWmVuRF9zaGcxYl9UbjlLay16dkR2SWQ4M0pKc0NfRU45dmJVRzZtOUI2TnVIeC16cF8tRWVFV2VSZG5xcjZZU3VpVWVGeWNiVTZITmdTalhqMXE1X0tQOWlmbFdQM3llcE9HNnNqRm91MGNFaEViOWVRXy1Mck55Vk4wMDd0algtdmhONXNBNG5iQWt2MkNWcVhYNmFSaHQ0TjRHYzZKQkNyT29uamYyQ0xDNzVPT3ByQ2lGNGpnSGRJUXFLYlhrQnNPYXJ2Ti14Z9IBmwJBVV95cUxNTUs1eTVPeE10RmlFRW1YazhSb3owdlJSUE1kUDB5WkdqbmJhZVBDN2RVXzFzQjloMW9BcndPVUdnU3lQcFJBNkQtT0ZwbWpQZzJjSTBEeDV4YWRiTVlyWEJnNk1SM2tYaFJDc2JlbXMxdVJab21zaXV2eUNkOWQ1dGhlYVVEaExnMDgwbU5ybXpjUE5QTTRBZDlzOWJDd1YwcDlrYTBjOUJ2bTNFYWhVVThkZHlrMmlSTjVPajh5MzdyZzBPaUpYQ1RHc01UMW5DVnBYSGh3RnRqcjNuSk1iY3lyQjFpQXhOS25fV3I4ZDZ6dkZ0WW8wd0R2aTlUa01YZ2FrVnVqWGU1eWJLb3hmanJITlh6NTJwUHpv?oc=5&hl=en-IN&gl=IN&ceid=IN:en,The Economic Times
CANBK,"Wed, 14 Jan 2026 07:43:47 GMT",NPCI BHIM Services set to provide Canara Bank with UPI payments tech - Business Standard,NPCI BHIM Services set to provide Canara Bank with UPI payments tech  Business Standard,https://news.google.com/rss/articles/CBMi0AFBVV95cUxPcHhPUzFVWklxZE9QbWVaYk9Ra25iRV9lazJvS3VwSmY3cEJJemZXOGZ6YnRtRmo3aFptN3MxMUJMdFNtR2FvSzAtLXNSeFZ6cEtjY2hVRG84WXZRbEhNS21wdmZ0bEtxTHFvN29Ja2xjTVhCWGdhMGJJNWRxczVKOWNmTU94UFJ1TGQtRkVDM1ltOHZLcUhxZjJiem9Vemg3Yk5jdklDdVA3ZGJZTHdsLTRRTjFiVVIxekxELUZvTjJXeDdsY0pHaFlJYzZNU1U50gHWAUFVX3lxTE1lRS0tdnh2TVp0S1Y5WUlhYnZuVEY5ZzMtRUtsZ0dpNFNKcE1xNHFhU216OFJTcnQ2QklySG1ZVDlCWTNLZ3dUbVk3am9lUHhBdVpHNW9xMnZOS0dtYmMwWGNtX3FYS0lQUlROUlk0YkdGVmVZMFFlbjhaMzlyRDZsMXlVazMyZlh6a3hLOUxsLUlvTDZyeFJHbWVMdGIyeXlnYS1ld3dvRXhQRXhGenVrM2VieU1fakxjYmE2RVdkUzVjM2IwR3lBd2RrSFhwU3M1UU1GaHc?oc=5&hl=en-IN&gl=IN&ceid=IN:en,Business Standard
CANBK,"Wed, 31 Dec 2025 02:17:17 GMT",Bengaluru: Canara Bank manager on the run after cheating 21 customers of ₹3 crore - MSN,Bengaluru: Canara Bank manager on the run after cheating 21 customers of ₹3 crore  MSN,https://news.google.com/rss/articles/CBMizwFBVV95cUxPc2ZoYmNDQ1pQalBmUUpnVmNPNTFJa3BVeEcyQnhfbC1NLXI5TDRITXh5d0VvN1BnQUF5UDBwYVpMZmZHUm9HdEdTQm52dXNWUFZvWUhYV1NPVWpVQ0ZuZWRwZTJkdW1YVmZKVHhXcHR2bzM5SkxuUmJRNDkxRlBYM25qczFsS1RYYzIyUG1MMl9ZMDVYRTNHaWhIWk1yY2EtYU1RQ3pUeHhaaWdtR0JMam5CaHgtUU0tUWZRMDJEZXRVOHliSU96T1d5Z0dEZ0E?oc=5&hl=en-IN&gl=IN&ceid=IN:en,MSN
CANBK,"Tue, 23 Dec 2025 08:00:00 GMT",Canara HSBC Life Insurance and Equitas Small Finance Bank Announce Strategic Bancassurance Partnership to Drive Insurance Inclusion - PR Newswire,Canara HSBC Life Insurance and Equitas Small Finance Bank Announce Strategic Bancassurance Partnership to Drive Insurance Inclusion  PR Newswire,https://news.google.com/rss/articles/CBMimgJBVV95cUxQN1o2RnFfWVUyMFZkSlBzQTRRaUtTWTMwTGV2ZlNsVTRGbk5xNHVJaUdiZTU4THloYWJnRExBazNvY0VleGp3Vmw5U3loaTl2LVFLUERjX1FUbzJZNkMxeGtYV0psNTVvMEUtd1JGU2pXeDRGWlg3LW1mVGJqa0g4TmJwU1RBRXlEejJJUWNTeFdKXzZPeW9RdFRLRWhWQlJ4bmQ0OUxoa1FHT3g2VUVxMDdOZ21TMTVVRHJ5dmlDRF9wNi0wUFVVOWduaVpLcVZYWWZxdUdiaFFXTUxGY0xObTRjNmRPUkpjNjllbDljSWNBSUpaWGVEVEdtbmtPdERobi1Eam5qc3VyMVVnSTgxbGNUblhWazg2NXc?oc=5&hl=en-IN&gl=IN&ceid=IN:en,PR Newswire
CANBK,"Wed, 31 Dec 2025 08:00:00 GMT","Canara Bank Appoints Hardeep Singh Ahluwalia as Interim MD & CEO from January 1, 2026 - scanx.trade","Canara Bank Appoints Hardeep Singh Ahluwalia as Interim MD & CEO from January 1, 2026  scanx.trade",https://news.google.com/rss/articles/CBMi0gFBVV95cUxOaC12aHp3VnVVZVN5YTEzbjBXajRtaFU2aGF3dHZQeEJlU2RtLXp5bDY3ck9TYnFlM2NKYWJSNlk4NjNEaGF4UFpNUGZTWFlSNEt2VFhleDhkeTNoa0dnWEJFbHJKY3p2MERDcmNGSjRZRUJ3QV9rR2paTU5FaVl4UWU5bC1QNzNWUGpQZVRnbnQ2WWp0TGFndC1oc19MQnJEMm01bk85RzBZN1ktcEZwWnVTR2s3M3BJS2V3d0lJRi1FMDIwaXNHbW5mOVI4bko0U2c?oc=5&hl=en-IN&gl=IN&ceid=IN:en,scanx.trade
CANBK,"Thu, 25 Dec 2025 08:00:00 GMT",Cybercrime: CBI arrests two ex-bank officials - Times of India,Cybercrime: CBI arrests two ex-bank officials  Times of India,https://news.google.com/rss/articles/CBMiuAFBVV95cUxPZnFVaWpyWVZJMHpKajBPcUZhRFNpc29WMDdCREptZGR0ZmZRWDd5LUl6dXc4N2pERjZ1MnFKeHJacDktdU1ieXowcjdqa2owVmVfRTdMdzgyTUlRRFYtRUROZE5lR1FIQ1o4ZC03TGh6LW10NTdacEVyaTZHdHJOdW9aMWNyTGlrdUplSzZzTXpHQ1R3OUtXaHNXcFEydHIxZXJhQmJpY2hQcFdIcGRpVFotUlpmMUcx0gG-AUFVX3lxTE90d1phZUc4bGtYWUFQYWVxLWVzSV9QUmJRU1ladVc0QUdOUGNjX1RyUDVIaUlOb2lJaktOa3JUVTVEUkZiODE1WGhIUGpwdVN1OC1tVlg1ZlR1R2pPZ2ZUSXdiaG02aS1NN0lHQl9xcXlYLXRCZXpmcThidFFVZ1ZtZDFZdTZGbmxZUlBaYTZ0ZEJKZ2xHcFg0aXIxb1ZRLTcwcU9Ea3dDWURJeFMwMUNOYmQtWVJXbUJMSG5HR3c?oc=5&hl=en-IN&gl=IN&ceid=IN:en,Times of India
CANBK,"Mon, 22 Dec 2025 08:00:00 GMT",FSIB recommends Brajesh Kumar Singh as Canara Bank MD & CEO - The Financial Express,FSIB recommends Brajesh Kumar Singh as Canara Bank MD & CEO  The Financial Express,https://news.google.com/rss/articles/CBMixwFBVV95cUxNOWVjYk0wZzBHZHloSy01M0o0V3YyOUdvMGJBLTM3V3pKOFZaMVdhdnBHWThYeTZ3OFNGTjhqTWtzTTR1R21JcmVGMHhMdFJfemxvbVNaT0ZTSWt6dDgzSGFQWG1lc0gxcUQ1U2liSmNSLVJQZjNfMHRBN0FZT09uSHFNbWU4Y0NVVk1fcHFRSFFMY0JwLWZmT3RxbHk0ZDlWUTZBei1YU1JqTHFBY0JzcWhlMjNqTlhTVjZ4QjdUN3k4WWVtNFVz0gHOAUFVX3lxTFA3b2x6RllqeGM0end6anRFeUx0ckxlUEhXaUxqbWlydVMyZVBEcEJXVWJaZnlWaU0xNXVmanJXdW5iUmdEREhaTGVQcjA5cmJzVTNXRkxGSU1aMGlGUFRjZExQbkZfMTNOSnZiRXk1WUk0Y1lDQUktT3l2ckQwejl3WkU3T3dVSml6cHRGMWNpR2ZfQVlEUnhPbHNDZzQwN3Mwd0laZldzWUIxbzlqNkhJaTV3QmRSX0lhOGNYUmRmQ1JuOENQM3V4X3g1WmxB?oc=5&hl=en-IN&gl=IN&ceid=IN:en,The Financial Express
CANBK,"Wed, 24 Dec 2025 08:00:00 GMT",CBI arrests two bank officials in mule accounts case - The Hindu,CBI arrests two bank officials in mule accounts case  The Hindu,https://news.google.com/rss/articles/CBMisAFBVV95cUxPRW5oaElReHFOYjUyMzFJbmFfOHdmYmloZzZOTm9ybUd3cVNQWl9NU2NSN21SYWR5aG5UTVNCMGJRQks0V1c4MHZYMm1EbnNzVU9kc1FXYzFXbUwtTzdtWEpnUU02Y3BqMkZ0eTFfcnNtNjhiZUpKNVBUdEVGUG1tUEFHbXZPYXc2bUlncDMxVjBvT3pRTmtXT2c3SExPVzZkdUdzZVZmMFBUc05wNjhGYdIBtwFBVV95cUxQR0lSVlZLZ1IwRl9jNEwwa212MTNrUTJhMnd2azNDMERYckQ2STRDUWJyUmtIVTUyRHU0LXlZSGVvVVBqMmcwMWc5Y0ZYSENXYlYxU2YyaVVSQ2c4b3RkMlc0bEszTXdWa09uLXRfNDl0UXBTOWI1N3NwZmVxMVMxSjN1eGFSYUV2ZzFKNFlQVEwzbU56N2tnYWlfYXdwamZxMjJQd01uX0lLbFlTUmhIM09XLXk3STA?oc=5&hl=en-IN&gl=IN&ceid=IN:en,The Hindu
CANBK,"Mon, 12 Jan 2026 11:04:13 GMT",Canara Bank to Bank of Baroda: 5 banks that revised their FD interest rates in January - Upstox,Canara Bank to Bank of Baroda: 5 banks that revised their FD interest rates in January  Upstox,https://news.google.com/rss/articles/CBMi5wFBVV95cUxNZWRmcENKMFdyUlpaajEzakt5MTZFQl9xMjBsbFNRT0JpckJ4eVM2OGVPOVFnTVMydGk1RHpjTVIyOHUxOUgzdGs2eDhqRlZmZFBFamdtRl80ZlZNMERqZDFTX1Y0VUs2dEs4QmhkeXBlcUpFRTF4TjNoQmdya2NJdlFETUpSaFlIUEJGQXVWREVFeFdENU1NRmt4TlJYOHhEeHByMk5LZ2RBNXFWLTR3OFplbVpWaVJESzRVRExwRWdfdF9TdlQ3cVM3LUVpcEdrS3R0dE9xRUNNZ0VCMU5pcTdxRHp2ZFE?oc=5&hl=en-IN&gl=IN&ceid=IN:en,Upstox
CANBK,"Tue, 23 Dec 2025 08:00:00 GMT",Tenure of Shri K. Satyanarayana Raju as MD & CEO of Canara Bank Ends in December 2025 - PSU Connect,Tenure of Shri K. Satyanarayana Raju as MD & CEO of Canara Bank Ends in December 2025  PSU Connect,https://news.google.com/rss/articles/CBMivwFBVV95cUxQekgxVlo5QkNPMGhfZEd6NFk3Yi0wR01IWVQzUVlYR3JXOGcxcVdXRHM0MEFlZVczSzd1ZDYtMG5CNGZNYUZrRkpka2E3RjdqaEtfdGdLVGlzRHk1WkdyTFV1UFlRSHBQc2RaZVAzM2RUSkV3X3JfX2Yxb0hDVlpKdnNkX2xnelhMYXVWRzJIRmYyTWNqRUtTX3kybkk0c1JkekcxWDFZZS1aSDN0dTVvdGJ5R1I1RDA4dDRNYTZSRQ?oc=5&hl=en-IN&gl=IN&ceid=IN:en,PSU Connect
CANBK,"Tue, 06 Jan 2026 08:00:00 GMT",Rekha Jhunjhunwala likely exits Canara Bank after taking home multibagger returns - The Economic Times,Rekha Jhunjhunwala likely exits Canara Bank after taking home multibagger returns  The Economic Times,https://news.google.com/rss/articles/CBMi6wFBVV95cUxOelRpZzFQNGZya01xaGhFQUNSZ0I1TjVOV1R0dDRxalllUGpSSGZndUhHOUFNYXNuVjdyT1lNX0JXSndLTGlvRko0d1JSR3pWYTMtR0tIWndFWnRWeGZHMXliQU9rV1pIcGtaMmljWS1tczhGY1FVLVhKb1VIMWR4RXNpWUtSeUdBcFdqRllxZ3d6YWVGOFlCSlVDQXVFRFF6TnZKT0FialFDYXlDTmF6SXRBTDNsSC1sSm1sNmR1cjhjc1F4b0NJTFVWNmtHM0JwM1djLUtpZUNaM1lkNDhrbUJ5Y0xGWldIVzBJ0gHwAUFVX3lxTFA1UmQ1dEVTSVk0Um5QcWdnbFpyeXFUTVEyX2xueWNZZTdLZmlvbDRTT2dENGJKX3BlQ19GR1BrTXo0YVg1RTZocWt1UXRfOTBFMEpMS3lJMGMyUkwxQThRSEZNdFN4UDNMMFQ4WFJWUW51YVV4WE1FakVFTHlWUU1xWHRmYlVIYklVVE53Z2ZaMGs0VHROXzAtYTZmZVRoNVJHdm93a3RpU21IdkYxZ0hLNndCX1lQTmw2NGRGSHFlTXNJazU0N3dFek1UdUJoUzNaUFVBZFBTT0tVR2hrVXZUdEl2TWsyRVFfU0VtNmFMcg?oc=5&hl=en-IN&gl=IN&ceid=IN:en,The Economic Times
CANBK,"Mon, 12 Jan 2026 16:34:59 GMT",Canara Bank revises FD rates: 555-day deposit offers highest interest – check rates for senior citizens - The Financial Express,Canara Bank revises FD rates: 555-day deposit offers highest interest – check rates for senior citizens  The Financial Express,https://news.google.com/rss/articles/CBMi4gFBVV95cUxPX0tjTkw1dDcyRUlIdlREYzFKbkZ4OEFKeWp2Mnl6Y3MwME9uZ3dmMXpmYnNmNHFtcFZ4bWZKX2J3U1FoTVF2VE1qaGpBa0hkUS10eHdTLW9yX05ybFZwb3hLN3F3VVVqVlNDTDdVLWN2WmZWX2NHR2FaNVRVYXR6dWZUZ083X3VBR090Q3Bac1NyMWg3bTFONW16RHZiandBV0x2Z0ZwSXF0TnlwUm9aWElBQ2JvYnNkRzBCMzE1ejRtbFpEUUdZZ1A2cEYxYVBmeTBpODZVQkxoZzA3dUdMZXdR0gHoAUFVX3lxTE5hdlNON1dyMHZnYWdYbG5sdWJSUTUwMEJNT0tMRHB1bFVBTEVZdzZyQ1V1X1VfVTJmYUdNQWhkRngyZFZPcTJhSHByWGRaMUxib2RwX01lNUZINk5KaXRjQTRWeW5naW1uSHhVa0p5QmgxRWk1SWswai1mVF9hNmhUMnZ2ZEI5NEJueVRBUmpvZjFyNnJXUmQyVllNWmwwcUVGMkxlNU9Eejc3eDdobURTMXE4Wk5ReHFYNWNkX1BwTDU1WHJyUmVDa25ma2x0T3hodUI4WXRoR2JEZ1JJTzMzY3VpNHh0dUY?oc=5&hl=en-IN&gl=IN&ceid=IN:en,The Financial Express
CANBK,"Tue, 23 Dec 2025 08:00:00 GMT",Canara Bank launches unified UPI app ‘Canara ai1Pe’ for secure digital payments: Check features and benefits - Upstox,Canara Bank launches unified UPI app ‘Canara ai1Pe’ for secure digital payments: Check features and benefits  Upstox,https://news.google.com/rss/articles/CBMiigJBVV95cUxPV3piSlg2ZUVRdVBCUm1fWG9oUWtkTGRkTWNqdmdEMnNIdmlHTkZVaXd4Nktub3dCODRDVVNZa2tYdUstWUJLUnZOMzZwUnBremNHZm95d0FyQk05d0Mtc3N5UFU3bjVIdlZveG80UmVLR2h5VEpNQlI3bTNOOHItXzNWc3JTVHM4YTdjQmtINFN0T3RrTHU2WDJtMUlwOUVxWFdxT19YNHBZNU4wbkdLdFN1VFlmZUtkZllFczJZaUJfQkFqU2lLLWFVNHd5U29qQW91OGhfREo4Nkt3bjlkdzF5RnJfR0dOTHh4WncyWFpqZ1psSFNfdXZPVXlYTkJxU2RRci15THJtQQ?oc=5&hl=en-IN&gl=IN&ceid=IN:en,Upstox
CANBK,"Mon, 22 Dec 2025 08:00:00 GMT","Canara Bank launches ‘Canara ai1Pe’, a unified UPI app for secure digital payments - CNBC TV18","Canara Bank launches ‘Canara ai1Pe’, a unified UPI app for secure digital payments  CNBC TV18",https://news.google.com/rss/articles/CBMi1gFBVV95cUxQX0J6MzZ2NkZ0YTIyeFpiMTN3cGlkX0tVZEZYWjN5OUxfSzNGckhvUGozS1N6d3F6dXBPLWNDOXlORlFjdmU2RlhoV3hlcFNhYXJDcE8tMUo3bDE5MXlNZWtGNlZDbVZ2NmdrQkpySHVzRDhrcDVzdktDWVRiSmxqSk5qeVJ2T05LQ3pRMGk4bXhpUTVXYllQaHNiSnktMm5teWVUMzlkVEVBcXN1WW95am44emJKTTdPN213cG9CZU54U1ludE5VZXktcGMzOTZWRmlGZUZn0gHbAUFVX3lxTE5fbV9wTFI2TTVmZDNLS0REazJYZC0xbTM3cXdBS0hVM3NxUDdCWDBUTXB1N3ZIalg0UlVvcHd1d1Z0TXhnUXFNQXdjUXpzRF9MYk5lMVBpUDkweEFYay1mRGN4amJhVnR3Z09UZk55dEw5X1RLdDBuMzlTaC1RbFFXV1hncl9vUXFidVIwWWROZXB1R1d1WFlDWEI5VGlpemhEVEtsQWtkMzBrU0hBRnpqZWZ4Q3dKSThvUVFzdzllVVV2X2M3NnZVUGU4NWxDM1pvLU9vQ0pyb1NpOA?oc=5&hl=en-IN&gl=IN&ceid=IN:en,CNBC TV18
CANBK,"Fri, 09 Jan 2026 15:42:46 GMT",Canara Bank Signs Strategic MoU with State bank of india (SBI) - PSU Connect,Canara Bank Signs Strategic MoU with State bank of india (SBI)  PSU Connect,https://news.google.com/rss/articles/CBMinAFBVV95cUxQQUZQNFYzb1dDYjJkSTJ1bEUzVHJ6b2x0SEVfUDhxNXVncWJBS2t2RTFGS0U4MkFhRXo3aml2LXZJSHNxaHp1WG5DMjAyRmx2VzBYbm5PUEtiZDA1TzhPZS0wTE5Zc3Y0M3JGTFF4VHhEWHpZd1A5bzRMQVdXeFBNN2QxbldSbTFrQkhObXZMXzhDVnhuMWp4eXhIcUY?oc=5&hl=en-IN&gl=IN&ceid=IN:en,PSU Connect
CANBK,"Thu, 01 Jan 2026 08:00:00 GMT",K Satyanarayana Raju Completes Tenure as MD CEO of Canara Bank - PSU Connect,K Satyanarayana Raju Completes Tenure as MD CEO of Canara Bank  PSU Connect,https://news.google.com/rss/articles/CBMinwFBVV95cUxQMWlqNDJyanlaMEpJSzdoRmh5UGdhZHoxSkIzZERpdmJQZmpGUXp0aUFrb1hWMDduak4xWVh6WVRvM1BsYnhjUE8wYkE2RnUwUXFkclhlVXFpS0l4dFZyYnFfSThKTHQ4THZ5anZSTjBEMlNYZ0IzbDZ1T29hNVVmTV9Ta2t0eUllRlZYSjUzNTR4ZFBXd3ZBX0x3bUFDanc?oc=5&hl=en-IN&gl=IN&ceid=IN:en,PSU Connect
CANBK,"Fri, 16 Jan 2026 02:04:55 GMT","Rs 152-crore Canara Bank Fraud Case | CBI court convicts two SRS group firms, hands 6 directors RI of four to five years - The Indian Express","Rs 152-crore Canara Bank Fraud Case | CBI court convicts two SRS group firms, hands 6 directors RI of four to five years  The Indian Express",https://news.google.com/rss/articles/CBMiiwJBVV95cUxPV3RoX1k5dTQzX18zeDQtUmpZdUpGM2dHNVFiY2dYbGVVM1oyWEJ5VXZfTnBhbFQ0M1pmZGNOTWF2amZnM0h3ZFVYX0F5cUhwdnNidy1ydlB6My16NnpXRkFHaUhOYVdFR1FTaG82U0JaWEFiajYtaFJHa0lnLWttdXBRY0FKblNhcm5JX2hWQmJxOWM1SFJhLS1QSDJ5RkFLSjFveVVMY0hia2djQXNhT3VrcXhlQWI3X2swS1F0cDVXMm5CUG5YR1hpSWdGMlQzbkY4RTNCT0Q3ZDJJV0h4VWtWaG82SnhoSjFnelZ6azZsX1FBaFR5NWI0b08zTDFrMnJ6VU1ZcW96LWfSAZICQVVfeXFMT0FySXZRcUU4MGJOM0tnU1liblJLQ1pvcjlHQ1VmNUd2cVhIN2haZE9SRWNqTTMyYm5QUU45QWRjcjd2ak9GenVTMk5BMjNYcUhnZXpadVczQm9IWVRNaUFMOWtoZ1lDYnEwQllGZlNxbUROWmF1a01maWdSRGFENTBBcXRENnNsdnRNMldwWG1TaV83dnRqVEZCcDdLZ3RWcEktRXAxdDZPZ0NDNWM3V0NYTlJKVEZQMHRmUzd4X0RnQ05DTUFQUkZFR0FjMTFFOTBSTmU5VHhiSjh4aEhJY0tVMUlCQTVsN0RRcU4tYkswTUpWRWhMV1JNSk44VjVGa2J3czU3ZDRSUW9NX1c0LUlVdw?oc=5&hl=en-IN&gl=IN&ceid=IN:en,The Indian Express
CANBK,"Wed, 31 Dec 2025 08:00:00 GMT",NBCC India Secures ₹220 Crore in New Orders: Canara Bank HQ & More! HUGE Boost for Construction Giant? - Whalesbook,NBCC India Secures ₹220 Crore in New Orders: Canara Bank HQ & More! HUGE Boost for Construction Giant?  Whalesbook,https://news.google.com/rss/articles/CBMiqgJBVV95cUxPcnZRQ3RTY25Ed25iVThJaXM1Qm9TRjNrTE1acnRuVGtQcXUyVWg5YnYyTC1ZLUlKRWRUR3pacW1BMEQ5LVZfV21VSFJtckdiLUtXN2ZKSWR5eHFjTWdqV1hrblNjRGk4amxBVjhQQXZWc05tVTZtUzVuNzhrcUdZc1h0V3NyNk9GaVBaTUNuc0F4ZUg3WGdaVW9oeFhRRFJDZDg2cVBtTXNka3lzVHVpczJ2VktqVnN1R1N0WTlXd29WWnBSZ1NIWU5ZMFhRTjlXWTg0YVQxS0Y5RE5QZU44ZllveVZhbmFlRkNnUjRNTTR3dmxIbnBPbUotamwwQkwtNV9uX2ZFTVpSOGRUNDhjWER0XzVPOHhyU1JPYWZBYzU1a1lrbW1mOEFB?oc=5&hl=en-IN&gl=IN&ceid=IN:en,Whalesbook
CANBK,"Mon, 22 Dec 2025 08:00:00 GMT",Canara Bank's Next Top Leader? FSIB Recommendation Sparks Intrigue – Brajesh Kumar Singh Tipped for MD & CEO! - Whalesbook,Canara Bank's Next Top Leader? FSIB Recommendation Sparks Intrigue – Brajesh Kumar Singh Tipped for MD & CEO!  Whalesbook,https://news.google.com/rss/articles/CBMilAJBVV95cUxPVHptN3A1X3pyNV9EYVRWVGc3d0JyNjdwdlY4MGZKbXJ1RFBtc1N4dDRVWE5uVUw3aTRLVHdKQjkyRnhuLWZwT3MzU21mSmRELVZJUXgzRVF1bVZReTBCWkYteXFmLS1mRnU5REo0QmN1Tk1VMVlHdURQeDF0WlotTG5RNFJsdkc1aUNCNi1wY0c2SWQtY0htQWhfaVQ0ZXBLSS1tNVF1TTFhOGN4alV3d1MwcnEycnRpUjhNc29ySnp1MFJLdWdvWVJRQWFKUmJMdTg4cDN1cXdRUjQ0WHhLNkd5ZlJERElUdzBqRmJ1VWQ4M2toUFlFQTBnZUlMQWJ0X1NJamtIYXV6dWZaak1rSzJjclM?oc=5&hl=en-IN&gl=IN&ceid=IN:en,Whalesbook
CANBK,"Thu, 08 Jan 2026 09:33:52 GMT","IMPS Transaction Charges: SBI, HDFC Bank, PNB, Canara Bank Revise Transfer Charges: Check New Rates, Slabs - MSN","IMPS Transaction Charges: SBI, HDFC Bank, PNB, Canara Bank Revise Transfer Charges: Check New Rates, Slabs  MSN",https://news.google.com/rss/articles/CBMi-gJBVV95cUxNSHZjSDNYUVF3SkNvaHhYTUlLZldiNFhiRnZQejVNeEFMMy12VlBSa2xiTFQzWnByNUxESUxaei14cS16MkZLeWtXWDE0WFJXZk9VSUlpSkIxN3N1cjFLSEF5SFZiT1NhRXExYndleVJpOVV0Nk1Lb21OZXg2bWpyN3ZwdUYtOWxWX3hKNjRfQlBfd3lBTklPS1NXMGE1Z0hWUWlhZTVJY2NsMmlKLU81M0l6OUVMTFVScW1NRm1LdHVPQTM0MzhtY0RVWnVBakZjd3lsT2E5TDNfbmJQSHJoV1RJYU1WelQzMTgwaXpqSlJra1BVV25XVkZYU0MwaVd6RTF0clJxdGNFakpwYXZRdFBLYzhjc1FGc2R6bHl6aEpBclJQNVRDLU9PYUFSaFQ1RU1pcEZicVBtc2J2alV0S1NaZGwzYUprOTQyMjBjNUNQcDl5ZHZETS0tXzhtRW14b1ZxaUdfYlFiOGFtZVE5cUEydEN0NEVqa3c?oc=5&hl=en-IN&gl=IN&ceid=IN:en,MSN
CANBK,"Wed, 07 Jan 2026 08:00:00 GMT",Canara Bank Pays Rs. 975.60 Crore Interest & Redemption on Tier II Bonds - PSU Connect,Canara Bank Pays Rs. 975.60 Crore Interest & Redemption on Tier II Bonds  PSU Connect,https://news.google.com/rss/articles/CBMirgFBVV95cUxNQ09pYy1EejNET3NQSmFweG91amZIVURuM2VWeTlFZU15S3htSzE2Mzd4YmppOEZMWEc5SVc4cXU5enQ2cjZzZXhtTGVPVVhLZkpTWGZzamdyT0laUEZoQU9SbWduNlVtQndRMDBqajRfNkNXLUV5UFBZdEsxVlR6N1FLTXU4VVRtM01YVzVQeUNCbEZzRXYxWWdoZEt0N1dDR3FKTkNfOUx5TGREOEE?oc=5&hl=en-IN&gl=IN&ceid=IN:en,PSU Connect
CANBK,"Mon, 22 Dec 2025 08:00:00 GMT",FSIB recommends Brajesh Kumar Singh as MD and CEO of Canara Bank - CNBC TV18,FSIB recommends Brajesh Kumar Singh as MD and CEO of Canara Bank  CNBC TV18,https://news.google.com/rss/articles/CBMiwAFBVV95cUxOck16bURxalM5b2FQcVhYRHpZWFdObDN4NjdpZ281aGFKMkt6THNOSFJDaUIwWS01MzlZYWhjNDlqQ2RPYXZGTlNwUGF5YlFZTW8tb1dpVU91WThaSnBOSTl2dDdRNzJORTVEZWhIdnBJbDRvYW1zVlhrN3FDajBPb3ltYlhZUHJpMHo5S1AzSGJjZ2I1TXpmb3c5N2hVRHZZdi14UWtQYzVaUjl0NF9rVkFsRDA2eTEzVE04Y3Zrb1HSAcYBQVVfeXFMUGNlcXdINGgyalJoQkdoTDFDNUNqeTlDakJOdXo0OFRqbmctVUdFNC1XNmF4TFgtWDQ5UTBaNmI5RHF6QVBING9NeW0zT2JQWmRUUGt0aGZqVVcwS2hoUVFMQU1SdEpWVFFDenlqZlFsVWtBbWtBa3lYUW15em9xeTNMcWdVV2xnZ1NaWkpnN0NsRFNnTVhNZnpFcG9KWWVfYkdqUmQ1OFpEZW9ZRTRCOWhNNFpjRUwwUzJUaUpLRWo5R1lOY0ln?oc=5&hl=en-IN&gl=IN&ceid=IN:en,CNBC TV18
CANBK,"Mon, 12 Jan 2026 20:57:39 GMT",Canara Bank Raises FD Rates: Senior Citizens Gain Most from Special 555-Day Deposit - Whalesbook,Canara Bank Raises FD Rates: Senior Citizens Gain Most from Special 555-Day Deposit  Whalesbook,https://news.google.com/rss/articles/CBMiiwJBVV95cUxOUFVJb1JsZF9LVXc3REMyMlF6anFXekZfYkFwVEFrdW9USnVXVGcwcGk5eUpKbW9rbG1WNFRKWExhYklWZ3FneGM1NmVxV3ctQ0s3TDdNYWNkeFMzRzJ1V3pkSmRCVmVvbzVwUS11dk5jM29kTmFCZnNhZUpMWlFRQ2dsNjA4RURtaGF4VmRzWVlteGdFMGZOQXdsUGprZVNyazVTajgxa0lkOFNaT2lNTUZyazRyeGJXMkVpNlU0dmVUNElzREFBV1NBRWhvOEdaQXc2aVd4Q2xaOXRFbzdkUVdoX0tZb1pHUXpzSFdrSEVXQVIxUFFLQmRQVFlLSTZqRkNyWVBiYUlsQkk?oc=5&hl=en-IN&gl=IN&ceid=IN:en,Whalesbook
CANBK,"Thu, 15 Jan 2026 14:05:56 GMT",Canara Bank opens 2nd branch in Kohima - Eastern Mirror,Canara Bank opens 2nd branch in Kohima  Eastern Mirror,https://news.google.com/rss/articles/CBMiggFBVV95cUxNWEdIdG9leFRVTTc4SFZMak0wQTJTM1poRXNJYktwdXc4RHVDX2RPbUNtMFRiRzB5TVJsVlF3WFE4QldKeHZ3bndSdzZKSi1ISk5lUlhkTFFzSnlkWHpYSnhlaElvTS1wVF9BVFVYbzFYSmRXYTFjT2hnNDU4ek54VHFB?oc=5&hl=en-IN&gl=IN&ceid=IN:en,Eastern Mirror
CANBK,"Tue, 06 Jan 2026 08:00:00 GMT",Canara Bank makes Rs 10.76 crore bond payment investors receive funds on Jan 6 - PSU Connect,Canara Bank makes Rs 10.76 crore bond payment investors receive funds on Jan 6  PSU Connect,https://news.google.com/rss/articles/CBMitAFBVV95cUxQZW1nWVJTdmVqQVFnSUpWTWNZSE5rellfUXlXMFM2SkVHSk5oRVA4Z0V5dzM0NDBrZC1sM1pJYXVXWXpRSm5JSnBtYlFxclBLNU9LZ293TUhUV0ZrYUNfbkp3R2ZKdl9jcmNpWlNBelJVamVZRlF1SmF1STMwaTdGY2Zjc3c0UDdYNXRNWHNmeThoOXBrR1VDQmppYXgxYzVHVXF0dHREU0ZQT2ktYVZranBFdEo?oc=5&hl=en-IN&gl=IN&ceid=IN:en,PSU Connect
CANBK,"Mon, 19 Jan 2026 15:43:16 GMT","Canara Bank Hits New 52-Week High at Rs.158.6, Marking Significant Market Milestone - Markets Mojo","Canara Bank Hits New 52-Week High at Rs.158.6, Marking Significant Market Milestone  Markets Mojo",https://news.google.com/rss/articles/CBMi1AFBVV95cUxPcVZXU0VFNnZEWF9JZ0ltQzlkT0FLQ2hPLXVkZ2NLcU9MdTIyS2tvTU02R253VUxWMGtYMGFvaUNpeC1mdmtaTTlwVFQ1QUhpbmJrLXhxTVN4U3Q4bklLVF9xNnFaQTZ5V1FGUnFrNTlFT1dLMjNNd2N4M1NIMVhzcmstd1JsUWVoNVVuVE1MT0ZCTkVsbUNGZ1QtTWhGb3ZMUjdBUGF0SXlBb1I0djZMMjl1RWlyajNRY2I1WlhKM0ZsZ2xBaXhSdHZZVHVuOU9KT3E1aw?oc=5&hl=en-IN&gl=IN&ceid=IN:en,Markets Mojo
CANBK,"Mon, 22 Dec 2025 08:00:00 GMT","Canara Bank Launches Revolutionary UPI App 'Canara ai1Pe': Experience Faster, Safer Digital Payments! - Whalesbook","Canara Bank Launches Revolutionary UPI App 'Canara ai1Pe': Experience Faster, Safer Digital Payments!  Whalesbook",https://news.google.com/rss/articles/CBMiggJBVV95cUxQYzVkM1ZUMHZlOGJYMnFUMkJoendtWmdmRHF5N3lQeUkxSW9HektsSC1VWEYzZ0JlYS1nTTBLc0VxSTZwV2FjQ25GNG9hbko2T05mODM1cUIycXdqTnJuQnVMWml3cGh1RWRSUXZ4eEdNZTNaYlBZTDdlTFJldnRGbC15UG9HRWcyTlBOLXkyVXU5OTNSb28tZC1PYVVyeGliLVQxRlgtQTRoWVI0NXFaRHF6QWppNUFPRlRObERCOGU4cVhpeUxTWE0tOEZsdEhQM3I2ejd6bUQxanZWZnBGb2VxX2RfUEpnOVRObDlBbnI4c2d6bVhxLUc0LXEzRGlqaHc?oc=5&hl=en-IN&gl=IN&ceid=IN:en,Whalesbook
