ticker,date,title,description,url,source
HDFCBANK,"Sat, 17 Jan 2026 10:02:37 GMT",India's HDFC Bank beats quarterly profit expectations on better lending margins - Reuters,India's HDFC Bank beats quarterly profit expectations on better lending margins  Reuters,https://news.google.com/rss/articles/CBMiwAFBVV95cUxQSU1FeXo1bjhnVEZqSlVSaGVPVmxYVGk2cnIwVGdPOGFOcHRzZUNFYWtqaHZmVkVjcmdJbk9YRG9pVmdmUTU4Z1F1cmVpMEwxTm9zSmRfM1FFeWNMTHgxZ3Npd1E0NWxyZUxTS1FOYUcxNGJfOE04eS1sYjg1d3ZEaVlaQS0zYUdVU1B5QlE5RENENjdkcVlnQXZ1Ulo1SzFiV0RJaFNVNmFMTm93WlJWcWp0aERMaHY1SHlIWDFrOEk?oc=5&hl=en-US&gl=US&ceid=US:en,Reuters
HDFCBANK,"Tue, 20 Jan 2026 00:00:00 GMT",Leading by example: How Aditya Puri took HDFC Bank to the top - McKinsey & Company,Leading by example: How Aditya Puri took HDFC Bank to the top  McKinsey & Company,https://news.google.com/rss/articles/CBMiugFBVV95cUxNMU95Ry1BbjYzbUFXSGNZM24tdnBIRWtqTko1bUF3TFEyMzBFZEtVeXN2QmZYNnVPamNITHZNZTRPSzZOUVNmRkxVazdMckFNMW9mUHdHdkwwNE1KQWdlVmhJeW4tS1daX1hxeG05T1VXc0Q3SFdPT0pmQ0Z5ZXUyZFZDZS1RTmo4ZmtQQjNYN0NuaEtfLWRTYVY4VzgxTUhLbjZ0Wmd1MjFqdGF1Q3JQd05HS3NTc1owb2c?oc=5&hl=en-US&gl=US&ceid=US:en,McKinsey & Company
HDFCBANK,"Sat, 17 Jan 2026 10:28:00 GMT","HDFC Bank Q3 profit jumps 12% to ₹19,807 crore - The Hindu","HDFC Bank Q3 profit jumps 12% to ₹19,807 crore  The Hindu",https://news.google.com/rss/articles/CBMiqgFBVV95cUxQRnZkVDFkQkFBQjM3ZDdIaHBnd2FpNURhWElvWTNSRHZmNUswVTBuR3ZQM1c2cV9lbmYtNFNPUVd3RkpZXy1XMF9qZUpLQlFWNEVoZkJoMXFkYnM4dF9oRG5JYVctS2tZMFQydk81VDdKWEJwOXZpdk13Zkt3S0sta3J5N29CYlhhU2JkODJnT3IxYUhsMFJYaEJTbGVqRHNSNVF4c1JxRklSd9IBsAFBVV95cUxOUFZBbzVId3ZPWmhlVHREU2tSbHhHbDUwNE1XTnVQOHVoanNSQTFoVk5mcVB0cmE2WHRQVDRmMi1RbjZBNGlfWGllaUVEU05sVTcwLXo4dHJLdkxsMnJXd2MyTWpwZEF2OGstMEUyNm5YMTZudG92Z054NTVPWlFXZWNQSUtyYTl4ZFhoaWNIcm1UdEtUX0txVjhuVUhlbGhZczc3UU5SM0VBVXUyMlFIdA?oc=5&hl=en-US&gl=US&ceid=US:en,The Hindu
HDFCBANK,"Mon, 19 Jan 2026 03:51:32 GMT",Will HDFC Bank shares stage a comeback after recent underperformance? Target prices - MSN,Will HDFC Bank shares stage a comeback after recent underperformance? Target prices  MSN,https://news.google.com/rss/articles/CBMi0wFBVV95cUxOSWhYZk1DV2UwYkZuVW15NTVsOU1DR3ZOQThDUWtJYVNTU1lpTHNKUlowRERieFo2RzNOS3pCbWxVd01PTjMtTV8wWWRyc2NUenVURlNrYjRJeXcybWNMT3BFaU9RcGxpSkVaUkxuU1NQd0dTZWFGaFRmWDZFVE5sS0FaWEoyTVFvU1JxSE43YUVQWVlvVXRoZFJ1TEVfWVBINXdBMHRYTldJXzVSY0VwNlhkeEVVa29aWk1XcVAwR0VMam0xRmY4eEpwYzdXWk1OYUFJ?oc=5&hl=en-US&gl=US&ceid=US:en,MSN
HDFCBANK,"Sat, 17 Jan 2026 09:38:59 GMT",HDFC Bank’s Net Income Exceeds Estimates on Strong Loan Growth - Bloomberg.com,HDFC Bank’s Net Income Exceeds Estimates on Strong Loan Growth  Bloomberg.com,https://news.google.com/rss/articles/CBMiswFBVV95cUxPX2xpaGtDTmNvTGY5WWpLT3VzcThxRjhRTEJJX1VNUnQ4RUQtam45c2Z3bGpwb29KQ2RpczREOHEzUXpGd0JiZExRU0xXcndWT2lqb1gzS2I4OXRNd25ycllUajRHblhSVWVSeE5MX285RTRFeXBWekRqMHM2aEluTHFDangtWU9iUzJGd3ZmZFBIaXpUUFRIWVU2NUxQa0YtYVlfelNYc2Z2WkZPbmU5aWhRZw?oc=5&hl=en-US&gl=US&ceid=US:en,Bloomberg.com
HDFCBANK,"Tue, 13 Jan 2026 08:00:00 GMT","CLSA flags margin recovery ahead for HDFC Bank, predicts 27% headroom despite weak start to the year - The Economic Times","CLSA flags margin recovery ahead for HDFC Bank, predicts 27% headroom despite weak start to the year  The Economic Times",https://news.google.com/rss/articles/CBMiggJBVV95cUxNc2NjT0p5ZGNQaUdkcnBCZ1g5YnZvRHdnZV9XUFdGQ1pRSEZsVTctd3dNN3VpREwwYlFhZWhWYXVMVDNyTE5lNFh1dGxTQ0hDOFFtaVZ6LWc4cmFhRGhtTVZMbmNXWC14eXI2aVYtUmZaN2FoWXRrZVZNdHZmSUFSTDVKcHdlY043dWVUSUVOREZMc0ZaWV8zM0hoNUtjSkF1eHVnRTBiQ2hzMkN6TmNNY0REanY3Q1ZIdUZBanFsVkVoTXpTS29HNHN3UVJGc2RBaTlQNWJ5QTBuY1owTTNWZWx4anNkTmVENUo0RmtJakRZZ2E1dXA2UXpnNHZWS2hSVHfSAYcCQVVfeXFMT0NSRmE0eGtiZ1B3TmU4T3hpZDd6WHZwcHRkaER4dXlHZU1NbENvT1JvOTRhS0N4OU5xMkV6eE1scEJkbzBqVXI4NjNqR3hsNmZNNkFTT2xUZ01QWFFJZE1yOFZpOW5ZRFlKbHFMRlB0VXl4TW5rMXpXTmlxN0RzLTRreWM1NWdlLWNyZXYyeWt2TWpHY0QtZ01BTWgzaGsxVlg4NDBvejFXbnBZdWtmbEZ1aVoxYmVhSUNRa0hOcTZ1VUxtaGlSLWVjTTJPQWJobFAwZ052Mk9MREs1cE1GUExtVFVXUnFSMVRRUjVUdWlmMS1uLXpqdUhRRXhRYS1tZDRyMTZIOUU?oc=5&hl=en-US&gl=US&ceid=US:en,The Economic Times
HDFCBANK,"Sat, 10 Jan 2026 08:00:00 GMT",HDFC Bank Changes Debit Card Lounge Access Rules From Today: What Cardholders Must Know - News18,HDFC Bank Changes Debit Card Lounge Access Rules From Today: What Cardholders Must Know  News18,https://news.google.com/rss/articles/CBMi5wFBVV95cUxOaWtHYllDZmZzRVpNRWVqUFp1clVVd0NtODlSS1cycVBxUTdBTzR4NzFja29wbG1SWDllQmxmOVoxcl9ERm5WQ1VjbGl3R2RnY0xXMWVfWVFoemRtTnhudXJQQTFyWU1TVHdLM0FnbVhPd1RrOFBrUVhDclp0VC1Xb1Y3MGdZSm1XQWx0MTNmSjJuNUtVOUtiSWVSVUpjWEVvMGN0UVBiYllGRjA2VEMtR2t1V0lqRUotVzlQSUZHWDg5aWs5YTVSQTBIY3I2dElWN0VzUzc0MWtBLUgxa2ZlbWZ3VFBLcGvSAewBQVVfeXFMT1RkTWtqTndOMlVQMk1tYWxYcUsxcngxbWZnTC1ISmhzUkFsUWw4Rmx0d2Y4ZUVleDZESlpOREgxaThDaTk2TDI2Rkt4ZFZNZGI2NUlIZUg2b3pqYUVKenNYQnZ0SkViT21INlo1OGJnVDdYa21oN3RIRS1VNGpWWXdKdm94Y01mbTVkNUZpWGkycnBQVHRVU3loZDRLUUtpX2s0c2NHNnN2SnlSZ1hFSl91RUJ1bkdYTzdGRUp2OXZqQzh6VEdMeW9IME1waEhlQTlZTFR5cWdXVXU4eWc4cndaVHlFVURPb3dodzQ?oc=5&hl=en-US&gl=US&ceid=US:en,News18
HDFCBANK,"Fri, 16 Jan 2026 09:18:20 GMT",HDFC Bank Q3 results: Net profit likely to rise up to 7% YoY on robust loan growth - Upstox,HDFC Bank Q3 results: Net profit likely to rise up to 7% YoY on robust loan growth  Upstox,https://news.google.com/rss/articles/CBMi2gFBVV95cUxOUndKLXBjQmdodzhobFU0eG55cy1zbWRsdm9FcDNpOXloVG1XZVp5SE54eGhfYTBWOWNqM2Y3amdNYmlwRkNlbXgxUElEY0JITG5pdldwV0hzQXh2S0FFMURzUXBtb0dXNmg2V2w4YWg5d3FuT2x5T2ZFajZhRHowOGNya0xHYzhoYTdLZEZlVW5iZGt6RFdCZmYyME9udEdKZzFpTjJxU3JKUFdlbnhXOUJzVjhrX1FmQXNYZkZIT29DS1Z5eUxpN3FuX1RoRU5mUnVXMVd2d2Fodw?oc=5&hl=en-US&gl=US&ceid=US:en,Upstox
HDFCBANK,"Tue, 13 Jan 2026 12:25:00 GMT",AIIMS Bhopal and HDFC Bank Sign MoU to Strengthen Organ Transplant Services - PIB,AIIMS Bhopal and HDFC Bank Sign MoU to Strengthen Organ Transplant Services  PIB,https://news.google.com/rss/articles/CBMiaEFVX3lxTE5GME5ZTHVhYnJCaWNMM3BCR0YzbHhoVGtYa1VSVWtYTTNMU0d5cUVEcF9Nc1Z4SjdvWTRHRlQ1bFZZSUthSmQyT2E0aUp2djA1eFZ1STFNOWNyRldtbUpENjdtZkVvNENC?oc=5&hl=en-US&gl=US&ceid=US:en,PIB
HDFCBANK,"Sun, 18 Jan 2026 01:16:00 GMT",HDFC Bank warns against APK fraud: What is it and how it works - Times of India,HDFC Bank warns against APK fraud: What is it and how it works  Times of India,https://news.google.com/rss/articles/CBMi3AFBVV95cUxPYmhid0NZTkpScVl3WXhWVC1mOGNaUEl0Zkw4UVJyQldtZG1JbXdNcDF5TUtPRmVDNkZPWmRlc2pjVklhdnJ0N25hQVhOUGtHUXpEYTZYeGVhMkhabV91QzZuMDBwaUYyWl9ZMDgwQVJJQWo5TkE3UVdEWVBQOUFJb1ZuUkRreTVsanlpQkdQRk5ETG9MWEowU0dROFJ6dk50QnBWbmtKMlBHQTJVRDNNOVo4aFJueW1kZ3JfQTd2cTRINFlPR1ZFa0ItTFRKUFprWkxOV0VjakZ1aGhL0gHiAUFVX3lxTE05d2Q0a1dXMm5qZTk3dlRpRlROM3JNVkpWUGh6N3A3aGxjU3hTRXIzeUlOX0RiTGpWOGNnV2NOV2VQOWVjUnVpck9weGRkUks3M2ZIV2xndDhTanFhNjNrRkxFTG5hM1B5dlhleXNoSG40M0FTaGtYUWo5Z1hESWFJN1M1dEpCN0U5cE83OVdXd2VoTG9GQXJOb2U3a1dreTFnVlJadTRHQnFBRDFoWW0ybDQzTUJKUEJibGFpLWZzSlYzTnBZTFFUVDV5Q2hzRjZnMVJKeTVxQjVpZjUydzVwN2c?oc=5&hl=en-US&gl=US&ceid=US:en,Times of India
HDFCBANK,"Wed, 14 Jan 2026 08:00:00 GMT",Earnings preview: HDFC Bank likely to post modest earnings growth in Q3 - BusinessLine,Earnings preview: HDFC Bank likely to post modest earnings growth in Q3  BusinessLine,https://news.google.com/rss/articles/CBMi3gFBVV95cUxNa2c2dW14TGljeTJERzhoVXc0RXpKT1k4ZU9VaTI4VXAtaUNmeDA4Tmo3Z016NzRUbnBwdUNuQ2VaRTd2Wms3Y3g5WmtjVDJLZkp5aGcwNEJCek1JdjRsRnJEVjNqTzdtRlNJUVdXMlJHX0Y5T0FlQlNxVzdOTjNlQ1hGRXUxMmR3OHRxTFZwLTg4YXU5eUZ5YWFiQnNrMmZFQTdUdk0wQm8tcGY4MWIzUmltM3d3Wmd5VHN1ZC1Gdmlma3FwUkk2eDdLdVZIT2JuLVRVMUxETDJTY0hUblHSAeQBQVVfeXFMT1d0STVtM0wtaXFST2xlTndmWWhGVzFmUlVmUmxuYWJGa3JwaVlnYW96Q3Zqa1VKNzJRTVI1LUNUZVNzOFBPR2VzVnhaNXJsQUxrY3JRYWlabXdaRHZNY1AzdnFoVmotNUtfbE04U29DNWtaMGVZRTBDLUR6ZXhKai1ZUjl1S3dPNG9xZTk5RW52TWZrMGx2ODZweWxFeTBkM0pCSlpEX3B2SDBRdjdkaU9oRlhRSzJDcVFGVUhQQWlyeEpHQUM2cW9UYWYtbW53OExmSXBtR3NyWko1Um9kaTJ3V05f?oc=5&hl=en-US&gl=US&ceid=US:en,BusinessLine
HDFCBANK,"Mon, 12 Jan 2026 08:00:00 GMT",Explained: Why HDFC Bank shares remain under selling pressure - India Today,Explained: Why HDFC Bank shares remain under selling pressure  India Today,https://news.google.com/rss/articles/CBMitgFBVV95cUxOOVVNZXotV2cwYl9TajJsX05sQVZkZjRwUmZPUFItekxNMDJNcVRVdGc1bFdDWmt5UHdCdUgxd2JxNW5DcEFtNGp0M1FyOGs0MkxrTG9fb29LVTlOWmhMQVBqcFRFQkMtekhMX05QdHBJSUV5RjhteXRIMjlyNXFxMGR3ZV9DTDc3djFheENrckJjRHd1U1ZZMmxVaTJjM1ZUbC13OTAwbFQyTHZDdmQwa1RSei01QdIBuwFBVV95cUxQTE1NekIyMU9QV3ppRTh2X1VGaldiTGpMUXVqYkszaExmRG5DX1cyc0tsNHVCWjNGMTk4VVBaR280SWloUU1kaTZ3LUNPaXJtejNoTGppZ29kN25BZGtaMmNBcF9GUEJzTzNCdkZRQnlUblRrWDVDLV9SZXB3ejBFM3JTX0ZtQ2pWbnNlV3MydG1FMUJFbEc0cV9xcm0yNmZzNUdxT0RxZFJnaWxtR2pHVHJUb0hXTVJMUjZ3?oc=5&hl=en-US&gl=US&ceid=US:en,India Today
HDFCBANK,"Mon, 12 Jan 2026 08:00:00 GMT",HDFC Bank to Hold Earnings Call on January 17 to Discuss Q3 FY26 Results - PSU Connect,HDFC Bank to Hold Earnings Call on January 17 to Discuss Q3 FY26 Results  PSU Connect,https://news.google.com/rss/articles/CBMiqwFBVV95cUxOQ0RCb2lFS0xtNDN2NHhyMkJYV1Bid3lfeUw5VE15RzV5TVJtZ2pJMkVYOEpjR25mSjVoYS1xTU5KTnlFcDFGY09YdXNSNnBscXV5V1ZwMm85bkM3dWozT2U3WnU4RHhxZVdaM1pDRm1Zbm5hb3EwNkN3WHZYOC1VVld4QnM4RDFmME56MnMwRDFTZTh6X1NVWC1BYjBCRWc1eWpjTnIxbF9iWG8?oc=5&hl=en-US&gl=US&ceid=US:en,PSU Connect
HDFCBANK,"Fri, 16 Jan 2026 17:33:08 GMT",HDFC Bank Q3FY26 preview: Street eyes steady earnings amid LDR concerns - CNBC TV18,HDFC Bank Q3FY26 preview: Street eyes steady earnings amid LDR concerns  CNBC TV18,https://news.google.com/rss/articles/CBMiowFBVV95cUxObVlVNzZZM3hBNk95Y0VtMWl1SU9NWHV3bHcwQVlGSlpnZ2d1YnJuQWUteVl6Y0hPQUVmOUNnblRTMzh2U3JaQzNHdDJaZnFLRXZBZ3ZfcFIwVEluSlNyUUszbXRrSkE0TkFrSDB4UkgwUVc1WC0tWF9vN255ZlJoaWJEaC1YNmIzUW9UZHR2Qllid2VETm83NjJiSFhZNDhvdkxR0gGoAUFVX3lxTE1LelZMenVwTmZneTV1dnJqd2RWZ0J1cVNWS1lQWjN3YVdsY3dZd2tvT3ZDRlNWQWpuVU9kck9VZ2FNY180S0FGMXU3bmQ4MUhNLU1GbEY4d1pMYmE5MXZLRVhvbndKVFQxNFMwSy1VZFRjTjVoV1RaRmRsV2NPRHViNGNwYXo4Z19OMlEzVlFLNGxKSTdxck5LZDZuWEpaSTJQUW9haW9nQg?oc=5&hl=en-US&gl=US&ceid=US:en,CNBC TV18
HDFCBANK,"Sat, 17 Jan 2026 15:45:00 GMT","HDFC Bank Q3 net rises 11.5% to ₹18,654 crore - The Hindu","HDFC Bank Q3 net rises 11.5% to ₹18,654 crore  The Hindu",https://news.google.com/rss/articles/CBMimwFBVV95cUxQSG9Rc2ZYTkxBWHhNWjJISV9sYmJjc29QNUM1Q0F2cjdkX1RxWkVQV3FvLVRFWXFhTlpyVXg4U1NwWWRsZGRXVEFJdFRUOUhZMjU1SU91bERoMUZRWDUtT3RpWHN4RmJnekY2dUJ6aTAwRW1INFkyTGxZbVFfX1ZzazdTUGREaEJidU9KdmJiclR0SXpqLW1UN3hFNNIBogFBVV95cUxOQUFsZGF1WllWLUZxTnJxdlFCZHR2R3NBaXRsVzFuNUNtZ1JIdTM1Rk9OZWFTaEFxVEZ6dmZUeS0wc3BmUFB5ZUJqbDJPT0lBZnU2SGt5YmcxZjBndXhkeTl6R3lTNmlYU2hBeUV2aWlVWm1sOExuOWdfLU9EN3VadFJ5bll5QlhuMlg4NEl3MW9ZN2xZOGdycjVXQkpXeWFtU2c?oc=5&hl=en-US&gl=US&ceid=US:en,The Hindu
HDFCBANK,"Sat, 17 Jan 2026 09:20:51 GMT","HDFC Bank Q3FY26 net profit jumps 11.5% to ₹18,650 crore; asset quality unchanged QoQ - Upstox","HDFC Bank Q3FY26 net profit jumps 11.5% to ₹18,650 crore; asset quality unchanged QoQ  Upstox",https://news.google.com/rss/articles/CBMi2gFBVV95cUxNZ1hYZXVZWXZldHJtcS1NR0xFOE9aZE9Lb1VFanNyTU83SXFwRFhXcGREdWF4bG5DbURRX0hoRVZ2LVJRZWVtT3o5S0poLXZub1lUaHBIVmNEemFhbkhvd3M4T2JEOHJtV1BYMngzVHRmbkZXckR6anUtbERva0ozY29ZbTVJMTB4WGpIZzhqVDR1U0VoM0dUZGJ6cnFnaXFDc1ZnR3lQeW02Z2pYY2N1LXoyakxhejhNSDJ3WHI4SUhlUmZBaTNkdGxadkR4cUV5SEFtWko5OGNZQQ?oc=5&hl=en-US&gl=US&ceid=US:en,Upstox
HDFCBANK,"Sat, 17 Jan 2026 11:29:00 GMT","HDFC Bank net profit rises 11.5% to Rs 18,653 crore on back of ltreasury profits - Times of India","HDFC Bank net profit rises 11.5% to Rs 18,653 crore on back of ltreasury profits  Times of India",https://news.google.com/rss/articles/CBMi9wFBVV95cUxOMEpnSEVGWVlPYnRrVExYNERFRXlDcXlGV09KZHJGRlZlaUtQdDJZV1ZlMWtXOHlBMDBSUkRfX295RjJIMWxzZUwyN3FyX3FaX2NlQi1UbU9fYnZCWkZUcHVfenBxVG1pMzVObEtkWVZwVDNJUTlvaXQwRnk5V28wbndQUTFUYVZQTjRManZUeS16b01hV1hKSU05d2dlNGF3X3Q1T2ZVYV9KUnFKSmpxeHFnZUZQQWhIU3pWbUJ3aDBZV2laLUQ5RVRzMTBrb0Jtc0RadDhVMmhvWHVwNGFta3NzaS1JdjZsTDFuRWoxSE5qMTJveTdB0gH8AUFVX3lxTFBYZ1ZXNDZOQzMzY0FWZGFxckt4azRPM3JOS1RGcTRQWTNHd2tjTnhBTXY0T3VxZ0drM2hZeExUU3lnT0gwRk8tZklTREdvalV6Nk1LWWdhY0VhNHNNakhqcWl2TjZxUXZ5ODFMb1VETUVIZjRlR0djZVNXOV9Za1dGbE5JMTZyZXF4aHJtYUMwRlZabFBOaDNSUHlTbU5MTXFfMnh3Uzc1UXhNSV9rSHh1VE9MSDVKd2lmZkVSc2xOOHd2VG1ULTZIb2pPNllFMkxHMjBobG5hRXdkZ1FaTVN4eGx5dEFBX1F5YWlsdmY4MjVKc0hDd1NBdVVCcw?oc=5&hl=en-US&gl=US&ceid=US:en,Times of India
HDFCBANK,"Sat, 17 Jan 2026 04:14:30 GMT","Q3 Results: HDFC Bank, ICICI Bank, YES Bank, RBL Bank, UCO Bank, IDBI Bank & others to post earnings on Jan 17 - Upstox","Q3 Results: HDFC Bank, ICICI Bank, YES Bank, RBL Bank, UCO Bank, IDBI Bank & others to post earnings on Jan 17  Upstox",https://news.google.com/rss/articles/CBMi-wFBVV95cUxOeEItY0o4UjFrd1Z4NUxDVlY2SktXOUJocGNicXRXVC1sU1AzUTlhdGZKZnBuLUFYUlYwcGg4djU0Y2N6ckduVFJOWDhEdjBHWjBRMl9oVFoxYS1mbXd4MFFTZTdsenRiOW9EbWZtTWVPN3FTU19IOGFiM2dTT0ZtU2diN3dwMzdGR0lOSnNqTHdFMjI2Rm9BMHJvLTA5ZWtxVFZNc29mNmlSZ3loQ3dUbHF5NlA3a05BWkdoX0UxZXV1R1dNUVg3NkdSSEw5ZEFPRzFDdktUdEIwbm5XLWhRclFjRk1ySlZfQXlfVkd6UkRwVUNkVEFIZTNJWQ?oc=5&hl=en-US&gl=US&ceid=US:en,Upstox
HDFCBANK,"Sat, 17 Jan 2026 00:55:00 GMT","Downtime alert for HDFC Bank net banking services for January 2026: Dates, what will work and not - Times of India","Downtime alert for HDFC Bank net banking services for January 2026: Dates, what will work and not  Times of India",https://news.google.com/rss/articles/CBMiigJBVV95cUxNQ3ZSRzh3WlJwQ295TUpsaGlwdXZNODRlQURuOWFsSGFRRWJEdFB0LTBpMFdHUDREYWMwQUJYenBkSDZOOHNHaTRaa3Y2ZFBQMU5sSTNnVzJ4b243NnZmUVpvb1pwN2RUN25SbC11VXJhNExHSTctSjFEY0dPeTk5d0wtdkRnMlo1ZzVtRVdfME0zdkNha1p3TnYxYXEtRlpmd1NiTHZYLUhaS01pcFQxdTZHLWVxeC1nQXJ5cWJac0ZpUVJQNmVnLWV5MTRhdWZrRXFLR3RvX2d3SXdveHhNazBJVnRZaHpZbVQ5TTAzRDJkUlE3bUtUcFg0anVHaTJfNG9TbktYempWUdIBjwJBVV95cUxOcWpDUFFwOFMxX0RDUERhYktIUE1sMEpsVGlvNU1sUjlXSmVRWUIwVVFGVExXT1F1QnJnWUhvRTMxbkt0TVdnS3dNcVhCcHFZcW9WQjJHalN1WW5OSHk5b25EazJkYkZGc0hManBiOHR6Y01qZGVneERTbDJzM1liWHBDeFRja2ZpdURGLVVnYW14UHp0VVY4enE2TkZGeXN1NllaZEVvM0tpZUF3cEtzYndDTTdDY090YU51QXRQcE5MMFVkX2p5X3ZoRU9hcHBCRjFjQmcyYUFCQUxIa1FaUzN1RTY3WnJjVEVFa1V0R3dIZW51MFNLMXNtUHlnakpoZkZMaFNzOGdnaEJOMmxF?oc=5&hl=en-US&gl=US&ceid=US:en,Times of India
HDFCBANK,"Sun, 18 Jan 2026 06:56:42 GMT","Reliance Industries, HDFC Bank, ICICI Bank Q3 earnings to drive markets on Monday; check key numbers here - Upstox","Reliance Industries, HDFC Bank, ICICI Bank Q3 earnings to drive markets on Monday; check key numbers here  Upstox",https://news.google.com/rss/articles/CBMi8wFBVV95cUxPcC15SC11N1dnLTc0ZUduSnQzVjhadEZXNTkteXM5a2pYaEV3X1FIUW1LTHhkZ2Z3dVRaWUdwTFhOclljcW44bnFKLXhLUE94R1lOU0NYeDdoUkVWa2lGVEhycnBlM0lCTVoxU1lYbEtySEo5VFNiN2RGMHdfenNPMmdWTWpueEFLUTBIVkJHQVEtalI1c21CaXhKSHpDVnAxNjBXTmI3cUNRcWRYMjF4TldVdDM4a1Z6VTZRVkJFUy03bXhWU2RBUEgxa3NtUmFSTlBaUzBCRXZpTFBJT29YYTVEc0JmWUlmaW1WV2J3dHdubTQ?oc=5&hl=en-US&gl=US&ceid=US:en,Upstox
HDFCBANK,"Mon, 19 Jan 2026 03:08:05 GMT","HDFC Bank stock outlook: Brokerages bullish after Q3 profit beat, flag deposit growth as key monitor - Moneycontrol","HDFC Bank stock outlook: Brokerages bullish after Q3 profit beat, flag deposit growth as key monitor  Moneycontrol",https://news.google.com/rss/articles/CBMi9wFBVV95cUxNUk5WcFZZRmx0Q0VIdnZ6SDVvZjdIcG5mTEZ1WVlRN1g0T29jUmJBNU9zUmFZcGlsR0xtbjlDclVOMEF5NlZ1Y0lWN2RNdEZTaXY4UmxNcTBrM3hvT3pWelZGRFlSYV83MDBoOGVPY2VhZW15aEpabV85YTQyYW5hcE9RWWFhUkMwV25tWGlWVWE5YzNVdHdYSWhyaDJSVDA4d1lUUzRpRGhhbklvMmNZS3hTalZvVEZCU2ZGYTVBNElBdWp1WGpjMVFPeU5iTDk0SFRvWGJGQ3JJM3BzakQ2OTRTLV9rZWZLcVZuQ0loaFB0MEcyMUY40gH8AUFVX3lxTFBTdGpRWVBYX1FrRnQzbldDVVUxTEY5U3Q1aHlYdTVsQ2RJQ1dGeE5sZ2lGaEpwMHd0dDh2ZnNhakwyTldKMWdmaXE4TkI4cUN5eHEyOGdGenB6SUpsY3NFSU5VRTlXUXZZNkxRdi05T0NTb3dJdEY5bWdYenIwMXhDQ0UxMFZseTRjNWI4OGpnUmVBMmJ4SHBLWUdIbUROZnNocnhZem1GbWJtakxWTFcxRHJTUnpHT1FuOTZUZXh2cUs1RXhLU0FvOGlRcHE0M3VHeHhPVXI1azI1cmxKaHZlenF6UlAwaWY2Z1dKRTJQR0owM0FaQkVfckVnZQ?oc=5&hl=en-US&gl=US&ceid=US:en,Moneycontrol
HDFCBANK,"Tue, 20 Jan 2026 16:34:51 GMT",RBI approves appointment of Kaizad Bharucha as whole-time director in HDFC Bank - The Economic Times,RBI approves appointment of Kaizad Bharucha as whole-time director in HDFC Bank  The Economic Times,https://news.google.com/rss/articles/CBMi-gFBVV95cUxPY191NUpPRi1yOWozd1hnNHdkU2RXeklxWmNFTUdHV3JjYzlxYWxLMnNzUXNjQ05nZ0R6cVVqSXcyb2p1aWxYcGR4ZjhXY0tpb2ZUcmx6NkRlRmNQeW5sTkU0Ml9TTllqb1h0b2ltaTlMNXhrbEZYUU51N2JWT3JYOHNDbUt3TS0zei0ycFA3NFRKUjdLZWxFTUJmYnd2T3JPQmlCWDB3UVZ6dGZGVEdnSWFuTEdpdlpYUURQdzltRGlmampRTGxoQjRVdGZfcnVUSlBYa0lCcHpuNmxUUHdPYUk1R2poal9aQk5kRnJTbGRkTTU5a0Qtc0530gH_AUFVX3lxTE5LTWRobmpqRVQ0NTFTOG1vXzN5LUs4Z2NMbWhhYnhlVGtJeWJTR1FiZkJBdHFQRzRuSXd2dVJ0UWlBdnNVcTZaWXpGZnVvcnFWdkh5YUw0M1J4eEYtallSN1JEcHFLcUxTRjI4MXpJc2VHUWxoZVVmcW52SVRwUHZ0TllRTmpNVHRDZmUzWjF5bVBxN1ltanJXdEF5ZGQxRTBZQnBJM1FtWV9DS19PS014NXZXcjBXbW00QWc3SXpUeXE1TEtLN3NOWTdNVk1XN0hpSTltNVQyQlI0QnY3MEMyRjkwckVSbTFYaThuMHRDUGtvdktZeXZHWUxvckZwWQ?oc=5&hl=en-US&gl=US&ceid=US:en,The Economic Times
HDFCBANK,"Mon, 19 Jan 2026 03:53:36 GMT",HDFC Bank shares slip today post Q3 results despite bullish brokerage calls - Moneycontrol,HDFC Bank shares slip today post Q3 results despite bullish brokerage calls  Moneycontrol,https://news.google.com/rss/articles/CBMi1gFBVV95cUxOMWR4dGM0eDdwaEppY2FRU0tjZ0hVSGluZ2FCU1RtSXo1NjBseVZ4dXlydG9YLV9qNzNQNmpHbXZxcFh6TUxCWkpNMzFjbHpkVkVhaVV0S2dsd1F5MVdQWmZOSlhtMWlBc2JGbU91bjJ4Q2otUGdTS3hHRU1LNWt6cFg5dWJvVVB6RVo3aEU5cVFLZktpU3BhNHRUb083ejdtLUpwQ0lTZUxjZzF0RzJHRk9jLWtBZmo2eHNTeHk5OXoxT3BuQUFVSFItbjhWZlllWGNqMnNR0gHbAUFVX3lxTE1IMG9IcG5CVG1RS3J4aGFXOVhQcFctdU1mVFVSY1RDUnlEbk1YazlLZUVYNzJ0V3ZNVjlPOVVINU1sQ3NGS3RtdjNnZXMtSmFqWGE2Nk82UVMzYjN0bV91WGZBTVFtQlVxUGNTeTJ6RFZrSGhiNm1JYXRaLVI1NWx0Y0ZBV2lVNFQ0TkdHX1E3TTlzeWlVTlZyUGxQSDVoSWQ1WjlNZmFRd3o1MjVhMlMtal94OFRXUGktX2dGYW42YXN2bUxPemhqYldlUnF6RF90NERTOEZZOWRGRQ?oc=5&hl=en-US&gl=US&ceid=US:en,Moneycontrol
HDFCBANK,"Fri, 26 Dec 2025 08:00:00 GMT","PSU banks are quietly eating private banks’ lunch? Motilal Oswal says HDFC Bank, ICICI Bank, SBI and AU Ba - The Economic Times","PSU banks are quietly eating private banks’ lunch? Motilal Oswal says HDFC Bank, ICICI Bank, SBI and AU Ba  The Economic Times",https://news.google.com/rss/articles/CBMimgJBVV95cUxNekRjdWNLZzhic1hFTWlZcHpOMDh2OG1INUt3VU9za1NSS2hfdlZJUUpRRlVmSjY2SmkyMmtPU0hiazlobVpBVXFZZWRVT0RBQWVxMWZWSnRWcFBIdFM2XzZRR3ZMWFhVM2JfM2lGZTYzX3hxRUVuMnIzU20wdFNEclJSdElQYk1INHpqUURPaElsV0l3NHB4MUE4dC1jN3FmYkpaR3k3REtteG9ZTnZoa0k5c0lHVFdYeTAtc3lVZE1lX1Z6WUFTRS10SkYwTU1FOGpxMXBRQzIwTHRadXMtTHQ3MEZKY29MT0ZPTlRiQ0JPcGNnYjBxYXlNQWVIQXk2YXdZOURzTWJZYzIxYkdjaDdkZmR4SnNjQ2fSAZ8CQVVfeXFMT1hGYU5UUjNYeTJiZHp3WndWdTNaeW9mamFGblJYTnZJSVdBT3FyVjJDUFRuQl9EQ3h0Uk9wempXUDhTX3BoNW1xOEdIZWtUeGRheWl2RndMdXlLaHYzbS1uV2pYaUNmX2NGMzlhT0JUaTBrNGphYUZYdjdFMXFjMHVWRUNJNlYzcXUwUmdYeEVyVmxsMlVIa0kxbER0Z2lmamhBbDdERFM3Z2xVVF9xaE1vdVFaV1ZtWF9SRnJsak56Y1pOSXlqdlhFeGhTTkFWYUpxMm1yeThCc2JOQ2RETVJQS1lPaWY4bGs3eU4yMlFZX3p5RUFlOVVYMUxjYTBGSF9hWDk5amQ4NDhXeWRZMi00WGJrbThOLUlLcGRRa28?oc=5&hl=en-US&gl=US&ceid=US:en,The Economic Times
HDFCBANK,"Tue, 13 Jan 2026 08:00:00 GMT","HDFC Bank shares will bounce back in FY27, CLSA says projecting 28% upside - CNBC TV18","HDFC Bank shares will bounce back in FY27, CLSA says projecting 28% upside  CNBC TV18",https://news.google.com/rss/articles/CBMiygFBVV95cUxNSFJxQnNpRGFmY0hUbDhvUHJvbnZyY0dkbnJFcEZ4UTkwYmI4Y3huVmJhbTZoNWs0eEstOTJfa0stRXRPdjFWblJjSGtURlZHU21lV2wzNXpzRHkycF80MElXYTAyQVAtZFRLaFhaWmM3a0gtRnVXcjR2OWFlVEY3cW9OYUlGeWVVZmFIYjlxcVl1WWFkMFBHR3VfM2Vra0dhX0Ryb3Z6XzNoelpLV0M5T1BDbWlic1BzYm0wQlIySHI3X0hLVVZmZXd30gHPAUFVX3lxTE9JdG9CS2hkMXZQc3RkRXZjUlZXOVlSTVhwQTZUS21XdENFa1FDY0ZhUzNfZHpiQ19TN1FkT1p6Zy1raHFMcDdjOTNYLUxWdXN5dkt3M1hoYWYzcHZjdUNWM2R6ai1vN1JSYkJGdmxXUDdXWWxNeVFxdWFZUEdmRXY0YmRqTFFkNU5jSnR6bDRMbUZGWEtlOS1qU2F3cld2bGdmbkRTR0JRYjZJY3ltYnIzTmxITm9VOUt5d1dLTFN4dDM4M21aSjc5Nk1kSUp4NA?oc=5&hl=en-US&gl=US&ceid=US:en,CNBC TV18
HDFCBANK,"Tue, 13 Jan 2026 08:00:00 GMT","CLSA Sets ₹1,200 Target for HDFC Bank with 28% Upside Potential - scanx.trade","CLSA Sets ₹1,200 Target for HDFC Bank with 28% Upside Potential  scanx.trade",https://news.google.com/rss/articles/CBMitgFBVV95cUxNVlFmNDNQd3BnZEhWUXYwNmVKdmhtTUpEaGw3bmJXWFlPVGFZZlg0U2RYa1JJeXZpUi03aUVFQ3ZTYVI0QWtzcXBkMThVWWlyTjBBbkVkb2RKdENzZXpxWnRkVWx1d0RVcTk1UUtPYU9jLVdUbHYyNXBydFpNQnZkVXl1a0pMR3U2RFEzUFhXTXZDcE9pYUs5RTM2dnFEaVZjMXlVSU1fSEN6TlUzQ1hNXzltWGhNUQ?oc=5&hl=en-US&gl=US&ceid=US:en,scanx.trade
HDFCBANK,"Wed, 21 Jan 2026 09:25:19 GMT",HDFC Bank hits over 9-month low; stock down 8% so far in January - Business Standard,HDFC Bank hits over 9-month low; stock down 8% so far in January  Business Standard,https://news.google.com/rss/articles/CBMiyAFBVV95cUxPSUZJR0VRRG9XMnl2cnl2RkgyUVNMR1I4b3h0WnM4a3NKTmpKZkNsM3AyY1A3WUVzYlowRkRJS0xYaWJrSHd5ai1YRVBBMHdHdXE5NkZsTXRXU3F3aDgwcEpoTUxpSmdRLWc0Q3VSUzNaa0owRTZsWlVCbVB5UDFoUmljd3V0NEhISmZzTk40cXU3djFZTUpISzJkSTFLSjZVc0M2U1M4VFJtZ19FTWc0aDI0Wm1mSWQzc1VHOTNrVTBtODZKcTRISNIBzgFBVV95cUxOU194eDZOTFR4VTlvQ0FqbHozcGxrNVFyaUs5MlMtV2xLQTBmajBTNGVnT0Z6eF95eHZyVldTWW5MS0JibEJmOUVpam5KNzRQRks2OG1Kd1JkVzljMmRSTUVTRHoxZG1zTDhUQlVKRXpZT1BkU0lsVXZYY0N4LU41RGRwc2t4M3pPbG5rTTg1UXRlMm9zM3FkdG9QQVZNY3ZPY0FTN0p1SzY0aGRfbFJGNzN5d0JCLUc0bC1YS0FYUV9OLWVxcTZTdXBBTE5VQQ?oc=5&hl=en-US&gl=US&ceid=US:en,Business Standard
HDFCBANK,"Sat, 17 Jan 2026 03:58:16 GMT","HDFC Bank Q3 results preview: Net profit likely to rise 11%, NII to remain healthy - Mint","HDFC Bank Q3 results preview: Net profit likely to rise 11%, NII to remain healthy  Mint",https://news.google.com/rss/articles/CBMi4wFBVV95cUxNQ0VMN1dOUzZlcThSX1BUOXlBb0s2V2ZSNF9VR3FWUjQ4bUVGeVN4ZW9FT2x4dS1tU3N2eEJyTHl3bHU3T1VoLTJySEpybk1hb0wwby1ZVG9aUHN3VVNxbFFLeUhBMGdIRXRiZ1lFYWIwXzN1NmxwRTFkeXlrRjFpbkVVRWhfVHRheWVab2NYeHpjME1LQjVldXItNS1oVjVMcXVpb3pLaTdQYUtQdlNJaXpndXRHUmt4T1pLTjZDWEJUd3k3VTNkUUN4aGNfcjFvUmxwTWhOdjFXZ3pJTk9zWjRHTdIB6AFBVV95cUxQeVlJYTFvdDJfUkdqLUZRVy1BSzliQjQzX0RJTTNob0xLcHpoZmMtbTNoSFNfUlpnTmY2STFDNTJMb21hYkRVYUlrUUx1enZrVU5zMlRHcEd0VFgzQ0ctVmtEaW14VC1hWE9xaVAzQVRRMTNia2hBQzhqazlOS0xYOFc5STJ3aFBrZTI2UXhESGxFWGRpZHJTaDI2LVBtaHV5MV9DczNoUmxwczA1Wktzal9VMUFoeXZrMHJGTTdILUtNblhxZjBFV2MxQl9NRE5tUkVfTVNuMnBabm1NMk92aF9QdmVyaWFX?oc=5&hl=en-US&gl=US&ceid=US:en,Mint
HDFCBANK,"Sat, 17 Jan 2026 09:33:31 GMT","HDFC Bank Q3 Results | Net profit beats estimates, NII up 6% at ₹32,615 crore - CNBC TV18","HDFC Bank Q3 Results | Net profit beats estimates, NII up 6% at ₹32,615 crore  CNBC TV18",https://news.google.com/rss/articles/CBMivAFBVV95cUxPblNfTDdHN3Q3ajk5SUVWa1ljV0NkaVdBM1ZzN0lzUld2Y2U2NXpNNlQ4cWNTOGRTRDItLVFvMXA0VWRmQkJ0RkNwamY1R0xaaG45amw4SnhOakRYWm9rUkNDcUVEMURjUXFQVG1tLUJDVWpxbzVwOGNjRE1nWDNmTHJTYmR4U1Y0elQtVnhEVzNpYlFFOW1RT0w2YzdpcFVXVVVmam1MM09JNmlIWF9rUURpcGw1emJfVXZmS9IBwgFBVV95cUxNb3BoeGVOVXhrWVpUVThGekppUmJKb0c4dW9zT1cwRFlwY2VWNWE5ZlUyWmdDY3lQOXpEY3NPNDBKeldhX0RueFFyLVQ5dDRVNTlSdF9ueWtlQmxuWm1vampLVE1FTXlwYkozQUhyMTlqaE83UG1Kcll3SlBVSkZXMmRySlJJMHBsMldxamVvZkM1am9keEVUNElkZWhoMVhRcjFwVm5jVlRzT1NsQXh1V00xWmxhSXV0U3NiRXQzaXhBZw?oc=5&hl=en-US&gl=US&ceid=US:en,CNBC TV18
HDFCBANK,"Fri, 16 Jan 2026 07:55:39 GMT","HDFC Bank Q3 Results Preview: PAT, NII and key factors to watch - Zee Business","HDFC Bank Q3 Results Preview: PAT, NII and key factors to watch  Zee Business",https://news.google.com/rss/articles/CBMi7wFBVV95cUxQTl95c3NFbTc4MFFhblRLc2tyT0ZiLUJoWHRHN3hlNTItNjh4RUl4VW1SRmlDRC04VkVBcUs1VVAyRDV5dW1tenZZMVIxeVNSZ2pkS2g4cXJncUxUOW9mMC1ReW9wdHVQc2FwbUE1b1lfdU9pRFpqWTRmN0RocTZQZlg2VlQ1T0pGWGtsWEJMS01SeHBPVlBHS1FEeVZnNmhaT0RWQWpROV9HSHYtMlYtZ0ZRYmVnVEJRRzdITlNqLVlfQWRidXJPQV9NNUVMcm9lNjVOOXdkcWdjcUdoLW5qU1hYR2xVVktwQ2FkSmtrVQ?oc=5&hl=en-US&gl=US&ceid=US:en,Zee Business
HDFCBANK,"Fri, 16 Jan 2026 08:50:39 GMT","HDFC Bank, Axis, Kotak, and PNB: What December quarter trends say about bank earnings - CNBC TV18","HDFC Bank, Axis, Kotak, and PNB: What December quarter trends say about bank earnings  CNBC TV18",https://news.google.com/rss/articles/CBMi8AFBVV95cUxPRnFKdThpQzRzdVNPbFlSRGRiRURFRTllalpDVTBCanphSTFacmtUck5sZ0FnM25NczJEakE5SEdtYjB2YUVMS05YWkxBQ3JUQ3lyY3NWME9uU1VUTWNXUmhOSVpkd1ZfTjE4UE8xQUVycGw5ZTlpWXFiN3JBQUhkbk5OVEhPaUlZTDVXeDd0OXpJQzFTOV85cHN5ZE0wTW9iMEk5Rjg0RUhnWS14UFp5NjhYRkhqRWZIbTY5M29zMDR2anFfVzdLZmUxb0djTHY3enppUzY5OFN3OW5YV0xjMVpObzlZamZTdHA3T3Z3RkHSAfYBQVVfeXFMTnloZGRCTEpXenFSdDdFVUZ6RXVOTUZJaU1YY25zMEFrNGNiaGhUQ3BwVWxkRVJvSU03Ri1kV3l1VXZXa0hXc2NDSHRoa3BIalVYeTJ0ZGJFdC12clRfSkcxTWhlWEphS1RFOUtjS3plWFQwNkFIdFRwYUMycTJjdFQxYkdrQ3otY2JtTXNBMlhTTDN3dmkwSWcyak5xTm50T3NGMm1YY19CNG8wR2EyaWo0bTd3OU92MjFMU0dvMHFrcS1mY1FYOEt4SkhfMkJ4WmtRcF9UaHNkVkZHYlE4Q1kzTVNMYnByU1BjeXlXQTlfMkFna2lB?oc=5&hl=en-US&gl=US&ceid=US:en,CNBC TV18
HDFCBANK,"Sun, 11 Jan 2026 08:00:00 GMT","Q3 Results: Reliance, TCS, Infosys, HDFC Bank, ICICI Bank, Wipro, others to post earnings this week; check day-wise list - Upstox","Q3 Results: Reliance, TCS, Infosys, HDFC Bank, ICICI Bank, Wipro, others to post earnings this week; check day-wise list  Upstox",https://news.google.com/rss/articles/CBMihgJBVV95cUxOVUdGVndPazZ5SHZvSjhBZ3lVT0thbG96MGloQXNQZ18yYTFZWFVGcjNRcDVQa0VUNkNIODBPbElLUlJ6c3Z1eS04VU9FTEVhRXJIQ21HTW11Z1dVc2ZyOW43V1J6alZFejN4VlZFM0lSNnpUQlFpbTJHNFI4M2lkWFFReTViTUw0MmNRWHVwRzdUMWhiaDhnVjZKNjEyQU81T3JxZDgwNUxlZmRwT1lGNFlMallTQ2VSQ3d5dU5GQlpjanhZN0d5Wk9aRk1Pb2RIMmxvZ3lzT25WdUxXVmdCSkxKTm95WURLUWZFX1NybHFJOWtaM1B4TlkzZkVhQWRTS2tWczFB?oc=5&hl=en-US&gl=US&ceid=US:en,Upstox
HDFCBANK,"Sat, 17 Jan 2026 09:36:21 GMT","HDFC Bank Q3 Results: Profit Rises 11%, Asset Quality Steady - NDTV Profit","HDFC Bank Q3 Results: Profit Rises 11%, Asset Quality Steady  NDTV Profit",https://news.google.com/rss/articles/CBMiowFBVV95cUxOeVRPcTZTYzhXdndGRjN5Z2NZRE9QcmFUUUgzVFdTaHNIcUU3UXprTUhUQjFVejFlLUQwVWRTNm1zT2xPTjM2Rk9rRjVmY3ZYbF9leUxUSTREeW95MkFSTkdnSkFwWk9YTEczSkNZbHptMncwN2Z4YXE5MjFXYks1VEpHR1NVZzJHM0M4OGlSTldqTC1qWjNJcnpUMmNRZlozOGxj0gGrAUFVX3lxTE1aTUl4dzRQV2tkUjBNOHRRaUpFcE9jNE1TZVlXUHZsblZzODJQS281M3Y2NnJCeUdtUXZYakpBWUxkR0ZqYjdKZFliRHdiVi1UN3hTRlFfUHh5OWh4X2VrNkZUcTBTcUxCVDNhUU40T1lhUEdzQmZ1a1VBY0ZkRWthME1SVjM5bF83clR3bGRBWDJCaVdQSlZSX1hVdUxVWXIxdk1qQVhaZnhiaw?oc=5&hl=en-US&gl=US&ceid=US:en,NDTV Profit
