ticker,date,title,description,url,source
HDFCBANK,"Thu, 15 Jan 2026 08:00:00 GMT","When are HDFC, ICICI Q3 results out? Indian investors in banking stocks await quarterly earnings: South Indian Bank results today - theweek.in","When are HDFC, ICICI Q3 results out? Indian investors in banking stocks await quarterly earnings: South Indian Bank results today  theweek.in",https://news.google.com/rss/articles/CBMi4AFBVV95cUxPQUJZOTdjdGNPbDg1TlhpWlZGeFIzOE1EMHZHNW9zSWx5ajJvMHJPeUt3RFFpMjF1aEpQVVZtUVlNOWE3aXpNRjdKamlSWFVRNXlEdVJQQVJLMHVtTUw0ck8wT1AxM1lWa3B0RlZxeFNKcjkyTWRjclN3SC1yR3prWHNub3JGeXBXWHhwUWJOUm1xdEFkd0h3bmFVOFZUUDNRWHVhVmlsRWRGMEFEY1dkYXRoRnFVeWN2aWdQdVVIdUNzNjBwRHJiTHJYNHhscjVTamFLSkxFZnFuTldISmJDdtIB5gFBVV95cUxQSTdVS0FkOXZhWnhnQjZwT1hIZWRVQ3U0cHZtOVIwVG9hTzBjMzl5ZlVjQ0xEOTgzYk1lY3FucmR2RHh5Zk43Ml9yZzNsSkxScjhPY0N2X0hLaGtyTnRNWVlyZWh2alc5cDNmT1lIZ2ZiZ2FfNFhFT3BHU1V4NVZKVEh1WkV6T0FadVJ4UFlEYWRNRkFzQXRMUGJvbkdweUZSdW1HdUVKR25POU9XRmNaZ3BNeElTdXB4OEZjMFdrLUc1NXNkbGs2WVR3bmd0SFNkQy1aT0tYZWJOVUotalFvckxuZ3FpQQ?oc=5&hl=en-US&gl=US&ceid=US:en,theweek.in
HDFCBANK,"Sun, 18 Jan 2026 04:31:52 GMT","Stocks to Watch for Jan 19: RIL, HDFC Bank, ICICI Bank, Wipro, L&T Finance, CG Power and more - CNBC TV18","Stocks to Watch for Jan 19: RIL, HDFC Bank, ICICI Bank, Wipro, L&T Finance, CG Power and more  CNBC TV18",https://news.google.com/rss/articles/CBMi2AFBVV95cUxORHZQTlRxaXVNTGtTWG5WUWs0Z2hzN0R2TDF5cTV4YVh1UWdsQkpwMno5THYtNWVOeng0bzFCYzladVd1RmZsQXI4SG4xaE92dVBUWW43SWZPN0QyLXJMcTYwRG1HWGZibmlXUDhjV0JfQnA3NmFIWklNanh3S2xZbkZ5ZFR6WjJ6Q192N25LV3daT2ZUdVo2RHhsU0xad25WMGpiWElta0NvS0JJUDFobE1NM2sta0N3WTdxQWcwYkk0dVk2ZEZRT3VkOTlSMUJYajVlSm5ybjLSAd4BQVVfeXFMT1VWVXlWaXoycnV1cDM0S3FDdjV5QWFfNVpHbUhqRHp2bG9wc3BTTHlPVUZzUXdYWmtDRjFfVWM3SzREM1RIT0hDUXprSEJTcXNDYUJzMy02Zi11ZktKRW04NnJJZEVQOWxtRVBYUFJjaExJdkZjY3I2S0pRem5ESkZ1LWxXak5NTVlROTZldDRMcXFxbjBpMjRIRFd4d2tmYUZqX2dkMkZ3dFlTYlFjYXcydWpYc1J1dy1LMURlNzg0Sm5DcFJ2T3BJbk16Y0lpRHBMWmlxVktsaVlBdmxn?oc=5&hl=en-US&gl=US&ceid=US:en,CNBC TV18
HDFCBANK,"Thu, 08 Jan 2026 08:00:00 GMT","HDFC Bank downtime on 10 January: NetBanking, app, UPI services to be unavailable - Moneycontrol","HDFC Bank downtime on 10 January: NetBanking, app, UPI services to be unavailable  Moneycontrol",https://news.google.com/rss/articles/CBMi2AFBVV95cUxQdlhqMmZXaWNNdXFlS2NfZ05Na0RJSFlUYUlTM0RYT21zRjJiUXJ3M1Z1LU1udnVXckhJanNhd0Q4TDB6ejIyZzg4LWItcWZnbEkwVFRfR016YTRoUUZQbDNPaEJwQWQwZkI1Y0gxTGFuSUJaMGpQLWRLN3RFT2hZM2E0eTRjblJPSloyTEVMRmdTeVhFelVrTVB5a19nTDlxaTVCMG1xdzdoMWdhOGZBNmFBQXRMSmZhemtBenBCamlBZUVGSTAtVlp2VUZHcnVYdG9TdEg5YlXSAd4BQVVfeXFMUFBIWXh3VWpibFAwemc5SU15Rk9ueG95bE5BOE5OYVVVLVdEUHhCOHRlcTVXcVQ2TWIxdFpUTTM3ZWFpZ1pqVm13NHhGRTJnazRfMmJMeGdIYTIyTUE4and6dXhOWVpJdWd1ekFNdW5iaXF3YnpUZUQ4T1hhUGFsVERhT3UzTTVFR0JiOXRHRl92cWFycXhlaWhRb1YzWFVRdldfNUpKM3JvQ2JGXzhmNlJ5T1NQM2lwM1ZwZ053dm11OEVhX3dTVk5SOFBvSUF4ZmdySmxraEhjSWpsNGd3?oc=5&hl=en-US&gl=US&ceid=US:en,Moneycontrol
HDFCBANK,"Sat, 17 Jan 2026 02:56:07 GMT","Q3 results 2026: HDFC Bank, ICICI Bank, Yes Bank, IDBI Bank among companies to declare earnings today; check full list - Mint","Q3 results 2026: HDFC Bank, ICICI Bank, Yes Bank, IDBI Bank among companies to declare earnings today; check full list  Mint",https://news.google.com/rss/articles/CBMikAJBVV95cUxPdUQ2d19YbjhDRlFPMmM3Mm1pcmN2TGVLQzE1UVFpTFRXa25OWWdWTm02RXVXbVdSdGZnOE5zY1dtWFJ2ZkZINUZvZFZkbHNxWURNbDJBS25yTW4yUENYTEU5Rm5acTZTY0c2aTZyc2tNQ2Nad0NxcUpnUDFRVXJpcFJTcUY1Tms0dFAtaXdjOFVJbFhlQmpGTHo3UXNHcWc4VEs2QzRBVnJFLTQ1NEdlUVVkUXRXdGM5T09OWnUtZ3NkSHRzNmtpdGhyZm9XOUxPbEk2bEJwcXByX0kxQ1NkZFNxQkxvUElOY0xZTFZocU9KVTZRSjdWREg4ekU3S1NTZ0YzQzRJQ25OQ3BIajhJXw?oc=5&hl=en-US&gl=US&ceid=US:en,Mint
HDFCBANK,"Sat, 10 Jan 2026 08:16:28 GMT","Q3 results: RIL, TCS, Infosys, HDFC Bank, Yes Bank to post earnings next week; check date - MSN","Q3 results: RIL, TCS, Infosys, HDFC Bank, Yes Bank to post earnings next week; check date  MSN",https://news.google.com/rss/articles/CBMi9wFBVV95cUxNWUxoaXZ5YXE1X3JVUV9LMmkzRTAwdk1EVzNWaUJ5R0FfaVZIc1FMem1hUUFVSFRWNUNhM2hRd3hYQVZYTWgxSm04WWpxTHNWQmhMLWhzSThQSm8ycU9qTnRyaEw3WGVhT18wRU16d25BOWVQbjZtdm9FQUhmaTNQR0g0OWZSRURhTUtvLXVXODRTOFhTdkhTVmJLUnpWSTNaVTluamRjem9BeWJtSUVlTi1lRUFXSTNsZGFUb01zcGpMYTlVNllMWXktd09kWjFVQ1pkQmYzQ3pHcFM4MjVnNUUzdkxpYXBhUk1Eb05mcFREa2duaS1Z?oc=5&hl=en-US&gl=US&ceid=US:en,MSN
HDFCBANK,"Sun, 18 Jan 2026 10:17:12 GMT","HDFC Bank ADR earnings missed, revenue fell short of estimates By Investing.com - Investing.com India","HDFC Bank ADR earnings missed, revenue fell short of estimates By Investing.com  Investing.com India",https://news.google.com/rss/articles/CBMirAFBVV95cUxOY0xIbjlyUk44WXBYQW9hUl92c3VVdGJ5Z1FLUV94d0RFSDdYWFQ1cFZXZERKZ09PeG5XNUUxNEtJZUxEUTcxNFJuZGtSZm1Jc1hwVG5tajBucGJvekJKR0Z1dk11SjVPS3dnZ0h2ckxNX1R6TV9acGNzRmxfaTZxckZxSmlSLWdjdmN2bGVTWi1rTjF1UVBpbGxjTl8tN1M5VjV6YWwxU2NpdjN0?oc=5&hl=en-US&gl=US&ceid=US:en,Investing.com India
HDFCBANK,"Fri, 09 Jan 2026 08:00:00 GMT",Why HDFC Bank and ICICI Bank are 'Nvidias' of Indian Stock Markets... - Equitymaster,Why HDFC Bank and ICICI Bank are 'Nvidias' of Indian Stock Markets...  Equitymaster,https://news.google.com/rss/articles/CBMi0AFBVV95cUxOdnFrRC1ibGlKNzVBUGVrV0hMRnMtT0tvUVF1bllWWXBDVzU5VEdqUlhXRXNYbkNEVzlCcmxxOGgwSEJ1STl3akJUb3ZUdUQ1T0M0N2lNYWt6YWhyc1FNQXZOV0swOXh4M2FUSjVQdTVHUmF6LXd1emd5eXBOOHdpdTRGbVZZU1BoWko4bzFvcWdaS3BxYXJwMGNsNnduOU9ZM19RazB2UWRfdnNFVXZvTG15cVB1d1ZrSXJJcUh1cWZtSTA4YzBTaThtYTM3UW84?oc=5&hl=en-US&gl=US&ceid=US:en,Equitymaster
HDFCBANK,"Thu, 15 Jan 2026 08:00:00 GMT",HDFC Infinia Credit Card reward cut rolled back; 5X points to continue from January 16 - Moneycontrol,HDFC Infinia Credit Card reward cut rolled back; 5X points to continue from January 16  Moneycontrol,https://news.google.com/rss/articles/CBMi8AFBVV95cUxQVTQ3VTNDNHRwLWwwcVJydUVXTEVHQnMtY0lEeUpMb01TVEJydjFwcFVkUXJSS05ubE1UYlFUMXFOeUF2YkdvN2g2ZTZSNW5TVmc5TzAtN0ZkWmItaG5PNlhOV1puWjlyTlEzcWdEYTVTRklFRmVrZ2pMMW53cFRYcEY2UDJ0T1lwZzBwVkJsYnc3WHRfTl82dmViaEpmSXdpQ0JnUDJTaHJPSS1qdEhXSUo1WWJ5bzdjQW5WRDUzVVNQYzBGYk1wN1VSWkdEWTZJcjNIUVZYWDVvbnIwZVQzbGwtYzFFMjZUbTVFamw3aS3SAfYBQVVfeXFMTWJQbzdQUG0tMVl6YjZfdmM0bmhFYlU2NDAxQnBTWUprdFl3S1dTVjYzX2tIZ2RMSGo1TVlvdDVDNG8yZ0E3al9uYzdqM1JJTnZJc2tUZi1XUlJwOWJWVElJcEs4ZWNrZ21scUl1MmNZNVdfZC1oWFAxZWd0ZkRGamp6aTdkUkNodFlfc0VyVXBNcV8tdFRlclV5WUJObDRSNkcwVXU2QnJyUnFhclJ6THRhMnRPZkdaU1p2Qi1MZ0Z0UG96Z3ozbzlGQVV6WlZ0dUlKVy1PMldYc0ZJUV9IVDJ5dVFKWTZMa20xMEx3QXEtLTdxekl3?oc=5&hl=en-US&gl=US&ceid=US:en,Moneycontrol
HDFCBANK,"Sun, 11 Jan 2026 08:00:00 GMT","Q3 results 2026: TCS, Infosys, Reliance Industries, HDFC Bank among companies to declare earnings next week - Mint","Q3 results 2026: TCS, Infosys, Reliance Industries, HDFC Bank among companies to declare earnings next week  Mint",https://news.google.com/rss/articles/CBMigwJBVV95cUxQei1aQkNvNnZySXIwU1ozUEJyZW9kLUdUbW9xSTdEb1NxeGdBT3p6N0I5WFBLcEpla2hUYWFBRXQxbFkzNklfcE9SQVZJSHZ6X0xDVEpVNHpTZU5yc1F2RDVYTU1RMkF2Uk9meWFocnhJQ3dWb29OelU1ZWdtS0xlWWxnQ0UyQjZRa2pqNmZJd2N5em9vVjhDRmVtUm1DNTRORGlPTGxkcEh4WlJhbHpac1Nqb2lNQjdKX01YUkl4TGtmVmdHUHdGa2xRdTZud3BQTS1YbGgtTUJPc0JULWJGSnJDMzFlT3ZmOTFIR05qekR3R21DbFhTRjd3VEpIajFPdjBz0gGIAkFVX3lxTFBPSmlEcGxKVDkwSXBMaUoxNUc0b2N5YUdualdUdXhIU2l4NmJqS3owdWxyT29VS0pMZUV1RlpRNkFGNGtkeXNuM0NNTGtKa09GR1JyaFNGYUNEcHpTVEdRV0plcjBuTkt1SjB6T0N4TzNvUjNXLTI3aElQQ1pDaHJ3SkNkTDE4RnBpeWJTaTZlYVVQc1AxZjhpbEs0d3VVcFNvSHo4WEJ5YUJxTURMZE1ZU2lyVElkdGZYbnVXaklQSXR3cXRDYmJPU1ItcmV4RXR4VW9JMUZ0b1FJZzk5U05ITTA3bFdSRlltaUtDdjlxNkxwTVBWeFZUZ1ZfZ2RkYWNJQjFqRktEcQ?oc=5&hl=en-US&gl=US&ceid=US:en,Mint
HDFCBANK,"Tue, 20 Jan 2026 01:31:41 GMT",HDFC Bank Ltd (HDB) Q3 2026 Earnings Call Highlights: Strong Profit Growth Amid Liquidity Challenges - Yahoo Finance,HDFC Bank Ltd (HDB) Q3 2026 Earnings Call Highlights: Strong Profit Growth Amid Liquidity Challenges  Yahoo Finance,https://news.google.com/rss/articles/CBMidEFVX3lxTE5jOUFDMmJ6WWZvcE1ydmRiUUh3TGRJbjYtNG5VUWlkcHM3QkNjcXROdUhFaDZQZHdYOS16VGE5dHlwU3BOQm5lQUFOSy1ZTTBFajExM01sZWJKWHh4Y2JCTEFHWW4wdTFfX2FQYUhxVVVxaVRI?oc=5&hl=en-US&gl=US&ceid=US:en,Yahoo Finance
HDFCBANK,"Sat, 10 Jan 2026 08:00:00 GMT","Q3 results: RIL, TCS, Infosys, HDFC Bank, Yes Bank to post earnings next week; check date - Business Today","Q3 results: RIL, TCS, Infosys, HDFC Bank, Yes Bank to post earnings next week; check date  Business Today",https://news.google.com/rss/articles/CBMi5gFBVV95cUxQZHJncnY0RDlxM1FsMEI4YUJIVldNWm9qTV9ha0JFWWZlV1BBek9XV0l2MHV0aVFlT3VWeVZ4cWdxZVNMRXFqZFhwNmJ3QmZ2ald1cXRnQ2xjU1dmcmF1c2pxZGY1djgxLUFrZ2loOFRtNmN3TXhjeS05TmxqTHRDY0NuMXNXdjVoSW5FeGFnN3BQS2xUZUQ1cVRTdHFQYnlCV3VMNkhnWmdBSDUyREoxX0FuemJ6MnBtVFVyZEowZ1NhUmZXOHJaSkZoOVJCZzJXYmlyd1IwYVJXWlZRR0Z6Rk5EaEJRQdIB6wFBVV95cUxOR2FVdXZWQ3ZhMjV6eS1teFF4RlFIRUh1Q3ozWU9YdkZCeGl6R0RQOFQ4RTJmYmJibGlhVHMzNE4wOHN0UDQtOGpSMGt1cXlsR1VQaFpQZ0Y2WUFnZGtfVjBmYlEySE02ejdDelRVQW9FMFpUa2xiVXB4ZUV4bDZtaHZTaF9td1h4QUNlUFNhaHNJeF9XOFVYaWdvWlBsV0xseDhYQ1pObThnV0ZMYkpXMlF4OEFtOS1GNFUzZjRoUVlsbTg5UkpLZ1R2N2VJOC1yT2JfQWk5TnBKbDdyWXRKTkRaazlacjVLbENv?oc=5&hl=en-US&gl=US&ceid=US:en,Business Today
HDFCBANK,"Tue, 20 Jan 2026 19:34:00 GMT",HDFC Bank Appoints Kaizad Bharucha as Deputy Managing Director - PSU Connect,HDFC Bank Appoints Kaizad Bharucha as Deputy Managing Director  PSU Connect,https://news.google.com/rss/articles/CBMinwFBVV95cUxQOFhxWFIyVFZwNDFfOXJscWJVUmxUZnk1V1F4Z3RJUFlzaUQxUzkxOXlxMVRnd2NoRGhINVFIWVRfVVhWVW9rRHlRZEtveUVPOGFCdGF2Y1RzbEw5emtqX0N4eVAtamJsb3FGNFJMTkNLRXA5SmNSV0w5RVZBRFd6LUl3c25KNC0yOTdYbktZY1k2WW8zWjVCSlgteVlHcFU?oc=5&hl=en-US&gl=US&ceid=US:en,PSU Connect
HDFCBANK,"Sat, 17 Jan 2026 10:02:31 GMT","HDFC Bank Q3 PAT up 12% at ₹18,654 crore on robust core, other income growth - BusinessLine","HDFC Bank Q3 PAT up 12% at ₹18,654 crore on robust core, other income growth  BusinessLine",https://news.google.com/rss/articles/CBMiugFBVV95cUxQNTlBTFg0dkZjbVhRc3RCalljdjBzVjloOUlNd2ZIOWVqNkxSQWFERzZjRE0xSXh3YlZLMWszSGQ1SUZWOFlkcUxCeC02TEtzN014VHlIUE1KVWpxMExDRW1XZ0RnWC1JVklGXzBEaEZMODZOZTB2azFhVlFSSlh1YW9qLWFpVDhMTDZBQ3hSOFFXZHFaWU9LR3RRX0VRcEg0Ti00RTRuaFFrelRwYUZzSndBN0FPYm1vcFHSAcABQVVfeXFMTmZVcUdsM1NrYW8xWktHbC1BVUt3ZkJPNXpxSmt5aFJZSXVuZmYyWG9QbDFjd2JXUDJKZ28wVGJtVXBOc29tMTBlYnJqUXlJMW1rU3RXbXpqb1ozbENoWGkwMVpLYVZyZTVnUl9QX2E0UUxKTm5JcHE0b1NrZVdvOU1QSzNCRWdsdGhKREs1RmExZG9zTjhQNHZNQ0Vya1EwUEdXY3FNNVROeUR0UkFwX2dUYi1nbmx2WmtCaDN0bVRJ?oc=5&hl=en-US&gl=US&ceid=US:en,BusinessLine
HDFCBANK,"Wed, 21 Jan 2026 01:39:02 GMT","Stocks to Watch: HDFC Bank Director, JSW Energy Power Deal, United Spirits Earnings - Whalesbook","Stocks to Watch: HDFC Bank Director, JSW Energy Power Deal, United Spirits Earnings  Whalesbook",https://news.google.com/rss/articles/CBMi5gFBVV95cUxOQWp5eWpqWWhWLWk1c0hQa2RIbW14eFFhbGx2b1Blc1N6UjdQNVY1bXI0TkRaLU9qTWU5V1JFX19kSm1rQUdUQU44NXJfZWxwd1BoOFZEOGc1Vk1MR19sWEtVeXhrendGdG9lY2JFTXdnNG02N3RlejBuVGF1RjYtUzl2ZnNCTlYwTG1wTVNFVk0zU0JfdVhGSkpzRHJfdjg0OFNlbGN4bTB0b0dIUXJGT2lDVWxRbFFMN05VTDdHZGVMcjhYcy0wU2c3SUgzczFYSjk5d1ppMlp4ekdkX2RnYlp6QUx1dw?oc=5&hl=en-US&gl=US&ceid=US:en,Whalesbook
HDFCBANK,"Fri, 23 Jan 2026 04:56:34 GMT","TrucksUp, HDFC bank renew partnership to boost vehicle financing for truckers - Indian Transport & Logistics","TrucksUp, HDFC bank renew partnership to boost vehicle financing for truckers  Indian Transport & Logistics",https://news.google.com/rss/articles/CBMiwgFBVV95cUxQWnB4eTRlVG42X2w4NnZkd0pMNm1memxZTndsSmtCRkVETWZIRTBnYmcyV21seThfYWFLM2pWQWpUbnlNRjdYRGViQ1VkbEpiYUlSM1RvQzgtTnhEV1FfRlU0blBZc0Q1VnBrMjM3dDhobUpMaWgyV0U3TGdha3loMTduYjhuTTNiMFlab1NVYU1GcmprUmVkUzZIalJ0R09JaV9IWEpvV2RYMmU3SFVfMXBCR1o1VzlxNXVJbWNVb0xWd9IBxwFBVV95cUxOZzZZYkJHWUxvZDR4dWxpMEd0blh2bldDOGRBRnFUOEFyLTBwZHRIOGFaR3FBOUZJbkxDR25nUWJiTzhBa1BsSVR0UFYwOENZZWdGQ0JrS2xjazZaeVdxMlVXS09xYzN4cl9Gb0xtRC1jTDJSTHVsdVNHSWR3VjFSb3ZRbVlRMzhPZ3NQSTFKT1FfX3UzeW45Vl9XSFRldS11QlVvb3RwZFlMaGRTVW5TaEJ5dEN0dDRLYWlNLWpPa1JFcV9tWGVJ?oc=5&hl=en-US&gl=US&ceid=US:en,Indian Transport & Logistics
HDFCBANK,"Sat, 17 Jan 2026 17:00:30 GMT",HDFC Bank clocks over 12% rise in Q3 net profit - Sarkaritel.com,HDFC Bank clocks over 12% rise in Q3 net profit  Sarkaritel.com,https://news.google.com/rss/articles/CBMif0FVX3lxTE5iWGtnQnU2MGZOS1pvc1VEN3B6M1gzdVNMWXluNk0wbEh3N0ZXNEFvNGFLdFg1R0ozb0NzRFN4ZGVBZ3B1MzdsbWVTOWZuLVU3djg5cFRPdDJqNml3a0JoRDRhOVBmd19Zd1FfTm13cThGQ3VpclJTUWo5MkVUT1k?oc=5&hl=en-US&gl=US&ceid=US:en,Sarkaritel.com
HDFCBANK,"Thu, 08 Jan 2026 08:00:00 GMT","HDFC Bank Careers: Recruitment Process, Work Culture & Growth - Physics Wallah","HDFC Bank Careers: Recruitment Process, Work Culture & Growth  Physics Wallah",https://news.google.com/rss/articles/CBMia0FVX3lxTE1aTHhVNXlHNThBTEs0R0V0T3hHVnFuOUFqa3dyamVoNWFWa1FoNDYyQlA2Q0paZmJ4OGE4MnkwZjNxZmRmQW5BeVo0eTVxXzdIbEo2NmtpNTJtLVhUX1J1X3pMZmtfQmlldHpZ?oc=5&hl=en-US&gl=US&ceid=US:en,Physics Wallah
HDFCBANK,"Tue, 20 Jan 2026 08:58:40 GMT",HDFC Bank to Disburse ₹20 Crore to Social Impact Start-ups Under FY26 Parivartan Grants - TheCSRUniverse,HDFC Bank to Disburse ₹20 Crore to Social Impact Start-ups Under FY26 Parivartan Grants  TheCSRUniverse,https://news.google.com/rss/articles/CBMivwFBVV95cUxQR2lsMl9iWDhXWFlQcFF1MlctVlpOTS1HSkxjaUJqN1doaXA1ejl1NVVNWGdzZUFtZVB0SEVIdXVYVUxDMFBvOW5zT2FnbGVpbVAxVVp2QkVMS3dCcnluTGNuY3k0RV9TOEtSTTJuOGdpZllnR0gyNjJMQkhKc3ZiUDVJVmdWVGhjVGR5ZlZNYWFYUzQxMUE3U3VCN01MMVllR1VMcHR3TWZCYzRKZjh3dlJqUlN6S0FoeFlvQ0g0Yw?oc=5&hl=en-US&gl=US&ceid=US:en,TheCSRUniverse
HDFCBANK,"Sat, 17 Jan 2026 13:52:06 GMT","HDFC Bank returns to double-digits growth first time since merger, net up 11.5% to Rs 18,650 cr - The New Indian Express","HDFC Bank returns to double-digits growth first time since merger, net up 11.5% to Rs 18,650 cr  The New Indian Express",https://news.google.com/rss/articles/CBMi3gFBVV95cUxPWmRBWTVFWFBTX2VCVHItRXhpTE5qRnZoU1lYNlpyWkJvbVJuVnhnWjg0THIydWE1VF8tLTgwTlpkYU9vOGxfWExpdXcwRV94Mkg2TDhub08xMGFjc3V6a1d6YUVKQzYxUU5uYTR1aXc5M2NRdGRtcWJKMEZmMnhPdHVjeVRtUEZCQ21GdWlkSGxSazFDV0dNRWI4dm53czZMN2NLSEc5S0JFWVpNX2xxTFVIU29IQkxKVmhEVWt3eDQxU0hvbnNiMXlmdjRjQ25USkZkeHdQbmI2ZU9OU2fSAesBQVVfeXFMTjlCUkJtWnJmT2lFYVZlWUt4Qi1HYVpMc2pWNmNsS0d2bk1ObzZ1T2NBVjZyMTdhOFVwR0F4WEhMNUc0TDItbmVaNjgyUUd6Vzd2Z3FPVzF4a25EdXlBdmd3OUltU0VrYUpReVJBRElIZk9LTXQwTG5Mc3U0MUxVMHBia3NOSGs2dTMwaFhiQXhLanZEZFVrZ2F5SUtJb19RbVBJM1VCY2U3SmtCNUxIUWVVVUlqdFJNZVpLSzV1QzQ4eGZtcnFoNHh2VnIzMmJ1WGw1a1FKNGZFTi1JRXBhLVQxNjFoM0VRWGYwWQ?oc=5&hl=en-US&gl=US&ceid=US:en,The New Indian Express
HDFCBANK,"Sat, 17 Jan 2026 19:24:00 GMT","HDFC Bank Q3 net profit up 11.5% to Rs 18,654 crore - Times of India","HDFC Bank Q3 net profit up 11.5% to Rs 18,654 crore  Times of India",https://news.google.com/rss/articles/CBMi0AFBVV95cUxQVWtTNkVienlVbUlRcHl2M203dXlYTUl3ZlVaX0tQNlJQWDNXZjA4MnNsTm4wUy1PYkdRTUNuTWN1SkI4WlNvOXlzeEprMmVfd2xMR0hGSWxub0F4aVotQmlBR2JrNlh1ZnRhc2xwTVlsNUxEU3dyY1NjZEpoQzI2dHJVMFNFQ2VtLXdlVFIwTk9ycDBZTk9YLXVzenRtc01NaWNQMnpXSW1ySjV6RlBuVkFJU1otNGhuVTgwOFgyVElaZ0V0LUlMODd6VzU3dHRi0gHWAUFVX3lxTE1BYW1YZHB0dDNGM3MtLVpVY2k1cE1HYW5ndEhMd2RLOXBpSVpDNXdnNEtfNW9KckJOS2tIMjdNc0k4RHE0M0tlY0pnUWtvT05NbXhRbUk4WFN3dmFFdTFsNEJjT3ZWdllRVlB6aGN4aXJuZHhHYmxNb19Vc3cxYVJ0bzZBZVA2TF9GODNHU3NMQ1hnM1MxdFE0SU1QYVZJbmJJOWJ3SFBfTTJZaFNXakVVa3V3U2hNQ3VTUXBVZDZVdV9LVURUN2JJeW9rN2xqdXlDcWlpTFE?oc=5&hl=en-US&gl=US&ceid=US:en,Times of India
HDFCBANK,"Sat, 17 Jan 2026 09:34:00 GMT","HDFC बैंक का तीसरी तिमाही का मुनाफा 11.5% बढ़ा, विश्लेषकों के अनुमानों को पार किया - Whalesbook","HDFC बैंक का तीसरी तिमाही का मुनाफा 11.5% बढ़ा, विश्लेषकों के अनुमानों को पार किया  Whalesbook",https://news.google.com/rss/articles/CBMi1gFBVV95cUxPVkxSOVFTeWZsd2piZnp6RVhLSUx0amlUdk9qdHFtNmEtYlB2X1NmYXkzaTN0Q0RveTY1THNwUzNjT0JLLVBKM2tCeVFiek13Y3hNOEZ2Vks5anpjTE1wZm5Xam1hLUFGbGRHMzlCS3JRbDJObnQ1ZEFxbUZTQ1N0QlVOSE9MQnBxakVzYmhVWnlMY2J5M0RCMVNoUEdFQjUxMjA3bjlYZHhnUTVtUGZBUWdiUzhnUjAzVi1YakwtSUxlaWhtX29nS2VZdndVS29hM3lZVFN3?oc=5&hl=en-US&gl=US&ceid=US:en,Whalesbook
HDFCBANK,"Thu, 08 Jan 2026 08:00:00 GMT",HDFC Bank shares fall 4% in 4 sessions. Will Q3 results change the script? - The Economic Times,HDFC Bank shares fall 4% in 4 sessions. Will Q3 results change the script?  The Economic Times,https://news.google.com/rss/articles/CBMi3gFBVV95cUxOeUdFMzFxdnRwSE5URjU2MjQ0YXozMjMtemFIbk9DSU05U3IwVEZwU3VzZWp2YVVxSUI5OUNSUXdPa1FWcUw4V3dRTnJyYW1zQ2haT3BNZVBLN2VVZ2RJMG93X00xNDV2SVpfM1B5RGZGMmFqOVRDU0RHYWZYSk44bG9UX2h5YTRBbjVHdmlOamN3Mkl2LVFiakN3QWZVd3N5SG1FelBRdTR3cUFxMzNpeHZCN0pvVDRXbFoydEtQRkQ1aDJjVXJIQ2tTNlNfckR1cnA5OWplWXZLTFNwWUHSAeMBQVVfeXFMTk9xVzJVOFRBT3p5MGNVVHRPTVBYYk9XOWotWEUxWDBBblFFY0k3dmh6UkhiaUQ2V0syMTJ6NFZjNm9zQmFraXI1Z1JjQ0hEak9WbkJQTlNCb2tDendlb3N1VHpCbW45R0NrWlN3VzllaUhWMmlNSElnZEZ4T2tWVjJUd05fR2VRTmpqYjJLS055dmdRQVBGYkVsangwUktIbkZKMEFvVHk0dFpPOHpCaG5kUDdHeUJnRjVLQ29WNnQwTkEwcm5nVGdZeTdOOHppNE05aUFkcXJ5YzZSaG56TU1qcGc?oc=5&hl=en-US&gl=US&ceid=US:en,The Economic Times
HDFCBANK,"Tue, 20 Jan 2026 09:56:50 GMT",HDFC Bank to disburse ₹20 crore to startups by March - BusinessLine,HDFC Bank to disburse ₹20 crore to startups by March  BusinessLine,https://news.google.com/rss/articles/CBMixAFBVV95cUxQTVVFbkhQMk1rOEVjR3dkOE15dXVnOTNnM0FURHA4WVdBaWQ0TmRBN1NFZW1vS3kzaXMwc3VLSjliTFpJUWRLSmtRcnJGSGhleEVwb0I5azZMMkpPc2QzUXptanNWa2U4U3VYVnpQTXM2V3Y2ekFZUE5IYl9NVDJGQ0d3TXNZNTh0ejFXNVdxcnF0N0hkSDJMYWpubjV2NGVkOURFSVZNSzFOcEktUEk0WUpQSGdlZkJjYkVQOWlka0VsQl960gHLAUFVX3lxTE04UlZKNkhwUUl4RzVmSDJJbDA1b0hfRVFjajFDWmt0Y0RxQ096N1NBQktLWGNPclJIRGJmQmt5WWp6UWFqSF8tMllNU1hLUUZyajVidHprMXhJUzhDVmZSdEZDYkxIYUhsM0VZbnFXOWdHUkt6TGZYdjE2ZTBOMnhHbk1GaGR5NXhQSGYtc1lyYy1MWW45cXVUT3pmV0JoX213aXhldDlOVVE4SmdEWTBTc2JoeGVpeklvVG1tY2szMng2TUYyUXRJdGZJ?oc=5&hl=en-US&gl=US&ceid=US:en,BusinessLine
HDFCBANK,"Mon, 19 Jan 2026 05:45:11 GMT","Earnings call transcript: HDFC Bank Q3 2025 sees steady EPS, minor revenue miss - Investing.com","Earnings call transcript: HDFC Bank Q3 2025 sees steady EPS, minor revenue miss  Investing.com",https://news.google.com/rss/articles/CBMizgFBVV95cUxNV05DTGRPRzYyb2o0MndlWmFCNWduMW80R1RJR0ozaWJPc0lTYXBCbGdNUjMyekdySUoxSm1QRDBjNGxZYUphdWYyclRVaUdZb1NEZ2ZUWU41XzAwcnZSRG5rUG54NzB2OThhOVowRXZkbU5WMDRQVFhNZnR4TnVBX0lGSkFERnAxMndKTFdpQ3FRZkkxT0dFNHJsQkZxajEzUWd6NTgxcUw3WlMxNnRVRWhlWWFZSWRqZDBUdDB4ZTBLejZKd3FnTDBGODVVQQ?oc=5&hl=en-US&gl=US&ceid=US:en,Investing.com
HDFCBANK,"Mon, 19 Jan 2026 14:39:27 GMT",What investors need to glean from HDFC Bank’s Q3 results - BusinessLine,What investors need to glean from HDFC Bank’s Q3 results  BusinessLine,https://news.google.com/rss/articles/CBMi6wFBVV95cUxORk0xbDJTRTVURGM0aE1VUE9BTEs2WEE4Y0ZhSlh2NElWcHlHanlJMW5KRVhBbVg4dTd6c0R4SnQwby1SNG1lTjZ6VU9jVU1FLXRSb20teFYxdUlndDU0aER0eFhvMGNrMGIzeGtYYTNIUWFJenBJWVpiYnptSG1LSDRrVEFZTXRmOUZwTkNmZ3JTMk5zc2lWVGJkVFJYa0szWEhwTk5SN0tDMU93MS1jRWhPUzVYUHlwVEZEeEdCSVd3U2FCa001UWx4VVFHR2pNT2h4M0hmemhxWWFFM1Bta0RTYk5IeE0zc0Vr0gHyAUFVX3lxTFBvUzJYMWs2VFdJQUJUR1Y2NjJ0Ty1EaXMyc1J1bTJKY2UxbW02ckFTUm9TRmtJbzhiSGVaVTRDU2NiUVlEM1dyenBCMW1zTWRnRVRPTGozNnVSWVpZSElFY3pPTl9oWmJfa2NsODVOc1JyV0twODk4R28tM2dKM2tLeEdYbFBFcnFCMTZ6QjZkRTJWZkhnVGtXeEZrZUNKRjFrOFdEUDllaGZzbWdhS0wtYy1Gd1hJZ0dickdESk5hQjhZUG1MVGZCZ1B1Nmw0Z0N5dEdTVTFtY25iWEJBRDdxcXg0N2F3b0dhRnNkR0RGeUh3?oc=5&hl=en-US&gl=US&ceid=US:en,BusinessLine
HDFCBANK,"Sun, 11 Jan 2026 08:00:00 GMT","HDFC Bank, Infosys and 8 Other Major Stocks Set to Announce Results Next Week - scanx.trade","HDFC Bank, Infosys and 8 Other Major Stocks Set to Announce Results Next Week  scanx.trade",https://news.google.com/rss/articles/CBMizAFBVV95cUxOaURVUjJxZE5FUER6TTBjdkhpbE90QnA5djZVeGUwSGVHLWRaeDdZZmRzS3Y4YnFSWkhOdTRpV1pwLWxOQkJ1aGNVQks4aFJYSU45QldTTnhYSFFUVXVzbndtNk1kdzB0Tk1UekEtbXp6Z3FvQmhOTXVhX3F1R3dYQUk5eTNXX3kycFRVVTJ3Yi1RUnhOclhVelhOazEyVzBNSGRWX3E1QjBGZ05WTFZzVU8tQTdCQ0JpVjNTNFpsRXJIczBnOGVIaUJJcTI?oc=5&hl=en-US&gl=US&ceid=US:en,scanx.trade
HDFCBANK,"Tue, 13 Jan 2026 08:00:00 GMT",Team HDFC Bank beat hosts Manipal University Jaipur to lift first Manipal Cup-2026 in last-ball thriller - Times of India,Team HDFC Bank beat hosts Manipal University Jaipur to lift first Manipal Cup-2026 in last-ball thriller  Times of India,https://news.google.com/rss/articles/CBMiigJBVV95cUxPS181cnZ0WV9fMUt3RlhOSExGNWJEWmVwcFp2UkRZenoxM0IxNGY1TGJscERyanVUOW9nZ2JESmFIci1hTTZ6MjhTMC1XYzMxZmZWWXpnbGxzSW5MRGxDeEsyOE9BQjhwci1TZXl2QW1PeE4weDcybGpSbXFKNWNEc0V5cHVsSHpZb2U3dUpsVjVDUlR4VFZ3MkhMYk1nTi01Y0E4cXZlUHVWVkpXNUNKa0RUaW8yNXh6anFyVENlaXlFODBabkF5WkdicEFrdlJvZ1BXQWdZeVpldEdlci1Fc0FQY3JnN1NzaFV1X2MzVmVBamN6UDgtUV9XUHBTQ3pOV2hLMXF2MGxrd9IBjwJBVV95cUxQWkhGWTQ1czdNTVhJY05EWnlaNzh3enBYUFl5MjFmajVMZXdrRzJ5bXF3WloydkthNmZrbmowbS1QbDk1Mk52LUlPaWZaYWdRWmhTSzJpTEFrcnFxbDM0VTNvb2hxakxpSklFOHZfckNLby03V1F2Nm5kb0Fzamo1YzRBcHdJcVJTa2RTQm9XaDR4b21JNXpCSEttRWx1bWFFQi1qY1hBcmdzTkJHUUtKTzYzeVlFWExPSmVHNFZXcWNQLVZtaFkzLWRHcVRTb24zNlZpYVlEc0pUU1B6WXZFcHQxaGZJMGFHcUQ0U0UzUHhlOTIzemJqVGJNMFJDV3JidDJGNXM2a3BXdkI0VWNr?oc=5&hl=en-US&gl=US&ceid=US:en,Times of India
HDFCBANK,"Sat, 17 Jan 2026 10:48:36 GMT","HDFC Bank Q3 profit rises 12.2% to Rs 19,807 crore - The New Indian Express","HDFC Bank Q3 profit rises 12.2% to Rs 19,807 crore  The New Indian Express",https://news.google.com/rss/articles/CBMiowFBVV95cUxOVjFKcllUSmtCeldDMzVINU1xMU0xVlBhNGtkUHIwVUNTLS16amJfN2JIdENCZUg4Q0RBZ1BpRDM5NVpORUQxRDNuelk1VFBGVkhvT1BfNjZDdk1xeVNMdVVub0ltajNKdGJLd3Y1MnFBRkpnSWtvRHBZTVhqVmhNd1JSbVhZLS1raDZuS3FhajZEX0lya2V6RDhmMlo3eHM2YVdV0gGwAUFVX3lxTE8zcEQxQmhzd0xBYnBaQ19ZOHVUYnJsbkwwRC12dXFuTFU1eWhhVFFJMTFMN3E5Zk5fMGpuZC1QWkNRRU1sS2ptN0dKS0JwT2RvVjRESGhyTTgzc2tjeDBzUUV0ZUJwOFo3TWFZalppbFA2bzdJS2VCS254MENOeWVEYjg4dEZPS0pzaFJkaktlU0NGYkt4aXZ0b2VVUS15T3pJc3QxZlRiYmZIcXphQTZW?oc=5&hl=en-US&gl=US&ceid=US:en,The New Indian Express
HDFCBANK,"Mon, 19 Jan 2026 04:27:09 GMT","Stocks to Watch Today are Reliance, HDFC Bank and ICICI as Q3 Earnings Dominate January 19 - Samco","Stocks to Watch Today are Reliance, HDFC Bank and ICICI as Q3 Earnings Dominate January 19  Samco",https://news.google.com/rss/articles/CBMi0wFBVV95cUxORUFzbDBMaXk0c04yRjhqRnQ1d1VUZkx3bGVPbnQwbWQtazEtSC1Bd2FsSmFYbHN1aDVDRV9UQmE4UG5tNDlHNjZEUVpDeXhjM2xSelZlZUxmeUhUNm9HWkZnUEZRQUpJWXZKNElwMWlsakd2V3hLQ1VwSHNMS2RmWGZsMEVrN0ppTXQ0eHB6OTJUemI1WHoyaUpzUm1tU2g4ZHRPQXNpOVlmamhMdlA1Y2VNUUhtU2FUQkZXWjRtZWg5VzAwbFBwLTFMWXpLaUc1UTRn?oc=5&hl=en-US&gl=US&ceid=US:en,Samco
HDFCBANK,"Sat, 17 Jan 2026 01:25:53 GMT",Small Finance Banks Eye 24% Growth: HDFC Bank's Next Successors? - Whalesbook,Small Finance Banks Eye 24% Growth: HDFC Bank's Next Successors?  Whalesbook,https://news.google.com/rss/articles/CBMi9wFBVV95cUxPb1VVSlpiUTM5Y0pINTkxWjRiOFZFMlBMa3VHTUJVZGlJbFpQVTBQbmV3NFZhdDNCc1VWOTBEZGFvWmZsamQ3TkpNQ29aWkVnc1FLcG5IZ3JZcW91cVZjbXNWaE5NRDBxenl2N1YtY3k3VmVzUTlnaFBXalFnM3UtWk1qNGdxSDdEVVM4RW9RY3F2aFlfQVdhYWZWbzJOUS1KVHFyNHNwaDNHTnp3RmRNV3lFUXBBLVhtTWNQT0ZuX2xsRmljMm9pd3pUTU5DTVJBT3BYQmt4OEQ3YVV5N055Mm5HcG1NdzEyc0VOZ0pUVmFxWElkbTBv?oc=5&hl=en-US&gl=US&ceid=US:en,Whalesbook
HDFCBANK,"Sat, 17 Jan 2026 10:14:47 GMT","HDFC Bank Q3 FY26 Results: Net Profit Up 11.5% to ₹18,654 Cr, Gross NPAs Fall 18 bps - outlookbusiness.com","HDFC Bank Q3 FY26 Results: Net Profit Up 11.5% to ₹18,654 Cr, Gross NPAs Fall 18 bps  outlookbusiness.com",https://news.google.com/rss/articles/CBMivAFBVV95cUxOemxpZzB4cmhRcU1CbEE0NmM4UHBnUmVnUGhsOHRpcGpRVV9fNHZab0tDZXhMNFVJLW0tQ09NcHNSb0tKZ2RYS2RaMUVueEF6NWdqS0p4SVBnY1hRNVFRSDNwZ0xlcVlkVVg1TmR2MWtZb0dxZFhWeTNtMW1JQ0dlWW1xclZ5LTB1V041T3kyX3h2X3RySHltZW9nZ2JCaVVaNzZUZ2dmWW5oMFlnRWFzdjFZMHhQWjA2cV9aUNIBygFBVV95cUxQdU9sdGhxazIweTZCRjdDa1pLVy1PaGtwOW9DRTh2MVlER0ZiYnc1dVRaVmNtYlZkLUNOQXlwMlZpLXhTNFV4c0pOQTVkb3VxQlIxRWQ1NmplSzlweDlQRU5mVzFYT0ZQdzc0TXFZWTJIOXpLMFdYa012T1pGRWt1MW9sY3dNeU0wdm1wcnU3a29fY0NsNTlJSF83UnpnYkE1SF9kVXBpSGVMT21fd2VJcjR0YWNjamJHZFIwa1duSEhmMGRsY0NKVkVR?oc=5&hl=en-US&gl=US&ceid=US:en,outlookbusiness.com
HDFCBANK,"Mon, 19 Jan 2026 05:03:00 GMT",Key facts: HDFC Bank Q3 results boost broker ratings; stock reacts positively - TradingView — Track All Markets,Key facts: HDFC Bank Q3 results boost broker ratings; stock reacts positively  TradingView — Track All Markets,https://news.google.com/rss/articles/CBMi0wFBVV95cUxOc0ViVlFhbzVGUDFibVdpUlFNLTV4TWNKdVdzeEt4ODA4YWdsSUFRb09DeDlkbm1wclZ5VWpuelR2eFFReXZ0eWRwM2YtM20tY3J5cVdDUERCbEdscTJGZlI5UVVFTFJHOE1TN18tVWNRUUJwSkxUeWsyWjFjRmlqclplbFA2NkxBUFF2NFpvT09CS2sxSW5fSHp4aWpIQkphM205RklwUDNObnZyek1UV3p4ajdrTDROa2pnN1JZbXdGOGR3OE5wWEMxdGJBeW14U0NJ?oc=5&hl=en-US&gl=US&ceid=US:en,TradingView — Track All Markets
HDFCBANK,"Thu, 22 Jan 2026 06:50:14 GMT",AIC ISB and HDFC Bank Parivartan Collaborate to Support Sustainability Startups in Punjab - Business Wire India,AIC ISB and HDFC Bank Parivartan Collaborate to Support Sustainability Startups in Punjab  Business Wire India,https://news.google.com/rss/articles/CBMi0gFBVV95cUxQMFZZTnNqS2R2M2w3clJ2eUpfVkpUR1BseW9BQldXOXhDUnBibDl0T1l2cFBXTUJVX1BBS1Z6djJrMDNRVWNWclI5X0xrYmx5TjdLeExyTi1fa0FYdEE5cVB3SG5Bc3lYTWhJRjdpS0RrUktzWkxoOW5DNHBNel9IUEN1RXlBYm0ybG5oNEV4U01fYkZHVVVQeVI2QUlramdPdGxmNEt2QmlZeTBQZ3UyM3l3WjRMNzg1TmoxMWZXQTdld2N5SkQzNks0MFZQZzhXYUE?oc=5&hl=en-US&gl=US&ceid=US:en,Business Wire India
HDFCBANK,"Tue, 20 Jan 2026 14:45:52 GMT","HDFC Bank gets RBI nod for Kaizad Bharucha as whole-time director from April 19, 2026 - CNBC TV18","HDFC Bank gets RBI nod for Kaizad Bharucha as whole-time director from April 19, 2026  CNBC TV18",https://news.google.com/rss/articles/CBMizwFBVV95cUxONEt5c2I4TGRpWXhwZzVHOUlOOEM3MloxR0k2WlhWZHhRYWpGZXdqdVpCNi14UXVkU3FTcEZPbzhUaS1NbDZqcTZTVDV0TUtTd09RX1U2dktwa1VvWFJxdmV2WlN5bzdKbW5LX2ZqYVNmX1hkNlBQajFYbmRjX1UzZEhsWGp6eUNqOUdVTC1xZGRLWkpWUUV2QnFnRXBxSUVrNG1ITmpQZjF3dDlQbC11MmdmR2JNeE9mMXhUVk52ZjlINWlyUFdDTkJNelZfblnSAdQBQVVfeXFMTmthZGppNXlLUGpMTHVheFBLNnVhd19RY19PdDhoMl8tX010VFA1Nm1Xb2pZZWQxdzQ5NXZ4Tmx5U04xWGdzNDlUamVnVnM2aEF1QzI3aUdRMTVuRnpremE2cE1BY2F5bEs1SzNuUEJqSVJvSV9oX0FrUTRBMTVacmw4dWI3Ymx4d3M5dnJDaEVMTVdNVmtyTHlOMm9xaEROeFV6N1JUemFjQWQ3WHloN1c2T09TdlRsUFRJRDJLNGZlQ00xZWZJdlpyeF9iRW5Ha2JRTzc?oc=5&hl=en-US&gl=US&ceid=US:en,CNBC TV18
